Link,Title,Text,Image,Date Publish
https://techcrunch.com/2024/02/26/ransomware-attack-change-healthcare-prescription-pharmacy-outages/,Ransomware attack blamed for Change Healthcare outage stalling US prescriptions,"

Breaking Down the Cyberattack on Healthcare Giant Change Healthcare

In a shocking turn of events, the ongoing cyberattack on Change Healthcare, a prominent U.S. healthcare technology company, has been attributed to the notorious BlackCat ransomware group. This revelation comes from a healthcare executive privy to a briefing by the company's executives. The attack has caused widespread disruptions, including outages at hospitals and pharmacies across the country.

BlackCat, also known as ALPHV, has not yet publicly taken responsibility for the cyberattack. However, ransomware gangs often release portions of stolen data to pressure victims into paying ransom demands. The attack involved encrypting the victim's files and demanding a ransom for the decryption key. In recent cyberattacks, criminals have resorted to stealing data before encrypting it, adding another layer of complexity.

The question of whether patient data was compromised during the ransomware attack remains unanswered. UnitedHealth Group, Change Healthcare's parent company, initially reported a ""suspected nation-state"" threat actor in its systems but did not specify a particular government or state. This attribution has raised eyebrows among cybersecurity experts, as BlackCat's ties to nation-states or governments have not been previously established.

Change Healthcare, a healthcare tech giant, plays a crucial role in the U.S. healthcare system, processing prescriptions and billing for over 67,000 pharmacies. The company handles a staggering 15 billion healthcare transactions annually, equivalent to approximately one-third of U.S. patient records.

The cyberattack, which began on February 21, has had far-reaching consequences. Hospitals, healthcare providers, and pharmacies have reported difficulties fulfilling and processing prescriptions through patients' insurance. The American Hospital Association (AHA) has advised its members to consider disconnecting from Optum, a subsidiary of UnitedHealth Group, until it is deemed safe to reconnect.

The impact of the attack has been felt beyond hospitals and pharmacies. Columbia University, which operates one of New York's largest hospitals, disconnected its systems from UnitedHealth Group, Change Healthcare, and Optum. Tricare, the U.S. military's health insurance provider, has also been affected, with disruptions reported at military pharmacies worldwide and some retail pharmacies nationwide.

BlackCat/ALPHV has a history of targeting prominent organizations. Previous victims include U.S. healthcare giant Norton, news-sharing site Reddit, and mortgage and loan giant Fidelity National Financial.

As the investigation into the Change Healthcare cyberattack continues, the healthcare industry remains on high alert. The incident underscores the urgent need for robust cybersecurity measures to protect sensitive patient data and ensure the smooth operation of healthcare services.

","https://techcrunch.com/wp-content/uploads/2024/02/unitedhealth-change-uhc-uhg-optum-breach-ransomware.jpg?resize=1200,801",2024-02-26 19:26:47
https://techcrunch.com/2024/02/26/supreme-court-social-media-moderation-texas-florida/,The Supreme Court could decide the future of content moderation - or it could punt,"

The Supreme Court is poised to determine the fate of content moderation in the digital realm, with two state laws challenging the authority of social media platforms to regulate content on their platforms.

The justices grappled with intricate questions during oral arguments, acknowledging the potential impact of their decision on various online platforms, from social networks like Facebook and TikTok to review-based apps like Yelp and Etsy.

The crux of the debate centers around two parallel cases: Moody v. NetChoice, LLC from Florida, and NetChoice, LLC v. Paxton from Texas. Both laws, enacted by Republican governors, aim to restrict social media companies from removing certain types of content.

Florida's Senate Bill 7072 prohibits social media platforms from banning political candidates or imposing restrictions on their content, while Texas' House Bill 20 bars these platforms from removing or demonetizing content based on the viewpoint expressed by users.

These laws stem from accusations of anti-conservative bias by social media companies, although research has not substantiated these claims. However, conservative social media users are more susceptible to political misinformation, potentially contributing to the perception of ideological discrepancies in content moderation decisions.

The legal landscape surrounding these cases is complex, drawing upon outdated precedents that predate the advent of modern internet platforms. The lack of clarity in existing laws has prompted both tech companies and their critics to seek guidance from the Supreme Court.

During the oral arguments, several justices expressed skepticism about the state laws. Justice Sonia Sotomayor raised concerns about the broad nature of the laws and their potential unintended consequences, citing the example of online marketplaces like Etsy being affected by regulations designed for social media companies.

Justice Brett Kavanaugh emphasized the First Amendment's protection against government suppression of speech, questioning the state's argument that content moderation is not a form of censorship.

Even Justice Neil Gorsuch, who appeared more receptive to arguments against social networks, pointed to Section 230, a law that shields internet companies from liability for content moderation decisions. He suggested that Section 230 may override the state-imposed limits on social media moderation.

However, Justices Clarence Thomas and Samuel Alito seemed more inclined towards the states' arguments, with Alito questioning whether content moderation is merely a euphemism for censorship.

The outcome of these cases remains uncertain, with the possibility of a decisive ruling or a remand to lower courts for a full trial. The Supreme Court's decision will have far-reaching implications for the future of content moderation and the role of social media platforms in shaping online discourse.

The need for the Supreme Court to address these issues is evident, given the outdated legal framework governing the internet age. The court's ruling will undoubtedly impact various online platforms and set a precedent for future debates on content moderation and First Amendment rights in the digital realm.

","https://techcrunch.com/wp-content/uploads/2022/05/GettyImages-1167833543.jpeg?resize=1200,798",2024-02-27 01:15:11
https://techcrunch.com/2024/02/26/inkitt-ai-publishing-37-million/,"Inkitt, a self-publishing platform using AI to develop bestsellers, books $37M led by Khosla","

In a world where every individual holds a unique narrative, Inkitt, a pioneering startup, believes in the transformative power of AI to unlock these stories and craft them into captivating blockbusters. With this vision, Inkitt has secured $37 million in funding, propelling its ambition to establish a modern-day ""Disney"" centered around user-generated content.

Inkitt's journey began with its eponymous app, a platform that empowers aspiring writers to self-publish their stories. Leveraging AI and data science, Inkitt meticulously selects the most promising tales, refining and distributing them through its second app, Galatea. This innovative approach has garnered an impressive following of 33 million users and produced numerous bestsellers.

The recently acquired funding, a Series C investment, will fuel Inkitt's expansion into diverse content realms. The company aims to harness AI to generate stories based on original ideas, tailor fiction to specific readers' preferences, venture into games and audiobooks, and adapt its published works into captivating video content. While human involvement remains crucial in the creative process, Inkitt envisions a future where AI will play a significant role in content creation.

CEO and founder Ali Albazaz harbors an ambitious long-term vision: to amass a vast library of captivating content and build a multimedia empire around it. Inkitt aspires to become a formidable competitor, not just to platforms like Wattpad, but to establish itself as the ""Disney of the 21st century.""

The Series C funding round was led by Vinod Khosla of Khosla Ventures, with participation from previous investors NEA and Kleiner Perkins, along with other undisclosed backers. This latest investment brings Inkitt's total funding to $117 million, positioning the company at a valuation of approximately $400 million post-money.

Inkitt's trajectory stands in stark contrast to the prevailing trend of declining reading habits in the digital age. The company recognizes this challenge and ingeniously addresses it by innovating the reading experience. Inkitt focuses on delivering books in a more engaging and dynamic manner, optimizing chapters for mobile devices, incorporating multimedia effects, and personalizing content to readers' tastes.

The company's data-driven approach involves conducting A/B tests on various aspects of a work, from titles and storylines to cliffhangers. This meticulous analysis provides Inkitt with valuable insights into readers' preferences, enabling them to refine subsequent publications.

Inkitt's strategy has proven effective, resulting in consistent growth and engagement across its platforms, even amidst the post-pandemic landscape. Albazaz attributes this success to the company's ability to provide an escape for readers seeking solace in a chaotic world.

Inkitt's achievements are remarkable. It ranks among the top 11 best-selling publishers globally, surpassing established names like Penguin Random House. Albazaz emphasizes that Inkitt's algorithms have yielded a 20-fold higher success rate in publishing bestsellers compared to traditional publishers.

Revenues have doubled in the past year, and newer ventures like Galatea TV are generating substantial returns. A TV series based on the Galatea book ""Beautiful Mistake"" alone has generated revenues of $500,000. The company is poised to achieve profitability in the near future.

Inkitt's focus on undiscovered talent sets it apart from traditional publishing houses. Albazaz acknowledges the challenges of working with established authors and their egos, preferring instead to nurture emerging writers.

The company's future plans involve integrating AI-generated stories, crafted from captivating treatments by talented human writers. Inkitt also aims to personalize stories using AI algorithms, although this remains a work in progress.

To realize this vision, Inkitt collaborates with various LLM providers, including OpenAI, Anthropic, and Mistral AI. The company employs a mix of AI tools, customizing them to enhance narrative construction. Additionally, Inkitt automatically translates books into 10 languages using DeepL and utilizes ElevenLabs for audiobook narration.

Inkitt's cautious approach to IP protection is evident in its avoidance of relying solely on a single LLM for an entire novel. This strategy mitigates the risk of proprietary data being used to train models.

Inkitt's unique approach and impressive achievements have attracted the attention of renowned investors like Vinod Khosla, who believes in the potential of AI-powered personalized entertainment.

With its innovative spirit and unwavering commitment to transforming user-generated stories into captivating blockbusters, Inkitt is poised to revolutionize the entertainment industry and establish a new era of storytelling.

","https://techcrunch.com/wp-content/uploads/2024/02/Screenshot-2024-02-27-at-00.56.38.png?resize=1200,457",2024-02-27 01:01:39
https://techcrunch.com/2024/02/26/for-whom-the-ring-tolls/,"The Ring Car Cam appears to be finished, doomed by an unclear target market","

In the realm of gadgets, the Ring Car Cam has faced an identity crisis since its launch. After three and a half years, Amazon's product page now suggests that the device's future is uncertain. This news comes as no surprise to industry observers, given the camera's ambiguous target audience and lack of a clear market niche.

Initially, the Ring Car Cam aimed to be an extension of the home security ecosystem into the automotive space. However, it struggled to find its place, whether as a dashcam, a security device, or a tech-savvy accessory. The price tag and subscription fees further hindered its appeal, especially when compared to more affordable and feature-rich alternatives in the market.

While the Ring Car Cam had some innovative features, such as the OBD-II port connection and the ""traffic stop"" mode, these were not enough to sway consumers. Most users found USB ports and continuous recording to be more practical and cost-effective. Additionally, the device's reliance on the Amazon Alexa ecosystem limited its appeal to a specific user base.

Amazon's decision to discontinue the Ring Car Cam highlights the challenges of disrupting established markets. Startups often face the dilemma of balancing innovation with a clear understanding of their target audience. Without a solid foothold in any particular category, the Ring Car Cam struggled to gain traction and ultimately met its demise.

The discontinuation of the Ring Car Cam may also prompt a reassessment of consumer expectations regarding dashcams and automotive security devices. As technology becomes more integrated into our lives, consumers may expect seamless connectivity and advanced features in their vehicles. However, the market's price-sensitive nature may hinder the widespread adoption of such devices.

Tesla's Sentry Mode, which promised remote access through the Ring Car Connect product, also seems to have fallen by the wayside. The lack of coverage and discussion around this feature suggests that it failed to gain significant traction among Tesla users.

The demise of the Ring Car Cam serves as a reminder that successful gadgets require a clear purpose, a well-defined target audience, and a competitive edge. Without these elements, even the most innovative devices may struggle to find their place in the market.

",https://techcrunch.com/wp-content/uploads/2024/02/Ring-Car-Cam.jpeg?w=1185,2024-02-26 23:29:25
https://techcrunch.com/2024/02/26/mwc-2024-everything-you-need-to-know/,"MWC 2024: Everything announced so far, including a Samsung smart ring, Google AI features","

Welcome to the bustling halls of Mobile World Congress 2024 in Barcelona! Our TechCrunch team is here to bring you all the exciting happenings from the world's biggest mobile technology event. Get ready for a whirlwind of product launches, industry insights, and startup innovations that will shape the future of connectivity.

From Google's AI-infused features to Xiaomi's robotic dog, MWC 2024 is a treasure trove of groundbreaking announcements. Stay tuned as we navigate the maze of booths and bring you the most captivating stories from the show floor.

Doublepoint's Gesture-Touch Revolutionizes Smartwatches

Android smartwatch users, rejoice! Doublepoint unveils its WowMouse gesture-touch control app, empowering you with intuitive hand gestures to navigate your smartwatch. Pinch away and experience the magic of touchless control.

Microsoft Unveils AI Access Principles

Brad Smith, Microsoft's president and vice chair, took the stage to introduce the ""AI Access Principles."" This 11-point framework outlines Microsoft's commitment to responsible AI development and infrastructure management. The company seeks to foster dialogue and collaboration with stakeholders, aiming for a transparent and ethical approach to AI.

Xiaomi's Electric Vehicle Unveiled

Xiaomi's foray into the electric vehicle market begins with the Xiaomi SU7. This full-size sedan promises high performance and eco-friendly technology. With plans to hit Chinese roads next year, the SU7 boasts five core EV technologies, including Xiaomi's proprietary HyperOS operating system.

Samsung's Smart Ring for Sleep Tracking

Samsung unveils the Galaxy Ring, a sleek wearable designed to monitor your sleep patterns. Equipped with onboard sensors, the Galaxy Ring tracks heart rate, movement, and breathing, providing a comprehensive analysis of your sleep health. Pricing and battery life details remain under wraps for now.

OnePlus Extends Watch Battery Life to 100 Hours

OnePlus' upcoming Watch 2 makes a bold promise: 100 hours of battery life in full Smart Mode. After three years of meticulous battery technology development, the company aims to redefine smartwatch endurance. Discover how OnePlus achieved this remarkable feat in our exclusive interview with Tuomas Lampén, OnePlus Europe's head of strategy.

Xiaomi's CyberDog 2: A Robotic Companion

After years of anticipation, Xiaomi's CyberDog 2 makes its grand appearance at MWC. This upgraded robotic dog showcases a more realistic head design and enhanced capabilities. Priced at $3,000, CyberDog 2 is ready to become your loyal companion.

Lenovo's Transparent Laptop Concept

Lenovo pushes the boundaries of laptop design with its transparent laptop concept. This futuristic device features a transparent screen and keyboard, creating an augmented reality-like experience. While still in the conceptual stage, Lenovo's innovation sparks curiosity and excitement.

Google Infuses AI into New Features

Google expands its AI capabilities across various services, including phones, cars, and wearables. Gemini, Google's AI assistant, now generates messages, captions for images, and text summaries. Android Auto users can access passes on Wear OS, while the Lookout app assists visually impaired individuals with AI-powered image captions.

Infinix's E-Color Shift: A Colorful Twist

Infinix takes e-ink technology to the next level with its E-Color Shift. This innovative display adds vibrant colors to the back of your phone, transforming it into a dynamic canvas. Discover how Infinix breathes new life into the often-overlooked rear panel of smartphones.

Seaborough's Mood-Boosting Desktop Lamp

Seaborough introduces a compact desktop lamp designed to mimic the sun's impact on serotonin production in the brain. This innovative device aims to improve mood and well-being, especially during the dreary winter months.

","https://techcrunch.com/wp-content/uploads/2024/02/mwc-2024-splash.jpg?resize=1200,675",2024-02-26 21:25:10
https://techcrunch.com/2024/02/26/ransomware-attack-change-healthcare-prescription-pharmacy-outages/,Ransomware attack blamed for Change Healthcare outage stalling US prescriptions,"

BlackCat Ransomware Cripples U.S. Healthcare Giant Change Healthcare

In a shocking turn of events, the ongoing cyberattack on Change Healthcare, a prominent U.S. healthcare tech giant, has been attributed to the notorious BlackCat ransomware group. This revelation sheds light on the severity of the situation that has caused widespread disruptions to hospitals and pharmacies across the nation.

The attack, which began on February 21, has led to outages and disruptions in patient care, prescription processing, and billing systems. Change Healthcare, responsible for handling one-third of U.S. patient records, was forced to take most of its systems offline to combat the intrusion.

The BlackCat ransomware group, also known as ALPHV, is a notorious cybercriminal organization known for its sophisticated attacks and extortion tactics. The group typically encrypts a victim's files and demands a ransom payment in exchange for the decryption key. In some cases, they also steal sensitive data before encrypting it, adding an extra layer of pressure on victims.

The extent of patient data theft in this attack remains unclear, but the potential consequences are deeply concerning. The compromise of sensitive medical information could have far-reaching implications for patients' privacy and healthcare outcomes.

The attribution of the attack to BlackCat is particularly noteworthy as cybersecurity experts have not previously linked the group to any nation-state or government. This raises questions about the potential involvement of state-sponsored actors in the cyberattack.

The impact of the attack has been felt far and wide, with hospitals, healthcare providers, and pharmacies struggling to fulfill prescriptions and process insurance claims. The American Hospital Association (AHA) has urged its members to disconnect from Optum, a subsidiary of UnitedHealth Group that acquired Change Healthcare in 2022, until the situation is deemed safe.

The ripple effects of the cyberattack have also reached the U.S. military, with Tricare, the health insurance provider for active military personnel, reporting disruptions to military pharmacies worldwide and some retail pharmacies nationwide.

The incident serves as a stark reminder of the vulnerability of healthcare systems to cyberattacks. As technology becomes increasingly integral to healthcare delivery, robust cybersecurity measures are essential to protect patient data and ensure the continuity of critical services.

","https://techcrunch.com/wp-content/uploads/2024/02/unitedhealth-change-uhc-uhg-optum-breach-ransomware.jpg?resize=1200,801",2024-02-26 19:26:47
https://techcrunch.com/2024/02/26/independent-vision-os-apps-for-the-apple-vision-pro/,Apple's Vision Pro is here: These are some of the most exciting indie apps and games,"

Apple Vision Pro: Unveiling the Most Exciting Indie Apps and Games

The wait is over! Apple's Vision Pro is finally here, and with it comes a world of possibilities for AR/VR enthusiasts. While big names like Disney+, Max, TikTok, Zoom, and Reddit have made their presence felt, there's a whole universe of independent developers ready to captivate your senses.

Dive into a Realm of Spatial Puzzles and Creative Expression

Prepare to be mesmerized by Soul Spire, a spatial puzzle game that challenges you to free friendly ghosts trapped within color-shifting cubes. Or, unleash your creativity with Blackbox, a unique puzzle experience that invites you to interact with floating puzzles in innovative ways, like singing and rotating.

If you're up for a card-matching challenge, Ploppy Pairs has you covered. Play with friends and family via SharePlay during FaceTime calls, and experience the joy of manipulating cards in 3D space. And for those who love to sketch and doodle, Doodle Draw offers a digital canvas to unleash your imagination with various brushes, pens, markers, and colors.

Immerse Yourself in Music Like Never Before

Music lovers, get ready for an auditory adventure. NowPlaying is your go-to app for discovering new music and expanding your knowledge. Search for your favorite songs, learn about artists, and even earn trophies to display on your virtual shelf. And for aspiring DJs, Djay offers a hyperrealistic 3D turntable, futuristic environments, and a built-in music library to create your own mixes.

Experience Live Concerts and Visual Music Performances

Get ready for a front-row seat to live-action 3D concerts with AmazeVR Concerts. Watch your favorite artists perform in stunning virtual environments, and immerse yourself in the music like never before. And if you're a fan of synthesizers, Spatial Symphony and Animoog Galaxy offer immersive playing experiences, allowing you to control sounds and visuals with hand gestures.

Boost Your Productivity and Stay Organized

The Vision Pro isn't just for entertainment; it's also a productivity powerhouse. MindNode helps you brainstorm and organize notes in the form of thought bubbles that float around your virtual space. Numerics brings your KPIs from various tools into one place, while OmniPlan lets you visualize Gantt charts in a large window. And for those who prefer a minimalist approach, Focus and Focused Work offer task management and timer features to keep you on track.

Explore the World and Learn in New Ways

Travel the world with Tizipizi, a time zone converter and world clock that lets you schedule meetings with ease. Navi breaks down language barriers by translating conversations in real time during FaceTime calls. And for students, Study Snacks and Subjects offer innovative ways to learn and track progress.

Unleash Your Creativity and Explore New Dimensions

Let your imagination soar with Sky Guide, a constellation finder app that brings the stars into your living room. Planner 5D lets you design your dream home in 3D, while AR Art Projector helps artists project images onto any surface for easy tracing or sculpting. And for basketball enthusiasts, Elite Hoops allows coaches to create plays and drills that come to life right before their eyes.

Relax and Find Your Zen

The Vision Pro is also a sanctuary for relaxation and mindfulness. Zenitzer offers meditation timers, daily tracking, and immersive sounds for a peaceful session. Lungy: Spaces provides interactive breathing exercises, while Odio delivers immersive soundscapes to help you escape from everyday distractions. And for a truly unique experience, Endel Realms combines audiovisual elements with gesture-controlled particles of light, creating a mesmerizing and responsive environment.

Additional Note:

While the Apple Vision Pro offers a wide range of apps and games, it's important to note that the availability of certain apps may vary depending on your region and device compatibility. Be sure to check the App Store for the latest information on available apps.

",https://techcrunch.com/wp-content/uploads/2024/01/Apple-Vision-Pro-Display-1-1200x695-1.webp?w=1200,2024-02-26 18:00:58
