Link,post_title,title,post_content,featured_image,Date-Publish,meta_desc,focuskeywords,post_category,Post_tag
https://techxplore.com/news/2024-04-sodium-battery-capable-rapid-seconds.html,Researchers develop sodium battery capable of rapid charging in just a few seconds, High-Performance Sodium-Ion Hybrid Batteries: A Game Changer in Energy Storage ,"Title: Revolutionary High-Performance Hybrid Sodium-Ion Batteries: A Leap Towards Next-Generation Energy Storage

Introduction

In recent years, sodium (Na) has emerged as a promising alternative to lithium (Li) in battery technologies due to its abundance and lower cost. However, sodium-ion batteries face challenges such as limited power output, inferior storage capabilities, and extended charging times. To address these issues, a research team headed by Professor Jeung Ku Kang from the Department of Materials Science and Engineering has engineered a groundbreaking high-energy, high-power sodium-ion hybrid battery that offers swift charging capabilities. This article discusses the novel hybrid energy storage system, its underlying principles, and potential applications.

High-Performance Sodium-Ion Hybrid Battery System

The new hybrid sodium-ion battery combines anode materials commonly employed in batteries with cathodes suited for supercapacitors, allowing the device to deliver impressive storage capacities alongside quick charge-discharge rates. These attributes render the technology a strong candidate to replace conventional lithium-ion batteries in various sectors, including electric vehicles, consumer electronics, and aerospace industries.

Synthesis Approach and Electrode Optimization

The research team capitalized on two distinct metal-organic frameworks to optimize the synthesis of hybrid batteries. An anode material featuring enhanced kinetics resulted from incorporating fine active components in porous carbon originating from metal-organic frameworks. Furthermore, a high-capacity cathode material was fabricated, enabling the creation of a balanced sodium-ion storage system with reduced variations in energy storage rates among the electrodes.

Ultrafine Iron Sulfide-Embedded S-doped Carbon/Graphene (FS/C/G) Cathode and Zeolitic Imidazolate Framework-Derived Porous Carbon (ZDPC) Cathode

Central to the innovation is the utilization of ultrafine iron sulfide-embedded S-doped carbon/graphene (FS/C/G) anode and zeolitic imidazolate framework-derived porous carbon (ZDPC) cathode materials. The former provides superior ion transportation channels, facilitating fast charge transfer during operation. Meanwhile, the latter boasts increased surface areas essential for accommodating higher quantities of charged species. When integrated, these advanced components enable the sodium-ion hybrid energy storage system to attain exceptional energy densities and power densities, exceeding those observed in commercial lithium-ion batteries.

Applications and Future Directions

With an energy density of 247 Wh/kg and a power density of 34,748 W/kg, the cutting-edge sodium-ion hybrid energy storage device demonstrates remarkable performance. Its ability to quickly charge combined with industry-leading energy levels paves the way for wider adoption in diverse electronic devices, particularly electric automobiles, portable gadgets, and aviation engineering. As researchers continue improving upon these designs, we can expect further advancements towards practical implementation and widespread use of sodium-based alternatives to lithium-ion batteries.

Conclusion

The pioneering sodium-ion hybrid battery constitutes a substantial step forward in addressing prevailing obstacles in contemporary energy storage solutions. By harnessing the strengths of both battery-type anodes and supercapacitor-like cathodes, this revolutionary design promises faster charging speeds without compromising energy efficiency. Moreover, its applicability extends beyond laboratory settings, presenting real-world possibilities for enhancing numerous modern technological landscapes.",https://scx2.b-cdn.net/gfx/news/hires/2024/kaist-develops-sodium.jpg,2024-04-19 13:02:30,"""Discover revolutionary fast-charging sodium-ion hybrid batteries: 247 Wh/kg energy & 34,748 W/kg power density. Redefining energy storage for EVs, electronics, & aviation.""", Fast-Charging ,Technology,"Formicoders,News,AI,Technology,Innovation,Programmering,Coding,Wordpress,Python"
https://techxplore.com/news/2024-04-flexible-efficient-dc-power-sustainable.html,A flexible and efficient DC power converter for sustainable-energy microgrids, Cutting-Edge DC Power Converter Boosts Efficiency in Sustainable Microgrids ,"Title: Revolutionizing Energy Storage and Conversion: A New Era of DC-DC Power Converters

Introduction

In the quest for more efficient, reliable, and sustainable energy storage and conversion solutions, a groundbreaking development by Kobe University and National Chung HSING University sets the stage for transformative changes. This innovative DC-DC power converter surpasses existing models in terms of efficiency, versatility, and overall performance. As we delve deeper into this remarkable discovery, let's explore how this invention tackles critical challenges in integrating various energy sources and appliances.

Addressing the Current Dilemma

While alternating current (AC) powers most electricity networks globally, many modern devices such as solar panels, batteries, and computer systems rely on direct current (DC). To accommodate these disparate requirements, bulky and often inefficient AC-to-DC conversion components become essential. In response, DC microgrids present a promising solution, allowing seamless interaction between numerous renewable DC energy sources and storage devices without unnecessary conversions. Nevertheless, managing varying voltage levels among individual DC devices remains a key hurdle—one that the novel DC-DC power converter aims to overcome.

Breakthrough Design Principles

Enter the brainchild of Mishima Tomokazu and his international team, comprising experts from various fields. They developed an advanced four-phase interleaved bidirectional DC-DC converter utilizing silicon carbide metal-oxide semiconductor field-effect transistors (SiC-MOSFETs), renowned for their exceptional switching speed and temperature tolerance. Boasting unique features like wide-range voltage ratio management and asymmetrical duty limit control, this innovation addresses the limitations of conventional DC-DC converters.

Impressive Performance Metrics

Through rigorous experimentation, simulation, and analysis, the team demonstrated outstanding results, achieving up to 98.3% efficiency during prototype evaluations. According to lead author Liu Shiqiang, these findings underscore the feasibility and scalability of the proposed design concept, opening doors for further advancements in bidirectional DC-DC conversion technology. Indeed, this achievement marks a considerable leap forward in addressing complex challenges associated with electric vehicle (EV)-connected DC microgrids.

Patent Protection and Commercialization

With patent filings underway in Japan and preparations commencing for commercialization through UPE-Japan, a Kobe University startup, the potential impact of this technological marvel cannot be overstated. Anticipating continuous improvements aimed at increasing power densities and expanding application possibilities, the research team maintains ambitious goals centered around promoting efficient, dependable, and eco-friendly energy storage and conversion methodologies, primarily targeting EVs and renewable energy integration.

Conclusion

As global demand intensifies for effective energy storage and conversion techniques, inventions like the state-of-the-art DC-DC power converter emerge as frontrunners capable of revolutionizing industries. By bridging gaps between diverse energy sources and appliances, embracing ingenious engineering concepts, and delivering tangible benefits, innovators continue pushing boundaries in pursuit of greener, smarter, and more resilient infrastructure.",https://scx2.b-cdn.net/gfx/news/hires/2024/a-flexible-and-efficie.jpg,2024-04-19 10:27:03,"New Era of High-Efficiency Power Converter: Achieves 98.3% Efficiency. Optimize renewable energy integration & EV-connected microgrids with Kobe University's breakthrough.

 Unique 4-phase interleaved bidirectional design
 Wide-range voltage ratio management
 Asymmetrical duty limit control
 SiC-MOSFET technology for exceptional speed & temperature tolerance
 Patent-pending & commercialization imminent through UPE-Japan", Power converter ,Technology,"Formicoders,News,AI,Technology,Innovation,Programmering,Coding,Wordpress,Python"
https://techcrunch.com/2024/04/19/post-news-the-a16z-funded-twitter-alternative-is-shutting-down/,"Post News, the a16z-funded Twitter alternative, is shutting down"," ""Post News Shuts Down: Monetizing Digital Content – A Cautionary Tale"" ","Title: The Rise and Fall of Post News: A Cautionary Tale in Monetizing Digital Content

In the world of microblogging, a new player named Post News attempted to carve out a niche for itself following Elon Musk's Twitter acquisition. However, founder Noam Bardin announced last week that the platform will be closing its doors, marking a premature end to its brief existence.

Post News aimed to capitalize on Twitter's status as a hub for journalists and industry professionals, intending to create a unique space where publishers and writers could directly monetize their content. Users could purchase standalone articles from select partner outlets rather than committing to full subscriptions. While this model presented an innovative approach to digital content consumption, it ultimately failed to gain sufficient traction among users.

Bardin acknowledged the shortcomings of the platform, stating, ""Our service is not growing fast enough to become a real business or a significant platform."" Nevertheless, he believes that Post validated several key concepts related to digital content monetization, such as the potential for micropayment systems and readers' willingness to support quality journalism through tips and contributions.

The demise of Post News raises questions regarding the future of alternative monetization strategies in the rapidly evolving media landscape. With increasing numbers of independent and worker-owned publications emerging—thanks to technology platforms like Substack, Beehiiv, and Ghost—it seems plausible that these decentralized models might present viable paths forward. Yet, Post News serves as a reminder that capturing and sustaining user interest remains a formidable challenge.

It is worth noting that Post News wasn't alone in trying to seize opportunities created by Musk's Twitter acquisition. Several other Twitter alternatives launched concurrently, hoping to lure away users unhappy with his leadership choices. Unfortunately, despite hanging on for over a year since its inception, Post isn't the only new kid on the block to fold; another microblogging site, Pebble (also known as T2), closed its doors in October.

Social media, as history has shown us repeatedly, is indeed a cutthroat marketplace. Even when platforms manage to attract a sizable initial user base, maintaining long-term engagement proves elusive. As Post News discovered firsthand, success requires far more than simply filling a temporary gap left behind by larger players. It demands continuous innovation, adaptive growth, and above all, resilience.","https://techcrunch.com/wp-content/uploads/2023/04/post-news-app-icon-ios.jpg?resize=1200,675",2024-04-19 19:13:22,"Discover why Post News, the Twitter alternative, couldn't sustain user interest in the competitive social media landscape. Explore its innovative monetization model and learn valuable insights about digital content consumption. Act now and stay informed!

Meta description length: 153 characters", Monetization Model ,Technology,"Formicoders,News,AI,Technology,Innovation,Programmering,Coding,Wordpress,Python"
https://techcrunch.com/2024/04/20/india-election-tough-fight-against-online-misinformation/,India's election overshadowed by the rise of online misinformation, India's Elections Threatened by Misinformation & Cheapfakes: A Solutions Overview ,"Title: The Epidemic of Misinformation in India's Elections: A Deep Dive into Its Impact and Solutions

Introduction

As India gears up for the world's largest democratic exercise, the 2023 general election, the electoral process is marred by the rampant spread of misinformation. With over 830 million internet users and a thriving social media landscape, India is particularly vulnerable to the manipulation and misuse of information. This article explores the challenges posed by misinformation, its potential consequences, and the measures required to combat this critical issue.

The Scope of Misinformation in India

India's vast diversity in language and culture has led to an unprecedented rise in the deliberate creation of misinformation, aimed at polarizing society. The situation has been further complicated by advances in technology, such as deepfakes generated using generative AI, which can have deadly effects, including violence and increased hatred towards minorities.

The Indian fact-checking community, led by organizations like Alt News, is working tirelessly to combat this issue. However, the sheer volume of misleading content, coupled with the limited resources and reach of these organizations, makes it difficult to maintain the integrity of the electoral process.

The Role of Big Tech

The government has attempted to address the problem by updating the IT intermediary rules in 2022, requiring social media companies to remove misleading content within 72 hours of being reported. However, the enforcement of these rules has been selective, and digital advocacy groups like the Internet Freedom Foundation have raised concerns about their vagueness.

Major technology platforms, including Google and Meta, have announced measures to limit misleading content on their platforms during Indian elections. However, these efforts have fallen short of implementing significant product-related changes or taking stringent actions against fake news. Just before the Indian election, Meta reportedly cut funding to news organizations for fact-checking on WhatsApp.

The Rise of ""Cheapfakes""

An emerging trend in India is the spread of ""cheapfakes"" – content generated with less sophisticated measures of altering images, videos, and audio. These cheapfakes are widely shared across social media platforms and can significantly impact the electoral process.

Civil Society's Response

In response to this crisis, 11 civil society organizations in",https://techcrunch.com/wp-content/uploads/2024/04/india-election-2024-getty.jpg?w=1200,2024-04-20 12:00:27,"""Uncover the truth behind India's 2023 election misinformation. Act now to support fact-checkers combatting disinformation, deepfakes, and cheapfakes."" (100 characters)

Meta Description:

Discover the depth of India's misinformation crisis threatening the 2023 elections. Learn about deepfakes, cheapfakes, and the efforts of fact-checkers. Act now to support the fight against disinformation.","Democracy Threatened: Tackling India's Misinformation Crisis in 2023 Elections

As the world’s most populous democracy prepares for the 2023 general elections, India faces an insidious challenge—the rapid proliferation of misinformation threatening the very foundation of its democratic system. Home to more than 830 million internet users and flourishing social networks, the country struggles under the weight of pervasive disinformation campaigns designed to sow discord among diverse linguistic and cultural communities. In light of this pressing concern, we delve into the extent of the misinformation epidemic, examine its ominous implications, and discuss possible solutions to safeguard the credibility of upcoming polls.

Dissecting Disinformation in India

A kaleidoscopic nation marked by rich linguistic and cultural heterogeneity, India presents fertile ground for disseminating fabricated narratives that stoke societal divisions. Technological advancements, notably artificial intelligence (AI)-generated deepfakes, exacerbate matters, leading to real-world ramifications, from inciting mob violence to escalating animosity toward religious minority groups. To counteract this menace, dedicated entities like Alt News strive ceaselessly to debunk falsehoods; however, they confront formidable obstacles due to overwhelming volumes of deceptive material, meager financial support, and restricted outreach compared to those propagating misinformation.

Government Regulations and Corporate Responsibility

Efforts to contain misinformation gained momentum when the Indian government revised IT intermediary guidelines last year, compelling social media corporations to purge fraudulent content within three days of notification. Nevertheless, inconsistent rule implementation and ambiguous provisions raise questions regarding effectiveness, prompting apprehension among digital freedom activists such as the Internet Freedom Foundation. Concurrently, tech giants like Google and Facebook grapple with mitigating misleading content but fall short of introducing substantial platform modifications or imposing severe penalties against creators of disinformation. Noteworthy examples include instances where major players reduced allocations for fact-checking initiatives just prior to crucial electoral events.

“Cheapfakes” Proliferation

Alarmingly, a novel phenomenon dubbed “cheapfakes” gains traction in India, characterized by unsophisticated yet potent methods to distort visual and auditory data. Cheapfakes pose considerable risks since they evade detection mechanisms employed by popular social networking sites, enabling them to spread rapidly and imperil electoral processes.

Community Initiatives

Urged by mounting threats, numerous nonprofit organisations have united forces to tackle the misinformation conundrum plaguing India’s political sphere. Among these collaborators are 11 distinguished civil society actors who recently unveiled a comprehensive toolkit addressing various aspects of the crisis, encompassing research, legal recourse, public awareness campaigns, and international collaboration. This collective endeavor underscores the gravity of the predicament while highlighting potential avenues for combatting malicious propaganda and restoring trust ahead of the pivotal 2023 elections.",Technology,"Formicoders,News,AI,Technology,Innovation,Programmering,Coding,Wordpress,Python"
https://techcrunch.com/2024/04/20/women-in-ai-allison-cohen-on-building-responsible-ai-projects/,Women in AI: Allison Cohen on building responsible AI projects, Allison Cohen: Pioneering Socially Beneficial AI Projects ,"Title: Allison Cohen: A Pioneer in Socially Beneficial AI Projects

Introduction

In an effort to highlight the achievements of women in AI, TechCrunch has been featuring interviews with remarkable women who have contributed significantly to the AI revolution. Among these influential figures is Allison Cohen, the Senior Applied AI Projects Manager at Mila, a Quebec-based community of over 1,200 researchers specializing in AI and machine learning. In this profile, we will delve into Cohen's professional journey, her role at Mila, and her thoughts on the importance of diverse perspectives in the AI field.

Breaking into AI and Navigating Challenges

Cohen's interest in AI began during her master's program in global affairs at the University of Toronto. She recognized the potential of AI in transforming world politics and decided to pursue her interest in the field. A creative writing competition essay on psychedelic drugs and AI in the labor market gave her the confidence to continue learning about AI and eventually break into the field.

As a woman in a male-dominated industry, Cohen draws inspiration from feminist standpoint theory, which emphasizes the importance of marginalized communities' perspectives in promoting fairness and inclusivity. She believes that the underrepresentation of women in AI can reinforce power dynamics and hinder progress.

Notable AI Projects

At Mila, Cohen manages various socially beneficial AI projects, including the development of a tool that detects misogyny, an app to identify online activity related to suspected human trafficking, and an agricultural app that recommends sustainable farming practices in Rwanda. She takes pride in her work on a dataset containing instances of subtle and overt expressions of bias against women. This project, which involved managing a multidisciplinary team and blending social science traditions with cutting-edge computer science, received recognition at the NeurIPS conference.

Additionally, Cohen's work has inspired similar interdisciplinary processes in other countries, such as AI Sweden's adaptation of the misogyny detection project to fit Swedish notions and expressions.

Advice for Women in AI

Cohen encourages women in AI to find allies and develop strong, trusting relationships. She emphasizes the importance of diverse perspectives in challenging structural issues and inequities within the industry, ultimately benefiting everyone involved.

[","https://techcrunch.com/wp-content/uploads/2024/04/women-in-ai-cohen.jpg?resize=1200,675",2024-04-20 13:00:04,"Discover Allison Cohen's vital contributions to responsible AI initiatives! As Mila's Senior Applied AI Projects Manager, she champions equitable AI advancement & tackles societal challenges. Explore her groundbreaking projects combatting misogyny, human trafficking, & eco-unfriendly farming - shaping a brighter future for all! AIforGood WomeninTech

Meta description length: 173 characters","Title: Allison Cohen: A Champion of Responsible AI Initiatives

Introduction

In our series showcasing women making significant strides in AI, Allison Cohen stands out as a trailblazer driving impactful, ethical AI projects. Currently serving as the Senior Applied AI Projects Manager at Mila, home to more than 1,200 AI research specialists, she focuses on creating socially advantageous AI applications. Let us explore Cohen's career path, her current position, and her valuable insights regarding gender diversity in AI.

Navigating Obstacles and Advocacy

Allison Cohen discovered her passion for artificial intelligence during her master's degree in global affairs at the University of Toronto. Her curiosity was sparked by realizing AI's capacity to reshape international relations. Faced with being a woman in a predominantly male sector, Cohen relies on feminist standpoint theory—an approach that values opinions from marginalized groups—to promote equity and inclusion. Understanding the need for varied viewpoints, she aims to address power imbalances hampering AI advancements.

Impactful AI Projects

Managing numerous meaningful initiatives at Mila, Cohen contributes substantively to improving society through AI innovation. Some notable projects include developing tools to combat misogyny, identifying potentially harmful online activities linked to possible human trafficking cases, and offering eco-friendly farming suggestions via an agriculture app in Rwanda. Moreover, she led a groundbreaking study analyzing biases faced by women using datasets comprising both explicit and implicit sexism examples. Presented at NeurIPS, this pioneering initiative paved the way for future cross-discipline collaborations among sociologists and data scientists.

Expanding Impact Internationally

Beyond Canada, Cohen's work inspires adaptations in different nations like Sweden, where AI Sweden adopted a version tailored to their local context. Such success exemplifies how inclusive collaboration leads to better outcomes across borders.

Empowering Women in AI

To foster growth and support in AI for aspiring female professionals, Cohen advocates seeking allies and cultivating solid connections based on mutual respect. Encouraging diverse voices helps challenge systemic problems and benefit all stakeholders in the field.",Technology,"Formicoders,News,AI,Technology,Innovation,Programmering,Coding,Wordpress,Python"
