Link,post_title,title,post_content,featured_image,Date-Publish,meta_desc,focuskeywords,post_category,Post_tag
https://www.zdnet.com/article/5-new-ways-google-can-help-you-plan-a-better-summer-vacation/,5 new ways Google can help you plan a better summer vacation,"Refined SEO Title: 
""Summer Getaway Planning Made Easy with Google's AI-Powered Tools""

Introduction:

Summer is here, and it's the perfect time to start planning your next vacation. Whether you're looking for a relaxing retreat or an adventurous escape, Google has the perfect tools to help you plan the perfect summer getaway. In this article, we will explore five new ways that Google can help you plan your vacation, making it easier and more enjoyable than ever before.

1. Google Flights:

Google Flights is an excellent tool for finding the best flight deals and travel options. With this tool, you can easily compare prices and find the cheapest flights, as well as travel deals and discounts. Whether you're traveling domestically or internationally, Google Flights can help you find the best travel options to suit your budget.

2. Google Maps:

Google Maps is an essential tool for any traveler. With this tool, you can easily find the best restaurants, attractions, and accommodations in your destination. You can use Google Maps to find the nearest restaurant, explore local neighborhoods, and get directions to your hotel. With its extensive database of information, Google Maps can help you make the most of your vacation.

3. Google Images:

Google Images is an excellent tool for finding inspiration for your vacation. With this tool, you can easily search for images related to your destination and find ideas for your vacation. Whether you're looking for a new outfit, a travel accessory, or inspiration for your itinerary, Google Images can help you find it all.

4. Google Search:

Google Search is the most powerful tool for finding information about your destination. With this tool, you can easily find information about local attractions, weather, events, and more. Whether you're looking for the latest news about your destination or information about popular tourist activities, Google Search can help you find it all.

5. Google Translate:

Google Translate is an excellent tool for travelers who speak different languages. With this tool, you can easily translate words and phrases into the language of your destination. Whether you're ordering food at a restaurant or asking for directions, Google Translate can help you communicate effectively with locals and make your vacation more enjoyable.
","Title: Plan Your Perfect Summer Getaway with Google's AI-Powered Tools

As the sun starts to shine and summer beckons, it's time to start planning your next vacation. Whether you're looking for a relaxing retreat or an adventurous escape, Google has the perfect tools to help you plan the perfect summer getaway.

Cleaning Instructions:

 Translate non-English text to English.
 Remove any advertisements, unrelated content, or author attributions.
 Correct grammatical errors, typos, or awkward phrasings.
 Maintain factual accuracy and the core message of the text.

Rewriting Instructions:

 Generate a rewritten version that retains the main points and facts from the original text but avoids close paraphrasing.
 Ensure the length falls within 700 to 1200 words.
 Use engaging and creative language suitable for a blog audience.
 Ensure uniqueness and originality to avoid any copyright issues.

Output Format:

 Organize the content into coherent paragraphs with a clear introduction, body, and conclusion.
 Ensure readability, engaging tone, and suitable language for a general audience.
 Use transition words in at least 50% of the sentences to enhance readability.
 The final output should be polished and ready for direct publication on a blog website.",https://www.zdnet.com/a/img/resize/67368207d78007e17a34577fd41476327f70f3df/2024/03/29/5baf7b9a-c131-4821-a6ed-54eca6744c6d/gettyimages-1326412398.jpg?auto=webp&fit=crop&height=675&width=1200,2024-03-29 00:00:00,"Title: 5 Ways to Plan the Perfect Summer Vacation with Google

The warm weather has arrived, and it's time to start thinking about planning your next summer vacation. Whether you're looking to relax on a beach or embark on an adventure, Google has a range of tools to help you plan the perfect getaway. Here are five new ways you can use Google to enhance your vacation planning experience.

1. Google Flights: This tool allows you to compare prices for flights from your departure airport to various destinations around the world. Simply enter your departure and arrival dates, and Google will show you a list of available flights along with prices. With this tool, you can quickly find the best deals on flights and save money on your vacation.

2. Google Maps: This tool allows you to explore the different attractions and locations you'll be visiting on your vacation. Simply enter the name of the location you want to explore, and Google Maps will show you a map of the area with information about popular tourist spots, restaurants, and hotels. With this tool, you can plan your itinerary and make sure you don't miss out on any must-see attractions.

3. Google Search: This tool allows you to search for information on almost any topic related to your vacation. Whether you're looking for tips on packing, weather forecasts, or information about local customs, Google Search can help you find the answers you need. With this tool, you can plan your trip with confidence and make informed decisions about your vacation.

4. Google Translate: If you're traveling to a foreign country, Google Translate can help you communicate with locals and navigate your way around. Simply enter the text you want to translate, and Google Translate will show you the translated text in the local language. With this tool, you can overcome language barriers and make your vacation more enjoyable.

5. Google Images: This tool allows you to search for images related to your vacation. Whether you're looking for inspiration for your trip or want to see what the destination looks like, Google Images can help. With this tool, you can find stunning images of the places you'll be visiting and use them to inspire your trip.

In conclusion, Google has a range of tools that can help you plan the perfect summer vacation. From finding the best deals on flights to exploring new locations, Google has everything you need to make your vacation planning easy and stress-free. So why not try out these tools today and plan your next adventure with confidence.

When it comes to planning your summer vacation, preparation is essential. You want to make the most of your time off and have the best possible experience. That's where Google comes in. With its range of AI-powered tools, Google can help you plan the perfect summer getaway with ease.

First, Google Flights is an excellent tool for finding the best deals on flights. Simply enter your departure and arrival dates, and Google will show you a list of available flights along with prices. With this tool, you can quickly find the best deals on flights and save money on your vacation.

Next, Google Maps is a must-have tool for exploring new locations. This tool allows you to search for information about popular tourist spots, restaurants, and hotels in the areas you'll be visiting. With this tool, you can plan your itinerary and make sure you don't miss out on any must-see attractions.

If you're looking for information on almost any topic related to your vacation, Google Search is the perfect tool. Whether you need tips on packing, weather forecasts, or information about local customs, Google Search can help you find the answers you need. With this tool, you can plan your trip with confidence and make informed decisions about your vacation.

If you're traveling to a foreign country, Google Translate can help you communicate with locals and navigate your way around. Simply enter the text you want to translate, and Google Translate will show you the translated text in the local language. With this tool, you can overcome language barriers and make your vacation more enjoyable.

Finally, Google Images is a great tool for finding inspiration for your trip. Whether you're looking for stunning images of the places you'll be visiting or want to see what the destination looks like, Google Images can help. With this tool, you can find images that will inspire your trip and help you plan your itinerary.

In conclusion, Google has a range of AI-powered tools that can help you plan the perfect summer vacation. From finding the best deals on flights to exploring new locations, Google has everything you need to make your vacation planning easy and stress-free. So why not try out these tools today and plan your next adventure with confidence?", Keyphrase: Summer vacation planning with Google ,Technology,"Formicoders,News,AI,Technology,Innovation,Programmering,Coding,Wordpress,Python"
https://www.engadget.com/microsoft-copilot-has-reportedly-been-blocked-on-all-congress-owned-devices-034946166.html,Microsoft Copilot has reportedly been blocked on all Congress-owned devices, Microsoft Copilot blocked on Congress-owned devices due to security concerns. ,"The US Congress has recently prohibited the use of Microsoft's Copilot on government-issued devices, citing security concerns. The AI chatbot, which is powered by OpenAI's large language models, was deemed a risk due to the potential for leaking House data to non-House approved cloud services. While staffers can still use Copilot on their own personal devices, it will be officially blocked on all Windows-based devices owned by the Congress.

This move is not new, as the Congress had already set strict limits on the use of ChatGPT, which is powered by OpenAI's large language models, a year ago. Staffers were allowed to use the paid (ChatGPT Plus) version of the chatbot for research and evaluation, but the free version was banned from use on House computers.

Recently, the White House issued rules for federal agencies to follow when it comes to the use of generative AI. These rules ensure that any tool used by the government does not endanger the rights and safety of Americans. Microsoft has acknowledged the need for higher security requirements for government users and has announced a roadmap of tools and services designed for government use. These include an Azure OpenAI service for classified workloads and a new version of Microsoft 365's Copilot assistant.

Szpindor's office will evaluate the government version of Copilot when it becomes available before deciding if it can be used on House devices. While this move may be inconvenient for staffers, it is crucial for maintaining the security of government data.",https://s.yimg.com/ny/api/res/1.2/wDCn8FUMHSGZ9JddUvosHA--/YXBwaWQ9aGlnaGxhbmRlcjt3PTEyMDA7aD03ODI-/https://s.yimg.com/os/creatr-uploaded-images/2024-03/f171ef30-ee34-11ee-bf2d-509460709f05,2024-03-30 03:49:46,"Microsoft Copilot has been banned on government-issued devices due to security concerns, as it was deemed a risk for leaking House data to non-House approved cloud services. The AI chatbot, powered by OpenAI's large language models, was already banned on all Windows-based devices owned by the Congress a year ago. The White House has issued rules for federal agencies to follow when it comes to the use of generative AI to ensure that any tool used by the government does not endanger the rights and safety of Americans. Microsoft has announced a roadmap of tools and services designed for government use, including an Azure OpenAI service for classified workloads and a new version of Microsoft 365's Copilot assistant. Szpindor's office will evaluate the government version of Copilot before deciding if it can be used on House devices.",Keyphrase: Microsoft Copilot Ban,Technology,"Formicoders,News,AI,Technology,Innovation,Programmering,Coding,Wordpress,Python"
https://techcrunch.com/2024/03/29/orbit-fab-unveils-30k-port-to-refuel-satellites/,Orbit Fab unveils $30K port to refuel satellites, Revolutionize Satellite Industry with $30K Ports | Orbit Fab ,"Orbit Fab, a Colorado-based startup, is revolutionizing the satellite industry by building ""gas stations"" for satellites. The company has developed a docking mechanism, called RAFTI, that allows spacecraft to transfer propellant from an orbital tanker to the customer's spacecraft. The price tag for each port is just $30,000.

The idea behind RAFTI is to provide a solution for spacecraft that are optimized with the amount of fuel they have and eventually run out. The extra kilogram of propellant that can be added can generate as much as $1 million in marginal revenue. This is a significant opportunity for the space industry, and Orbit Fab is positioned to capitalize on it.

The company was founded in 2018 and has since raised $6 million in seed funding and $28.5 million in Series A funding. The CEO and co-founder, Daniel Faber, has been working in the space industry for decades and has a wealth of experience in satellite thrusters and asteroid mining.

Orbit Fab's technology is ambitious, but the architecture is relatively simple. The company sells fuel and fueling ports, and the real money will come from the fuel sales. The hydrazine delivery service in geostationary orbit will cost $20 million for up to 100 kilograms.

However, nailing each part of the hardware is critical, and it has taken years for Orbit Fab to debut the refueling port. There are many variables to consider, including the cost to the customer, the potential marginal revenue from extra life on orbit, the impact of fueling on the customer spacecraft, and the challenge of developing a docking mechanism that can also transfer propellant.

To ensure its component complied with standards from NASA, the Space Force, and the American Institute of Aeronautics and Astronautics, the company had to go through a rigorous process. The RAFTI had to be safe, reliable, and able to withstand the harsh environment of space.

One of the biggest shifts from when the company started to now is the standing up of the U.S. Space Force and its effects on the space industry. Orbit Fab ended up pivoting much of its attention to addressing the nascent needs of the Space Force, which was very interested in orbital mobility to avoid space debris","https://techcrunch.com/wp-content/uploads/2024/03/An-Orbit-Fab-fuel-shuttle-is-docking-with-an-on-orbit-satellite-equipped-with-a-RAFTI-refueling-port.jpg?resize=1200,817",2024-03-29 18:34:11,"Meta Description:

Revolutionize your satellite industry with Orbit Fab's RAFTI refueling port. The company's docking mechanism allows spacecraft to transfer propellant from an orbital tanker to the customer's spacecraft. Positioned to capitalize on this opportunity, Orbit Fab has raised $6 million in seed funding and $28.5 million in Series A funding. The hydrazine delivery service in geostationary orbit will cost $20 million for up to 100 kilograms. Trust Orbit Fab for a safe, reliable, and innovative solution to space debris removal.",Space debris removal keyphrase,Technology,"Formicoders,News,AI,Technology,Innovation,Programmering,Coding,Wordpress,Python"
https://techcrunch.com/2024/03/29/sample-seed-pitch-deck-plantee-innovations/,Pitch Deck Teardown: Plantee Innovations' $1.4M seed deck," ""Plantee's $1.4M Seed Deck Analysis: What to Love and Improve"" ","Condensed Version:

The Plantee team has created an impressive pitch deck that ticks almost all the boxes, earning a 97.7% chance of success according to a pitch deck analysis tool. However, there are a few areas that could be improved.

Three things to love about Plantee's pitch deck:

1. The opening slides provide a clear introduction to the company and its goals.
2. The product is focused on making plant care easier and more effective, addressing a gap in the market.
3. The competitive landscape slide is comprehensive and highlights the lack of competition in the space.

Three things that Plantee could have improved:

1. The product's unique selling point is not clear, and it is unclear how the device works.
2. The pricing and unit economics slide is not well-explained, and it is unclear how the company plans to make money.
3. The ask slide lacks clarity on how the funds raised will be used.

In conclusion, Plantee's pitch deck is impressive and has a strong chance of success. However, there are a few areas that could be improved to clarify the product's unique selling point and how the company plans to make money.","https://techcrunch.com/wp-content/uploads/2024/03/Pitch-Deck-Teardown-Plantee.jpg?resize=1200,675",2024-03-29 16:00:37,"Meta Description: Discover Plantee's impressive pitch deck, earning a 97.7% chance of success. Learn about what to love and what to improve.", Productivity Tools ,Technology,"Formicoders,News,AI,Technology,Innovation,Programmering,Coding,Wordpress,Python"
