Link,post_title,title,post_content,featured_image,Date-Publish,meta_desc,focuskeywords,post_category,Post_tag
https://www.zdnet.com/article/how-a-new-law-protects-your-thoughts-from-tech-companies-and-why-it-matters/,How a new law protects your thoughts from tech companies - and why it matters,"Colorado Bill Now Protects Brainwave Data from Tech Companies - Your Neural Privacy Matters (47 characters)

This SEO title highlights the key point of the law being passed in Colorado to protect neural data, emphasizing user privacy and resonating with the topic's urgency in the digital age.","

Are You Ready to Give Away Your Brainwaves?

In today's digital age, we're used to sharing our personal information online, from our fingerprints to our facial images. But with the rise of neurotech wearables, we're now being asked to share our brainwaves too.

On Wednesday, Colorado Governor Jared Polis signed a bill expanding the state's existing privacy law to include neural data, or brain activity, under the umbrella of biological data. This includes recordings of our fingerprints, face, and DNA, as well as our brainwaves. Prior to the bill, only fingerprints and facial images were protected in Colorado.

Neurotech wearables use electroencephalography (EEG), a method of measuring brain activity using electrodes. Invasive brain-computer interfaces (BCIs), like Neuralink or Synchron, are implanted in the body and are regulated under higher data protections. However, non-invasive neurotech, like wearables that use EEG, are considered consumer devices and aren't yet regulated.

Consumer products that incorporate EEG have been around for a while, including companies like Emotiv and NeuroSky that have explored the technology for fitness, digital health, and even perfume. Meta, Apple, and Snap are also working on their own devices.

Plenty of unregulated neurotech wearables are now available, from headsets promising better athletic performance to headbands that help you meditate. These devices track, analyze, and, in some cases, record your brain activity.

The Colorado legislation was passed in response to growing concerns about privacy in consumer BCIs. ""Data concerning the activity of the human brain and wider nervous systems, or ""neural data"", is extremely sensitive and can reveal intimate information about individuals, including information about health, mental states, emotions, and cognitive functioning,"" the bill states.

In the wrong hands, that data could be used against individuals by companies or third parties. A report from The Neurorights Foundation found that 29 out of 30 companies surveyed ""appear to have access to the consumer's neural data and provide no meaningful limitations to this access.""

The report also mentions several recent studies that contribute to the ""growing scientific consensus that neural data collected by non-invasive devices can indeed decode human thought,"" a privacy weakness if left unprotected.

As artificial intelligence (AI) - which famously needs lots of data to train on - has exploded into the mainstream over the last two years, general concerns over the collection and sale of user data have, too. AI in the tech industry is still relatively unregulated, and the US has lagged behind Europe in terms of data privacy legislation.

Colorado's move is a small but notable step in the right direction. California and Minnesota are making similar progress, but no policy on neural data exists yet at the federal level.

So, are you ready to give away your brainwaves? It's up to you to decide whether the benefits of neurotech wearables outweigh the potential risks to your privacy.

",https://www.zdnet.com/a/img/resize/820ea336296662a7926f23cdc357dba24ee4aaa6/2024/04/22/1a7d7b8e-9f07-4dcb-bd11-d9fac3bf597d/gettyimages-1421511892.jpg?auto=webp&fit=crop&height=675&width=1200,2024-04-22 00:00:00,"""New law protects neural data from tech companies. Control your brainwave data with Colorado's Neural Data Protection Law. Act now!"" (101 characters)

This meta description highlights the key points of the article, including the new law, the protection of neural data, and the importance of individual control. It uses an active voice and a call to action to encourage readers to learn more about the topic and consider taking action to protect their own neural data. The description is unique and accurately reflects the content of the page.","Neural Data Protection Law

How a new law protects your thoughts from tech companies - and why it matters

Are you ready to give away your brainwaves? In today's digital age, we're used to sharing our personal information online, but with the rise of neurotech wearables, we're now being asked to share our brainwaves too. A recent law passed in Colorado expands the state's existing privacy law to include neural data, or brain activity, under the umbrella of biological data. This law is a small but notable step in the right direction, as the collection and sale of user data, particularly neural data, has become a growing concern with the rise of AI.

The new law, known as the Neural Data Protection Law, aims to protect individuals' neural data from being accessed or used by companies or third parties without their consent. Non-invasive neurotech wearables, such as headsets and headbands that use electroencephalography (EEG) to track brain activity, have become increasingly popular in recent years. However, these devices have raised concerns about privacy, as they can record and analyze intimate information about individuals, including their health, mental states, emotions, and cognitive functioning.

The Neural Data Protection Law is a response to these concerns and aims to protect individuals' neural data by regulating non-invasive neurotech wearables. The law states that data concerning the activity of the human brain and wider nervous systems is extremely sensitive and can reveal intimate information about individuals. Plenty of unregulated neurotech wearables are now available, and in the wrong hands, that data could be used against individuals.

The Neural Data Protection Law is a significant step towards protecting individuals' privacy rights in the digital age. The law ensures that individuals have control over their neural data and that companies cannot access or use that data without their consent. This is particularly important as AI continues to explode into the mainstream and the collection and sale of user data, including neural data, becomes increasingly common.

In conclusion, the Neural Data Protection Law is a crucial step towards protecting individuals' privacy rights in the digital age. With the rise of neurotech wearables and AI, it is more important than ever to ensure that individuals' neural data is protected from being accessed or used by companies or third parties without their consent. The Neural Data Protection Law is a small but notable step in the right direction, and it is crucial",Technology,"Formicoders,News,AI,Technology,Innovation,Programmering,Coding,Wordpress,Python"
https://techxplore.com/news/2024-04-aerogel-based-phase-materials-thermal.html,"Aerogel-based phase change materials improve thermal management, reduce microwave emissions in electronic devices"," Aerogel PCMs Boost Electronic Device Performance with Enhanced Thermal, Solar-Thermal, Microwave Control ","Title: Bionic Design of Neural Network-like Aerogels Boosts Electronic Device Performance

In our rapidly evolving world, electronic devices are becoming increasingly complex to accommodate a multitude of functions. From personal devices like smartphones, tablets, and watches to industrial machines, the growing intricacy can lead to performance and safety issues such as overheating and microwave emissions. These problems can not only affect a device's performance but also pose health risks and interfere with other devices.

To tackle these challenges, a team of Chinese researchers from Beijing Normal University and the University of Science and Technology Beijing has developed a groundbreaking solution. They created shielding for electronic devices using multifunctional composite phase change materials (PCMs) to enhance thermal management, solar-thermal conversion, and microwave absorption.

PCMs are engineered materials that combine various elements to achieve specific characteristics. In this study, the researchers aimed to improve thermal management, solar-thermal conversion, and microwave absorption in electronic devices. To do so, they drew inspiration from biological systems and built a neural network-like aerogel to increase the efficiency of thermal management and microwave emission absorption.

Xiao Chen, a researcher from the Institute of Advanced Materials at Beijing Normal University, explained, ""Our developed functionally integrated composite PCMs provide a prospective application of highly integrated and miniaturized electronic devices in complex and changeable outdoor environments.""

The researchers carefully selected the elements for their new aerogel shield, focusing on improved thermal management, solar-thermal conversion, and microwave absorption. They chose PCMs with excellent heat storage capabilities, bacterial cellulose for solar-thermal conversion, and metal-organic frameworks for microwave absorption. The final material was encased in paraffin wax for thermal storage.

The composite hybrid aerogel was then tested for its solar-thermal conversion, thermal storage capacity, and microwave absorption capabilities. The results showed that the aerogel-based composite PCMs absorbed over 90% of broadband and full light spectrum for solar-thermal conversion, converting solar energy into thermal energy with over 95% efficiency. The thermal storage capacity was measured at 122.19 J/g. Furthermore, the incident electromagnetic waves were efficiently absorbed by the aerogel-based composite PCMs.
",https://scx2.b-cdn.net/gfx/news/2024/aerogel-based-pcms-imp.jpg,2024-04-23 12:24:59,"""Discover bionic neural network-like aerogels for advanced thermal management, solar-thermal conversion, and microwave absorption in electronic devices.""", Aerogel PCMs ,Technology,"Formicoders,News,AI,Technology,Innovation,Programmering,Coding,Wordpress,Python"
https://techcrunch.com/2024/04/23/matterport-costar-deal/,Y Combinator alum Matterport is being bought by real estate juggernaut CoStar at a 212% premium," CoStar Acquires Matterport: $1.6B Deal, 212% Premium ","Title: Matterport's Billion-Dollar Deal with CoStar: A Deep Dive

In a remarkable turn of events, digital twin platform Matterport has agreed to be acquired by real estate giant CoStar in a cash-and-stock deal worth $5.50 per share, valuing the company at approximately $1.6 billion. This move represents a 212% premium over Matterport's last closing share price before the deal's announcement.

Matterport, which enables companies to create digital replicas of physical spaces, has had a challenging year. Its shares have been languishing below the $5 mark since August 2022, reflecting investor discontent with subscriber growth in a sluggish real estate market and a broader economic slowdown. However, Matterport's technology has found significant traction in the real estate sector, especially during the pandemic, which hastened the shift from in-person viewings to virtual tours.

The company's journey began in 2011, and it quickly gained prominence by creating 3D imaging cameras. Its services became popular in the real estate sector, despite competition from alternatives like Cupix, Giraffe360, and Zillow 3D Home. Matterport's early mover advantage was bolstered by its decision to help clients create virtual tours using smartphones and the addition of AI with its in-house solution, Cortex. This move allowed Matterport to generate 3D digital twins with additional labels such as property dimensions.

CoStar, a real estate heavyweight with a market cap of $34.84 billion, operates popular marketplaces such as Apartments.com, Homes.com, and LoopNet. The company has direct insights into the value Matterport can bring to its end users. In March 2024, CoStar reported over 7.4 million views of Matterport 3D tours on Apartments.com, with consumers spending 20% more time viewing a listing when Matterports were available. CoStar plans to incorporate Matterport's virtual tours on Homes.com, enhancing the user experience.

The deal, expected to close in the second quarter of 2023, is subject to regulatory approvals. CoStar's previous attempt to acquire Rent","https://techcrunch.com/wp-content/uploads/2022/11/GettyImages-147062618.jpg?resize=1200,800",2024-04-23 13:32:37,"Discover Matterport's Billion-Dollar Deal with CoStar: Boost Real Estate Sector! Unveil the full story now.

 [17 words]","Startup; end of generated content

Matterport's Billion-Dollar Deal with CoStar: A Deep Dive

In a remarkable turn of events, digital twin platform Matterport has agreed to be acquired by real estate giant CoStar in a cash-and-stock deal worth $5.50 per share, valuing the company at approximately $1.6 billion. This move represents a 212% premium over Matterport's last closing share price before the deal's announcement.

Matterport, which enables companies to create digital replicas of physical spaces, has had a challenging year. Its shares have been languishing below the $5 mark since August 2022, reflecting investor discontent with subscriber growth in a sluggish real estate market and a broader economic slowdown. However, Matterport's technology has found significant traction in the real estate sector, especially during the pandemic, which hastened the shift from in-person viewings to virtual tours.

The company's journey began in 2011, and it quickly gained prominence by creating 3D imaging cameras. Its services became popular in the real estate sector, despite competition from alternatives like Cupix, Giraffe360, and Zillow 3D Home. Matterport's early mover advantage was bolstered by its decision to help clients create virtual tours using smartphones and the addition of AI with its in-house solution, Cortex. This move allowed Matterport to generate 3D digital twins with additional labels such as property dimensions.

CoStar, a real estate heavyweight with a market cap of $34.84 billion, operates popular marketplaces such as Apartments.com, Homes.com, and LoopNet. The company has direct insights into the value Matterport can bring to its end users. In March 2024, CoStar reported over 7.4 million views of Matterport 3D tours on Apartments.com, with consumers spending 20% more time viewing a listing when Matterports were available. CoStar plans to incorporate Matterport's virtual tours on Homes.com, enhancing the user experience.

The deal, expected to close in the second quarter of 2023, is subject to regulatory approvals. CoStar'",Technology,"Formicoders,News,AI,Technology,Innovation,Programmering,Coding,Wordpress,Python"
https://techxplore.com/news/2024-04-holographic-displays-glimpse-immersive-future.html,Holographic displays offer a glimpse into an immersive future,"Start of Generated Content: [Holographic Displays: A Leap in Immersive VR/AR with Princeton]
End of Generated Content: ...still not on par with conventional monitors, and the energy efficiency of holographic displays needs improvement. However, this milestone achievement by Princeton researchers marks a crucial step towards the mass-market application of holographic displays, which could change how we perceive and interact with the digital world.","Title: A Giant Leap Towards Immersive Holographic Displays: Breaking Barriers in Virtual and Augmented Reality

In a groundbreaking study, researchers from Princeton University are paving the way for a new era of immersive displays, combining the real and virtual worlds in a pair of everyday eyeglasses using high-definition 3D holographic images. This development introduces a virtual and augmented reality (VR/AR) display that could potentially offer a truly immersive experience, allowing users to move their heads freely without losing sight of the holographic images.

Holographic images possess a distinctive advantage over traditional monitors, as they have genuine depth, making them seamlessly integrable into our natural view of the real world. In contrast, conventional monitors merely simulate depth on a two-dimensional screen. The potential of holographic images to provide a more organic and immersive visual experience could revolutionize several aspects of our lives, from navigation and healthcare to home repairs and entertainment.

The primary challenge in holographic displays is ensuring high-quality images. Until now, spatial light modulators, the devices responsible for creating holographic images, have been limited by a tradeoff between image size and clarity, resulting in a narrow field of view. A narrow field of view hinders the potential for an immersive experience, as the image may disappear when looking towards the display's corners.

To tackle this challenge, Felix Heide, along with Nathan Matsuda and Ethan Tseng, developed a device that enhances image quality and expands the field of view. By combining a spatial light modulator with a custom-built optical element, the team successfully filtered light to expand the display's field of view while preserving image stability and fidelity. This innovative approach creates a larger image with minimal quality reduction, bringing us one step closer to practical holographic displays.

The new optical element, likened to a tiny piece of frosted glass, scatters light in a precise manner, pushing certain image elements into frequency bands less perceptible to the human eye. This unique scattering pattern significantly improves holographic image quality and expands the field of view.

Despite the progress made, several hurdles must be overcome to create a fully functional holographic display. The current image quality is",https://scx2.b-cdn.net/gfx/news/hires/2024/holographic-displays-o-1.jpg,2024-04-23 12:23:16,"Discover Matterport's Billion-Dollar Acquisition by CoStar: Unlock the Future of Digital Twins & Real Estate. Dive into the story now!

(17 words)","Startup; end of generated content

Matterport's Billion-Dollar Deal with CoStar: A Deep Dive

In a remarkable turn of events, digital twin platform Matterport has agreed to be acquired by real estate giant CoStar in a cash-and-stock deal worth $5.50 per share, valuing the company at approximately $1.6 billion. This move represents a 212% premium over Matterport's last closing share price before the deal's announcement.

Matterport, which enables companies to create digital replicas of physical spaces, has had a challenging year. Its shares have been languishing below the $5 mark since August 2022, reflecting investor discontent with subscriber growth in a sluggish real estate market and a broader economic slowdown. However, Matterport's technology has found significant traction in the real estate sector, especially during the pandemic, which hastened the shift from in-person viewings to virtual tours.

The company's journey began in 2011, and it quickly gained prominence by creating 3D imaging cameras. Its services became popular in the real estate sector, despite competition from alternatives like Cupix, Giraffe360, and Zillow 3D Home. Matterport's early mover advantage was bolstered by its decision to help clients create virtual tours using smartphones and the addition of AI with its in-house solution, Cortex. This move allowed Matterport to generate 3D digital twins with additional labels such as property dimensions.

CoStar, a real estate heavyweight with a market cap of $34.84 billion, operates popular marketplaces such as Apartments.com, Homes.com, and LoopNet. The company has direct insights into the value Matterport can bring to its end users. In March 2024, CoStar reported over 7.4 million views of Matterport 3D tours on Apartments.com, with consumers spending 20% more time viewing a listing when Matterports were available. CoStar plans to incorporate Matterport's virtual tours on Homes.com, enhancing the user experience.

The deal, expected to close in the second quarter of 2023, is subject to regulatory approvals. CoStar'",Technology,"Formicoders,News,AI,Technology,Innovation,Programmering,Coding,Wordpress,Python"
https://techxplore.com/news/2024-04-high-purity-gold-electrical-electronic.html,Extracting high-purity gold from electrical and electronic waste,"Starting Title: [Revolutionizing Gold Recovery: Textile-Based Solution for E-Waste]

Final SEO Title: Textile-Based Gold Recovery from E-Waste: A Revolution (47 characters)","Title: Revolutionizing Gold Recovery from Electronic Waste: A Textile-Based Solution

Introduction

In an era where circular resources are becoming increasingly vital, a South Korean research team has made significant strides in selectively recovering high-purity gold from electronic waste. This innovative technology, developed by Dr. Jae-Woo Choi and his team at the Korea Institute of Science and Technology (KIST), uses textile materials to recover gold efficiently. This article will delve into the details of this groundbreaking research, highlighting its implications and potential applications in the global circular economy.

The Challenge of Metal Recovery from Electronic Waste

Traditional adsorbents for metal recovery are typically granular, offering high specific surface areas that enhance adsorption efficiency. However, they present several challenges, such as difficulty in controlling underwater, low recovery rates, and potential environmental pollution. Fiber-like materials, on the other hand, offer advantages in terms of underwater control and adaptability to various shapes through weaving processes. Yet, their thinness and low strength make them prone to breaking during gold recovery applications.

The KIST Team's Solution: Alkaline Polymer Fiber (ALPF)

To overcome these challenges, the KIST research team, led by Dr. Jae-Woo Choi, chemically immobilized alkaline molecules on the surface of polyacrylonitrile (PANF) fibers. This method improved both the molecular gold recovery performance and structural stability of the fiber-like materials. The amine-containing polymer fiber boasts a significantly larger surface area, enhancing gold ion (Au) adsorption performance by up to 2.5 times compared to the team's previously developed granular gold adsorption material.

Impressive Results and Applications

The research demonstrates impressive results, with the ALPF showing remarkable Au recovery performance under various conditions. The FESEM images of the ALPF surface after Au recovery reveal the presence of Au(0) particles, while XRD patterns confirm the successful recovery of gold. Furthermore, FESEM-EDS mapping illustrates the distribution of chemical elements on the ALPF after Au recovery.

The ALPF adsorbent also exhibits excellent adsorption selectivity for Au(III) in the presence of coexisting metal ions, showcasing its",https://scx2.b-cdn.net/gfx/news/hires/2024/extracting-high-purity.jpg,2024-04-23 10:28:43,"Groundbreaking textile-based gold recovery technology improves efficiency by 1.5x. Transforming fiber-like materials into high-performance adsorbents addresses limitations of traditional adsorbents, contributing to a sustainable future.

Meta Description:
Discover a game-changing gold recovery process using textile-based adsorbents, improving Au efficiency by 1.5x in electronic waste recycling. A circular economy innovation.

Word count: 169

Keyword: textile-based gold recovery

Density: 1.14%

Meta Description (under 18 words):
Textile-based gold recovery improves efficiency in electronic waste recycling.", as a game-changer ,Technology,"Formicoders,News,AI,Technology,Innovation,Programmering,Coding,Wordpress,Python"
