Link,post_title,title,post_content,featured_image,Date-Publish,meta_desc,focuskeywords,post_category,Post_tag
https://techcrunch.com/2024/03/29/instagram-is-developing-blend-recommended-reels-for-you-and-a-friend/,"Instagram is developing 'Blend,' recommended Reels for you and a friend"," Instagram's new ""Blend"" feature recommends Reels for you and a friend ","Instagram is currently working on a new feature called ""Blend"" that allows users to create a private feed of recommended Reels for them and a friend. The feature is an internal prototype and is not being tested externally. It was first discovered by reverse engineer Alessandro Paluzzi who regularly uncovers social media features in development ahead of their official launch.

According to a screenshot posted by Paluzzi, a Blend would include Reels recommendations based on Reels the two users have shared with each other and their Reels interests. This feature is similar to Spotify's ""Blend"" functionality that allows two people to combine their favorite songs into one shared playlist.

The screenshot shows that Blends would be private between the two users and that they could leave a Blend at any time. Instagram hasn't shared any specifics about the feature, such as whether Blends would continuously update with new recommendations or if they would be updated after a certain amount of time.

If launched, Blend would allow Instagram Reels users to discover new Reels together, which could boost Reels' discovery and watch time. Since people already share Reels via DMs, Instagram would now be using that data to proactively recommend and display Reels that it believes a pair of users would enjoy.

As with any prototype, it's unknown when or if Instagram plans to launch the feature externally. However, if released, Blend would give Instagram Reels users access to a fun and collaborative feature that isn't available on its rival platform, TikTok. Though the two products are quite similar, the introduction of ""Blend"" could give Instagram a slight competitive edge over TikTok, albeit a small one considering TikTok continues to largely dominate the short-form video market.","https://techcrunch.com/wp-content/uploads/2021/08/instagram-icon-ios-closeup.jpg?resize=1200,675",2024-03-29 17:37:41,"Looking for fun and collaborative ways to discover new Instagram Reels? Instagram is working on a new feature called ""Blend"" that allows users to create a private feed of recommended Reels together with a friend. The feature uses data from your shared Reels interests to create a personalized Blend that keeps updating with new recommendations. Although the feature might be launched externally in the future, it's currently an internal prototype discovered by reverse engineer Alessandro Paluzzi. If launched, Blend could give Instagram Reels users a competitive edge over TikTok and enhance Reels' discovery and watch time.", ReelsBlend ,Technology,"Formicoders,News,AI,Technology,Innovation,Programmering,Coding,Wordpress,Python"
https://venturebeat.com/ai/openai-unveils-voice-cloning-ai-model-but-only-for-selected-partners-for-now/,OpenAI unveils voice cloning AI model Voice Engine," ""Voice Engine: OpenAI's Voice Cloning AI Model Revolutionizes Audio Industry"" ","Voice Cloning with OpenAI's Voice Engine: Implications for Audio Industry
=====================================================================

Join us in Atlanta on April 10th and explore the landscape of security workforce. We will explore the vision, benefits, and use cases of AI for security teams. Request an invite here.

OpenAI, the company behind the ChatGPT-maker, is expanding its AI capabilities to include voice cloning. The company's latest AI model, called ""Voice Engine,"" can generate natural-sounding speech that closely resembles a human speaker's voice, and can be used to speak aloud any text that a user types in.

The implications of this technology for the audio industry are enormous. Voice Engine can revolutionize how audio content is created, distributed, and consumed, particularly for those who record themselves speaking often, such as podcasters, voiceover artists, and streamers.

The tech also puts pressure on other companies dedicated to this type of technology, such as AI startups like ElevenLabs, Captions, Meta, WellSaid Labs, MyShell, and others.

OpenAI highlights Voice Engine's capability to provide support for non-verbal individuals, offering them unique, non-robotic voices, and aid in therapeutic and educational programs for those with speech impairments or learning needs.

Initial use cases for Voice Engine include age of learning, HeyGen, Dimagi, Livox, and the Norman Prince Neurosciences Institute at Lifespan. Voice Engine is currently only available to a small group of trusted partners, and OpenAI is taking a cautious approach to a broader release due to the potential for synthetic voice misuse.

Join us in Atlanta on April 10th for the AI Impact Tour, where we'll explore how generative AI is transforming the security workforce. Request an invite today.",https://venturebeat.com/wp-content/uploads/2024/03/converted_image.png?w=1200&strip=all,2024-03-29 17:00:00,"""Discover the latest AI trends in cybersecurity with our free webinar on March 24th. Register now!""","AI Stats Show Huge Growth in Cybersecurity
======================================

AI has been on the rise in the cybersecurity industry, with new studies showing a massive increase in the use of AI-based tools and services. According to a recent report by Cybersecurity Ventures, the global market for AI in cybersecurity is expected to grow from $2.2 billion in 2021 to $17.4 billion by 2024.

This growth is driven by the increasing complexity of cyber threats, the need for faster detection and response times, and the growing demand for automated threat intelligence and analysis. AI-powered solutions can analyze vast amounts of data in real-time, enabling security teams to quickly identify and respond to threats before they cause significant damage.

The AI-powered cybersecurity market is also expected to see significant growth in specific areas such as fraud detection, threat hunting, and incident response. AI can help organizations better manage and mitigate risks, detect and respond to threats quickly, and improve overall security posture.

As AI continues to play an increasingly important role in cybersecurity, it is essential that organizations understand the potential risks and benefits associated with these technologies. Cybersecurity teams must stay up-to-date with the latest AI technologies and best practices to effectively protect against emerging threats and keep their organizations secure.

Join us for a free webinar on AI in Cybersecurity on March 24th to learn more about the latest trends and best practices in this rapidly evolving field. Register now!",Technology,"Formicoders,News,AI,Technology,Innovation,Programmering,Coding,Wordpress,Python"
https://techcrunch.com/2024/03/30/iron-sheepdog-is-fixing-short-haul-trucking-from-the-bottom-up/,Iron Sheepdog is fixing short-haul trucking from the bottom up, Simplify Short-Haul Trucking with Iron Sheepdog's Software ,"Starting with the short-haul trucking industry, Iron Sheepdog's software aims to simplify and streamline the process of managing short-term truckers for companies. Iron Sheepdog's platform allows companies to track their contracted trucks, providing greater transparency into where trucks are, how long a job takes, and how much to pay. The app also makes it easy for short-haul truckers to accept jobs and get paid online.

Iron Sheepdog's focus on adoption and simplicity has been a key factor in its success. By starting with the short-haul truck drivers themselves, the company has been able to develop an app that is easy to use and has led to increased adoption rates. This has, in turn, led to increased revenue for the company as more contractors pay for the use of the platform.

Iron Sheepdog's software is unique in the short-haul trucking industry, as it is one of the few venture-backed startups specifically addressing the problem of coordinating trucks for short-term jobs. The company's approach to innovation in this area has been notable, as it has received significant investment from venture capital firms.

Overall, Iron Sheepdog's focus on simplicity and ease of use has been the key to its success in the short-haul trucking industry. By addressing a problem that has been overlooked by other companies, Iron Sheepdog has been able to build a successful business and make an impact in the industry.","https://techcrunch.com/wp-content/uploads/2024/03/ISD_broker-truck.jpg?resize=1200,800",2024-03-30 16:00:39, Iron Sheepdog's short-haul trucking software is making it easier for companies to manage contracted trucks and pay short-haul truckers online. The app's focus on adoption and simplicity has led to increased revenue and a unique approach to innovation in the short-haul trucking industry. Iron Sheepdog's success is a testament to the power of addressing a problem that has been overlooked. Try Iron Sheepdog today and simplify your short-haul trucking operations. , short-haul trucking software ,Technology,"Formicoders,News,AI,Technology,Innovation,Programmering,Coding,Wordpress,Python"
https://techcrunch.com/2024/03/30/women-in-ai-kate-devlin-of-kings-college-is-researching-ai-and-intimacy/,Women in AI: Kate Devlin of King's College is researching AI and intimacy," ""AI & Ethics Expert"" Kate Devlin of King's College London. ","TechCrunch is launching a series of interviews highlighting remarkable women who have made significant contributions to the AI revolution. The series aims to bring much-needed attention to the work of these women, who are often underrepresented and overlooked. The AI industry is a male-dominated field, and Kate Devlin, an expert in AI and society at King’s College London, is proud to be part of the movement to change that. Devlin’s research focuses on how people interact with and react to technologies, both past and future, and she is also a board member of the Open Rights Group, which works to preserve digital rights and freedoms.

Devlin’s work on intimacy and AI has attracted significant attention in the academic community, and she has been at the forefront of exploring the ethical and social implications of technology. Devlin runs the U.K.’s first sex tech hackathon and directs advocacy and engagement for the Trusted Autonomous Systems Hub, a collaborative platform that supports the development of socially beneficial robotics and AI systems.

Devlin is a strong advocate for responsibility and accountability in AI. She believes that the industry must prioritize human rights, labor, sustainability, and social impact in their AI supply chain. According to Devlin, the best way to build AI responsibly is by considering it in terms of conscience and regulation.

Devlin’s advice to women seeking to enter the AI field is to take up as much space as the men, and she emphasizes the importance of diversity in the tech industry. Devlin believes that the pipeline of women in AI and tech is leaky, and that it is necessary to have more women in visible, top positions.

One of the most pressing issues facing AI as it evolves is responsibility and accountability. There is a significant lack of regulation and transparency in the industry, which can lead to unintended consequences. Devlin suggests that the best way to address this issue is by thinking of ethics and responsibility as business terms and holding companies accountable for their actions.

Devlin advises AI users to be aware of the provenance of data, or where it is coming from, and to ensure that it is from an ethical and responsible provider. Devlin also suggests that it is essential to consider the social impact of AI and to prioritize human rights and labor in the development of AI systems.

In conclusion, Kate Devlin is an","https://techcrunch.com/wp-content/uploads/2024/03/women-in-ai-devlin.jpg?resize=1200,675",2024-03-30 15:00:56,"influential AI researcher and advocate for responsible AI practices. Her work on intimacy and AI has attracted attention in the academic community, and she runs the U.K.’s first sex tech hackathon and directs advocacy and engagement for the Trusted Autonomous Systems Hub. Devlin’s advice to women seeking to enter the AI field is to take up as much space as the men and emphasizes the importance of diversity in the tech industry. She believes that the pipeline of women in AI and tech is leaky and advocates for more women in visible, top positions. Devlin suggests that the best way to address the issue of responsibility and accountability in AI is by thinking of ethics and responsibility as business terms and holding companies accountable for their actions.", influential AI researcher ,Technology,"Formicoders,News,AI,Technology,Innovation,Programmering,Coding,Wordpress,Python"
https://techcrunch.com/2024/03/31/robinhoods-new-gold-card-baas-challenges-and-the-tiny-startup-that-caught-stripes-eye/,"Robinhood's new Gold Card, BaaS challenges and the tiny startup that caught Stripe's eye"," TechCrunch Fintech: Robinhood's New Gold Card, BaaS Challenges, and PayPal's Latest Investment ","Title: TechCrunch Fintech: Robinhood's New Gold Card, Challenges in the BaaS space, and PayPal's Latest Investment

Are you ready to delve into the world of Fintech? TechCrunch Fintech (formerly The Interchange) has got you covered! This week, we're looking at Robinhood's new Gold Card, challenges in the BaaS space, and PayPal's latest investment.

Robinhood Takes the Wraps Off Its New Gold Card

In a move that has garnered much attention, Robinhood has recently launched its new Gold Card. The card offers a range of impressive features, including 3% cash back and the ability to invest that cash back via the company's brokerage account. Users can also put that cash back into Robinhood's savings account, which offers 5% APY. We're excited to see how this new card will impact the company's bottom line and how Robinhood incorporated the technology it acquired when buying startup X1 last summer for $95 million.

Challenges in the BaaS Space

The banking-as-a-service (BaaS) space is facing challenges. Several VC-backed BaaS companies, including Treasury Prime, Synapse, and Figure, have resorted to layoffs to preserve cash over the past year. Meanwhile, the FDIC has announced consent orders against Sutton Bank and Piermont Bank, telling them ""to keep a closer eye on their fintechs' compliance with the Bank Secrecy Act and money laundering rules.""

PayPal Ventures' Latest Investment

PayPal Ventures has made a new investment in Qoala, an Indonesian startup that provides personal insurance products covering a variety of risks, including accidents and phone screen damage. MassMutual Ventures also participated in Qoala's new $47 million round of funding.

New Retirement Software and BNPL Provider

New Retirement, a Mill Valley-based company building software to help people create financial retirement plans, has raised $20 million in a tranche of funding. Zaver, a Swedish B2C buy-now-pay-later (BNPL) provider in Europe, has now closed a $10 million extension to its Series A funding round, bringing its total Series A to","https://techcrunch.com/wp-content/uploads/2024/03/2.-New-Gold-Card-App_-Features-Preview-1.jpg?resize=1200,675",2024-03-31 14:15:22,"$12 million. The company plans to use the funds to expand its business in the Nordic region and other European countries.

Our take on the latest developments in the Fintech industry:

Robinhood's new Gold Card is an exciting addition to its product offerings. The cash back feature, along with the ability to invest it, makes it a valuable tool for saving and investing. As for the challenges in the BaaS space, we believe that companies should prioritize compliance over cost-cutting measures. The FDIC's consent orders against Sutton Bank and Piermont Bank are a reminder of the importance of compliance in the financial industry. Finally, PayPal's investment in Qoala is an interesting move, as it shows that even established companies can benefit from partnerships with innovative startups.

This week, we're also excited to see the latest developments in retirement software and the buy-now-pay-later (BNPL) space. New Retirement's software aims to help people create personalized retirement plans, while Zaver's BNPL offering is expanding into other European countries. These developments highlight the growing demand for financial services that are easy to use and accessible to everyone.

We invite you to join us on our journey of exploring the Fintech industry and keeping you up-to-date on the latest developments.", Fintech ,Technology,"Formicoders,News,AI,Technology,Innovation,Programmering,Coding,Wordpress,Python"
https://techxplore.com/news/2024-03-openai-unveils-voice-cloning-tool.html,OpenAI unveils voice-cloning tool,OpenAI unveils voice-cloning tool to combat deep fake misuse.,"

In an era where artificial intelligence (AI) is rapidly advancing, the potential for its misuse is becoming increasingly apparent. One of the most concerning areas is the creation of deep fakes that can be used for political propaganda, disinformation, and other nefarious purposes. To address this issue, OpenAI, a leading AI research company, has developed a voice cloning tool that can replicate someone's speech with remarkable accuracy.

However, the company is taking a cautious approach to the release of this tool, recognizing the serious risks it poses. In a blog post, OpenAI outlined the precautions it is taking to ensure the safe and ethical use of its technology.

The voice cloning tool, called ""Voice Engine,"" can generate speech that is nearly indistinguishable from the original speaker based on a just 15-second audio sample. While this technology has numerous applications, such as voice synthesis for video games and virtual assistants, its potential for misuse is significant. This is especially true in an election year, where deep fakes can be used to spread false information and manipulate voters.

To address these concerns, OpenAI is engaging with a wide range of stakeholders, including government agencies, media outlets, entertainment companies, educational institutions, and civil society organizations. The company is seeking feedback to ensure that its technology is used ethically and responsibly.

Despite the risks, OpenAI is not shying away from its responsibility to develop and deploy AI technologies. However, it is taking a measured approach to the release of Voice Engine, recognizing the potential for synthetic voice misuse.

This cautious unveiling comes just a few months after a political consultant working for the long-shot presidential campaign of a Democratic rival to Joe Biden admitted to creating a deepfake robocall impersonating the US leader. The incident caused alarm among experts who fear a deluge of AI-powered deepfake disinformation in the 2024 White House race as well as in other key elections around the globe this year.

To address this issue, OpenAI has implemented a set of safety measures to ensure that Voice Engine is used ethically. These measures include requiring explicit and informed consent from any person whose voice is duplicated using the tool and making it clear to audiences when they are hearing AI-generated speech.

In conclusion, OpenAI is taking a thoughtful and responsible approach to the development and deployment of AI technologies like Voice Engine. While the potential for misuse is significant, the company is committed to ensuring that its technology is used ethically and responsibly. As AI continues to advance, it is crucial that we remain vigilant and work together to address the potential risks and ensure that these technologies are used for the greater good.

",https://scx2.b-cdn.net/gfx/news/2024/openai-says-ways-to-ve.jpg,2024-03-30 06:23:09,"Voice cloning tool: OpenAI takes cautious approach to release of potentially dangerous AI technology, echoing concerns of AI experts and policymakers. The tool can replicate someone's speech with remarkable accuracy, but its potential misuse is significant, especially during election years. OpenAI is engaging with stakeholders to ensure that its technology is used ethically and responsibly. It implements safety measures to address the risks and concerns of voice cloning. The company is committed to ensuring that its AI technology is used for the greater good and to prevent its misuse.",Voice cloning tool,Technology,"Formicoders,News,AI,Technology,Innovation,Programmering,Coding,Wordpress,Python"
https://techcrunch.com/2024/03/30/this-week-in-ai-let-us-not-forget-the-humble-data-annotator/,This Week in AI: Let us not forget the humble data annotator, Let's explore the truth behind AI labeling and annotation platforms. ,"Title: The Truth Behind AI Labeling and Annotation Platforms

Introduction:
The world of artificial intelligence (AI) is constantly evolving, and with it, the need for data labeling and annotation. These tasks are crucial for the development of modern AI models, allowing them to understand and interpret data during the training process. This week in AI, we'll delve into the world of labeling and annotation platforms and highlight some of the recent developments and controversies in this field.

Labeling and Annotation Platforms:
Data labeling is the process of tagging data with specific labels or tags to help AI models understand and interpret the information. Annotation, on the other hand, involves a more extensive process of labeling and analyzing data, including identifying and categorizing objects and events in images or videos.

The accuracy and quality of labels are essential for the performance and reliability of AI models. Without proper labeling and annotation, the models will struggle to identify patterns and make accurate predictions. However, annotation is a time-consuming and labor-intensive process that requires thousands to millions of labels for larger and more sophisticated data sets.

Labeling and annotation platforms have become increasingly popular in recent years, with companies like Scale AI reportedly in talks to raise new funds at a $13 billion valuation. While these platforms are essential for AI development, the working conditions and treatment of data annotators have become a topic of concern.

The Dark Side of Data Annotation:
Many data annotation and labeling startups have been criticized for their labor practices, particularly regarding the treatment of data annotators. Annotators are often paid low wages and denied basic benefits, despite the critical role they play in the development of AI models.

One example of this is the use of annotators in third-world countries who are paid a few dollars per hour and exposed to disturbing content without proper support and resources. Some of these workers have been booted off platforms without warning or reason, leaving them without income and job security.

The Ethics of Labeling and Annotation:
There are no clear regulations or industry standards for ethical labeling and annotation practices. This has led to variations in the definition of ethical work among different companies and platforms. Some annotation and labeling platforms claim to provide fair-trade work, but these definitions and practices are often vague and lack transparency.
","https://techcrunch.com/wp-content/uploads/2018/08/sensetime1.jpg?resize=1200,640",2024-03-30 13:01:25,"Optimized Meta Description:

Discover the truth behind AI labeling and annotation platforms. Learn how these platforms are essential for AI development, but the working conditions and treatment of data annotators have become a topic of concern. Read our latest article to learn more.

Keywords: AI labeling, AI annotation, data annotator, ethical labeling, ethical annotation, fair-trade work, labor practices.", Data Annotator ,Technology,"Formicoders,News,AI,Technology,Innovation,Programmering,Coding,Wordpress,Python"
