Link,Title,Text,Image,Date Publish
https://www.forbes.com/sites/markminevich/2024/02/25/saudi-arabias-bold-leap-shaping-the-future-of-ai-at-fii-miami-summit/,Saudi Arabia’s Bold Leap: Shaping The Future Of AI At FII Miami Summit,"

In the vibrant atmosphere of Miami Beach, the Future Investment Initiative (FII) Priority Miami Summit unfolded, a landmark event poised to reshape the global investment and technological landscape. This summit brought together industry giants, political leaders, and visionaries to navigate the future of innovation, sustainability, and AI.

At the heart of the FII gathering were discussions led by Richard Attias, CEO of the FII Institute, who emphasized the urgency of addressing the world's complex challenges. The summit showcased Saudi Arabia's bold strides towards Vision 2030, highlighting its role in forging a new paradigm of global cooperation and innovation.

Spearheaded by Saudi Arabia's Public Investment Fund (PIF), the summit showcased the Kingdom's pioneering vision, steering not just a nation but setting a precedent for the global community towards an era powered by artificial intelligence and underpinned by sustainability.

His Excellency Yasir al-Rumayyan, Governor of the Saudi Public Investment Fund (PIF), outlined Saudi Arabia's strategic leap into artificial intelligence to shape the global future. The Kingdom aims to position itself as a global hub for AI and innovation, leveraging its leadership in clean energy and robust funding capabilities.

The summit also highlighted the strong partnership between Miami and Riyadh, positioning them as interconnected hubs of innovation and commerce. This synergy has sparked a creative and economic alliance propelled by shared visions of sustainable tech growth, with AI serving as a central theme in their collective development efforts.

The FII Summit provided a window into Saudi Arabia's investment priorities and strategic direction to emerge as a focal point for both sustainability efforts and artificial intelligence advancement. The Kingdom's ambition to lead in renewable energy and AI was clear, with initiatives aimed at positioning Saudi Arabia as a hub for innovation and sustainable development.

The summit also explored the transformative role of AI, with thought leaders providing strategic perspectives on investment priorities and seizing opportunities unlocked by technological innovation. The ethical implications and societal impacts of AI were also discussed, emphasizing the need for robust ethical frameworks and governance to navigate the unprecedented challenges and opportunities presented by advanced AI systems.

Leaders across sectors stressed the importance of harnessing technology responsibly, addressing concerns over income inequality and the need for inclusive growth. The summit highlighted the critical role of public-private partnerships in crafting effective regulations and ensuring that advancements in AI do not exacerbate global inequalities.

The FII Miami Summit represented a pivotal moment for Saudi Arabia in unveiling its blueprint to emerge as an international hub for technology innovation rooted in sustainability principles and positive human impact. The summit showcased the Kingdom's ambitious vision for the future, attracting global leaders and sparking discussions on the role of technology and investment in shaping a sustainable future.

",https://imageio.forbes.com/specials-images/imageserve/65dbe81ad7b4966b533142e4/0x0.jpg?format=jpg&height=900&width=1600&fit=bounds,2024-02-25 21:47:54
https://www.forbes.com/sites/erikkain/2024/02/25/todays-wordle-hints-and-clues-for-monday-february-26th---wordle-982-answer/,"Today’s ‘Wordle’ Hints And Clues For Monday, February 26th - Wordle #982 Answer","

In the realm of daily word puzzles, Wordle reigns supreme, captivating players worldwide with its enigmatic allure. As a dedicated Wordle enthusiast, I embark on a journey to unravel today's cryptic challenge, guided by subtle hints and clever wordplay.

Frequently encountered, this elusive word begins its tale with a vowel's embrace. As I ponder potential solutions, a peculiar starting word emerges: spore. Inspired by Pedro Pascal's captivating acceptance speech for his role in The Last of Us, the concept of spores transmitting sickness seeps into my consciousness, shaping my initial guess.

Next, I venture into a realm of rearrangement, seeking harmony between the letters 'O' and 'E'. A word unexpectedly surfaces from the depths of my mind: foley. Although uncertain of its validity, I submit it to the Wordle oracle. Lo and behold, a green square and two yellow squares illuminate my path, guiding me closer to the ultimate solution.

With renewed determination, I delve into the realm of possibilities, seeking a word that fits the remaining clues like a perfectly crafted puzzle piece. Often emerges as the triumphant contender, though Wordle Bot slyly suggests an alternative option: offed. While intriguing, this grim prospect seems a tad too morbid, even for the enigmatic Bot.

Triumphantly, I secure my victory, earning two coveted points for my linguistic prowess. One point for deciphering the puzzle in three attempts and another for outsmarting the formidable Wordle Bot. Bwahaahahahahaha! My laughter reverberates through the digital realm, a symphony of victory.

Venturing beyond the realm of gameplay, we embark on a linguistic expedition to uncover the etymological roots of the word ""often."" Its origins trace back to the Old English word ""oft,"" signifying frequency or recurrence. The suffix ""-en"" gracefully adorns this ancient word, transforming it into the modern English adverb ""often,"" emphasizing its frequent occurrence.

The word's journey doesn't end there. Its roots extend even further back to Proto-Germanic ofta, forging a connection with kindred words in other Germanic languages. German ""oft"" and Dutch ""vaak"" share a common ancestry, echoing the linguistic heritage of the Germanic family.

Over time, the pronunciation of ""often"" has undergone subtle transformations, influenced by the esteemed Latin language. During the Middle Ages and Renaissance, Latin's profound impact on English led to variations in pronunciation, with the ""t"" sometimes silenced and sometimes pronounced. Today, both pronunciations coexist harmoniously, reflecting the word's rich history and the ever-evolving nature of language.

",https://imageio.forbes.com/specials-images/imageserve/6222c207e957517e5b79a719/0x0.jpg?format=jpg&height=900&width=1600&fit=bounds,2024-02-25 21:00:00
https://www.forbes.com/sites/mikestubbs/2024/02/25/w7m-wins-the-the-rainbow-six-invitational-after-incredible-grand-final/,W7m Wins The The Rainbow Six Invitational After Incredible Grand Final,"

w7m Esports Crowned Rainbow Six Invitational Champions in a Thrilling Grand Finale

In a breathtaking display of skill and resilience, w7m esports emerged victorious as the Rainbow Six Invitational 2024 champions, defeating FaZe Clan in a gripping grand final. The Brazilian squad etched their name into the annals of Rainbow Six Siege history, claiming the coveted title of world champions and the $1 million grand prize.

The stage was set for a clash of titans, as w7m and FaZe Clan, the two dominant forces in the competitive scene, faced off in a battle for supremacy. The electrifying atmosphere of the sold-out arena in Brazil, where all 10 players hailed from, added an extra layer of intensity to the already high-stakes match.

The grand final kicked off with an unexpected twist, as FaZe Clan asserted their dominance on Oregon, securing a commanding 7-1 victory. However, w7m refused to be deterred and fought back valiantly, exchanging close rounds with FaZe Clan on Bank and Skyscraper. Both teams showcased their tactical prowess, winning their respective map picks with 7-5 scores. The momentum shifted in w7m's favor on Border, where they triumphed 7-4, setting the stage for a thrilling map five showdown.

Nighthaven Labs became the battleground for the climactic clash. FaZe Clan drew first blood, taking the opening two rounds, partially aided by a costly team kill from w7m. Yet, the Brazilian squad displayed unwavering resilience, clawing back the third round. FaZe Clan appeared poised to claim the championship, reaching championship point. However, w7m ignited a remarkable comeback, storming back from a 6-1 deficit to force overtime, much to the delight of the roaring crowd.

The tension was palpable as the teams entered overtime. w7m seized the initiative, securing the first round and putting themselves on championship point. With nerves of steel, they executed a flawless final round, securing the two points needed to be crowned world champions. The victory was met with an eruption of cheers from the passionate Brazilian crowd, who witnessed one of the greatest Rainbow Six Siege finals in history.

While both teams entered the tournament as favorites, their paths to the grand final were far from straightforward. Neither team secured a group stage victory, forcing them into an extra round in the upper bracket. For w7m, this near-elimination scenario served as a catalyst, as they embarked on an awe-inspiring run through the lower bracket. In six best-of-three matches, they dropped a mere two games, showcasing their exceptional mental fortitude and adaptability.

FaZe Clan, on the other hand, navigated the upper bracket with greater ease, despite facing formidable opponents such as G2 Esports, Soniqs, and Virtus.Pro. The European squad secured their spot in the grand final with a series of 2-0 victories.

Outside of the Brazilian dominance in the top two spots, Virtus.Pro claimed third place, while G2 Esports finished fourth. The first Six Invitational held in Brazil proved to be an unforgettable spectacle, with record-breaking attendance and an atmosphere that was second to none. Fans eagerly await the return of a major Rainbow Six Siege tournament to the passionate Brazilian soil.

",https://imageio.forbes.com/specials-images/imageserve/65dbbfe7ae8ffdcc5052041c/0x0.jpg?format=jpg&height=900&width=1600&fit=bounds,2024-02-25 19:34:42
https://www.forbes.com/sites/jamiecartereurope/2024/02/25/see-jupiter-and-the-false-dusk-as-dark-skies-return-the-night-sky-this-week/,See Jupiter And The ‘False Dusk’ As Dark Skies Return: The Night Sky This Week,"

In the realm of celestial wonders, the week of February 26 to March 3 promises a captivating journey through the night sky. As the moon wanes from its full 'Snow Moon,' darkness envelops the early evening, presenting an ideal canvas for stargazing enthusiasts.

On Monday, February 26, Saturn and tiny Mercury vanish from our view, lost in the sun's blinding embrace. This astronomical event, known as superior conjunction, temporarily conceals these planets from Earth's perspective.

Wednesday, February 28, brings a celestial rendezvous between the moon and Spica, the brightest star in the Virgo constellation. Before sunrise, look towards the southern sky to witness this beautiful pairing, where the waning gibbous moon shines just a degree and a half from Spica.

A unique occurrence graces the calendar on Thursday, February 29 - Leap Day. This special day, occurring only every four years, adjusts for the Earth's orbit around the sun, accounting for the extra quarter day.

Sunday, March 3, marks the Last Quarter Moon's encounter with Antares, a red supergiant star in Scorpius. An hour before sunrise, gaze towards the southern sky to witness this celestial conjunction. The Last Quarter Moon, illuminated by half its light, offers an excellent opportunity to explore the lunar surface through a telescope, as sharp shadows accentuate the landscape's features.

Amidst these celestial events, the Zodiacal Light emerges as a subtle yet spectacular sight. Visible in the western sky about an hour after sunset, this triangular glow is a reflection of sunlight bouncing off cosmic dust in the solar system. This phenomenon, also known as ""false dusk,"" is best observed in dark locations in the northern hemisphere.

While stargazing offers a glimpse into the cosmos, light pollution poses a growing challenge. A recent study revealed a significant increase in night sky brightness in urban areas, making it harder to see stars. This alarming trend underscores the importance of preserving dark skies and seeking out locations away from artificial light to fully appreciate the wonders of the night sky.

As you embark on your celestial adventures, remember to consult online planetariums like Stellarium and The Sky Live for location-specific information on planet-rise, planet-set, sunrise, sunset, moonrise, and moonset times.

Wishing you clear skies and a universe of discoveries!

",https://imageio.forbes.com/specials-images/imageserve/658347f80580431d97069f64/0x0.jpg?format=jpg&height=900&width=1600&fit=bounds,2024-02-25 19:15:00
https://www.forbes.com/sites/ewanspence/2024/02/25/samsung-galaxy-z-fold-6-new-design-smaller-size-cover-display-new-galaxy-z-fold/,New Samsung Leak Reveals Galaxy Z Fold 6 Design Decision,"

Samsung's Galaxy Z Fold 6: A Bold New Era of Foldable Smartphones

Samsung's Galaxy Z Fold series has been at the forefront of foldable smartphone innovation, and the upcoming Galaxy Z Fold 6 promises to be no exception. With a revolutionary redesign, the Z Fold 6 aims to address some of the lingering concerns surrounding foldable devices, making them more mainstream and appealing to a wider audience.

A Sleeker, More Refined Design

One of the most noticeable changes in the Galaxy Z Fold 6 is its slimmer profile. Previous foldable phones have been criticized for their bulkiness, but the Z Fold 6 is set to be significantly thinner, making it more comfortable to hold and use. This reduction in thickness is achieved without compromising durability, thanks to Samsung's use of advanced materials and engineering techniques.

An Enhanced Cover Display

Another improvement in the Z Fold 6 is its cover display. Previous models featured a tall and narrow cover display that felt cramped and restrictive. The Z Fold 6, however, is expected to have a wider cover display that's more in line with traditional smartphones. This will make it easier to use the phone when it's folded, without having to unfold it every time.

Addressing Durability Concerns

Durability has been a major concern for foldable smartphones, and Samsung is taking steps to address this issue with the Z Fold 6. The phone's foldable display has been certified by the US Department of Defense to the MIL-STD-810G standard, which means it can withstand drops, shocks, and other harsh conditions. This certification should give consumers peace of mind knowing that their foldable phone is built to last.

A More Mainstream Appeal

With its slimmer design, enhanced cover display, and improved durability, the Galaxy Z Fold 6 is poised to appeal to a wider range of consumers. It addresses many of the concerns that have held back foldable smartphones in the past, making it a more viable option for those looking for a cutting-edge mobile device.

Conclusion

The Galaxy Z Fold 6 represents a significant step forward for foldable smartphones. With its sleek design, enhanced features, and improved durability, it has the potential to make foldable phones more mainstream and accessible to a wider audience. As the foldable smartphone market continues to grow, the Z Fold 6 is sure to be a major player, setting the standard for future generations of foldable devices.

","https://imageio.forbes.com/specials-images/imageserve/65d8c1d99a6516a610d01545/0x0.jpg?format=jpg&crop=2519,1416,x0,y319,safe&height=900&width=1600&fit=bounds",2024-02-25 18:39:52
https://www.forbes.com/sites/erikkain/2024/02/25/the-walking-dead-the-ones-who-live-episode-1-review---rick-and-michonne-return-in-a-lackluster-series-premiere/,‘The Walking Dead: The Ones Who Live’ Episode 1 Review - Rick And Michonne Return In A Lackluster Series Premiere,"

Title: ""The Ones Who Live"" - A Bumpy Start to Rick Grimes' Return

In the premiere of ""The Walking Dead: The Ones Who Live,"" we find Rick Grimes in the clutches of the enigmatic Civic Republic Military (CRM). The episode spends a significant portion of its runtime catching us up on Rick's journey, with voice-overs and flashbacks revealing his numerous escape attempts and the CRM's peculiar strategy of eliminating independent thinkers.

While the premise holds promise, the execution falls short. The episode is bogged down by excessive exposition and narration, leaving little room for action or character development. The abundance of dialogue often resorts to ""Gimple-speak,"" a term used to describe the stilted and melodramatic speech patterns common in the ""Walking Dead"" universe.

One of the highlights of the episode is the introduction of new characters, such as Okafor, a forward-thinking CRM leader, and Thorne, a South African submariner. These characters add depth to the story and provide some much-needed intrigue. However, their potential is cut short when Okafor is killed off in a rather unceremonious manner, a disappointment given the actor's strong performance.

The episode's saving grace comes in the form of a thrilling ending, where Rick and Okafor's helicopter is shot down by none other than Michonne. This revelation sets the stage for a highly anticipated reunion between the two beloved characters.

Despite the strong ending, the episode suffers from pacing issues and an overreliance on exposition. It could have benefited from a more balanced approach, allowing for more action and character moments to complement the necessary backstory.

Overall, ""The Ones Who Live"" is a decent start to Rick Grimes' return, but it fails to live up to the high expectations set by the long wait. The episode is weighed down by exposition and Gimple-speak, leaving fans wanting more substance. While the ending provides a glimmer of hope, it remains to be seen if the series can maintain this momentum and deliver a satisfying conclusion to Rick's story.

",https://imageio.forbes.com/specials-images/imageserve/65dbbece6c3233381309f054/0x0.jpg?format=jpg&height=900&width=1600&fit=bounds,2024-02-25 18:36:04
https://www.forbes.com/sites/traversmark/2024/02/25/a-psychologist-explains-6-types-of-conspiracy-theories/,A Psychologist Explains 6 Types Of Conspiracy Theories,"

 Conspiracy Theories: Unraveling the Allure and the Dangers

In the vast tapestry of human discourse, there lies a captivating realm where reality is intertwined with suspicion and speculation: the realm of conspiracy theories. These theories, often fueled by a distrust of authority and a yearning for hidden truths, have permeated societies for centuries, weaving their way into our conversations, newsfeeds, and even our political landscapes.

While conspiracy theories can be intriguing and thought-provoking, it's crucial to approach them with a healthy dose of skepticism and critical thinking. For beneath their alluring façade lies a potential for harm, not just to individuals but to society as a whole.

 Unveiling the Common Threads

Research has identified six types of conspiracy theories that resonate with people across cultures and backgrounds:

1. Government Malfeasance: The belief that governments engage in covert activities, orchestrating events to manipulate the public or justify their actions.

2. Malevolent Global Manipulation: The notion that shadowy groups, like the Illuminati, control world events to further their own agendas.

3. Personal Well-being Control: The fear that corporations or governments use technologies to manipulate or harm individuals, often without their knowledge.

4. Extraterrestrial Cover-ups: The belief that governments conceal the existence of extraterrestrial life, suppressing evidence of UFO sightings or alien encounters.

5. Control of Information: The suspicion that various organizations manipulate information to shape public perceptions, suppress dissent, or advance certain agendas.

6. Covid-19 Theories: A range of false and misleading claims about the origins, severity, and responses to the Covid-19 pandemic.

 Recognizing the Perils

While conspiracy theories may seem harmless at first glance, they can have detrimental consequences:

- Erosion of Trust: Conspiracy theories undermine trust in institutions, authorities, and experts, leading to a fractured society where people struggle to find common ground.

- Misinformation and Misguided Actions: False information spread through conspiracy theories can lead to misguided actions, such as refusing vaccines, ignoring public health guidelines, or supporting extremist ideologies.

- Social and Political Polarization: Conspiracy theories can exacerbate social and political divisions, creating echo chambers where people only interact with those who share their beliefs, further entrenching their convictions.

- Fueling Extremism: In extreme cases, conspiracy theories can provide a breeding ground for political extremism and violence, as people may feel justified in taking drastic actions to expose or combat perceived conspiracies.

 Navigating the Labyrinth of Truth

In an era of information overload and rampant misinformation, it's more critical than ever to cultivate critical thinking skills and embrace evidence-based discourse. Here are some strategies to navigate the labyrinth of truth:

1. Question Assumptions: Challenge the underlying assumptions and motives behind conspiracy theories. Ask yourself, ""Who benefits from promoting this theory?"" and ""What evidence supports these claims?""

2. Seek Diverse Perspectives: Expose yourself to a variety of viewpoints, including those that challenge your own beliefs. Engage in respectful dialogue with people who hold different opinions.

3. Evaluate Evidence Critically: Examine the evidence presented in support of conspiracy theories with a discerning eye. Look for logical fallacies, cherry-picked data, and unsupported assertions.

4. Trust Credible Sources: Rely on reputable sources of information, such as scientific studies, established news organizations, and fact-checking websites. Be wary of sensationalized headlines and unverified claims.

5. Embrace Uncertainty: Accept that not everything can be known or explained. Embrace uncertainty as a natural part of life and focus on addressing the challenges we can actively influence.

Conspiracy theories may offer a tantalizing glimpse into the shadows of human imagination, but they can also lead us down a treacherous path. By embracing critical thinking, seeking diverse perspectives, and trusting credible sources, we can navigate the complexities of our world with a clear-eyed understanding of reality.

Remember, the pursuit of truth is an ongoing journey, and it's through collective action and informed discourse that we can illuminate the darkness and build a more enlightened and harmonious world.

","https://imageio.forbes.com/specials-images/imageserve/65dbc3d36a87d91cedc1f520/0x0.jpg?format=jpg&crop=999,469,x0,y58,safe&height=900&width=1600&fit=bounds",2024-02-25 18:25:25
