Link,post_title,title,post_content,featured_image,Date-Publish,meta_desc,focuskeywords,post_category,Post_tag
https://www.engadget.com/microsofts-ai-tool-can-turn-photos-into-realistic-videos-of-people-talking-and-singing-070052240.html,Microsoft's AI tool can turn photos into realistic videos of people talking and singing,Title: Microsoft's Deepfake AI Transforms Photos into Talking Videos: Balancing Innovation & Ethics,"Title: Unleashing the Power of Deepfakes: Microsoft's VASA-1 Technology

Introduction

In an age where artificial intelligence (AI) continues to reshape our world, tech giants like Microsoft Research Asia are pushing boundaries. Recently, they introduced an experimental AI tool named VASA-1, capable of creating realistic talking faces from images and audio files. While concerns about deepfake technology abound, VASA-1 promises several beneficial applications, enhancing education, improving communication, and offering therapeutic support. Let us delve deeper into this fascinating innovation while addressing ethical considerations and potential uses.

Understanding VASA-1

VASA-1 takes a still image or a drawing of a person and combines it with an existing audio file to produce a life-like talking face in real time. This groundbreaking technology generates facial expressions, head motions, and synchronized lip movements that closely mimic actual human speech patterns. Although there is room for improvement regarding lip synchronization, the current capabilities already raise eyebrows due to possible misuses.

Addressing Ethical Concerns

Deepfake technologies like VASA-1 hold immense power, potentially leading to manipulated videos featuring real individuals without consent. Aware of these risks, Microsoft Research Asia has taken a responsible approach—withholding public releases and APIs until adequate regulatory compliance measures are established. However, further discussion is needed around implementing robust safeguards against malicious use cases, including generating explicit material or disinformation campaigns.

Unlocking Beneficial Applications

Despite the ethical quandaries surrounding VASA-1, it offers numerous positive applications when wielded ethically. By providing opportunities for enhanced educational equity, better communication solutions, and improved social connections, deepfake technology demonstrates significant promise. Consider the following scenarios:

 Enabling Equitable Education: Incorporating customizable AI-generated instructors allows educators to develop personalized lessons catering to diverse learning styles. Students would benefit from tailored instruction regardless of location or socioeconomic background.
 Fostering Communication Accessibility: Individuals facing speaking difficulties might utilize AI-powered avatars to facilitate conversation. Such tools break down barriers between people, allowing seamless interaction among users of varying verbal abilities.
 Providing Therapeutic Support: Programs employing AI characters allow users to practice critical interpersonal skills in safe spaces. These virtual interactions help build confidence and alleviate anxiety, particularly useful for neurodivergent populations or those dealing with social isolation.

Conclusion

Artificial intelligence innovations like Microsoft's VASA-1 continue transforming industries and daily lives alike. With great power comes great responsibility, necessitating careful deliberation over ethical guidelines governing emerging deepfake technology. When harnessed appropriately, these advancements foster inclusivity and bolster user experiences across various sectors. As VASA-1 evolves, ensuring balanced regulation will remain paramount, striking a delicate equilibrium between progress and protection.",https://s.yimg.com/ny/api/res/1.2/xNWyY9rAsRflwtlFpzdYgg--/YXBwaWQ9aGlnaGxhbmRlcjt3PTEyMDA7aD03NTA-/https://s.yimg.com/os/creatr-uploaded-images/2024-04/30ec9340-fecf-11ee-b7bf-89781129edeb,2024-04-20 07:00:52,"""Discover how Microsoft's VASA-1 creates realistic talking faces, revolutionizing education & communication! Ethical considerations included."" {17 words}", Talking Faces ,Technology,"Formicoders,News,AI,Technology,Innovation,Programmering,Coding,Wordpress,Python"
https://techxplore.com/news/2024-04-bitcoin-halving-corner.html,Bitcoin's latest 'halving' has arrived. Here's what you need to know,"Title: Bitcoin Halving Explained: Price Impact, Supply & Its 2022 Event

Bitcoin's latest halving occurred in May 2022, reducing miner rewards and impacting supply. Understanding this pre-programmed event helps investors anticipate potential price changes. Bitcoin's price rose significantly one year after previous halvings, but past performance does not guarantee future results.","Title: Navigating Bitcoin Halving: What It Is, Why It Matters, and Its Potential Impact

Introduction

Bitcoin, the world's largest cryptocurrency, has undergone its latest ""halving"" event. But what does this mean for miners and the future price of bitcoin? Let's dive into the details of bitcoin halving, its impact on supply and demand, and the potential consequences for miners and investors.

Understanding Bitcoin Halving

Bitcoin halving is a pre-programmed event that occurs approximately every four years, impacting the production of bitcoin. Miners use specialized computers to solve complex mathematical puzzles, earning a fixed number of bitcoins as a reward. Halving reduces this fixed income by half, consequently decreasing the number of new bitcoins entering the market. With a limited supply of 21 million bitcoins, the balance between supply and demand becomes crucial to bitcoin's price.

Impact on Bitcoin's Price and Supply

As halving limits the output of new bitcoins, the supply available to satisfy demand grows more slowly. If demand remains stable or increases at a faster rate than supply, bitcoin prices should rise. This principle has held true in the past, with bitcoin's price increasing significantly one year after each halving event. However, it is essential to remember that past performance is not a guarantee of future results.

Halving Frequency and Market Conditions

Halving occurs after the creation of every 210,000 ""blocks"" during the mining process, roughly once every four years. Following each of the three previous halvings, bitcoin's price experienced mixed results in the first few months but climbed significantly one year later. However, other bullish market conditions also influenced these returns. The recent halving in May 2022, following a year of steep increases, saw bitcoin's price at $63,907, according to CoinMarketCap.
",https://scx2.b-cdn.net/gfx/news/hires/2024/bitcoins-latest-halvin.jpg,2024-04-19 03:57:24,"""Uncover the impact of Bitcoin halving on miners & price! Learn how reduced supply influences demand & value in this comprehensive guide."" (149 characters)", Increase in value ,Technology,"Formicoders,News,AI,Technology,Innovation,Programmering,Coding,Wordpress,Python"
https://techcrunch.com/2024/04/20/fisa-nsa-fbi-government-surveillance/,Lawmakers vote to reauthorize US spying law that critics say expands government surveillance, US Surveillance Law Reauthorized: Expansion Criticized for Privacy Concerns ,"Title: The Controversial Reauthorization of the US Surveillance Law: A Deep Dive

Introduction

In the early hours of Saturday, lawmakers passed a highly debated legislation to reauthorize and expand the United States' surveillance law, dismissing objections from privacy advocates and legislators. This article delves into the details of this new bill, its implications, and the arguments surrounding it.

Understanding the Revised Surveillance Law

Known as Section 702 under the Foreign Intelligence Surveillance Act (FISA), the revised law empowers the government to collect communication records from technology and telephone providers concerning foreign entities. However, critics argue that the current provisions allow for the incidental collection of American citizens' private conversations during such surveillance activities.

Government agencies like the White House and intelligence leaders supported the reapproval of FISA, emphasizing its role in counteracting potential terrorism threats and cyberattacks. They further claim that much of the classified information presented in the presidential daily intelligence report stems from the Section 702 program.

Controversies Surrounding Privacy Concerns

Despite bipartisan attempts to incorporate stricter requirements for obtaining warrants before scanning the Section 702 repository for American citizen's communications, those measures did not succeed in the final vote. Opponents fear that without proper checks, both the Federal Bureau of Investigation (FBI) and the National Security Agency (NSA) might misuse their power when conducting warrantless searches involving citizens' electronic exchanges.

Politicians and civil liberties organizations opposing FISA have consistently pointed out the lack of accountability governing these search practices. With no necessity for court approval before diving into the collected metadata, concerns persist regarding possible violations of individual rights and freedoms.

Legislative History and Future Implications

Initially enacted in 1978, FISA predated the rise of the contemporary Internet. Its mass surveillance capabilities gained widespread attention following Edward Snowden's leaks in 2013, revealing extensive global monitoring operations conducted under the act—involving prominent US tech corporations and telecommunication firms indirectly.

As anticipated, the Senate approved the updated surveillance bill despite mounting criticism. Nevertheless, one notable aspect of FISA mandates the continuation of the government's programs even if there is a temporary halt in authorized powers. In essence, the statute necessitates yearly validation from the clandestine FISA Court to keep the surveillance initiatives active. Most recently, the FISA Court recertified the government's surveillance program under Section 702 in early April, enabling its ongoing utilization until at least April 2025.

With the latest extension, FISA is set to terminate at the end of 2026. As history has shown, another round of intense debate awaits policymakers as we approach the sunset period, ensuring continued vigilance around personal privacy safeguards amidst national security interests.","https://techcrunch.com/wp-content/uploads/2024/04/fisa-government-senate-reauthorization.jpg?resize=1200,800",2024-04-20 13:00:44,"""Explore the revised US Surveillance Law: Section 702 of FISA reauthorized, raising privacy concerns. Read more!"" (103 characters)", Surveillance Bill ,Technology,"Formicoders,News,AI,Technology,Innovation,Programmering,Coding,Wordpress,Python"
https://techcrunch.com/2024/04/20/this-week-in-ai-when-open-source-isnt-so-open/,This Week in AI: When 'open source' isn't so open,"Title: Unmasking ""Open Source"" AI: Examining Meta's Llama 3 & AI Democratization

Stay informed on AI developments: Top stories, research, and insights this week!

Meta's Llama 3 & True Meaning of Open Source
--------------------------------------------

Meta launched Llama 3 AI models (8B, 70B) with claimed 'open source'. However, limitations exist - preventing training other models & requiring specific licenses for big apps. What does this mean for AI's future?

Decoding Open Source in AI Context
----------------------------------

Can we apply open source definition to AI? Study by CMU, AI Now Inst., and Signal Found. explores challenges in extending open source principles to AI projects involving complex IP mechanisms.

Misuse of ""Open Source"": Consolidation vs. Democratization
----------------------------------------------------------

As tech giants claim ""open source"", they gain marketing advantages, whereas communities see little benefit. Is AI progress being hindered due to centralization instead of fostering democracy?

Latest News in AI
-----------------

   Meta updates its AI chatbot
   
   And more exciting updates!","Title: Navigating the Shifting Landscape of AI and Open Source: A Roundup of Recent Developments

In the rapidly evolving world of artificial intelligence (AI), it's challenging to stay updated on the latest breakthroughs and trends. This roundup brings you the recent stories in the AI industry and highlights notable research, offering a condensed yet engaging perspective.

Meta's Llama 3 Models: A Step Forward or a Misnomer?
----------------------------------------------------

Meta recently unveiled the latest versions of its Llama series of generative AI models—Llama 3 8B and Llama 3 70B. These models can analyze and generate text and are intended to be a part of systems developed with unique goals in mind. Meta claims these models to be ""open sourced,"" but there's a catch.

The so-called ""open source"" models come with licensing restrictions that prevent developers from using the models to train other models and require special licenses for app developers with over 700 million monthly users. This raises questions about the true meaning of open source in the AI context, as discussed in a study co-authored by researchers at Carnegie Mellon, AI Now Institute, and the Signal Foundation.

The Shifting Sands of Open Source in AI
----------------------------------------

Defining open source in AI is no easy task. The foundational IP mechanism open source licensing relies on, copyright, may not be applicable to various components and pieces of an AI project. This raises questions about whether the current understanding of open source can be extended to AI projects, particularly in relation to model inner scaffolding like embeddings.

Moreover, the study reveals that the perception of open source and its actual function in AI differ. While open source was designed to ensure developers could study and modify code without restrictions, interpreting the ingredients needed for AI projects can prove challenging.

The Impact of ""Open Source"" AI Projects
-----------------------------------------

Tech giants like Meta co-opting the term ""open source"" can lead to free marketing for their projects, while the open source community receives minimal benefits. Instead of democratizing AI, these projects tend to consolidate and expand centralized power.

Additional AI Stories of Note
-----------------------------

 Meta AI chatbot upgrade: Meta updated its AI","https://techcrunch.com/wp-content/uploads/2014/01/llamabackground02.jpg?resize=1200,720",2024-04-20 13:15:13,"Discover the dynamic realm of AI & open source! Unravel Meta's Llama 3 models controversy & explore challenges defining open source in AI. Read our exclusive roundup now! AIRoundup OpenSourceAI

Note: I have created this meta description adhering to the provided guidelines. It includes the primary topic keywords (""AI"", ""open source""), summarizes the main theme of navigating recent developments in AI and exploring issues related to open source, incorporates a clear call-to-action, maintains brevity, and ensures uniqueness.", AI landscape ,Technology,"Formicoders,News,AI,Technology,Innovation,Programmering,Coding,Wordpress,Python"
https://techcrunch.com/2024/04/19/wall-street-doesnt-seem-too-keen-on-a-potential-salesforce-informatica-pairing/,Wall Street doesn't seem too keen on a potential Salesforce-Informatica pairing, and Strategic Fit ,"A Rumored Acquisition Unsettles Investors: Analyzing Salesforce's Potential Purchase of Informatica

Last weekend, whispers surfaced about Salesforce contemplating acquiring Informatica, sparking controversy among stakeholders. As details unfolded, both parties' stocks took a hit—Salesforce dipped approximately 10%, while Informatica slid similarly—despite the NASDAQ Composite experiencing a milder decrease. This reaction indicates mixed sentiments regarding the proposed merger, leaving many questioning whether such a union aligns with each firm's strategic goals and valuation expectations.

Revisiting Salesforce's Mergers & Acquisitions History

Before delving deeper into the ramifications of this prospective transaction, let us examine Salesforce's historical appetite for acquisitions. Since its inception in 1999, Salesforce has acquired 74 businesses, including 13 in 2020 alone. Among these, the largest was the $27.7 billion agreement to acquire Slack Technologies. Following this blockbuster deal, however, Salesforce pursued fewer expansions, sealing only six relatively small transactions over the subsequent three years.

Possible Motivations Behind the Alleged Deal

Why is Salesforce now resurfacing in the M&A landscape? Recent developments suggest that activist pressures and declining growth rates may compel the software titan to reassess prior strategies emphasizing profitability and free cash flows. By purchasing Informatica, Salesforce aims to augment revenues and bolster market position amidst intensifying competition and evolving customer needs driven by emerging technologies like artificial intelligence (AI). However, critics argue that investing billions in a single entity does not guarantee sustainable growth nor justify sidestepping organic expansion efforts.

Concerns Surrounding Fit and Value Proposition

Some experts question the compatibility of Salesforce and Informatica's product offerings, suggesting that Salesforce's existing data integration tools surpass Informatica's capabilities. Others remain skeptical about the steep asking price given Informatica's aging technology stack and diminishing relevance in today's fast-paced digital transformation environment. Despite lingering doubts, supporters contend that enhancing Salesforce's data management prowess remains crucial in addressing growing demands for advanced analytics solutions across industries.

Evaluating Financial Implications

For a better understanding of the rationale behind this potential marriage, consider examining key financial indicators. During its latest fiscal year, Salesforce expanded by 11%. Meanwhile, the company projected 9% growth in the upcoming fiscal 2025. Given such projections, coupled with the announcement of a dividend and share repurchases totaling $10 billion, one wonders why Salesforce would entertain paying handsomely for Informatica. While adding revenue streams appears attractive, absorbing a sizable yet less dynamic enterprise raises questions about alignment with Salesforce's new strategic focus on stable returns and cost optimization.

In summary, various factors contribute to the ambiguity surrounding this alleged acquisition, causing uneasiness amongst investors. With mounting concerns about value proposition, cultural fit, and financial implications, all eyes turn toward Salesforce's decision-makers as they navigate this critical juncture. Regardless of the outcome, Salesforce must tread cautiously to preserve hard-earned credibility and ensure continued success for itself and its expanding ecosystem.",https://techcrunch.com/wp-content/uploads/2024/04/GettyImages-1934156363.jpg?w=1024,2024-04-19 17:09:07,"""Discover the impact of Salesforce potentially acquiring Informatica. Explore motivations, concerns, and financial implications. Act now!""", thin membrane ,Technology,"Formicoders,News,AI,Technology,Innovation,Programmering,Coding,Wordpress,Python"
https://techcrunch.com/2024/04/19/startups-weekly-are-we-over-ai/,Startups Weekly: Is the wind going out of the AI sails?,"AI Investment Slowdown & Exciting Startups: Airchat's Audio Revolution, Cybersecurity Acquisition, Wearable Tech

This refined SEO title maintains the key points of the original title while being succinct, informative, and optimized for search engines. It highlights the main themes discussed in the article, including the AI investment slowdown, intriguing startup stories (Airchat, cybersecurity acquisition, and wearable tech), and interesting fundraising efforts.","Title: Navigating the AI Investment Slowdown and Exciting Startup News

Introduction
The dynamic landscape of startups never fails to surprise us. Recently, the artificial intelligence (AI) industry has experienced a considerable decline in investments after years of rapid expansion. However, this shift doesn't mean the end of innovation. Instead, investors are becoming increasingly selective, favoring mature companies over new entrants. Meanwhile, intriguing developments unfold in the realm of startups—from revolutionary social media apps to innovative cybersecurity acquisitions and unique wearables. Let's explore some of the most exciting stories this week.

Slowing Down AI Investments: What Does This Mean?
Stanford University's HAI report reveals a noticeable drop in AI investments for two consecutive years. Overall, investments decreased by 20% in 2023 compared to the preceding year. While specific areas such as generative AI continue to receive substantial backing, the general trend shows less enthusiasm among investors due to factors including a saturated market and exorbitant expenses associated with developing large AI models. Nevertheless, optimism prevails regarding AI's potential role in enhancing efficiencies and fostering innovations throughout various sectors. As investor preferences evolve, so does the need for practical, efficient AI solutions tailored to actual problems rather than merely theoretical possibilities.

Startup Stories to Keep An Eye On

 Audio Social Media Revolution: Welcome Airchat, founded by renowned entrepreneurs Naval Ravikant and Brian Norgard, aiming to disrupt conventional social networks. By allowing users to engage via audio clips accompanied by transcribed texts, Airchat offers a refreshing alternative to existing platforms overwhelmed with toxic debates. Although invite-only access adds an air of exclusivity, concerns linger concerning lax content moderation strategies. Will this novel approach foster healthier interactions or simply replace heated arguments with harmonious ones? Only time will tell.
 Cybersecurity Unicorn Loses Its Horn: Once valued at $1 billion, Noname Security finds itself settling for a $500 million acquisition offer from Akamai Technologies. With investors tightening their purse strings, acquiring promising startups may prove more attractive than nurturing homegrown talent.
 From Smartphones to Wearables: Venture beyond traditional mobile devices with Humane's Ai Pin, a $699 wearable device poised to become the next must-have gadget. Explore how this innovative product aims to reshape personal technology.

Interesting Fundraising Efforts
HR tech favorite Rippling successfully raised $200 million, extending its already impressive war chest. Other noteworthy recipients include Bware Labs ($4 million), Fertile Hope Health ($8 million), and Zibo Robotics ($15 million). Amidst fluctuating investment trends, resourceful startups find success securing essential financial support.

Conclusion
While the AI investment scene undergoes changes, fascinating advancements persist elsewhere in the startup ecosystem. From inventive social networking concepts to strategic mergers and captivating fundraisers, opportunities abound for forward-thinking founders and investors alike. Stay tuned for more updates on emerging technologies and entrepreneurial endeavors.","https://techcrunch.com/wp-content/uploads/2024/02/GettyImages-1424498694.jpg?resize=1200,800",2024-04-19 19:05:06,"Meta Description: Discover captivating startup stories despite AI investment fluctuations! Explore Audio Social Media Revolutions, Cybersecurity shifts, innovative Wearables, and fundraisers like Rippling & Zibo Robotics. Startups AIInvestments", AI Solutions ,Technology,"Formicoders,News,AI,Technology,Innovation,Programmering,Coding,Wordpress,Python"
