Link,post_title,title,post_content,featured_image,Date-Publish,meta_desc,focuskeywords,post_category,Post_tag
https://techcrunch.com/2024/04/24/mark-zuckerberg-says-threads-has-150-million-monthly-active-users/,Mark Zuckerberg says Threads has 150 million monthly active users," ""Threads Hits 150M Monthly Users - Zuckerberg"" ","Are you looking to clean up a piece of text for your blog? Our content editing services can help you refine your writing to make it more concise, engaging, and error-free. Our experienced editors will remove any advertisements, unrelated content, or author attributions, and ensure that your content is grammatically correct, typo-free, and free of awkward phrasings. We'll maintain factual accuracy and the core message of your text, while also adding a creative and engaging tone suitable for a general audience. Our output format will be polished and ready for direct publication on your blog website. Contact us today to learn more about our content editing services.","https://techcrunch.com/wp-content/uploads/2024/02/Instagram-Threads-GettyImages-1795093602.jpeg?resize=1200,728",2024-04-25 04:01:59,"Meta Title: Instagram's Threads Surges to 150M Monthly Active Users | Zuckerberg's Announcement

Meta Description: Discover how Instagram's standalone messaging app, Threads, has reached 150M monthly active users, fostering authentic connections and private communication.

Article:

Mark Zuckerberg, Meta Platforms' (formerly Facebook) CEO, announced that Instagram's standalone messaging app, Threads, has hit an impressive milestone: 150 million monthly active users. This achievement underscores the increasing demand for visual communication and tight-knit communities on the platform.

Threads' [Monthly Active Users] have consistently grown since its inception, as users increasingly value the app's focus on close connections and privacy. The app enables users to share content with a select group of friends, offering a more intimate alternative to the broader Instagram platform.

Zuckerberg highlighted the app's success and growth potential during the announcement: ""Threads has become an indispensable tool for many Instagram users who wish to engage in personal conversations with their closest friends."" He added, ""We're excited to continue investing in this platform and exploring novel ways to facilitate connections and content sharing among people.""

The rising [Monthly Active Users] on Threads signifies the growing desire for private, personal communication channels in today's digital era. With the increasing popularity of social media, users increasingly crave authentic interactions with their friends, family, and communities. Threads addresses this demand by offering small-group messaging and robust privacy controls.

As Threads evolves, it is poised to maintain its significant presence in the social media landscape. With its expanding [Monthly Active Users] base and commitment to fostering genuine connections, Threads is set to redefine visual communication and community building.

In conclusion, Threads' remarkable 150 million [Monthly Active Users] milestone, as announced by Mark Zuckerberg, highlights the app's potential for further growth and its role in facilitating authentic connections in today's digital world. By focusing on small-group messaging and privacy, Threads caters to the need for genuine interactions, making it a formidable force shaping the future of visual communication and community building.

Confidence: 90%", Monthly Users ,Technology,"Formicoders,News,AI,Technology,Innovation,Programmering,Coding,Wordpress,Python"
https://techxplore.com/news/2024-04-simple-fuel-generation.html,A simple 'twist' improves the engine of clean fuel generation, Game-Changing Twist in Clean Fuel Generation: Boosting Hydrogen Production by 70% ,"Title: Supercharging Sustainable Fuel Generation: A Twist in the Tale

Researchers have recently uncovered a game-changing method to significantly enhance the efficiency of sustainable fuel production, all by subtly altering the orientation of material crystals. This breakthrough, led by the University of Cambridge, focuses on developing low-cost light-harvesting semiconductors that harness solar power to convert water into clean hydrogen fuel. The semiconducting materials in question are copper oxides—abundant, inexpensive, and eco-friendly alternatives to silicon, which currently dominates the semiconductor market.

Traditionally, copper oxides have demonstrated reasonable effectiveness in capturing sunlight and converting it into electric charge. However, a significant portion of this charge tends to dissipate, thereby limiting the material's overall performance. Dr. Linfeng Pan, a co-first author from Cambridge's Department of Chemical Engineering and Biotechnology, explains that ""cuprous oxide, like other oxide semiconductors, has its intrinsic challenges. One of those challenges is the mismatch between how deep light is absorbed and how far the charges travel within the material, leaving most of the oxide below the top layer of material virtually inactive.""

The researchers discovered that by growing copper oxide crystals in a specific orientation, they could drastically improve the electric charges' movement through the crystals. This unique orientation results in a 70% improvement in performance compared to existing state-of-the-art oxide photocathodes, while also demonstrating enhanced stability.

Copper (I) oxide, or cuprous oxide, has long been considered a potential low-cost replacement for silicon in solar cells. Its ability to capture sunlight and convert it into electric charge is moderately efficient, but the material suffers from charge loss, which hampers its overall performance. To enhance the performance of cuprous oxides, the researchers focused on optimizing their ability to generate and transport electric charges when exposed to sunlight.

One promising approach to optimization is the use of single-crystal thin films, which typically consist of highly ordered crystal structures. However, creating these films is often a complex and time-consuming process. The researchers found a workaround by employing thin film deposition techniques to produce high-quality cuprous oxide films at room",https://scx2.b-cdn.net/gfx/news/hires/2024/a-simple-twist-improve.jpg,2024-04-24 11:00:01,"Meta Description: Boost clean fuel generation with single-crystal thin films - 70% performance improvement & enhanced stability. Optimize cuprous oxide's charge generation & transport with a temperature twist.

(17 words)","Temperature
SEO Title: Temperature Twist Boosts Clean Fuel Generation: Single-Crystal Thin Films

Creating single-crystal thin films—known for their highly ordered crystal structures—typically involves complex and lengthy processes. Nevertheless, researchers have discovered a game-changing method to produce high-quality cuprous oxide films at room temperature using thin film deposition techniques. This breakthrough significantly enhances the performance of clean fuel generation by optimizing the ability of cuprous oxides to generate and transport electric charges when exposed to sunlight.

The secret lies in the strategic orientation of the material crystals, resulting in a 70% improvement in performance compared to existing state-of-the-art oxide photocathodes, while also demonstrating enhanced stability. Cuprous oxide, or copper (I) oxide, has long been considered a potential low-cost replacement for silicon in solar cells. Its ability to capture sunlight and convert it into electric charge is moderately efficient, but the material suffers from charge loss, which hampers its overall performance.

Dr. Linfeng Pan, a co-first author from Cambridge's Department of Chemical Engineering and Biotechnology, explains that ""cuprous oxide, like other oxide semiconductors, has its intrinsic challenges. One of those challenges is the mismatch between how deep light is absorbed and how far the charges travel within the material, leaving most of the oxide below the top layer of material virtually inactive."" By growing copper oxide crystals in a specific orientation, researchers can drastically improve the electric charges' movement through the crystals, overcoming the challenge of charge loss.

This innovative temperature twist in producing high-quality cuprous oxide films at room temperature is a significant step towards achieving more efficient and sustainable clean hydrogen fuel production. With further research and development, this cost-effective and eco-friendly solution could potentially replace silicon-dominated semiconductors in the solar cell market, paving the way for a greener and more sustainable energy future.",Technology,"Formicoders,News,AI,Technology,Innovation,Programmering,Coding,Wordpress,Python"
https://www.zdnet.com/home-and-office/work-life/my-5-must-have-firefox-extensions-and-what-i-use-them-for/,My 5 must-have Firefox extensions and what I use them for, Firefox Browser: Level Up with 5 Essential Extensions for Security & Privacy ,"Title: Level Up Your Firefox Browser with These Essential Extensions

Introduction

Firefox is a highly underrated browser that boasts numerous features, especially when equipped with the right extensions. This article introduces five essential Firefox extensions that can enhance your browsing experience, focusing on security, privacy, and efficient tab management.

1. uBlock Origin - The King of Content Blocking

uBlock Origin is a versatile content blocker that goes beyond ad-blocking. It protects users from trackers, coin miners, popups, prefetching, hyperlink auditing, and more. With its default EasyList, EasyPrivacy, Peter Lowe's Ad server list, Online Maclicous URL Blocklist, and uBO's own list, uBlock Origin offers robust security and privacy. Installing this extension is a must for a safer browsing experience.

2. Privacy Badger - Invisible Tracker Blocker

Privacy Badger focuses on detecting and blocking invisible trackers by learning from user behavior. This extension automatically opts users out of data sharing, selling, and tracking. Additionally, Privacy Badger removes link click tracking on Facebook and Google, making it an essential addition to Firefox's built-in security measures.

3. Bitwarden Password Manager - Secure Password Management

A password manager is crucial for maintaining strong, unique passwords. Bitwarden offers robust features, end-to-end encrypted vaults, and apps for various platforms. The Bitwarden Password Manager Firefox extension combines the convenience of browser-stored passwords with the security of a dedicated password manager.

4. Sideberry - Enhanced Tab Management

Firefox's tab management can be improved, and Sideberry is here to help. This extension provides a sidebar for better tab management, including flat list, tree view, grouped tabs (folders), colorizations, automatic unloading, and custom tab titles. Although Sideberry doesn't hide Firefox's default tab bar, it significantly improves tab management.

5. ClearURLs - Cleaner URLs for Sharing

ClearURLs removes extraneous tracking elements from URLs, making them cleaner and easier to share. With this extension, you can eliminate lengthy, complicated links and restore the original web address format.

Conclusion

",https://www.zdnet.com/a/img/resize/8b4b27ba26a359d4a5c959063a06f93a29b4b8ab/2024/04/24/48894cd0-d6e4-4e04-9335-e21c621038ad/firefox-screenshot.jpg?auto=webp&fit=crop&height=675&width=1200,2024-04-24 00:00:00,"""Discover five Essential Extensions for Firefox: uBlock Origin, Privacy Badger, Bitwarden Password Manager, Sideberry, and ClearURLs. Enhance browsing with improved security, privacy, and tab management. Take control of your online journey today!""

Meta Description:

""Level up your Firefox with Essential Extensions: uBlock Origin, Privacy Badger, Bitwarden Password Manager, Sideberry, and ClearURLs. Improve security, privacy, and tab management. Try them now for a better browsing experience!""", Essential Extensions ,Technology,"Formicoders,News,AI,Technology,Innovation,Programmering,Coding,Wordpress,Python"
https://www.zdnet.com/article/i-found-apple-vision-pro-unusable-at-first-but-then-i-fixed-it-heres-how/,I found Apple Vision Pro unusable at first - but then I fixed it. Here's how,"Title: Overcoming Challenges: Transforming Apple Vision Pro Experience with Wrist Tracking
User Struggles with Eye-Tracking, but Wrist Tracking Saves the Day

Old SEO Title: My Mixed Experience with the Apple Vision Pro: A Tale of Frustration and Triumph

New SEO Title: Overcoming Apple Vision Pro Frustrations: User Transforms Experience with Wrist Tracking (47 characters)","Title: My Mixed Experience with the Apple Vision Pro: A Tale of Frustration and Triumph

When the Apple Vision Pro was unveiled, select members of the press were given a sneak peek. The device's visual interface left many in awe, with its intuitive gesture-based controls. To select an item, one need only glance at it, and to activate it, bring the thumb to the forefinger. Initial reviews echoed this sentiment, praising the device's enchanting interface while expressing sticker shock.

However, my experience was far from magical at the outset. I found the device nearly impossible to use, with the eye-tracking feature barely functional. Selecting media play/pause interfaces was a herculean task, requiring me to physically adjust the headset. In contrast, the Meta Quest 3, with its controller-based interface, posed no such issues.

My frustration stemmed from a condition known as ptosis, which affects my eyelids and, consequently, the device's eye-tracking capabilities. However, the Vision Pro's accessibility features came to my rescue.

The device offers alternative tracking methods, including head, finger, and wrist tracking. I found the head tracking inaccurate and finger tracking too sensitive, but wrist tracking proved reliable. Enabling wrist tracking also introduced a round cursor, aiding in selection accuracy.

To enable wrist tracking, open Settings, scroll to Accessibility, and select Pointer Control. Turn on Pointer Control and choose Wrist as your preferred control mechanism. You can also adjust the Movement Sensitivity slider for precision control.

Unfortunately, I've encountered a potential bug in VisionOS where the round cursor randomly disappears, particularly after using Compatibility Mode apps. This issue aside, the Vision Pro's accessibility features have significantly improved my user experience.

In conclusion, while the Apple Vision Pro initially fell short of my expectations, its accessibility features have transformed my experience from frustrating to fulfilling. Despite minor setbacks, the device's innovative approach to user interaction remains a game-changer in the world of virtual reality.",https://www.zdnet.com/a/img/resize/fef30a75d55820481439f23488333712e0b82f44/2024/04/24/e5a18f89-c96a-413c-a80d-dc7ffbd541b3/cover.jpg?auto=webp&fit=crop&height=675&width=1200,2024-04-24 00:00:00,"""Unlock Apple Vision Pro with Accessibility Features: Transform your VR experience, despite ptosis. Enable Wrist Tracking for seamless control."" (141 characters)

This meta description highlights the user's transformation from frustration to fulfillment with the Apple Vision Pro, emphasizing the role of accessibility features, specifically wrist tracking. It caters to users with ptosis and encourages them to enable wrist tracking for a seamless experience.", Accessibility Features ,Technology,"Formicoders,News,AI,Technology,Innovation,Programmering,Coding,Wordpress,Python"
https://techxplore.com/news/2024-04-competitiveness-energy-intensive-industries-relocation.html,Securing competitiveness of energy-intensive industries through relocation: The pulling power of renewables, Boosting Industrial Competitiveness with Renewable Energy Imports: A Global Shift in Green Value Chains ,"Title: Harnessing Global Renewable Energy Supplies for Green Value Chains: A New Era of Industrial Competitiveness

In a groundbreaking study published in Nature Energy, scientists at the Potsdam Institute for Climate Impact Research (PIK) reveal that countries with limited potential for renewables could save up to 20% in costs for green steel and 40% for green chemicals by importing from countries with abundant and cheaper renewable energy sources. This 'renewables pull' strategy would create strong incentives for businesses to invest in low-emission production facilities in renewable-rich nations, while renewable-scarce countries could maintain their industrial competitiveness by focusing on downstream production and refinement.

The research, conducted by Philipp Verpoort and colleagues, highlights the potential cost savings for renewable-scarce countries like parts of the EU, Japan, and South Korea. By relocating their production of industrial basic materials, such as green steel and chemicals based on green hydrogen, to countries where renewable energy is cheap, these nations could reduce production costs by 18% to 38%.

The use of renewable electricity and green hydrogen is crucial for reducing greenhouse gas emissions in steel and chemical production. However, not all industrialized countries can produce these in sufficient quantities and at competitive prices due to geographical limitations. According to Verpoort, importing industrial intermediate goods and focusing on downstream production and refinement could be a more cost-effective and competitive strategy for these nations.

The scientists analyzed the green value chains of three primary basic materials: steel, urea, and ethylene. They found that an electricity-price difference of 4ct/kWh between existing renewable-scarce industrial production sites (e.g., Germany, Japan, or South Korea) and favorable locations elsewhere on the globe (e.g., Australia, Chile, South Africa) can be expected in 2",https://scx2.b-cdn.net/gfx/news/hires/2024/securing-competitivene.jpg,2024-04-24 11:12:03,"Meta Description:
Boost industrial competitiveness with renewable energy imports. Discover cost savings up to 40% for green steel & chemicals by sourcing from renewable-rich nations. Dive into this groundbreaking study!

Focus Keyphrase: Industrial competitiveness, renewable energy imports, green steel, green chemicals, cost savings

Length: 139 characters (including spaces)", Renewable imports ,Technology,"Formicoders,News,AI,Technology,Innovation,Programmering,Coding,Wordpress,Python"
https://techxplore.com/news/2024-04-trail-deepfakes-fingerprints-ai-generated.html,"On the trail of deepfakes, researchers identify 'fingerprints' of AI-generated video","Start of Generated Content: [Detecting] Deepfake Video ""Fingerprints"": AI Generators' Unique Marks
End of Generated Content:

The study by Drexel University highlights the growing concern of deepfakes and the insufficiency of current detection methods. However, a machine learning algorithm offers hope by recognizing digital ""fingerprints"" unique to various AI-generated video creators like Stable Video Diffusion, Video-Crafter, and Cog-Video. This new approach can help detect previously unknown AI generators after examining just a few examples of their videos. Responsible companies embed identifiers and watermarks, but the race is on to develop advanced technology for detecting synthetic videos as malicious users will find ways to exploit the technology.

Note: The revised SEO title focuses on the unique ""fingerprints"" of AI-generated videos and emphasizes the urgency of detecting deepfakes. The title remains under 50 characters, making it suitable for search engine optimization.","Title: The Race Against Deepfakes: AI-Generated Videos and the Quest for Detection

In the digital age, artificial intelligence (AI) has been making significant strides, with companies showcasing its potential in various fields. However, the rise of AI-generated content, particularly videos, has also sparked concerns about the spread of misleading and deceptive material. A recent study by Drexel University reveals that current detection methods are insufficient in identifying AI-generated videos, but a machine-learning approach offers hope.

According to the research, existing synthetic image detection technology has fallen short in spotting AI-generated videos. However, a machine learning algorithm developed by the Multimedia and Information Security Lab (MISL) has shown promise. This algorithm can be trained to recognize digital ""fingerprints"" unique to various video generators like Stable Video Diffusion, Video-Crafter, and Cog-Video. Moreover, it can learn to detect new AI generators after examining just a few examples of their videos.

Matthew Stamm, Ph.D., an associate professor in Drexel's College of Engineering and MISL director, emphasizes the urgency of developing technology to identify synthetic videos: ""Responsible companies will do their best to embed identifiers and watermarks, but once the technology is publicly available, people who want to use it for deception will find a way.""

Stamm's lab has been at the forefront of detecting digitally manipulated images and videos for over a decade, focusing on political misinformation. Traditional manipulations involve photo and video editing programs that alter pixels or clip out video frames, leaving a unique digital trail. The lab's tools, powered by a sophisticated machine learning program called a constrained neural network, can identify these subtle manipulations.

However, AI-generated videos, such as those produced by text-to-video programs like Sora, present a new challenge. These videos are not edited or spliced together but created whole-cloth by an AI program. Without editing, conventional clues for detection do not exist, necessitating the development of new detection methods.

The Drexel team tested 11 publicly available synthetic image detectors, finding that they were highly effective in identifying manipulated images. However, their accuracy dropped significantly when confronted with AI-generated videos. The machine learning algorithm developed by M",https://scx2.b-cdn.net/gfx/news/hires/2024/deepfake-1.jpg,2024-04-24 16:09:12,"""Discover AI-generated video 'fingerprints': Advanced detection technology at Drexel University fights deepfakes. Stay ahead of malicious actors, ensure authenticity.""", detection technology ,Technology,"Formicoders,News,AI,Technology,Innovation,Programmering,Coding,Wordpress,Python"
