Link,Title,Text,Image,Date Publish
https://techcrunch.com/2024/02/26/uipath-stock-turnaround-general-automation-ai/,UiPath finds firmer financial footing with pivot to general automation and AI,"

In the realm of technology, a tale of resurgence unfolds, centered around UiPath, a company that once soared high but faced a turbulent descent. Back in 2021, UiPath was riding the wave of success, securing a hefty valuation of $35 billion. However, the market's sentiments shifted, and the company's fortunes took a downturn.

Enter Rob Enslin, a seasoned enterprise veteran, who joined UiPath as co-CEO in 2022, bringing a wealth of experience to steer the company out of its doldrums. Enslin recognized that UiPath's focus on robotic process automation (RPA) alone was limiting its potential. He embarked on a strategic transformation, broadening the company's horizons and diversifying its offerings.

Enslin's vision centered around creating an automation platform that would cater to customers' evolving needs. He reorganized the company's structure, sales motion, and product focus, shifting away from a single RPA product towards a comprehensive platform approach. This strategic pivot allowed UiPath's sales team to offer a wider range of products, addressing the limitations of RPA.

Initially, the market reacted cautiously to UiPath's changing trajectory, resulting in slower growth. However, Enslin's persistence and unwavering belief in his strategy began to bear fruit. Over time, the company's stock price started to rebound, signaling a renewed investor confidence.

UiPath's transition involved not only internal changes but also a strategic shift in its go-to-market approach. The company focused on expanding its presence in large accounts, building strong relationships, and acquiring customers with a propensity to utilize automation extensively. Additionally, UiPath forged partnerships with industry giants like Deloitte and SAP, leveraging their expertise to enhance its sales and implementation capabilities.

In the realm of innovation, UiPath embraced generative AI, recognizing its transformative potential in the automation landscape. The company showcased its AI-powered products, capturing the attention of investors and customers alike. This strategic move further solidified UiPath's position as a forward-thinking leader in the automation industry.

The company's transformation under Enslin's leadership has been met with positive feedback from analysts. Jake Roberge, an analyst at William Blair, highlighted UiPath's progress in gaining traction with various products beyond RPA, which has resonated well with investors.

UiPath's stock price, which had plummeted to just over $10 per share in late 2022, has rebounded significantly, reaching $25 per share in 2023. While the company's valuation remains below its IPO price and all-time highs, its recovery from the lows is a testament to the success of its strategic transformation.

The company's financial performance reflects the impact of its updated strategy. UiPath's growth rates, which had reached their nadir in 2022, have rebounded and are now accelerating. The company's revenue and ARR growth rates have shown consecutive quarters of improvement, indicating a positive trajectory.

UiPath's net retention rate, a key indicator of customer satisfaction and loyalty, has remained strong at 121%, even amidst challenging market conditions. This impressive figure suggests that the company's strategic shifts have resonated with its customer base.

UiPath's resurgence is a testament to the power of strategic transformation and the importance of adapting to changing market dynamics. Under Enslin's leadership, the company has diversified its product portfolio, embraced innovation, and forged strategic partnerships, positioning itself for continued growth and success.

As UiPath looks to the future, the question remains: how much acceleration is left in its tanks? The company's upcoming earnings report will provide further insights into its growth trajectory. Regardless, UiPath's current position, with an ARR approaching $1.5 billion and growth rates around 25%, is a far cry from its challenging days in 2022. The company's transformation journey serves as an inspiration for businesses seeking to navigate the ever-changing landscape of technology and innovation.

","https://techcrunch.com/wp-content/uploads/2024/02/UiPath-Rob-Enslin-horizontal-4.jpg?resize=1200,800",2024-02-26 17:37:18
https://techcrunch.com/2024/02/26/samsung-centers-sleep-with-its-first-smart-ring/,Samsung centers sleep with its first smart ring,"

In the realm of wearable technology, Samsung made waves at MWC this year with the unveiling of its Galaxy Ring. This announcement confirms the company's entry into the emerging market of smart rings, a niche that has been gaining traction in recent years.

The news was met with mixed reactions from competitors in the field. While some expressed enthusiasm about the validation it brings to the category, others hinted at underlying concerns. The general consensus, however, is that Samsung's foray into this space is a testament to the growing significance of smart rings.

Despite the potential competition, the Galaxy Ring's arrival could inadvertently benefit existing players like Oura. Samsung's presence in the market could expand the overall consumer base, potentially leading to increased awareness and adoption of smart rings. Additionally, Oura's strong intellectual property portfolio positions it well to navigate any potential patent disputes.

The Galaxy Ring's focus on health and wellness aligns with Samsung's broader strategy of building a comprehensive health ecosystem. The ring's ability to measure heart rate, movement, and breathing patterns contributes to a holistic understanding of the wearer's health and sleep patterns. This data feeds into Samsung Health, the company's digital wellness platform, which connects various devices and partner solutions.

While smart rings and smartwatches have often been seen as mutually exclusive, Samsung's entry into both categories could change this dynamic. The company may explore ways to integrate the two devices, allowing users to seamlessly track their health and fitness across different form factors.

The Galaxy Ring is still in its prototype stage, with a release date set for later this year. Details regarding pricing, battery life, and additional features are yet to be revealed. However, Samsung's commitment to making the ring competitive with existing offerings suggests a compelling product that could reshape the smart ring landscape.

As the smart ring market continues to evolve, it will be intriguing to see how Samsung's entry impacts the industry. Will it revolutionize the way we track our health and wellness? Only time will tell.

","https://techcrunch.com/wp-content/uploads/2024/02/IMG_0369.jpg?resize=1200,900",2024-02-26 16:47:28
https://www.forbes.com/sites/katherinehignett/2024/02/27/sharp-rise-in-arfid-eating-disorder-sparks-warning-from-uk-charity/,Sharp Rise In ARFID Eating Disorder Sparks Warning From U.K. Charity,"

In the United Kingdom, calls to Beat, a charity dedicated to eating disorders, have witnessed a staggering sevenfold increase over the past five years, reaching 2,054 calls in 2022 alone. This alarming surge in inquiries pertains to a lesser-known eating disorder called Avoidant/Restrictive Food Intake Disorder (ARFID).

ARFID, often misunderstood and poorly supported, is characterized by an avoidance of food. Individuals with ARFID may restrict their diet to a limited number of foods or consume insufficient quantities of food, leading to nutritional deficiencies, malnutrition, and social difficulties.

Unlike other eating disorders, ARFID is not driven by body image concerns or weight loss desires. Instead, it may stem from sensory sensitivities to food textures or tastes, fear of eating due to traumatic experiences, or a lack of interest in eating.

ARFID can manifest in people of any age, but it commonly emerges in infants and young children. While many children may exhibit food fussiness at some point, ARFID is distinguished by a diet so restricted that it fails to meet nutritional needs, resulting in medical, nutritional, and psychosocial problems.

Despite the severity of ARFID, specialist support for this condition remains limited. Andrew Radford, the chief executive of Beat, expressed concern over the lack of readily available specialist care, highlighting the struggles of individuals who face lengthy waits or are unable to access treatment near their homes.

To raise awareness of ARFID during Eating Disorders Awareness Week, healthcare providers and charities in the UK are sharing stories from families affected by the disorder. One parent recounted their teenage daughter's rapid loss of interest in food, accompanied by anxiety, weight loss, and a decline in energy.

With dedicated personalized care from a specialist team, the daughter was able to regain weight, improve her physical and mental well-being, and expand the variety of foods she could consume. The parent emphasized the time, patience, and support required from healthcare professionals but expressed gratitude for the positive changes they witnessed in their daughter's life.

The increasing calls to Beat underscore the urgent need for greater awareness, understanding, and support for ARFID. By shedding light on this often-overlooked eating disorder, we can help affected individuals and their families access the specialized care they need to reclaim their health and well-being.

",https://imageio.forbes.com/specials-images/imageserve/65dd6cd5ba9bb792340bf67f/0x0.jpg?format=jpg&height=900&width=1600&fit=bounds,2024-02-27 01:12:55
https://www.forbes.com/sites/chuckbrooks/2024/02/26/5-actions-businesses-should-take-to-strengthen-their-cybersecurity/,5 Actions Businesses Should Take to Strengthen Their Cybersecurity,"

Cybersecurity: A 5-Step Plan to Protect Your Business

In today's digital age, cybersecurity is not just an IT issue; it's a business imperative. A single breach can cripple operations, tarnish reputations, and even bankrupt companies. Here's a 5-step plan to help businesses strengthen their cybersecurity and protect their bottom line:

1. Foster Collaboration Between C-Suite and IT Specialists:

The first step towards robust cybersecurity is bridging the communication gap between the C-Suite and IT specialists. Establish a shared framework that includes clear communication channels and a common strategy. Educate the board on cybersecurity risks and their potential impact on the business.

2. Develop a Comprehensive Cybersecurity Framework:

Translate the shared strategy into a detailed plan that outlines roles, responsibilities, and priorities. Focus on identifying and monitoring threats, updating security architectures, implementing access controls, and deploying advanced defensive layers. Don't forget to include resilience, gap analysis, and incident response procedures.

3. Stay Ahead of the Curve with Emerging Technologies:

The rapid evolution of technologies like AI, quantum computing, and 5G brings new security challenges. Understand how these technologies impact cybersecurity and adjust your strategies accordingly. Stay informed about emerging threats and vulnerabilities to stay one step ahead of malicious actors.

4. Bring in Cybersecurity Experts:

Hiring subject matter experts (SMEs) with deep knowledge of cybersecurity risks, regulations, and technologies can significantly enhance your defenses. These experts can provide valuable insights, help navigate complex architectures, and offer fresh perspectives on emerging threats.

5. Implement Cyber Hygiene Practices:

Cyber hygiene is a shared responsibility. Encourage employees to practice good online habits like using strong passwords, enabling multifactor authentication, and being vigilant about phishing attempts. Regular cybersecurity awareness training can help employees stay informed and vigilant.

By following these five steps, businesses can significantly improve their cybersecurity posture and protect themselves from the ever-evolving threat landscape. Remember, cybersecurity is not just about technology; it's about people, processes, and a shared commitment to protecting the organization's digital assets.

",https://imageio.forbes.com/specials-images/imageserve/65dd51b276729e3ca6f97309/0x0.jpg?format=jpg&height=900&width=1600&fit=bounds,2024-02-26 22:20:32
https://www.forbes.com/sites/stevemcdowell/2024/02/26/dells-new-telecom-focused-offerings-simplify-5g-deployments/,Dell’s New Telecom-Focused Offerings Simplify 5G Deployments,"

Dell Technologies Unveils Solutions to Simplify 5G Deployment for Communication Service Providers

In the lead-up to Mobile World Congress, Dell Technologies announced a suite of offerings designed to streamline the deployment of advanced 5G solutions for communication service providers (CSPs). The Dell Telecom Infrastructure Automation Suite and the updated Dell Telecom Infrastructure Blocks for Red Hat 2.0 are set to transform the telecom landscape.

Dell Telecom Infrastructure Automation Suite: Simplifying Network Management

The Dell Telecom Infrastructure Automation Suite addresses the challenges of deploying and managing complex network infrastructure. The comprehensive suite automates the management and orchestration of compute, storage, networking, and cloud resources, enabling CSPs to seamlessly manage their entire network infrastructure.

The suite offers a balanced approach to network transformation, combining the simplicity of integrated stacks with the agility of open, cloud-native networks. It simplifies the management of multi-cloud environments through a single management and orchestration plane.

Dell Telecom Infrastructure Blocks for Red Hat 2.0: Accelerating 5G Deployment

The updated Dell Telecom Infrastructure Blocks for Red Hat 2.0 empowers CSPs in deploying and scaling 5G networks. The pre-loaded, pre-integrated, and pre-validated cloud platform software on Dell hardware simplifies the transition to cloud-native network infrastructures.

Engineered collaboratively by Dell Technologies and Red Hat, these blocks provide a cloud foundation for 5G Core workloads running Red Hat OpenShift on bare metal. The solution streamlines network transformation, offering automation, resource pooling, and a unified architecture that reduces compatibility issues.

Dell's Strategic Play in the Telecom Sector

Dell's recent announcements underscore its commitment to the telecom sector. The company's focus on automation, cloud-native infrastructure, and energy efficiency positions it as a strategic player in the rapidly growing 5G market.

Dell's solutions lower the barriers to 5G deployment, offering CSPs a toolkit that enhances efficiency, scalability, and innovation. These offerings will help Dell gain a competitive edge in a market poised for exponential growth driven by the global rollout of 5G technology.

Conclusion

Dell Technologies' latest offerings are a testament to its commitment to empowering CSPs in deploying and managing advanced 5G solutions. The Dell Telecom Infrastructure Automation Suite and the updated Dell Telecom Infrastructure Blocks for Red Hat 2.0 simplify network management, accelerate 5G deployment, and position Dell as a key player in the telecom sector.

",https://imageio.forbes.com/specials-images/imageserve/65dd527276729e3ca6f9730b/0x0.jpg?format=jpg&height=900&width=1600&fit=bounds,2024-02-26 22:14:25
https://www.forbes.com/sites/richkarlgaard/2024/02/26/2024-new-paradigms-part-i/,"2024-New Paradigms, Part I","

In the tumultuous year of 2024, the world stands at a crossroads, facing a multitude of challenges and opportunities. From the political arena to the business landscape, uncertainty looms large, demanding adaptability and resilience.

At the forefront of concerns for business leaders is the unprecedented convergence of major events that will shape the global landscape. The year 2024 marks a ""super year"" of democratic elections, with over 60 countries and territories set to cast their votes. The outcomes of these elections will have far-reaching implications, influencing policies, economies, and international relations.

Geopolitics and war remain persistent threats, casting a shadow over global stability. The ongoing conflicts and tensions between nations pose significant risks to businesses and economies worldwide.

The rapid acceleration of artificial intelligence (AI) presents both immense potential and profound challenges. While AI holds the promise of transforming industries and enhancing human capabilities, its ethical implications and potential disruptions to the workforce raise valid concerns.

Beyond these primary concerns, a host of other questions linger in the minds of investors and business leaders. Will inflation truly subside, or will it continue to cast a pall over economic growth? Where will interest rates settle, and how will they impact borrowing costs and investment decisions? Will voters embrace climate policies that may lead to higher energy costs, or will they resist such measures?

The year 2024 promises to be a year of change and disruption. New paradigms are emerging, driven by technological advancements and evolving consumer preferences. Traditional business models are being challenged by the relentless march of AI and the rise of younger, tech-savvy customers.

In this environment of uncertainty, hunkering down and adopting a risk-averse approach may seem like a prudent strategy. However, such a stance could inadvertently stifle innovation and hinder progress. Instead, businesses must embrace agility and adaptability, seeking opportunities amidst the challenges.

The upcoming elections hold immense significance, with billions of people casting their votes for national leaders. The outcomes of these elections will shape the direction of countries, influencing economic policies, social welfare programs, and global alliances.

The United States, with its upcoming presidential election, offers a stark contrast in visions. President Joe Biden's first term has been marked by significant federal intervention, including the $3 trillion Inflation Reduction Act. His rival, Donald Trump, represents a populist and nativist movement that challenges the status quo.

The divide between the elite and the general population is evident in their contrasting views on climate change policies. A poll conducted by the Committee to Unleash Prosperity revealed a significant gap in support for measures such as rationing gas, meat, and electricity, as well as bans on non-essential air travel and gas-powered cars.

The possibility of Trump's return to power may seem absurd to some, but it underscores the deep-seated fears and frustrations felt by his supporters. They perceive their freedoms and values under attack, leading to a sense of alienation and resentment.

In this high-risk year of 2024, it is imperative to avoid schadenfreude, the pleasure derived from the misfortune of others. Instead, we must strive for global prosperity and peace, recognizing that the challenges we face are interconnected and require collective action.

","https://imageio.forbes.com/specials-images/imageserve/65dc0a802c826499aa4e9a1f/0x0.jpg?format=jpg&crop=1500,845,x0,y19,safe&height=900&width=1600&fit=bounds",2024-02-26 20:31:19
https://www.forbes.com/sites/jenniferpalumbo/2024/02/26/what-is-health-equity-and-why-it-matters-to-those-with-disabilities/,What Is Health Equity And Why It Matters To Those With Disabilities,"

Title: Ensuring Health Equity for Children with Special Needs: A Call for Action

In the realm of healthcare, children with special needs, disabilities, or autism face a stark reality of inequity. This disparity reflects broader systemic challenges that hinder their access to quality healthcare, leading to profound long-term effects on their well-being and development.

The Pervasive Disparities:

Studies have revealed a troubling picture of healthcare disparities experienced by children with special needs. They are more likely to have chronic physical, developmental, behavioral, or emotional conditions, requiring additional care and services. Yet, they often encounter barriers in accessing adequate healthcare.

Key Findings from the National Survey of Children's Health:

- Children with special needs are nearly four times more likely to have unmet care needs compared to their peers.
- Cost and appointment availability are major obstacles to accessing necessary care.
- Less than two-thirds of children with special needs have adequate health insurance coverage.
- Transition planning for adult healthcare is lacking for youth with special needs.

Compounding Challenges:

Race, geographic location, and socioeconomic status further compound these challenges. Children from marginalized communities face even greater hurdles in receiving accessible and quality healthcare.

Communication Barriers and Suboptimal Care:

Effective communication is paramount in healthcare, but children with complex needs or non-verbal communication often struggle in this area. This can lead to misdiagnosis and suboptimal care, further exacerbating their health concerns.

The Role of Social Determinants of Health:

Social determinants of health, such as family income, job security, insurance access, and living conditions, significantly impact the healthcare experiences of children with disabilities. These factors can create additional stress and affect their overall health and well-being.

Policy and Legislative Imperatives:

Policy and legislation play a crucial role in advancing health equity for children with disabilities. Initiatives such as increasing Medicaid reimbursement for diagnostic and treatment centers can help address the healthcare crisis faced by families and individuals with disabilities.

Data-Driven Approaches and Economic Impact:

Leveraging data and technology can help develop targeted interventions and policies to address the disparities faced by children with disabilities. Investing in health equity is not only a moral imperative but also a smart financial decision, as it can unlock economic value and improve the quality of life for millions of individuals.

Conclusion:

Achieving health equity for children with special needs requires a multifaceted approach that addresses systemic barriers, improves communication in healthcare settings, enacts supportive policies and legislation, and leverages data for targeted interventions. By committing to these efforts, we can ensure that our most vulnerable populations have the opportunity to attain their highest level of health and well-being.

",https://imageio.forbes.com/specials-images/imageserve/65dd228b724dcdb467f51dd1/0x0.jpg?format=jpg&height=900&width=1600&fit=bounds,2024-02-26 18:53:02
https://www.zdnet.com/article/the-most-jaw-dropping-demo-at-mwc-was-from-a-brand-i-wasnt-expecting-to-see/,The most jaw-dropping demo at MWC was from a brand I wasn't expecting to see,"

In the realm of AI assistants, the Humane Ai Pin stands out as a pioneering hardware device. While its presence at Barcelona's Mobile World Congress (MWC) may have been subtle, its impact was undeniable.

Unlike traditional booths, Humane opted for a unique approach, scattering its team of engineers and designers across partner companies' spaces. This strategic move allowed them to engage in captivating demos, showcasing the Ai Pin's capabilities to attendees.

During my encounter with the Humane duo, I witnessed firsthand the Pin's impressive voice command capabilities. Its quick responses and accurate information were particularly notable. The device's ability to project answers onto the user's palm using its Laser Ink Display was equally impressive. This feature not only added a futuristic touch but also provided a discreet way to receive information, especially for sensitive questions.

While the live demos provided valuable insights, questions remain regarding the practicality of integrating the Ai Pin with smartphones. Additionally, the $699 price tag and $24 monthly subscription may deter some potential users.

Despite these considerations, the Humane Ai Pin offers a glimpse into the future of AI companions. Its seamless interactions and contextually relevant information make it an intriguing option for those seeking a hands-free and intuitive AI experience.

",https://www.zdnet.com/a/img/resize/65a6f6195a9992e0f468f90074dfaa2b520209d5/2024/02/26/f9148cb7-7aa7-445d-9080-a65be0eebf77/dsc01357.jpg?auto=webp&fit=crop&height=675&width=1200,2024-02-26 12:27:00
