Link,post_title,title,post_content,featured_image,Date-Publish,meta_desc,focuskeywords,post_category,Post_tag
https://www.zdnet.com/article/microsoft-launches-phi-3-mini-an-ai-model-that-is-smaller-but-still-rivals-gpt-3-5/,"Microsoft launches Phi-3 Mini, an AI model that is smaller but still rivals GPT-3.5"," Microsoft's Small But Mighty Phi-3 Mini AI Model Rivals GPT-3.5
","Title: The Power of Small: Microsoft's Phi-3 Mini Language Model

In the rapidly evolving world of artificial intelligence, tech companies are in a race to create increasingly large and sophisticated models. However, Microsoft is taking a different approach by focusing on the potential of smaller models. The tech giant has recently unveiled Phi-3 Mini, the first in a series of three compact AI models, and the smallest of the trio.

Phi-3 Mini was trained on 3.8 billion parameters or variables, which enable AI models to provide more accurate and efficient results. Microsoft has yet to announce the release dates for Phi-3 Small and Phi-3 Medium, which will be trained on 7 billion and 14 billion parameters, respectively.

For context, OpenAI's GPT-4 Turbo is reported to have been trained on more than 1 trillion parameters, while Meta's final Llama 3 model, launching later in 2024, will have been trained on 700 billion parameters. While larger models can deliver better results for complex queries and critical AI implementations, they require more power and energy.

Smaller AI models, like those Microsoft is developing, are particularly beneficial for lower-powered devices, such as smartphones, where on-device AI performance is limited by chipset power and battery life. Microsoft plans to utilize Phi-3 in mobile devices, leveraging its compact size without compromising performance.

Despite its diminutive scale, the Phi-3 Mini model reportedly performs well. According to Microsoft, Phi-3 Mini offers the same capabilities as models trained on more than 10 times the number of parameters used by Microsoft. Although it cannot compete with GPT-4 or GPT-4 Turbo, it is as capable as GPT-3.5.

Microsoft achieved this performance by training Phi-3 Mini on a ""curriculum"" that included children's books. The company also employed a larger model to generate AI-created children's books, supplementing its real-world material.

Phi-3 Mini is now accessible for free on Microsoft's Azure cloud platform, model collaboration site Hugging Face, and AI model service Ollama, further expanding its potential applications.

In conclusion, Microsoft's Phi-3 Mini offers a compelling alternative to larger AI models, demonstrating that",https://www.zdnet.com/a/img/resize/23a38ae04f37f510b5e5ad8f85f776c6055b59fc/2024/04/23/47aa9e75-92af-487f-b404-065a5f9bc26c/microsoft-mobile-device.jpg?auto=webp&fit=crop&height=675&width=1200,2024-04-23 00:00:00,"Discover Microsoft's Phi-3 Mini: A Powerful, Compact AI Language Model. Experience top-tier AI performance on lower-powered devices. Try it for free on Azure, Hugging Face, and Ollama.","smaller can still be powerful

in the realm of artificial intelligence. By focusing on compact models, Microsoft is addressing the needs of lower-powered devices and enabling wider access to AI technology. This innovative approach to AI development could shift the industry's focus towards smaller, more accessible models, ultimately democratizing AI and fostering a new wave of AI-driven innovations.",Technology,"Formicoders,News,AI,Technology,Innovation,Programmering,Coding,Wordpress,Python"
