Link,Title,Text,Image,Date Publish
https://www.forbes.com/sites/traversmark/2024/02/28/how-to-disarm-a-narcissist-with-the-gray-rock-method/, Disarm Narcissists: The 'Gray Rock' Method ,"

Navigating the Maze of Narcissism: The Gray Rock Method

Introduction

In the realm of human interactions, narcissists stand out as masters of manipulation and emotional vampirism. Their insatiable need for admiration and lack of empathy can leave us feeling drained and bewildered. Whether it's a coworker, family member, or romantic partner, dealing with a narcissist can be a daunting task. But fear not, for there's a strategy that can help you navigate this treacherous terrain: the Gray Rock Method.

What is the Gray Rock Method?

The Gray Rock Method is a technique that aims to neutralize the impact of narcissistic behavior by becoming emotionally unresponsive. It's like turning yourself into a dull and uninteresting gray rock, devoid of any reaction that could fuel the narcissist's desire for drama and attention.

How to Use the Gray Rock Method

When a narcissist tries to provoke you, your first instinct may be to react defensively or emotionally. However, this only feeds their power. Instead, try the following:

 Recognize the Manipulation: Understand that the narcissist's criticism or provocation is solely intended to elicit a response.
 Remain Neutral and Unresponsive: Acknowledge their comments calmly without showing any emotion. Avoid engaging in arguments or debates.
 Redirect Attention Away: Once you've established neutrality, redirect the conversation back to the topic at hand or disengage from them altogether.

When to Use the Gray Rock Method

The Gray Rock Method is particularly effective when:

 Interactions with someone consistently leave you feeling drained or emotionally exhausted.
 The person constantly seeks attention, validation, or control in conversations.
 Your attempts to set boundaries or assert yourself are met with defensiveness, hostility, or disregard.

Benefits of the Gray Rock Method

By refusing to engage with a narcissist, you:

 Deprive them of the drama and attention they crave.
 Protect yourself from further emotional harm.
 Regain control over your own emotions and well-being.

Limitations of the Gray Rock Method

It's important to note that the Gray Rock Method is not a one-size-fits-all solution. It may not be effective in situations where there is a history of cyclically abusive behavior. If you find yourself trapped in a cycle of narcissistic abuse, it's crucial to seek professional help.

Conclusion

The Gray Rock Method can be a powerful tool for disengaging from narcissistic behavior and protecting your own well-being. By becoming emotionally unresponsive, you can starve narcissists of the attention they feed on and reclaim your happiness. Remember, you're not alone, and there are always ways to break free from the cycle of narcissistic abuse.

","https://imageio.forbes.com/specials-images/imageserve/65de70c3c94d68b2a2b9831b/0x0.jpg?format=jpg&crop=3715,1743,x0,y357,safe&height=900&width=1600&fit=bounds",2024-02-28 21:46:03
https://techcrunch.com/2024/02/28/meta-consent-or-pay-consumer-gdpr-complaints/, Meta's EU Data Grab Faces Coercion Charges ,"

Meta's ""Pay or Privacy"" Dilemma: Consumer Groups Fight Back

Last year, Meta sparked controversy by introducing a ""pay or consent"" model for European Union (EU) users. Under this model, users had to pay a monthly fee to opt out of targeted advertising or agree to be tracked for profiling purposes.

This move has drawn the ire of consumer rights groups, who argue that it violates EU data protection rules. Eight consumer groups from across Europe have filed complaints with national data protection authorities, alleging that Meta's offer is unfair and coercive.

The ""Pay-or-Consent"" Model Under Scrutiny

The consumer groups argue that Meta's model does not meet the high standards of consent required by the General Data Protection Regulation (GDPR). They contend that users are not fully informed about how their data is processed and that the fee imposed on those who do not consent is not necessary.

Specifically, the groups accuse Meta of violating the GDPR principles of:

 Purpose limitation: Processing data for purposes other than those specified
 Data minimization: Collecting more data than necessary
 Fair processing: Treating users fairly and transparently

The Stakes for Meta and EU Users

The complaints could have significant implications for Meta. Penalties for violating the GDPR can reach up to 4% of global annual turnover. More importantly, Meta could be forced to stop its tracking-based advertising business in the EU if the complaints are upheld.

For EU users, the outcome of these complaints could determine their ability to protect their privacy online. If Meta's model is found to be unlawful, it could force the company to change its business practices and give users more control over their data.

Other Challenges to Meta's Model

The consumer group complaints are not the only challenge Meta faces. The EU's Digital Services Act (DSA) and Digital Markets Act (DMA) also impose restrictions on the use of personal data for advertising purposes. These regulations require consent to be freely given and easily withdrawn.

The European Commission, which oversees enforcement of the DSA and DMA, could also take action against Meta if it finds that the ""pay or consent"" model violates these regulations. Penalties under these laws can be even higher than those under the GDPR.

Conclusion

The consumer group complaints against Meta's ""pay or consent"" model represent a significant challenge to the company's business practices. If upheld, these complaints could force Meta to reform its tracking-based advertising business and give EU users more control over their data. The outcome of these complaints will be closely watched by privacy advocates and regulators alike.

","https://techcrunch.com/wp-content/uploads/2019/05/01-Mark-Zuckerberg-F82019.jpg?resize=1200,800",2024-02-29 05:30:23
https://techcrunch.com/2024/02/28/elon-musk-ccdh-court-date/, Elon Musk vs. Anti-Hate Research Org: X's Court Appearance ,"

Elon Musk's Legal Battle Against Hate Speech Watchdogs

Elon Musk's ongoing legal battle with the Center for Countering Digital Hate (CCDH) has reached a critical juncture. The lawsuit, filed by Musk's company X, alleges that CCDH has spread false and misleading claims about the social media platform.

CCDH's Role in Monitoring Online Extremism

CCDH is a non-profit organization dedicated to combating hate speech, extremism, and misinformation on social media. Its reports have been widely cited by news outlets, including TechCrunch. After Musk's acquisition of Twitter, CCDH published findings on the platform's rise in hate speech and the potential for unbanned accounts, like neo-Nazi Andrew Anglin, to generate significant ad revenue.

Musk's Lawsuit and CCDH's Defense

X's lawsuit accuses CCDH of illegally scraping data and violating its terms of service through Brandwatch, a social media monitoring tool. However, CCDH maintains that X's lawsuit is frivolous and violates California's anti-SLAPP law, which protects against lawsuits intended to silence critics.

Musk's Personal Involvement and Accusations

Musk has been personally involved in the lawsuit, labeling CCDH an ""evil propaganda machine"" on Twitter. He has also filed similar lawsuits against other media watchdogs, such as Media Matters for America and the Anti-Defamation League.

CCDH's Legal Team and Potential Impact

CCDH's legal team includes renowned lawyer Roberta Kaplan, known for her victory against former President Donald Trump in a defamation suit. A loss for CCDH in court could have a chilling effect on researchers studying hate speech and misinformation on social media. This research has been crucial in shedding light on the negative societal impacts of social media platforms.

Conclusion

The outcome of this lawsuit has significant implications for the freedom of researchers and the transparency of social media platforms. CCDH's work is essential in holding these platforms accountable for the spread of harmful content. Musk's legal actions, on the other hand, raise concerns about the potential for wealthy individuals to silence critics and suppress research that exposes the dark side of social media.

","https://techcrunch.com/wp-content/uploads/2023/08/twitter-x-logo-musk-2.jpg?resize=1200,675",2024-02-29 01:10:38
https://www.zdnet.com/article/windows-11-pro-deal/, Windows 11 Pro Upgrade: Just $40 Limited Time Offer ,"

Unveiling the Secrets of ZDNET's Recommendations

In the vast digital landscape, finding trustworthy product recommendations can be a daunting task. Enter ZDNET, a trusted source that has spent countless hours meticulously evaluating and comparing products to guide you towards informed purchasing decisions.

The Science Behind the Recommendations

ZDNET's team of experts leaves no stone unturned in their quest for unbiased and reliable information. They meticulously gather data from reputable sources, including vendor and retailer listings, independent review sites, and customer testimonials. This comprehensive approach ensures that their recommendations are grounded in real-world experiences and expert insights.

Ensuring Editorial Independence

ZDNET's integrity is paramount. Their editorial team operates independently, free from any influence or compensation from advertisers. This unwavering commitment to objectivity guarantees that their recommendations are solely driven by the desire to provide you with the most accurate and unbiased information.

Supporting ZDNET's Mission

When you make a purchase through ZDNET's affiliate links, you not only get access to top-notch products but also support their mission of empowering you with knowledge. These commissions help sustain their tireless efforts to deliver high-quality content and maintain their editorial independence.

Your Voice Matters

ZDNET values your feedback. If you encounter any inaccuracies or misleading information in their content, don't hesitate to report it. Your input is invaluable in ensuring that ZDNET continues to provide the most reliable and up-to-date recommendations.

Conclusion

ZDNET's recommendations are a testament to their commitment to providing you with the most informed and unbiased guidance in the tech world. Their rigorous research, editorial independence, and unwavering support from their readers make them an invaluable resource for anyone seeking to make smart purchasing decisions.

",https://www.zdnet.com/a/img/resize/210bc66f7f72578d128c268bf78cbcf817209402/2023/10/03/e02665e0-f9de-434f-99f7-45a3cde856fa/windowspro-stack-social.jpg?auto=webp&fit=crop&height=675&width=1200,2024-02-28 07:21:00
https://techcrunch.com/2024/02/28/liveliness/, Liveliness: Find Workout Buddies ,"

Discover Your Active Tribe with Liveliness

Finding like-minded adventure buddies can be a challenge. Your friends might not share your passion for hiking, and meeting new people at the gym can be daunting. Enter Liveliness, a game-changer for connecting with fellow sports enthusiasts.

This free app empowers you to create a profile and connect with others who share your active pursuits. Whether you're into hiking, biking, running, or anything in between, Liveliness has got you covered.

Connect and Explore

With Liveliness, you can chat with potential hiking partners, join organized events, and discover new ways to push your limits. The app's user-friendly interface makes it easy to find and connect with people who align with your interests.

Learn and Grow

Beyond connecting you with fellow enthusiasts, Liveliness also provides a wealth of resources to help you improve your skills. From running clubs to calisthenics sessions, the app offers a curated selection of organized events tailored to specific sports. These events are often led by qualified coaches, giving you the opportunity to learn from experts and enhance your performance.

Build a Community

Liveliness is more than just an app; it's a thriving community of active individuals. Users can create plans together, share experiences, and support each other on their fitness journeys. The app fosters a sense of belonging and camaraderie, encouraging you to connect with like-minded people and build lasting relationships.

A Niche for Social Connection

In an era where mainstream social media platforms seem increasingly fragmented, niche networks like Liveliness offer a refreshing alternative. By focusing on shared interests, these platforms create welcoming and supportive spaces where people can connect authentically.

So, if you're looking to expand your social circle and find people who share your active lifestyle, give Liveliness a try. It's a vibrant community where you can connect, explore, and embark on unforgettable adventures with like-minded individuals.

","https://techcrunch.com/wp-content/uploads/2024/02/Liveliness.jpg?resize=1200,984",2024-02-28 18:13:39
https://techcrunch.com/2024/02/28/following-the-bitcoin-surge-coinbases-app-is-showing-users-a-zero-balance/, Bitcoin's Surge Crashes Coinbase ,"

Coinbase Outage: Zero Balances and Frustration

Cryptocurrency enthusiasts and Coinbase users were met with a rude awakening on Wednesday when they logged into their accounts to find their balances had mysteriously vanished. Despite assurances from Coinbase that ""Your assets are safe,"" the outage left many users anxious and frustrated.

Bitcoin's Surge and Coinbase's Strain

The outage coincided with a surge in Bitcoin's value, which recently reached $60,000, close to its all-time high. This surge has fueled renewed interest in cryptocurrency trading platforms like Coinbase, leading to a surge in traffic and demand.

High Traffic, High Anxiety

Coinbase's infrastructure, unfortunately, was not prepared for this influx of users. The app experienced technical difficulties, including zero balance displays and errors in buying and selling. Coinbase initially responded with automated troubleshooting steps, which did little to alleviate users' concerns.

Coinbase's Response and Timeline

Coinbase eventually acknowledged the issue on its status page, assuring users that their assets were safe and that the team was investigating. The company provided updates throughout the day, indicating that the outage was caused by high traffic and that it was working to resolve the issue.

User Reactions

Coinbase users took to social media to express their frustration and share screenshots of their zero balances. Some users reported that their mothers had also experienced the same issue, indicating the widespread nature of the outage.

Lessons Learned

The Coinbase outage highlights the importance of robust infrastructure for cryptocurrency trading platforms. With the increasing popularity of Bitcoin and other cryptocurrencies, it's essential for these platforms to be able to handle high traffic without compromising user experience or security.

Conclusion

While Coinbase has assured users that their assets are safe, the outage has raised concerns about the stability and reliability of cryptocurrency trading platforms. As the crypto market continues to grow, it's crucial for these platforms to invest in infrastructure and customer support that can handle the increasing demand.

","https://techcrunch.com/wp-content/uploads/2023/01/coinbase-phone.jpg?resize=1200,678",2024-02-28 18:03:58
