Link,Title,Text,Image,Date Publish
https://venturebeat.com/ai/a-year-after-ai-code-red-google-is-red-faced-amid-gemini-backlash-was-it-inevitable-the-ai-beat/,"A year after AI 'code red,' Google is red-faced amid Gemini backlash. Was it inevitable?","

In the realm of artificial intelligence, Google's Gemini AI model has sparked a whirlwind of controversy. Initially hailed as a potential rival to OpenAI's ChatGPT, Gemini's recent outputs have drawn criticism for their inaccurate and offensive nature. This backlash stands in stark contrast to the positive reception it received upon its release in December 2022.

The crux of the issue lies in the inherent tension between Google's desire for speed and its need to maintain user satisfaction. The company's eagerness to compete with ChatGPT led to the hasty release of Gemini, resulting in a barrage of inappropriate outputs that have tarnished Google's reputation.

This is not the first time Google has faced backlash for its AI endeavors. In June 2022, Google engineer Blake Lemoine made headlines by claiming that LaMDA, Google's conversational AI, had achieved sentience. This bold assertion, coupled with Lemoine's subsequent actions, further fueled the debate surrounding the ethical implications of AI.

Unlike Google, smaller AI companies like OpenAI and Anthropic have the advantage of being unburdened by the same level of scrutiny and legacy concerns. They can take bolder steps in releasing their AI models without the fear of damaging their brand reputation.

The challenges faced by Google in the realm of generative AI are compounded by the fact that it has to cater to a vast global user base and satisfy the demands of its shareholders. This balancing act makes it difficult for the company to strike the perfect balance between innovation and responsibility.

While hallucinations and errors are inevitable in the current state of AI technology, the public holds Google to a higher standard due to its dominant position in the tech industry. This expectation makes it challenging for Google to navigate the complex landscape of social, cultural, and political values.

As Google grapples with these challenges, it finds itself caught between a rock and a hard place. The company must balance its desire for progress with the need to protect its reputation and maintain user trust. The future of Google's AI endeavors hinges on its ability to find a harmonious equilibrium between these competing forces.

",https://venturebeat.com/wp-content/uploads/2024/02/Untitled-design-2024-02-26T130039.881.png?w=1200&strip=all,2024-02-26 18:07:52
https://venturebeat.com/ai/microsoft-showcase-next-generation-ai-and-computing-at-nvidia-gtc/,Microsoft showcases next-generation AI and computing at Nvidia GTC,"

Title: Unveiling the Practical Power of AI: Microsoft at NVIDIA GTC

In the realm of technology, AI has long been a captivating concept, promising transformative possibilities. Now, we're witnessing a surge of innovative and practical AI applications, revolutionizing businesses and industries worldwide. Microsoft is at the forefront of this AI revolution, empowering organizations to harness the power of AI to achieve remarkable outcomes.

At the upcoming NVIDIA GTC AI Conference, Microsoft will showcase cutting-edge AI solutions, technologies, and best practices, inspiring companies to unlock their AI potential. The conference will feature in-person and virtual sessions, live discussions, hands-on demos, and insightful panels, providing attendees with a comprehensive understanding of Microsoft's AI offerings.

Microsoft's AI focus revolves around four key areas: enriching employee experiences, reinventing customer engagement, reshaping business processes, and accelerating innovation. By leveraging Microsoft's AI expertise, organizations can transform their operations, enhance productivity, and gain a competitive edge.

At booth 1108, Microsoft will connect with AI experts, engage in live discussions, explore the latest technologies through demo pods and a hardware bar, and savor fresh coffee brewed by Artly, the AI coffee bot. For those unable to attend in person, a virtual booth will be available, offering access to the same valuable content and insights.

Microsoft's featured sessions, talks, and panels at NVIDIA GTC will delve into topics such as powering AI transformation with the Microsoft Cloud, unlocking generative AI in enterprises, and exploring the next level of generative AI with Azure OpenAI Service and Copilot. These sessions will provide attendees with practical knowledge and actionable insights to accelerate their AI journey.

In addition to the conference sessions, Microsoft is sponsoring NVIDIA Hands-on Training, offering full-day, instructor-led workshops both onsite and virtually. Participants will have the opportunity to earn an NVIDIA certificate of subject matter competency and gain hands-on experience with the latest AI technologies.

Join Microsoft at NVIDIA GTC to discover the transformative power of AI and accelerated computing. Visit the Microsoft blog for more details and register today. Unleash the potential of AI and revolutionize your business with Microsoft's innovative solutions.

",https://venturebeat.com/wp-content/uploads/2024/02/AdobeStock_735569484.jpeg?w=1200&strip=all,2024-02-26 15:30:00
