Link,Title,Text,Image,Date Publish
https://www.forbes.com/sites/robertdefrancesco/2024/02/28/servicenow-stock-slips-from-record-high-despite-recent-growth-acceleration/, ServiceNow Stock Dips After Growth Surge ,"

ServiceNow: Riding the AI Wave to Transform Businesses

ServiceNow, a leading provider of workflow solutions, has been making waves in the tech industry with its impressive financial performance and innovative AI-powered offerings.

Q4 Earnings Showcase Strong Growth

In its recent Q4 earnings report, ServiceNow delivered a stellar performance. Total revenue surged by 26%, outpacing the previous quarter's growth. The company also saw a 29% increase in its total RPO (Remaining Performance Obligation), indicating a strong pipeline of future revenue.

Diversified Portfolio and AI Leadership

ServiceNow's success stems from its diversified portfolio of workflow solutions. These solutions help organizations automate tasks, improve efficiency, and reduce costs. The company's recent Vancouver platform update introduced Now Assist, a generative AI-powered tool that enhances service management, HR, customer service, and creator workflows.

AI Tailwinds Fuel Growth

The rise of AI is creating a massive opportunity for ServiceNow. Gartner predicts that spending on AI will reach $3 trillion by 2027. ServiceNow is well-positioned to capitalize on this tailwind, as its AI-powered solutions are in high demand.

Large Customer Base and New Logo Growth

ServiceNow continues to attract large customers, with over 8,100 in its base. In Q4, the company signed a record number of new large logos, including a $10 million deal with a global financial services firm. This growth is a testament to the value that ServiceNow's solutions provide.

AI-Powered Products Drive Innovation

ServiceNow's AI-powered products are driving growth across its portfolio. The Pro Plus SKU, which includes Now Assist, has shown strong net new ACV contribution. AI is also catalyzing growth in HR and customer service workflows.

CEO Outlook: Generative AI Revolution

CEO Bill McDermott believes that generative AI is revolutionizing business. He has met with numerous CEOs who are eager to embrace this technology. McDermott sees a ""real appetite to invest in generative AI"" due to its potential to significantly improve productivity.

Wall Street Bullish on ServiceNow

Following the Q4 report, Wall Street analysts have raised their price targets for ServiceNow. Many now predict that the stock could reach $840 to $875, with some even setting targets as high as $910. This bullish sentiment reflects the company's strong fundamentals and its leadership in AI-powered solutions.

Conclusion

ServiceNow is poised to continue its growth trajectory in the coming years. Its diversified portfolio, AI leadership, and large customer base provide a solid foundation for success. As AI becomes increasingly prevalent in business, ServiceNow is well-positioned to ride this wave of innovation and transform the way organizations operate.

",https://imageio.forbes.com/specials-images/imageserve/65dfcba1cbd3f75be32918e5/0x0.jpg?format=jpg&height=900&width=1600&fit=bounds,2024-02-28 19:58:15
https://techcrunch.com/2024/02/28/gemini-on-android-cant-id-songs-and-its-frustrating/, Gemini on Android: No Song ID Feature ,"

Google's Gemini: A Botched Launch with a Shocking Misstep

Google's recent launch of its Gemini chatbot has been met with a barrage of criticism, and for good reason. The chatbot's image generator has been found to produce disturbing images, including people of color in Nazi-era uniforms.

But beyond these alarming cultural insensitivities, Gemini has also exhibited a glaring technical flaw that has left many users frustrated: its inability to recognize songs on Android devices.

Song Recognition: A Frustrating Omission

As a user of the minimalist Niagara Launcher, I heavily relied on Google Assistant's song recognition feature to quickly identify tracks I encountered in various settings. The feature's convenience and accuracy made it an indispensable tool.

However, with Gemini replacing Google Assistant on Android, this functionality has vanished. Instead of providing song recognition, Gemini suggests using third-party apps like Shazam or switching back to Google Assistant.

A Disappointing Substitute

This omission is particularly disheartening considering that I pay for the Google One AI Premium Plan, which promises a more advanced Gemini experience. While Gemini may offer other benefits that I have yet to discover, its lack of basic features, including song recognition and music playback, makes it a poor substitute for Google Assistant.

A Call for Improvement

I have contacted Google regarding this issue and will update this post if I receive a response. It is clear that Gemini needs significant improvements to address its cultural insensitivities and technical shortcomings. Until then, users will have to find alternative methods for song recognition and other tasks that were once effortlessly handled by Google Assistant.

The Importance of Thorough Testing

The problems with Gemini highlight the importance of thorough testing before releasing new products. Rushing a product to market can lead to embarrassing blunders and user dissatisfaction. Google should have taken the time to ensure that Gemini was free of offensive content and that its core features were fully functional.

Conclusion

Google's Gemini chatbot has been a disappointment, marred by both ethical and technical issues. Its inability to recognize songs on Android devices is a major inconvenience for users who rely on this feature. While Google has promised to address these problems, it remains to be seen whether Gemini will ever live up to its potential.

","https://techcrunch.com/wp-content/uploads/2023/12/google-bard-gemini-v1.jpg?resize=1200,675",2024-02-28 23:12:47
https://venturebeat.com/ai/enterprise-large-language-models-small-and-nimble-is-smart/, LLMs: Nimble and Smart for Enterprise ,"

The Future of AI: Small, Specialized Models Dominate the Enterprise

Introduction

Generative AI, powered by large language models (LLMs), has taken the world by storm. These AI giants have demonstrated remarkable natural language capabilities, bringing AI to the forefront of public consciousness. However, the future of AI lies not in these massive models but in the proliferation of smaller, specialized LLMs tailored to specific domains.

The Rise of Domain-Specific LLMs

While large LLMs excel at general queries and versatile AI platforms, they lack the precision and customization required for complex business applications. For organizations to truly leverage AI's potential, they need models trained on their own private data, addressing specific business challenges.

Fortunately, open-source, small LLMs are emerging, offering high accuracy with a fraction of the size and cost of large models. These nimble models can be fine-tuned with domain-specific data, resulting in expert models that enhance products, improve customer engagement, and optimize cost structures.

Advantages of Small LLMs

 Improved accuracy: Tailored to specific domains, small LLMs provide more precise results, reducing errors and bias.
 Data privacy and security: Private data remains within the organization, protecting sensitive information and ensuring compliance.
 Explainability: Results can be traced back to the source data, facilitating decision-making and ongoing monitoring.
 Cost-effectiveness: Fine-tuning and deploying small LLMs is significantly more economical than using large models.
 Proximity: Co-locating models with applications ensures natural response times.
 Integration: LLMs can be seamlessly integrated into existing business logic and IT systems.

Why Enterprises Will Manage Their Own LLMs

 Data privacy: Protect sensitive information and comply with regulations.
 Accuracy: Ensure reliability for mission-critical applications and protect reputation.
 Explainability: Trace results back to data sources for informed decision-making.
 Cost: Reduce expenses by self-operating persistent models on existing IT infrastructure.
 Proximity: Co-locate models with applications for optimal response times.
 Integration: Deploy models within existing business processes and IT systems.

Understanding Your Requirements and Model Options

AI is not about isolated applications but an integrated function within every business application. Organizations must understand their data, use case requirements, and available AI models. While some enterprises may opt to build their own large LLMs, most will benefit from nimble, open-source models for specific tasks.

Intel's End-to-End AI Platform

Intel offers a comprehensive AI platform that includes the Intel速 Gaudi速 accelerator for cost-effective performance and the 5th Gen Intel速 Xeon速 CPU for smaller LLMs and AI data pipelines. This platform provides automated model optimization, software tools, and validated production AI models.

Embarking on Your Generative AI Journey

The journey to generative AI begins with identifying business use cases. Developers can start with open-source LLMs, specific models, and Intel's AI platform for maximum performance and ease of use.

",https://venturebeat.com/wp-content/uploads/2024/02/AdobeStock_690904630.jpeg?w=1200&strip=all,2024-02-28 20:32:45
https://techcrunch.com/2024/02/28/mwc-2024-everything-you-need-to-know/," MWC 2024: Announcements, Nothing Phone (2a), 4FYN Winner ","

Mobile World Congress 2024: A Glimpse into the Future of Tech

Greetings from Barcelona, where the Mobile World Congress 2024 is in full swing! Get ready for a whirlwind tour of the latest and greatest in the world of technology, brought to you by the TechCrunch team.

Day 1: A Feast of Innovation

- Liveliness: Connecting fitness enthusiasts for workouts and events.
- Sweanty: A wearable patch that tracks sweat loss for personalized hydration plans.
- Qilimanjaro: A quantum computing company awarded for its groundbreaking work.
- Kombucha Threads: Biodegradable filaments made from the fermented beverage.

Day 2: Enterprise and Beyond

- HTC Vive: Embracing mixed reality for enterprise solutions.
- eQub: Digitizing peer-to-peer lending in Africa.
- SynFlora: Revolutionizing acne treatment with biotechnology.
- Lizcore: Indoor climbing gets a tech upgrade with progress tracking.
- Jolla: A personal cloud and AI router for privacy-conscious data storage.
- Displace: Wireless TVs that stick to walls, with AI-powered features.
- Motorola: A rollable concept phone that wraps around your wrist.

Day 3: Smart Devices and AI

- Doublepoint: Gesture-touch control for Android smartwatches.
- Microsoft: Unveiling AI Access Principles for responsible data center operation.
- Xiaomi: First electric car, the SU7, with advanced technologies.
- Samsung: Galaxy Ring for sleep tracking and health monitoring.
- OnePlus: Extended battery life for the Watch 2, promising 100 hours of usage.
- Xiaomi: CyberDog, a robotic dog with improved features and a realistic head.
- Lenovo: Transparent laptop concept that offers a unique visual experience.
- Google: AI-powered features for phones, cars, and wearables, including text generation and image analysis.

Day 4: Health and Wellness

- Seaborough: Desktop lamps that mimic sunlight to improve mood.
- Infinix: E-Color Shift, an innovative e-ink display that adds color to the back of smartphones.

Conclusion

Mobile World Congress 2024 has been a showcase of the relentless pace of technological innovation. From AI-powered devices to wearable health trackers and futuristic concepts, the future of tech is shaping up to be both exciting and transformative. Stay tuned as the TechCrunch team continues to bring you the latest from the event, ensuring you don't miss a beat of the digital revolution.

","https://techcrunch.com/wp-content/uploads/2024/02/mwc-2024-splash.jpg?resize=1200,675",2024-02-28 18:19:10
https://techcrunch.com/2024/02/28/the-apple-car-that-never-was-a-timeline/, The Apple Car: Timeline of an Unreleased Project ,"

Apple's Elusive Car Project: A Decade of Speculation and Pivots

In the realm of tech giants, Apple's secretive car project has been a captivating enigma for over a decade. The project, known as Project Titan, has been a rollercoaster ride of ambitious goals, pivoting strategies, and elusive details.

The Genesis: Electric Dreams and Tesla Crossings

Apple's interest in the automotive industry began in 2013, when they reportedly met with Tesla's Elon Musk. Around the same time, Tesla poached Apple's Doug Field, a key figure in hardware design.

Project Titan: A Shrouded Beginning

In 2014, Apple officially launched Project Titan, hiring talent from automakers like Ford and Mercedes-Benz. Led by Steve Zadesky, the team operated off-site, fueling speculation about Apple's automotive ambitions.

The Media Frenzy: Rumors and Glimmers

In 2015, Project Titan became public knowledge. Reports emerged of Apple working on an electric vehicle and exploring self-driving technology. The hunt for more information intensified, with Apple hiring designer Marc Newson, who had previously created a concept car for Ford.

The Pivots: Electric, Autonomous, or Both?

Apple's automotive vision remained elusive. The company vacillated between chasing an electric vehicle, a self-driving car, or a combination of both. This indecision plagued the project, leading to setbacks and team changes.

The Rise and Fall of Momentum

In 2016, Jony Ive expressed dissatisfaction with the progress, and hiring slowed. Zadesky left the project, and the team faced challenges in defining clear goals. Despite a target ship date of 2019, momentum began to falter.

The Self-Driving Focus: A New Direction

In 2017, Apple shifted its focus to developing an autonomous driving system. They received a permit to test self-driving technology, and Tim Cook confirmed the automotive project, emphasizing the importance of autonomy.

The Resurgence: Doug Field's Return and Tesla's Shadow

In 2018, Apple re-hired Doug Field from Tesla, sparking speculation about a renewed push for an Apple-built car. Musk revealed that he had attempted to sell Tesla to Apple during its financial struggles.

The Cuts and Restructuring: A Scaling Back

2019 brought another round of cuts and restructuring, with over 200 workers laid off. Apple acquired Drive.ai, a self-driving startup, but scaled back its test fleet.

The Pandemic Pause and Renewed Ambitions

The COVID-19 pandemic slowed down Project Titan's progress, but Apple resumed discussions with EV startup Canoo in 2020. They also hired Tesla's VP of engineering to bolster the team.

The Electric-Autonomous Convergence: A Breakthrough Battery

In 2021, Apple reportedly planned to build an electric vehicle with ""breakthrough battery technology"" that would also be autonomous. The team aimed to produce this new model by 2024.

The Partnership Dance: Hyundai, Kia, and Beyond

Apple engaged in talks with Hyundai and Kia about manufacturing the Apple Car. However, the partnership negotiations ultimately fell through, and Apple decided to go it alone.

The Full Self-Driving Pivot: A Bold Ambition

In 2021, Apple reportedly refocused the project on ""full self-driving capabilities."" They aimed to create a car that could drive itself completely, without a steering wheel or pedals, by 2025.

The Scaling Back: A More Realistic Approach

In 2022, Apple realized the challenges of a fully autonomous vehicle and scaled back its ambitions. They pivoted to a car that would only be autonomous on highways, with a target date of 2026.

The End of an Era: Project Titan Killed

Despite years of effort and billions invested, Apple announced the end of Project Titan in 2023. The project had faced numerous challenges, from technical difficulties to strategic shifts.

Lessons Learned: The Path Not Taken

Apple's Project Titan serves as a reminder that even the most ambitious projects can face setbacks and pivots. It highlights the challenges of entering new industries, the need for clear goals, and the importance of adapting to changing circumstances.

","https://techcrunch.com/wp-content/uploads/2024/02/apple-ghost-logo.jpg?resize=1200,675",2024-02-28 22:08:46
https://techcrunch.com/2024/02/28/substack-gets-more-social-with-the-launch-of-dms/, Substack's Social Expansion: Introducing Direct Messaging ,"

Substack's Social Media Metamorphosis: Embracing Direct Messaging

Substack, the popular newsletter platform, has taken a significant step towards becoming a full-fledged social network with the introduction of direct messaging (DMs). This new feature allows users to engage in private one-on-one conversations within the Substack app and website.

A Shift Towards Social Connectivity

Substack's transformation into a social hub has been gradual but steady. Last year, the platform launched Notes, a Twitter-like feature that enabled users to follow each other and share short updates. Now, with the addition of DMs, Substack has further blurred the lines between a newsletter platform and a social media platform.

Meeting User Demand

Substack's decision to introduce DMs was driven by popular demand. Many users had expressed a desire for a private communication channel within the platform. Substack believes that DMs will enhance the connections between writers and readers, fostering a sense of community.

Customizable Privacy Settings

To ensure user privacy, Substack has implemented customizable privacy settings. By default, users will only receive DMs from people they are connected to. Other messages will be sent to a Requests folder, where users can choose to accept or reject them. For those who prefer to limit direct contact, the option to disable DMs is available in the settings.

Encouraging Reader Engagement

Writers can leverage DMs to build stronger relationships with their subscribers. By adding a ""Send a message"" button to new posts, writers can encourage readers to share news tips, ask questions, or provide feedback. This direct line of communication can foster a sense of involvement and loyalty among readers.

A Controversial Journey

Substack's recent introduction of DMs comes amidst a controversial period for the platform. The company's decision not to ban Nazi newsletters sparked a backlash, leading to the departure of several prominent writers. Despite the criticism, Substack remains committed to its decentralized approach to content moderation.

Conclusion

Substack's embrace of direct messaging is a testament to its ongoing evolution as a platform. As it continues to expand its social media features, Substack is positioning itself as a hub for both content creation and community engagement. Whether this transformation will be embraced by all users remains to be seen, but it is clear that Substack is determined to reshape the landscape of online publishing and connection.

","https://techcrunch.com/wp-content/uploads/2024/02/substack-dms.jpg?resize=1200,871",2024-02-28 18:01:00
https://techcrunch.com/2024/02/28/snowflake-ceo-frank-slootman-stepping-down-and-wall-st-hates-it/," Snowflake CEO Frank Slootman Resigns, Wall Street Reacts Negatively ","

Snowflake's CEO Shakeup: A Tale of Surprises and Stock Plunge

In a surprising turn of events, Snowflake's CEO, Frank Slootman, has announced his departure, sending shockwaves through the tech world. Investors reacted swiftly, with the company's stock price plummeting over 20% in after-hours trading.

Slootman, a seasoned tech executive, has been at the helm of Snowflake since 2019, guiding the company through its successful IPO. He will now step back into the role of Chairman of the Board, while Sridhar Ramaswamy, formerly of Google Ads, will take over as CEO.

While the executive shuffle dominated the headlines, Snowflake's earnings report was overshadowed. The company reported a solid 33% year-over-year revenue growth to $738 million, with guidance for the next quarter projecting a respectable 26-27% growth.

Slootman's tenure at Snowflake was marked by his outspoken personality and generous compensation. His base salary of $375,000 was complemented by a lucrative stock option package, reportedly earning him a staggering $95 million monthly at one point.

Despite his financial success, Slootman courted controversy in 2021 with comments suggesting that diversity should not take precedence over merit. He later retracted these remarks after facing backlash from the tech community.

Prior to joining Snowflake, Slootman had a successful stint as Chairman and CEO of ServiceNow. With his substantial wealth, it remains to be seen whether he will retire or pursue other ventures.

As the dust settles on this executive shakeup, investors will be closely monitoring Snowflake's performance under its new leadership. The company's strong growth trajectory and Ramaswamy's experience in AI technology suggest a bright future, but only time will tell if the stock price will recover from this sudden drop.

","https://techcrunch.com/wp-content/uploads/2020/08/GettyImages-655141262.jpg?resize=1200,800",2024-02-28 22:05:49
https://techcrunch.com/2024/02/28/leaked-documents-techstars-lost-7-million-2023-layoffs-enough-cash/, Leaked Documents Reveal Techstars' $7M Loss and Ample Cash ,"

Techstars: Financial Woes and Strategic Overhaul

Techstars, a renowned accelerator for startups, has faced financial challenges in 2023, leading to significant cuts in its programs and staff. Internal documents obtained by TechCrunch shed light on the company's financial performance and the reasons behind its recent restructuring.

Missed Revenue Targets and Rising Costs

The documents reveal that Techstars missed its revenue goals for 2023, falling short by a substantial $15 million. This shortfall, coupled with higher-than-anticipated costs, resulted in a significant loss of $7.2 million in adjusted earnings before interest, taxes, and amortization (EBITA).

Accelerator Expansion and Expenses

Despite the financial headwinds, Techstars expanded its accelerator programs in 2023, operating an average of 54 active programs. However, these programs failed to generate sufficient revenue to offset the company's expenses.

Program expenses amounted to $34.3 million, while operating expenses reached $53.5 million. The company had initially budgeted for higher expenses, but cost-cutting measures, including the closure of accelerators in Boulder, Seattle, and Austin, helped reduce spending.

Cash Cushion and Future Prospects

Despite the financial challenges, Techstars maintained a healthy cash balance of $48.7 million at the end of 2023. This provides a buffer for the company as it implements its restructuring plan, dubbed ""Techstars 2.0.""

However, sources have expressed concerns that the company's cash reserves may not be sufficient to sustain its operations beyond 2024. Techstars' parent company, however, is well-capitalized, suggesting that additional funding may be available if needed.

Strategic Realignment

Techstars' restructuring aims to reduce costs and improve efficiency. The company has laid off 7% of its staff and is exploring further program closures. These measures are designed to align the company's operations with its revenue streams.

The company's long-term strategic choices, such as which programs to discontinue, remain under scrutiny. However, the financial data suggests that Techstars' decision to retrench and rebuild was a necessary step to ensure its financial stability.

Conclusion

The financial challenges faced by Techstars in 2023 underscore the impact of economic headwinds on the startup ecosystem. The company's response, including cost-cutting measures and strategic realignment, demonstrates its commitment to adapting to the evolving landscape. While the future holds uncertainties, Techstars' strong cash position and the support of its parent company provide a foundation for its continued operations and potential recovery.

","https://techcrunch.com/wp-content/uploads/2022/07/5D509C82-2FDC-4634-8302-63910ED421E9.jpeg?resize=1200,800",2024-02-28 21:05:06
