Link,post_title,title,post_content,featured_image,Date-Publish,meta_desc,focuskeywords,post_category,Post_tag
https://techxplore.com/news/2024-03-simultaneous-energy-algorithm-6g-vision.html,Simultaneous performance improvement and energy savings with an innovative algorithm for 6G vision services, Revolutionize 6G Vision Services with Integrated Learning & Optimization ,"Title: Revolutionizing 6G Vision Services: A New Integrated Learning and Optimization Approach

In a world increasingly reliant on cutting-edge communication technologies, Professor Jeongho Kwak from the Department of Electrical Engineering and Computer Science at DGIST has taken a significant step towards enhancing 6G mobile vision services (1). His novel learning model and resource optimization technology promise to transform how we approach these advanced capabilities.

Mobile vision services encompass groundbreaking innovations like augmented reality (AR) and self-driving cars. Rapid video and image capture, along with deep learning-driven content analysis, characterize these services. However, delivering top-notch results necessitates powerful GPUs and precise learning models—a challenge previous technologies failed to tackle effectively. Often treating learning models and computing/networking resources separately led to suboptimal performance and poor resource allocation on mobile devices.

Enter Professor Kwak's game-changing solution: VisionScaling, an integrated learning model and computing/networking optimization algorithm designed specifically for 6G vision services. By merging learning models and resources, this pioneering method reduces energy consumption by at least 30%, all while preserving comparable accuracy to existing approaches (2). Moreover, there's no sacrifice when it comes to average target accuracy or time delays.

Adaptable and versatile, VisionScaling adjusts to ever-evolving mobile settings thanks to its implementation of Online Convex Optimization (OCO)—one of today's most sophisticated learning techniques. With OCO, the system maintains peak functionality regardless of whether future conditions are known beforehand. In essence, VisionScaling guarantees superb performance in fluctuating, uncertain environments.

But does theory meet practice? Absolutely! Testing the algorithm in real-world scenarios yielded impressive outcomes. Embedded AI devices and linked edge computing systems allowed researchers to confirm a substantial 30% reduction in energy usage and improvements of up to 39% in end-to-end latency relative to earlier algorithms (3).

Reflecting on his achievement, Professor Kwak noted, ""This study offers twofold contributions – first, demonstrating effectiveness in challenging, real-life contexts; second, employing dynamic optimization and learning methods to substantiate exceptional performance. This innovation establishes a solid basis for data-intensive mobile applications demanding increased memory and processing capacity"" (1).

Indeed, publishing the findings in the esteemed IEEE Internet of Things Journal underscores the significance of this breakthrough (4). Expect further developments building upon this remarkable foundation, reshaping our interaction with next-gen mobile services.

1 DGIST (Daegu Gyeongbuk Institute of Science and Technology). (n.d.). Research reveals key advancements toward 6G vision services | DGIST News. Retrieved March 8, 2023, from <https://www.dgist.ac.kr/eng/sub04_01_02_01.jsp?mode=view&articleNo=1886&categoryId=87>
2 Choi, P., Kim, S., Lee, J., & Kwak, J. (2024). VisionScaling: Dynamic Deep Learning Model and Resource Scaling in Mobile Vision Applications. IEEE Internet of Things Journal, 11(10), 8212–8222. https://doi.org/10.1109/jiot.2024.3349512
3 Ibid.
4 Ibid.",https://scx2.b-cdn.net/gfx/news/hires/2024/wireless-tower.jpg,2024-03-30 13:40:01,"Title: Revolutionizing 6G Vision Services: A New Integrated Learning and Optimization Approach

Meta Description: Discover how Professor Jeongho Kwak's innovative ""VisionScaling"" technology is revolutionizing 6G vision services, delivering superior performance with at least 30% less energy consumption. Try it now!","Keyphrase: ""Resource Scaling for Mobile Vision""",Technology,"Formicoders,News,AI,Technology,Innovation,Programmering,Coding,Wordpress,Python"
https://techxplore.com/news/2024-03-gmail-revolutionized-email-years-people.html,Gmail revolutionized email 20 years ago. People thought it was Google's April Fool's Day joke,Title: The Unbelievable Beginnings of Gmail - How Google's Email Service Revolutionized Communication,"Title: The Unbelievable Beginnings of Gmail

Introduction:

Google's Gmail has been one of the most successful email services in the world. It's hard to imagine life without Gmail, but did you know that it started as an April Fool's prank? In this article, we'll explore the unbelievable beginnings of Gmail and how it has evolved into the powerful email service it is today.

Body:

Google co-founders Larry Page and Sergey Brin loved to pull pranks, and their April Fool's Day pranks became legendary. One year, they posted a job opening for a Copernicus research center on the moon. Another year, they said they planned to roll out a ""scratch and sniff"" feature on their search engine. However, their biggest prank of all was the launch of Gmail.

On April 1, 2004, Gmail was unveiled to the world. At the time, it offered 1 gigabyte of storage per account, which seemed like an impossibly large amount of email capacity. In comparison, the leading webmail services of the time, Yahoo and Microsoft, offered only 30 to 60 emails of storage. Gmail's 1 gigabyte of storage was 250 to 500 times more than what was available in other webmail services.

Besides its massive storage capacity, Gmail also came with Google's search technology, allowing users to quickly find a tidbit from an old email, photo, or other personal information stored on the service. It also automatically threaded together a string of communications about the same topic, making everything flow together as if it was a single conversation.

Former Google executive Marissa Mayer, who helped design Gmail and other company products, described the original pitch they put together as all about the three ""S's"" - storage, search, and speed. This mind-bending concept made people question what was possible within a web browser.

It took three years to build Gmail as part of a project called ""Caribou."" The name Caribou was a reference to a running gag in the Dilbert comic strip, and it made everyone laugh. In fact, after The Associated Press published a story about Gmail late on the afternoon of April Fool's 2004, readers began calling and emailing to inform the news agency that it had been duped by Google's pranksters.

However, Google wasn't joking about Gmail. An AP reporter was abruptly asked to come down from San Francisco to Google's Mountain View, California, headquarters to see something that would make the trip worthwhile. After arriving at a still-developing corporate campus that would soon become known as the ""Googleplex,"" the AP reporter was ushered into a small office where Page was wearing an impish grin while sitting in front of his laptop computer.

Page, then just 31 years old, proceeded to show off Gmail's sleekly designed inbox and demonstrated how quickly it operated within Microsoft's now-retired Explorer web browser. He pointed out that there was no delete button featured in the main control window because it wouldn't be necessary, given Gmail's vast storage and the ease with which it could be searched.

Today, Gmail has an estimated 1.8 billion active accounts, each offering 15 gigabytes of free storage bundled with Google Photos and Google Drive. Despite this, many users still hoard their email, photos, and other content, which is why companies like Google, Apple, and others now make money from selling additional storage capacity in their data centers.

Conclusion:

The unbelievable beginnings of Gmail are a testament to Google's innovative spirit and its ability to think outside the box. From its initial prank to its current dominance in the email market, Gmail has revolutionized the way we communicate and store our data.",https://scx2.b-cdn.net/gfx/news/hires/2024/gmail-revolutionized-e.jpg,2024-03-31 06:31:14,"Gmail started as an April Fool's prank that offered 1GB of free storage, revolutionizing the email industry. Learn more about its history and evolution in this article.",Keyphrase: Gmail's 1GB storage,Technology,"Formicoders,News,AI,Technology,Innovation,Programmering,Coding,Wordpress,Python"
https://venturebeat.com/ai/the-risks-and-rewards-of-generative-ai-in-software-development/,The risks and rewards of generative AI in software development," Revolutionizing Security Workforce with AI: Benefits and Challenges
","AI Transformation in the Security Workforce: A Vision for the Future

The world of security workforce is rapidly evolving, and AI is poised to play a significant role in shaping its future. In this blog post, we will explore the potential benefits and challenges of using AI in the security workforce, and what it means for the industry as a whole.

Benefits of AI in the Security Workforce

AI has the potential to revolutionize the way security teams operate. One of the most significant benefits is the end of grunt work for developers. With AI-powered language models, developers can describe a desired outcome and get perfectly formatted code in response. These models can also check existing code to identify typos, punctuation mistakes, and other errors that drive developers crazy.

Another advantage of AI in the security workforce is the ability to create more efficient and streamlined frameworks. Software frameworks like Spring, Express.js, and Django have already revolutionized the industry by providing developers with consistent guidelines and prewritten code for common functions. With AI, these frameworks can be further enhanced by creating boilerplate code, automating repetitive tasks, and suggesting code optimizations.

AI can also help customize framework components to a specific project. This level of customization can lead to more effective and efficient development, ultimately improving the overall security of the organization.

Challenges of AI in the Security Workforce

While AI holds many potential benefits, it also presents some challenges for the security workforce. One of the most significant challenges is the risk of over-testing. Because AI-powered bots can create as many test scripts as needed, there is a risk that organizations could end up with too many tests, which can slow down projects and create bottlenecks.

Another challenge of AI in the security workforce is the potential for skills degradation. While AI can automate many tasks, it doesn't replace the importance of human expertise and creativity. As AI becomes more prevalent in the industry, developers may become lazy and rely too heavily on AI-generated code, resulting in bloated, inefficient, and poorly performing code.

Finally, the security workforce must be aware of the trust deficit that can arise from using AI. AI-generated code is only as good as the quality of the data used to train the model. Poor quality data, training shortcuts, and l",https://venturebeat.com/wp-content/uploads/2024/03/rays-of-code-like-the-rays-of-the-sun-tlj00jOCQASpmpShHxPbkA-fqYKCDpMQ8a7wneyM-sPbA-transformed.jpeg?w=1200&strip=all,2024-03-31 19:05:00,"AI Transformation in the Security Workforce: A Vision for the Future

Discover the potential benefits and challenges of using AI in the security workforce, and how it will shape the future of the industry. Our latest blog post explores the benefits of AI-powered language models, efficient frameworks, and customized components, as well as the challenges of over-testing, skills degradation, and trust deficit. Read on to learn more!",AI-Transformed Developers: Harnessing the Power of Generative AI,Technology,"Formicoders,News,AI,Technology,Innovation,Programmering,Coding,Wordpress,Python"
https://www.zdnet.com/article/buy-a-windows-11-pro-license-for-just-25-right-now-last-chance/,Buy a Windows 11 Pro license for just $25 right now: Last chance,"""Trust ZDNET for unbiased product recommendations""","

Are you tired of sifting through endless product recommendations on the internet? Look no further than ZDNET, where we take the time to thoroughly test, research, and compare products before making our recommendations. Our team of experts gathers data from reliable sources like vendor and retailer listings, independent reviews sites, and customer reviews to provide you with the most accurate and insightful information possible.

But what sets ZDNET apart from other review sites is our commitment to editorial integrity. We follow strict guidelines to ensure that our content is never influenced by advertisers, and we take pride in delivering unbiased and knowledgeable advice to our readers. Plus, when you click through from our site to a retailer and make a purchase, we may earn affiliate commissions, but this does not affect the price you pay or our editorial independence.

So why trust ZDNET's recommendations? Because our goal is to help you make smarter buying decisions on tech gear and a wide array of products and services. Our editors review and fact-check every article to ensure the highest standards of accuracy and quality, and we are always willing to correct or clarify any mistakes that we may make. If you see any inaccuracies in our content, simply report the mistake via our feedback form.

In conclusion, ZDNET's recommendations are based on rigorous testing, research, and comparison shopping. Our editorial team is committed to delivering accurate and insightful information to our readers, and we take pride in our unbiased and knowledgeable advice. So the next time you're in the market for a new product, trust ZDNET to help you make the right choice.

",https://www.zdnet.com/a/img/resize/210bc66f7f72578d128c268bf78cbcf817209402/2023/10/03/e02665e0-f9de-434f-99f7-45a3cde856fa/windowspro-stack-social.jpg?auto=webp&fit=crop&height=675&width=1200,2024-03-31 06:00:00,"

Are you tired of sifting through endless product recommendations on the internet? Trust ZDNET's expert recommendations, based on rigorous testing, research, and comparison shopping. Our team of experts delivers unbiased and knowledgeable advice, while adhering to strict guidelines for editorial integrity. So the next time you're in the market for a new product, trust ZDNET to help you make the right choice. Click now to start shopping smarter.

","The focus keyphrase for this news article is ""editorial integrity."" It is a 2-word phrase that is relevant to the main topic of the article, which is the importance of ZDNET's commitment to providing unbiased and accurate information to its readers. The keyphrase is also placed towards the middle of the title and appears several times throughout the body of the article.",Technology,"Formicoders,News,AI,Technology,Innovation,Programmering,Coding,Wordpress,Python"
https://www.engadget.com/microsoft-copilot-has-reportedly-been-blocked-on-all-congress-owned-devices-034946166.html,Microsoft Copilot has reportedly been blocked on all Congress-owned devices, Microsoft Copilot Blocked on All Congress-Owned Devices ,"The US Congress has recently prohibited the use of Microsoft's Copilot on government-issued devices. This decision was made by House Chief Administrative Officer Catherine Szpindor, who deemed the AI chatbot to be a security risk. The Office of Cybersecurity has expressed concern that Copilot could leak House data to non-House approved cloud services. While there is no ban on the use of Copilot on personal devices, it has been prohibited on all Windows devices owned by Congress.

This move comes almost a year after the Congress banned staffers from using ChatGPT's free version on House computers. However, they were allowed to continue using the paid version for research and evaluation due to its tighter privacy controls. The White House also recently revealed rules federal agencies have to follow when using generative AI, which would ensure that any tool they use does not endanger the rights and safety of Americans.

Microsoft has recognized the need for higher security requirements in government use and has announced a roadmap of tools and services meant for this purpose. The company has also launched an Azure OpenAI service for classified workloads and a new version of Microsoft 365's Copilot assistant. All these tools and services will feature higher levels of security to make them suitable for handling sensitive data.

Szpindor's office will evaluate the Copilot version for government use when it becomes available before deciding if it can be used on House devices. While this decision may be controversial, it is necessary to ensure the security of sensitive government data.",https://s.yimg.com/ny/api/res/1.2/wDCn8FUMHSGZ9JddUvosHA--/YXBwaWQ9aGlnaGxhbmRlcjt3PTEyMDA7aD03ODI-/https://s.yimg.com/os/creatr-uploaded-images/2024-03/f171ef30-ee34-11ee-bf2d-509460709f05,2024-03-30 03:49:46,"Optimized Meta Description:

Microsoft Copilot banned on government-issued devices, due to security concerns. This decision was made by House Chief Administrative Officer Catherine Szpindor, who deemed the AI chatbot a potential security risk. Copilot was prohibited on all Windows devices owned by Congress, even though there is no ban on personal devices. The Office of Cybersecurity expressed concern that Copilot could leak House data to non-House approved cloud services. The White House has also revealed rules for federal agencies using generative AI to ensure safety. Microsoft has responded with a roadmap of tools and services for government use, including a new version of Copilot for classified workloads. Szpindor's office will evaluate Copilot for government use before deciding if it can be used on House devices.", Microsoft Copilot ,Technology,"Formicoders,News,AI,Technology,Innovation,Programmering,Coding,Wordpress,Python"
