Link,Title,Text,Image,Date Publish
https://techcrunch.com/2024/02/27/subsets-uses-explainable-ai-to-help-subscription-media-companies-reduce-customer-churn/,Subsets helps subscription businesses reduce churn with 'retention experiments' and explainable AI,"

In the realm of business, recurring revenue reigns supreme. It's the holy grail that companies strive for, the steady stream of income that fuels growth and stability. This is why tech giants like Apple have shifted their focus towards becoming service providers, with a significant portion of their revenue now generated from subscription-based services like Apple TV+, Apple Music, and iCloud.

The allure of recurring revenue is undeniable, but it comes with its own set of challenges. Acquiring new customers has become increasingly expensive, and companies must constantly work to retain their existing subscriber base. Reducing churn, the rate at which customers cancel their subscriptions, is the key to long-term success.

Enter Subsets, a Danish startup that aims to help companies bridge the retention gap in the subscription industry. Founded in 2022, Subsets leverages the power of AI to identify subscribers who are at risk of churning and provides tailored experiments to entice them to stay.

Subsets' secret weapon is explainable AI, a type of AI that can explain its decisions and insights in a way that humans can understand. This is crucial for building trust and ensuring that companies can make informed decisions about their retention strategies.

Since its launch, Subsets has gained traction with notable customers such as the New York Times-owned Athletic and Danish newspaper Børsen. Now, the company has secured $1.65 million in pre-seed funding, led by Nordic early-stage VC Upfin and Y Combinator (YC), to fuel its growth and expand its reach.

Subsets is currently focused on the digital media vertical, helping publishers, streaming platforms, subscription apps, and telecoms retain their subscribers. The company plans to expand into other industries in the future, such as mobility, banking, food delivery, and even offline subscription categories.

To harness the power of Subsets, companies simply connect their internal systems, such as CRM, CMS, billing, and data warehouse, to the platform. Subsets then analyzes subscriber data points, including demographics, content consumption patterns, and interactions with the product, to identify churn risks.

Through an intuitive web app, commercial teams can delve into churn audiences and understand their behavior. Subsets allows non-technical teams to run retention experiments on subsets of their subscriber base to determine which actions effectively reduce churn. These experiments can range from personalized push notifications and email offers to free upgrades and new feature unlocks.

The results of these experiments are presented in a clear and actionable format, allowing companies to automate what works and continuously improve their retention strategies. Subsets' AI algorithms, built using gradient-boosting models and temporal sequencing methods, provide a solid foundation for accurate predictions and effective churn reduction.

While Subsets doesn't currently utilize OpenAI's GPT.x models, the company is exploring ways to incorporate them into its product to enhance its downstream functionality. This aligns with the growing trend among YC companies, with CEO Garry Tan revealing that around half of them are leveraging LLMs in some capacity.

YC's involvement as an early backer is a testament to Subsets' potential. The prestigious accelerator's strong network has already opened doors for the startup, connecting them with potential customers and investors.

Subsets' pre-seed funding round also saw participation from institutional and angel investors, including Cuesta Labs, Sandhill Markets, and Peakon founder Phillip Chambers. With this funding, Subsets is poised to expand its team, enhance its product, and solidify its position as a leader in the subscription retention space.

","https://techcrunch.com/wp-content/uploads/2024/02/Team-YC-classic-e1708948534646.jpg?resize=1200,676",2024-02-27 10:32:02
https://techcrunch.com/2024/02/27/shadowfax-speeds-ahead-with-100m-funding-as-instant-delivery-boom-fuels-growth/,Shadowfax confirms $100M round to fuel instant delivery push,"

In the heart of India's bustling e-commerce landscape, Shadowfax, a prominent logistics provider, has secured a remarkable $100 million in funding, propelling its annual growth to an impressive 35%. This latest investment round, led by TPG NewQuest, marks a significant milestone in Shadowfax's journey to revolutionize last-mile delivery in the country.

Shadowfax's mission is to untangle the complexities of India's fragmented delivery infrastructure, addressing the challenges of inefficient networks, urban complexities, and inconsistent service quality. By unifying disparate elements in the last-mile ecosystem, Shadowfax streamlines logistics operations, ensuring timely and reliable deliveries for small businesses and e-commerce giants alike.

With a vast network spanning over 2,500 cities and 15,000 zip codes, Shadowfax boasts a daily delivery volume of over 2 million packages and a loyal customer base of 3.5 million registered users. Abhishek Bansal, Shadowfax's co-founder and CEO, attributes this remarkable growth to the wider adoption of quick-commerce in India, enabling the startup to maintain profitability while gaining significant market share.

Shadowfax's success story is further underscored by its impressive track record of customer retention, having not lost a single client in five years. The startup collaborates with numerous renowned firms, including Flipkart, Meesho, and various direct-to-consumer brands, catering to their same-day and next-day delivery needs.

Amit Gupta, Partner and Head of India and Southeast Asia at TPG NewQuest, lauds Shadowfax's transformative impact on India's e-commerce logistics sector. Mirae Asset, another key investor, echoes this sentiment, emphasizing the fundamental role of logistics in driving e-commerce growth.

With a total funding of over $220 million, Shadowfax stands poised to continue its remarkable journey, expanding its network, enhancing its platform, and delivering exceptional logistics services to businesses across India.

","https://techcrunch.com/wp-content/uploads/2024/02/shadowfax.jpg?resize=1200,728",2024-02-27 09:50:00
https://techcrunch.com/2024/02/26/supreme-court-social-media-moderation-texas-florida/,The Supreme Court could decide the future of content moderation - or it could punt,"

In the realm of the internet, a battle is brewing over the fate of content moderation, with the Supreme Court at the center of it all. Two state laws, one from Florida and the other from Texas, have sparked a heated debate about the role of social media companies in shaping online discourse.

At the heart of the matter lies the question of whether these laws, crafted by Republican lawmakers, infringe upon the First Amendment rights of tech companies and their users. The laws aim to curb social media platforms' ability to remove or restrict content based on political viewpoints, a move seen by some as a response to perceived anti-conservative bias.

However, research has not substantiated these accusations, leaving experts to ponder whether the laws stem from a skewed perception of ideological discrepancies in content moderation decisions. The Supreme Court justices themselves expressed skepticism during oral arguments, raising concerns about the broad nature of the laws and their potential unintended consequences.

The legal landscape surrounding the internet is a tangled web of outdated precedents, leaving both tech companies and their critics craving clarity. The Supreme Court's previous rulings on social media cases have demonstrated the court's reluctance to provide clear-cut answers, leaving the issue in a state of uncertainty.

During the hearing, Justice Sonia Sotomayor highlighted the far-reaching implications of the laws, emphasizing the diverse nature of the internet and the potential impact on non-traditional social media platforms. Justice Brett Kavanaugh echoed these concerns, underscoring the importance of the First Amendment's protection against government suppression of speech.

Even Justice Neil Gorsuch, who appeared more receptive to arguments against social networks, pointed to Section 230, a law that shields internet companies from liability for content moderation decisions. He suggested that this law may override the state-imposed restrictions on social media moderation.

The outcome of these cases remains uncertain, with the Supreme Court having the option to issue a decisive ruling or remand the cases back to lower courts for further proceedings. The justices' indecision about the way the cases were brought forward adds another layer of complexity to the already convoluted legal battle.

Regardless of the court's decision, the internet age demands a fresh approach to First Amendment jurisprudence. The Supreme Court must confront the evolving nature of online communication and update its legal framework accordingly. The vast technological changes of the internet era necessitate a modern understanding of free speech and content moderation in the digital realm.

As the highest court in the land, the Supreme Court has a responsibility to provide clarity and guidance in this rapidly evolving landscape. The future of content moderation hangs in the balance, with far-reaching implications for the way we interact and communicate online.

","https://techcrunch.com/wp-content/uploads/2022/05/GettyImages-1167833543.jpeg?resize=1200,798",2024-02-27 01:15:11
https://techcrunch.com/2024/02/26/inkitt-ai-publishing-37-million/,"Inkitt, the self-publishing platform using AI to develop bestsellers, nabs $37M","

In an era where digital distractions compete for our attention, Inkitt, a pioneering startup, believes in the enduring power of storytelling. With its innovative platform, Inkitt empowers aspiring authors to self-publish their stories and harnesses the potential of AI and data science to identify and refine the most captivating tales. These chosen narratives are then curated and distributed on a dedicated app, Galatea, where they find their audience.

Inkitt's mission is bold: to become the ""Disney of the 21st century,"" a multimedia empire built around a vast library of compelling content. The company's recent $37 million Series C funding, led by Vinod Khosla of Khosla Ventures, propels it toward this ambitious vision.

Inkitt's unique approach challenges the traditional publishing industry's norms. It recognizes the changing reading habits of the digital age, where shorter, more dynamic formats thrive on mobile devices. Inkitt caters to this evolving landscape by crafting chapters that are easily digestible and incorporating multimedia elements like sounds to enhance the reading experience.

The company's data-driven approach to storytelling sets it apart. Through A/B testing, Inkitt analyzes every aspect of a story, from titles and cliffhangers to character arcs and plot twists. This meticulous process yields invaluable insights into reader preferences and guides the creation of stories that resonate deeply with audiences.

Inkitt's success is evident in its impressive growth. Despite the post-pandemic decline in certain digital services, Inkitt, Galatea, and its newest venture, Galatea TV, have witnessed a surge in engagement. This positive trajectory is a testament to the company's ability to tap into the human desire for escapism and entertainment.

Inkitt's commitment to nurturing undiscovered talent is commendable. The company shuns the headaches of working with established authors and their egos, instead focusing on the vast pool of untapped talent waiting to be discovered. This approach aligns with Inkitt's belief that AI can unlock the potential of these hidden gems, transforming their stories into bestsellers.

The company's exploration of AI-generated content is particularly intriguing. Inkitt envisions a future where AI algorithms collaborate with human creativity to craft captivating narratives. This fusion of human ingenuity and technological prowess holds immense promise for expanding the boundaries of storytelling.

Inkitt's journey is a testament to the enduring power of stories and the transformative potential of technology. As it continues to navigate the ever-changing digital landscape, Inkitt's mission to create a multimedia empire centered around compelling content remains unwavering. The company's success serves as an inspiration to aspiring authors, demonstrating that with the right tools and a data-driven approach, anyone can turn their stories into captivating experiences that resonate with audiences worldwide.

","https://techcrunch.com/wp-content/uploads/2024/02/Screenshot-2024-02-27-at-00.56.38.png?resize=1200,457",2024-02-27 01:01:39
https://www.forbes.com/sites/forbestechcouncil/2024/02/27/driving-c-suite-conversations-the-role-of-hosted-private-cloud/,Driving C-Suite Conversations: The Role Of Hosted Private Cloud,"

Navigating the Cloud Maze: Unveiling the Hosted Private Cloud

In the ever-evolving world of technology, cloud computing has become an integral part of modern business operations. Yet, amidst the hype and buzz surrounding cloud adoption, many organizations find themselves caught in a dilemma – should they embrace the public cloud, retreat to on-premise infrastructure, or explore a middle ground?

In this blog, we delve into the concept of hosted private cloud (HPC), a compelling solution that offers the best of both worlds – the agility and scalability of the cloud, coupled with the control and security of dedicated infrastructure.

What is a Hosted Private Cloud?

A hosted private cloud is a fully managed cloud environment designed to provide organizations with the benefits of cloud computing while maintaining dedicated resources, enhanced security, and control over their data and applications. Unlike public clouds, where resources are shared among multiple users, HPC offers a private and isolated environment, ensuring greater performance, privacy, and compliance.

Why Consider a Hosted Private Cloud?

1. Dedicated Resources and Security: HPC provides dedicated compute and storage resources, ensuring consistent performance and heightened security. This is particularly valuable for applications and enterprises that demand stable operation and zero downtime.

2. Control and Customization: Hosted private cloud solutions offer organizations greater control and customization options compared to public cloud solutions. Businesses can tailor their infrastructure to specific requirements, ensuring optimal performance and alignment with their unique business needs.

3. Legacy Application Compatibility: Many legacy applications may not be easily migrated to public cloud environments. HPC allows organizations to continue using their legacy applications on a more adaptable and scalable infrastructure, avoiding costly rewrites or disruptions.

4. Cost Optimization: While hosted private cloud may involve higher initial costs compared to public cloud, it can lead to long-term cost savings for certain workloads. Organizations can consolidate their infrastructure, enhance resource utilization, and avoid unforeseen cloud service charges.

5. Managed Services and Support: Hosted private cloud providers offer managed services and support, eliminating the need for organizations to invest in specialized expertise or resources to manage their private cloud infrastructure.

Transitioning to a Hosted Private Cloud: A Step-by-Step Guide

1. Assess Your IT Environment: Conduct a thorough audit of your existing IT environment, identifying applications, dependencies, usage patterns, and security requirements. This assessment will help you determine which applications and workloads are suitable for migration to a hosted private cloud.

2. Evaluate Application Compatibility: Determine which applications are compatible with the hosted private cloud environment. Consider whether containerization is needed or if applications need to be rewritten. Avoid blindly moving workloads to the cloud, as this may lead to costly repatriation.

3. Define Access Control: Establish a structured access list, granting the right people in your organization appropriate access to the cloud environment. Overlooking this step can lead to unauthorized access and increased security risks.

4. Ensure Security Compliance: Review and comply with relevant security and regulatory requirements. Implement robust identity and access management controls, encrypt critical data and applications, and configure security policies to minimize the risk of data breaches or unauthorized access.

Conclusion

In today's digital landscape, organizations must continuously evaluate their data management strategies. Hosted private cloud emerges as a compelling option, offering a unique blend of cloud agility and dedicated infrastructure control. By understanding the benefits and challenges of HPC, businesses can make informed decisions about their cloud adoption journey, ensuring optimal performance, security, and alignment with their specific business goals.

",https://imageio.forbes.com/specials-images/imageserve/5fbbc3ed6379c6ef3bc9a97d/0x0.jpg?format=jpg&height=900&width=1600&fit=bounds,2024-02-27 09:00:00
https://www.forbes.com/sites/forbestechcouncil/2024/02/27/how-to-create-a-unified-data-and-ai-governance-framework/,How To Create A Unified Data And AI Governance Framework,"

Navigating the Convergence of AI and Data Integration: A Unified Framework for Governance

In the ever-evolving realm of Artificial Intelligence (AI), the challenge of harmonizing AI and data integration has become paramount. The complexity of disparate data sources and aligning them with AI objectives poses significant hurdles for AI-driven enterprises. To address this, unified data and AI governance has emerged as a top priority.

The Imperative for Unified Data and AI Governance

Aligning data management with AI development necessitates a unified governance approach. Data quality, accuracy, and fairness are inextricably linked to the data used to train AI systems. Maintaining consistent standards and practices for data management and AI development is vital.

Organizations must identify and mitigate a broad spectrum of risks, including data privacy, security, and AI ethics. Compliance with regulations like GDPR and the AI Act is essential. Additionally, organizations should consider cost savings and improved operational efficiency through this process.

Building a Unified Framework for Data and AI Governance

Creating a unified framework for data and AI governance requires buy-in from across the organization and involvement of key stakeholders, including leadership teams and external experts. Continuous oversight, monitoring, and auditing mechanisms are crucial for an effective governance program.

Actionable Standard Operating Procedures (SOPs) for Success

1. Risk Assessment Protocols: Develop standardized risk assessment models for AI, especially in sensitive sectors like healthcare and finance. These models should encompass technical, ethical, and societal implications.

2. Ethical Data and AI Audits: Conduct regular audits by independent bodies to ensure alignment with ethical standards and regulatory requirements. These audits help identify biases in AI algorithms and compliance gaps.

3. Data and AI Literacy Programs: Launch educational initiatives to enhance public and internal understanding of AI. These programs should focus on both the functioning of AI and its broader implications.

4. Innovation Sandboxes: Create controlled environments for testing AI in real-world scenarios. These sandboxes help identify operational challenges and potential risks before full-scale deployment.

5. Global Data and AI Governance Forums: Participate in global forums that facilitate the sharing of best practices and challenges in data and AI governance. Focus on finding common ground and establishing global standards while respecting local variations.

The Road Ahead: AI Governance for a Better Future

Effective governance of AI is pivotal to harnessing its potential and ensuring safety, fairness, and inclusivity. The principles and SOPs outlined here aim to guide AI development towards a future where technology serves humanity's best interests.

As AI continues to evolve, so too must our governance strategies. Ongoing dialogue, research, and collaboration across all sectors of society are essential to navigate the ever-changing landscape of AI governance.

",https://imageio.forbes.com/specials-images/imageserve/6324a7cf6ad48ae6c3b00cbf/0x0.jpg?format=jpg&height=900&width=1600&fit=bounds,2024-02-27 08:45:00
https://www.forbes.com/sites/williamhaseltine/2024/02/27/gene-therapy-for-a-neurological-disease-rett-syndrome/,Gene Therapy For a Neurological Disease: Rett Syndrome,"

Gene Therapy: A Ray of Hope for Rett Syndrome

In the realm of rare genetic disorders, Rett syndrome stands out as a challenging condition that primarily affects girls. With an estimated one in 10,000 girls born each year carrying this X-linked mutation, Rett syndrome disrupts brain development, leading to a range of severe symptoms. While there's currently no cure, a groundbreaking gene therapy approach offers a glimmer of hope for those living with this debilitating condition.

Understanding Rett Syndrome

Rett syndrome manifests itself in a unique pattern. Initially, babies appear to develop typically for the first six to 18 months. However, as time progresses, they encounter significant challenges in speech, memory, and coordination. These wide-ranging symptoms, which vary in severity, impact every aspect of their lives, from basic communication to physical movement. Additionally, people with Rett syndrome may face scoliosis, seizures, heart problems, and difficulties with eating and sleeping.

Current Treatment Landscape

Despite the relentless nature of Rett syndrome, there's a beacon of hope in the form of gene therapy. This innovative approach aims to tackle the root cause of the condition by directly targeting the mutated gene responsible for the disorder.

Advantages of Direct Injection

Traditional gene therapy methods involve modifying a person's cells in a lab and then reintroducing them into the body. However, this approach often leads to complications, including liver toxicity.

A team of researchers from Shanghai, China, has pioneered a novel gene therapy technique that involves direct injection. This method delivers the treatment straight to the brain, bypassing the liver and minimizing the risk of toxicity. Additionally, it utilizes cells already present in the individual, eliminating the need for costly and complex cell manipulation outside the body.

Preclinical Findings

In their preclinical study, the researchers employed CRISPR/Cas9 gene editing to create mouse models of Rett syndrome. They then injected these mice with a gene therapy treatment packaged in a viral vector. The results were promising.

The treatment partially restored MeCP2 protein levels in the brain, a crucial protein for brain development and function. This restoration led to a significant increase in the lifespan of the mice, with the cytomegalovirus/chicken promoter showing the most remarkable results.

Furthermore, the treatment improved the body weight and movement abilities of the mice, suggesting a potential improvement in their overall quality of life.

Future Implications

These preclinical findings paint an optimistic picture for the future of Rett syndrome treatment. Gene therapy holds the potential to revolutionize the way we approach this challenging condition, offering hope for improved outcomes and a better quality of life for those affected.

While human testing is still necessary to fully assess the safety and efficacy of this gene therapy, the early results are encouraging. The direct injection method, with its targeted delivery and reduced toxicity, could pave the way for a more effective and cost-effective treatment for Rett syndrome.

",https://imageio.forbes.com/specials-images/imageserve/65ce939a2aa3b3361599a84a/0x0.jpg?format=jpg&height=900&width=1600&fit=bounds,2024-02-27 08:45:00
