Link,post_title,title,post_content,featured_image,Date-Publish,meta_desc,focuskeywords,post_category,Post_tag
https://techcrunch.com/2024/03/29/the-final-countdown-early-stage-2024-ticket-savings-end-tonight/,The final countdown: Early Stage 2024 ticket savings end tonight,"""Last Chance for Early Bird Savings: TechCrunch Early Stage 2024 Tickets End Tonight""","

The clock is ticking down! March 29th marks the last chance to secure early-bird savings for TechCrunch Early Stage 2024 - a one-day event set to kickstart your entrepreneurial journey on April 25th in Boston. 

Don't miss out on this exclusive opportunity to gain valuable insights, resources, and connections to propel your startup forward. From engaging roundtable sessions to expert-led discussions and exclusive 1:1 meetings with investors, TechCrunch Early Stage 2024 has everything you need to supercharge your startup journey.

Here's what you can expect:

Roundtable sessions: Join in collaborative conversations with industry experts.

Expert-led discussions: Get insights from leaders such as Alex Kayyal, Rudina Seseri, Tom Blomfield and many more!

Exclusive 1:1 meetings: Schedule meetings with potential investors and partners.

Exciting side events: Immerse yourself in partner-hosted meetups, workshops, and happy hours.

Valuable resources: Access session materials for ongoing learning.

Networking opportunities: Connect with startup service providers offering valuable tools.

But time is running out! This is your last chance to secure your early-bird ticket at a discounted rate. Don't wait until it's too late - buy your early-bird ticket today by 11:59 p.m. PT and reserve your spot at TechCrunch Early Stage 2024. Don't let this opportunity slip away - act now and take your startup to new heights!

Is your company interested in sponsoring or exhibiting at TechCrunch Early Stage 2024? Fill out this form to learn more. ",https://techcrunch.com/wp-content/uploads/2024/02/LastDay_EarlyStage24_1200x628.jpg?w=1200,2024-03-29 12:00:54,"Secure early-bird savings for TechCrunch Early Stage 2024 before it's too late! Gain valuable insights, resources, and connections with expert-led discussions, exclusive 1:1 meetings, and engaging roundtable sessions. Don't miss out on this exclusive opportunity - buy your early-bird ticket by 11:59 p.m. PT. Learn more about sponsoring or exhibiting at TechCrunch Early Stage 2024 here.",Early-stage ticket savings end tonight,Technology,"Formicoders,News,AI,Technology,Innovation,Programmering,Coding,Wordpress,Python"
https://techcrunch.com/2024/03/29/google-deepmind-ceo-demis-hassabis-gets-uk-knighthood-for-services-to-artificial-intelligence/,Google DeepMind CEO Demis Hassabis gets UK knighthood for 'services to artificial intelligence'," ""DeepMind CEO Hassabis Knighted"" ","Demis Hassabis, CEO and one of the founders of Google's DeepMind, has been awarded a knighthood in the U.K. for ""services to artificial intelligence."" This recognition honors Hassabis's contributions to the field, which have been instrumental in positioning the U.K. as a leading player in the global AI revolution.

Hassabis, born in London in 1976, emerged as a prodigy in a variety of disciplines and reached master status at chess as a teenager. He went on to work in various AI and computer science roles before earning a PhD in cognitive neuroscience from University College London. In 2010, he founded DeepMind along with Shane Legg and Mustafa Suleyman, and the company has since become one of the U.K.'s greatest AI exports.

The U.K. has been eager to position itself at the forefront of the AI revolution, driven by initiatives such as the AI Safety Summit, which it hosted in England last November. The country sits among the top-tier AI countries globally in terms of R&D investment, behind the U.S. and China. Demis Hassabis has been a critical figure in this effort, and his knighthood recognizes his contributions to the field.

In recent years, Hassabis has led DeepMind to develop an AI system that beat the world champion of strategy board game Go, among other achievements. However, the company has also courted controversy, such as when it signed data-sharing deals with the U.K.'s National Health Service (NHS). Nevertheless, Hassabis's knighthood is a testament to the importance of his work in the field of AI.

Other notable figures from the technology world to receive knighthoods include Apple's Jonathan ""Jony"" Ive in 2011 for ""services to design and enterprise."" Hassabis's knighthood is a well-deserved recognition of his contributions to the field of AI and his role in positioning the U.K. as a global leader in the field.","https://techcrunch.com/wp-content/uploads/2024/03/GettyImages-1760047727-e1711731094140.jpg?resize=1200,674",2024-03-29 18:24:26,"""Discover the U.K.'s AI Expert Demis Hassabis Awarded a Knighthood for Services to the Field! Learn about his contributions, achievements, and controversies. Read more about the AI revolution and how the U.K. is leading the way. Click now to learn more!""",AI Expert Demis Hassabis Awarded U.K. Knighthood,Technology,"Formicoders,News,AI,Technology,Innovation,Programmering,Coding,Wordpress,Python"
https://techxplore.com/news/2024-03-qa-ai-dont.html,Q&A: How to train AI when you don't have enough data," ""How to Train AI with Limited Data: UW Researchers Use Baby Monitor to Monitor Baby's Pose"" ","Artificial intelligence (AI) is a powerful tool that excels at analyzing large amounts of data and detecting patterns or trends. However, these machine learning algorithms require extensive training before they can accurately identify patterns and make predictions.

One challenge faced by researchers in the field of AI is the lack of data to train algorithms for certain applications. For example, analyzing X-ray image data to detect rare conditions or identifying a rare fish species caught on a commercial fishing boat can be difficult due to the limited availability of data.

Jenq-Neng Hwang, a professor at the University of Washington, specializes in developing algorithms to address these issues. One of his team's recent projects involved teaching AI to monitor a baby's distinct poses throughout the day. The team developed a pipeline to create a unique algorithm that accurately and reliably identified a baby's 3D pose from annotated video sequences.

The team presented their work at the IEEE/CVF Winter Conference on Applications of Computer Vision 2024 and their research is available on the arXiv preprint server. Hwang spoke with UW News about the project details and other similar challenges his team is addressing.

One of the main benefits of using AI for this task is the ability to continuously and consistently track a baby's poses throughout the day using a baby monitor. This information can be used to identify potential health issues and help families with a history of autism determine if their babies are also at risk.

While AI is a good fit for this task, there are challenges related to the lack of data available to train the algorithms. In this case, the team developed a pipeline that combined a generic 3D pose generative AI model with their limited dataset of annotated baby motion sequences. This allowed the AI model to adapt to the small dataset and produce high-quality results.

There are many other scenarios where there is not enough data to train AI algorithms. For example, analyzing rare conditions in medical images or identifying unknown species in the wild can be challenging due to the limited availability of data. However, with continued advancements in AI and data collection, these challenges may become less prevalent in the future.",https://scx2.b-cdn.net/gfx/news/2024/qa-how-to-train-ai-whe.jpg,2024-03-28 16:49:00,Discover how Professor Jenq-Neng Hwang and his team used AI to accurately identify a baby's 3D pose from annotated video sequences. Learn how they overcame the challenge of limited data and their research is now available on the arXiv preprint server., training AI with limited data ,Technology,"Formicoders,News,AI,Technology,Innovation,Programmering,Coding,Wordpress,Python"
https://techcrunch.com/2024/03/28/byjus-founder-floats-share-offer-to-make-peace-with-estranged-investors/,Byju's founder makes last-ditch attempt to placate disgruntled investors, Byju's Founder Offers Renounced Shares to Dissatisfied Investors Amid Legal Battle | TechCrunch ,"Byju Raveendran, founder of embattled edtech group Byju’s, has made a last-ditch effort to appease the company's disgruntled investors, who include Prosus Ventures. The company’s board is weighing an offer of renounced shares, which were recently rejected by some investors in protest, to prevent the dilution of the investors' holdings ahead of validating a recent rights issue.

At stake is the future of Byju’s, once the most valuable startup in India and the face of the local ecosystem. The dispute between the Bengaluru-based startup and its investors stems from a rights issue that the startup initiated in late January, following a year-long struggle to raise funds. Rights issues allow companies to raise capital by giving shareholders the opportunity to purchase additional shares at a discount, in proportion to their current stake. By not participating in the rights issue, the investors risk getting their holdings in Byju's diluted down to almost nothing.

Investors Prosus, Peak XV, and the Chan Zuckerberg Initiative didn't participate in the rights issue, and are currently in a legal battle to remove Raveendran from the firm and invalidate the $200 million it raised through the rights issue. The investors reached an Indian company court earlier this year that ordered Byju’s to move the $200 million to an escrow account until the matters are resolved.

In an email to shareholders on Friday morning, Raveendran announced the startup’s board’s consideration of making the offer to disgruntled investors, despite the “animosity” they have displayed and their “uncalled for legal actions.” Raveendran also informed the shareholders that the startup has already received over 50% of the votes required to increase the authorized share capital in the startup to bring into effect the fully-subscribed $200 million rights issue. Byju’s held an extraordinary general meeting on Friday, where it attempted to pass the resolution over the rights issue. The result of the rights issue won't emerge until April 6, and the two parties are set to appear before the Indian company court again on April 4.

Byju’s is running against time even though it has slashed costs in recent quarters. Byju's needs the capital raised from the rights issue to sustain its business operations. Resolving the ongoing dispute with its investors is also crucial for the company to initiate future fundraising efforts and maintain its financial stability.

Raveendran has always been committed to building a company with a spirit of equality and equity, regardless of shareholding size. In his email, he reiterated his conviction that they would overcome their challenges together, despite the difficult time they are facing.

The story was updated with additional details.","https://techcrunch.com/wp-content/uploads/2021/03/GettyImages-1132893022.jpg?resize=1200,800",2024-03-29 03:53:15,"Meta Description:

Byju Raveendran, founder of embattled edtech group Byju’s, has made a last-ditch effort to appease disgruntled investors, including Prosus Ventures, to prevent the dilution of their holdings ahead of validating a recent rights issue. The company's board is weighing an offer of renounced shares, which were recently rejected by some investors in protest. The future of Byju's is at stake, and a resolution to the ongoing dispute with investors is crucial for the company to initiate future fundraising efforts and maintain its financial stability.", offer ,Technology,"Formicoders,News,AI,Technology,Innovation,Programmering,Coding,Wordpress,Python"
https://techcrunch.com/2024/03/29/x-confirms-plans-for-nsfw-communities/,X confirms plans for NSFW Communities,"""NSFW Communities on Twitter: A New Dawn for Moderation""","

The Evolution of Adult Content Moderation on Social Media Platforms

In the ever-evolving landscape of social media, platforms are continually adapting to the diverse content shared by their users. Recently, a significant development has emerged concerning the management of adult content on a platform widely recognized as a microblogging giant.

A New Dawn for NSFW Content

The platform, which has undergone a rebranding, has introduced a pivotal change in its approach to Not Safe For Work (NSFW) content. Community administrators now have the autonomy to mark their groups with an ""Adult Content"" label. This initiative is a departure from the previous blanket filtering system, aiming to provide a more nuanced content experience.

The Impact of NSFW Content

NSFW material has long been a part of the platform's ecosystem, serving as a prominent advertising medium for various adult-oriented services and creators. Historical data suggests that a significant portion of the platform's posts fell under this category, highlighting its prevalence and growth even amidst the decline of other content genres.

Technological and Policy Enhancements

The platform's commitment to refining user experience is evident in its latest updates. Administrators are empowered with new tools to categorize content effectively, and a suite of moderation features is set to streamline community management. These include sorting capabilities, enhanced reporting mechanisms, and the introduction of a Ban button to combat spam and maintain community standards.

Future Prospects and Community Growth

Looking ahead, the platform is poised to enhance community engagement through improved discovery tools and analytics. The promotion of communities on prominent tabs promises to bolster visibility and growth, while upcoming interface updates anticipate an enriched user interaction.

Conclusion

As social media platforms navigate the complexities of content moderation, the integration of clear policies and advanced tools is crucial. The recent changes mark a significant step towards a more inclusive and controlled environment, where adult content can coexist with other forms of expression within the bounds of community guidelines.

","https://techcrunch.com/wp-content/uploads/2023/08/twitter-x-logo-musk-1.jpg?resize=1200,675",2024-03-29 16:07:11,"This Meta Description is clear, concise, and includes the focus keyphrase ""NSFW Communities."" It highlights the platform's changes in approach to managing adult content, including the introduction of a new label and improved moderation tools. The description also provides an overview of the impact of NSFW content, as well as future prospects and community growth. The Meta Description is under 20 words, making it actionable and valuable to potential readers.","The keyphrase for this article would be ""NSFW Communities"" as it closely relates to the main topic of the article and is 2 words long. The focus keyphrase appears in the SEO title and is found within the first paragraph and at least twice within the body of the news article.",Technology,"Formicoders,News,AI,Technology,Innovation,Programmering,Coding,Wordpress,Python"
https://techcrunch.com/2024/03/28/xs-grok-chatbot-will-soon-get-an-upgraded-model-grok-1-5/,"X's Grok chatbot will soon get an upgraded model, Grok-1.5","Grok-1.5: Musk's AI Breakthrough Set for Launch

Discover how the latest generative AI model from X.ai's Grok series is set to revolutionize social network interactions. Grok-1.5 promises enhanced capabilities, including improved performance on benchmarks, expanded context processing, and the ability to tackle sensitive topics. With open-sourcing and democratization of AI access, the future of AI is set to be more integrated and intelligent.","

The Dawn of Grok-1.5: A Leap in Generative AI

In the ever-evolving landscape of artificial intelligence, a new chapter unfolds with the introduction of Grok-1.5, the latest generative AI model from Elon Musk's innovative startup, X.ai. This cutting-edge technology is poised to revolutionize the way we interact with social networks, specifically through the Grok chatbot on platform X. The anticipation builds as its deployment is slated for the imminent future.

A Glimpse into Enhanced Capabilities

Grok-1.5 heralds a significant advancement in AI reasoning, especially in the realms of coding and mathematical computations. The leap in performance is evident, with Grok-1.5 surpassing its predecessor's scores on renowned benchmarks. It has achieved more than double the score of Grok-1 on the MATH benchmark and has shown a remarkable 10%+ improvement on the HumanEval test, which assesses programming language generation and problem-solving prowess.

Predicting Practical Performance

While benchmark results are promising, the true test lies in real-world applications. Traditional AI benchmarks, often focusing on niche academic challenges, fall short in reflecting everyday interactions with AI. However, Grok-1.5's enhanced context processing ability is a tangible upgrade that promises to improve user experience significantly.

Understanding Context at Scale

The ability to process up to 128,000 tokens allows Grok-1.5 to retain and utilize information from extensive documents, ensuring a more coherent and continuous interaction. This expanded context window not only prevents the loss of recent conversational content but also enables the AI to comprehend and respond to more complex prompts effectively.

Charting New Territories

X.ai's Grok series has always stood out for its willingness to tackle topics often deemed too sensitive or controversial for other AI models. With a design philosophy that embraces a ""rebellious streak,"" these models have been known to engage with a wide array of subjects and even adopt a brash tone if prompted.

Looking Ahead

As Grok-1.5 gears up for its release to early testers, accompanied by several exciting new features, the tech community eagerly awaits the enhancements it will bring. Musk has teased functionalities like summarizing conversations and generating content suggestions, which could soon be part of the Grok experience.

Expanding Access

Following the open-sourcing of Grok-1, X.ai continues to democratize AI access. Musk's recent announcement promises that more users, particularly those subscribed to X's affordable Premium plan, will soon enjoy the capabilities of the Grok chatbot, previously exclusive to a higher-tier subscription.

In conclusion, Grok-1.5 stands as a testament to the relentless pursuit of innovation in AI. As it prepares to make its debut, we stand on the cusp of a new era where AI becomes more integrated into our digital lives, promising an enriched, seamless, and more intelligent future.

","https://techcrunch.com/wp-content/uploads/2023/11/xAI-Grok-GettyImages-1765893916.jpeg?resize=1200,800",2024-03-29 03:48:42,"Get Ready for Grok-1.5: The Future of Generative AI

Discover the latest advance in AI with Grok-1.5, a revolutionary generative AI model from Elon Musk's X.ai. With its enhanced reasoning, coding, and mathematical computation capabilities, Grok-1.5 is set to revolutionize social networks through the Grok chatbot on platform X. Stay informed on its deployment and explore its groundbreaking features. Don't miss out on this exciting future!",Grok-1.5,Technology,"Formicoders,News,AI,Technology,Innovation,Programmering,Coding,Wordpress,Python"
https://techcrunch.com/2024/03/29/the-ai-world-needs-more-data-transparency-and-web3-startup-space-and-time-says-it-can-help/,The AI world needs more data transparency and web3 startup Space and Time says it can help,"""Web3's Verifiable Computing Layer for Data Transparency in AI and Blockchain""","

In today's world, where AI is becoming increasingly prevalent and the internet is more vulnerable to manipulation, the need for data transparency and verifiability is more important than ever. Space and Time, a web3 startup, believes it can help solve this problem with its verifiable computing layer for web3.

On TechCrunch's Chain Reaction podcast, Space and Time's CTO and co-founder, Scott Dykstra, discussed the importance of data transparency and the need to ensure that data and brands are verifiable. Dykstra gave the example of the FTX collapse, where the now-defunct crypto exchange was manipulating its books internally and misleading investors. This manipulation was similar to making a query to a database for financial records but manipulating it inside their own database.

Dykstra sees this as a problem that transcends beyond the crypto industry and into other industries. There is an incentive for financial institutions to want to manipulate their records, and this becomes more problematic. ZK proofs, which are cryptographic actions used to prove something about a piece of information without revealing the origin data itself, can be used to verify and retrieve the data.

Space and Time aims to be the verifiable computing layer for web3 by indexing data both off-chain and on-chain. However, Dykstra sees it expanding beyond the industry and into others. The startup has indexed from major blockchains like Ethereum, Bitcoin, Polygon, Sui, Avalanche, Sei, and Aptos and is adding support for more chains to power the future of AI and blockchain technology.

One of Dykstra's recent concerns is that AI data isn't really verifiable. He is worried that we will never be able to efficiently verify that an LLM was executed correctly. There are teams today that are working on solving this issue by building ZK proofs for machine learning or large language models, but it can take years to try and create that. This means that the model operator can tamper with the system or LLM to do things that are problematic.

Dykstra believes that there needs to be a ""decentralized, but globally, always available database"" that can be created through blockchains. Everyone needs to access it, and it can't be a monopoly. For example, in a hypothetical scenario, OpenAI itself can't be the proprietor of a database of a journal for which journalists are creating content. Instead, it has to be something that's owned by the community and operated by the community in a way that's readily available and uncensorable.

In conclusion, Space and Time's verifiable computing layer for web3 can help ensure data transparency and verifiability in the rapidly evolving world of AI and blockchain technology. With ZK proofs and a decentralized database, we can prevent bad actors from manipulating data and ensure that data is trustworthy and reliable. ","https://techcrunch.com/wp-content/uploads/2024/02/GettyImages-1828490321.jpg?resize=1200,800",2024-03-29 17:00:55,"""Space and Time's Verifiable Computing Layer for Web3: Ensuring Data Transparency and Verifiability in the Age of AI""

""Learn how Space and Time's Verifiable Computing Layer for Web3 can help ensure data transparency and verifiability in the rapidly evolving world of AI and blockchain technology. Discover how ZK proofs and a decentralized database can prevent bad actors from manipulating data and ensure that data is trustworthy and reliable.""

""Don't let bad actors manipulate data in your industry. Space and Time's Verifiable Computing Layer for Web3 is the solution for ensuring data transparency and verifiability. With ZK proofs and a decentralized database, you can prevent bad actors from tampering with your data and ensure that your data is reliable and trustworthy.""

""Get started with Space and Time's Verifiable Computing Layer for Web3 today. Our solution is perfect for industries looking to ensure data transparency and verifiability. Trust our team of experts to help you protect your data and build a better future for your business.""",Verifiable computing layer for web3.,Technology,"Formicoders,News,AI,Technology,Innovation,Programmering,Coding,Wordpress,Python"
