Link,post_title,title,post_content,featured_image,Date-Publish,meta_desc,focuskeywords,post_category,Post_tag
https://techcrunch.com/2024/03/30/tiktok-ban-implication-amazon/,TikTok ban could harm Amazon sellers looking for alternatives,TikTok's E-commerce Potential: Impact on Amazon Sellers and Young Shoppers [50 CHARACTERS],"TikTok’s E-commerce Dream: The Potential Ban and Its Impact on Amazon Sellers

In March 2023, the U.S. House of Representatives passed a bill that could force ByteDance, the parent company of TikTok, to divest the app or face a ban in U.S. app stores. While the focus of the debate has been on American data security and speech rights, the potential move also highlights something else: TikTok’s growing focus on e-commerce and its potential impact on small merchants.

Over the past few months, sellers from China, many of whom were looking for an Amazon alternative, have flocked to TikTok to peddle a variety of products to U.S. buyers through the platform’s TikTok Shop feature. However, with the political tension between the U.S. and China, the future of TikTok’s e-commerce business is uncertain.

Sellers from Shenzhen, a Chinese megacity that’s a major hub for Amazon merchants, expressed frustration and helplessness about a potential TikTok ban. One retailer specializing in maternity and baby products told TechCrunch, “The situation is not within our control. It’s just difficult to know how things will develop.”

TikTok Shop officially launched in September 2023 with 200,000 merchants already on board. However, since then, the platform has not provided any updated numbers on how many merchants are currently on the platform, nor how much they sell there, nor how many sell elsewhere (and where else that might be).

Research from Jungle Scout, an Amazon data intelligence provider, provides some idea of TikTok’s e-commerce impact. It found that 20% of Amazon sellers, brands, and businesses have plans to expand to TikTok Shop this year. Before the current political backlash took off, ByteDance reportedly projected that it had the potential to grow its U.S. e-commerce business tenfold to $17.5 billion this year.

TikTok is not the only platform on the list for merchants looking for more channels beyond Amazon to expand their customer bases. Its rise is part of a bigger shift we’ve been seeing around alternative marketplaces like Temu commanding more attention not just from shoppers, but from a Chinese e-commerce exporters and merchants. And Amazon is reportedly taking notice, another sign that alternatives are picking up traction.

TikTok did not immediately reply to a request for comment.

A New Way to Sell and Buy

TikTok has been trying to boost its e-commerce business since the U.S. launch in September 2023. To do this, it has taken a different approach than its competitors. Unlike Temu, known for its seas of cheap, white-labeled products from Chinese factories sold directly to U.S. consumers, TikTok’s strategy has been to onboard and highlight more branded goods, making it a more of a direct competitor to Amazon.

TikTok is also looking to attract sellers with more traditional subsidies. According to reports, to encourage merchants to sell goods at a steep discount during the most recent Black Friday sales period, TikTok doled out subsidies to those merchants to mark down their prices by as much as 50%.

Merchants have been interested in selling on the app simply because TikTok’s short video platform generates massive engagement. According to a survey from Tabcut, a Chinese firm that tracks TikTok Shop performance, nearly 70% of sellers reported an increase in sales year-over-year for the first 11 months of 2023.

This is also borne out by consumer behavior, where products endorsed by influencers continue to gain ground, especially with coveted younger consumers. According to Jungle Scout, nearly 20% of consumers began their search for products on TikTok in the first quarter of 2023, up 44% from a year ago. While 56% of all consumers still preferred to start their product search on Amazon, 40% of the Gen Z demographic preferred TikTok for search instead of Google.

The Heavy Concentration of Young Shoppers

TikTok has the opportunity to reshape how America’s younger generations shop online. With 52% of TikTok’s U.S. users aged 18-34, according to Pew Research, it has the potential to","https://techcrunch.com/wp-content/uploads/2021/09/tiktok-shop-tab.jpg?resize=1200,669",2024-03-30 17:00:02,"""Discover New Opportunities: TikTok's E-commerce Dream and Its Potential Impact on Amazon Sellers""", TikTok E-commerce Dream ,Technology,"Formicoders,News,AI,Technology,Innovation,Programmering,Coding,Wordpress,Python"
https://techxplore.com/news/2024-03-optimization-based-method-autonomous.html,An optimization-based method to enhance autonomous parking,"Title: Revolutionary Planner Boosts Autonomous Parking Ability

Revolutionary planner developed by Mach Drive in Shanghai has significantly enhanced the ability of cars to safely reach a parking spot without colliding with objects on the way. OCEAN planner, which builds on a previously introduced approach called Hybrid Optimization-based Collision Avoidance (H-OBCA), has addressed its primary limitations, enhancing its ability to avoid collisions, robustness, and speed in real time. The planner's design was tested on hundreds of simulated scenarios and conducted real-world experiments in public parking areas, outperforming a variety of methods for autonomous parking applications. The proposed method makes it possible to deploy large-scale parking planner on low computing power platforms.","Title: A Revolutionary Planner Enhances Autonomous Parking of Vehicles

Introduction

Autonomous vehicles have been a long-standing goal of both the robotics industry and the automotive sector. While significant progress has been made in the development of these vehicles, their deployment in a widespread setting has been limited. Recently, researchers have been exploring the possibility of ""automated valet parking"" (AVP), a function that would allow a car to drive itself from the entrance of a parking lot to a free parking spot. While AVP has garnered substantial research interest, its reliable realization has so far proved challenging. In this article, we explore a new trajectory planner developed by researchers at Mach Drive in Shanghai, which has significantly enhanced the ability of cars to safely reach a parking spot without colliding with objects on the way.

Body

The new planner, known as OCEAN (Openspace Collision-freE trAjectory plaNner), addresses the two primary limitations of previous approaches to autonomous parking. The first limitation involves the inability to accurately predict collisions, while the second entails poor performance in real-time tests. OCEAN planner build on a previously introduced approach called Hybrid Optimization-based Collision Avoidance (H-OBCA), addressing its primary limitations.

OCEAN planner's improved design enhances its ability to avoid collisions, along with its robustness and speed in real time. The OCEAN planner starts by warm-starting a collision-free Hybrid A trajectory, then reformulating the collision avoidance trajectory planning problem as a smooth and convex dual form and solving it by ADMM (Alternating Direction Method of Multiplier) in parallel. The optimization variables are carefully split into several groups, so that ADMM sub-problems are formulated as Quadratic Programming (QP), Sequential Quadratic Programming (SQP), and Second Order Cone Programming (SOCP) problems that can be efficiently and robustly solved.

The researchers tested the OCEAN planner on hundreds of simulated scenarios and conducted real-world experiments in public parking areas. Their results were highly promising, as OCEAN was found to outperform a variety of methods for autonomous parking applications. The proposed method makes it possible to deploy large-scale parking planner on low computing power platforms",https://scx2.b-cdn.net/gfx/news/hires/2024/an-optimization-based.jpg,2024-03-30 09:00:01,"Title: Revolutionize Your Parking with Autonomous Vehicles and OCEAN Planner

Introduction

Say goodbye to the hassle of finding parking spots with our new autonomous vehicle technology and OCEAN planner. Our latest advancement in robotics and automotive sectors has made it possible for cars to drive themselves to a free parking spot without collisions. In this article, we explore the OCEAN planner, a revolutionary new approach to autonomous parking that has significantly enhanced the ability of cars to safely reach a parking spot.

Body

The OCEAN planner, developed by Mach Drive in Shanghai, addresses two main limitations of previous approaches to autonomous parking. First, it improves the ability to accurately predict collisions, and second, it enhances performance in real-time tests. OCEAN planner builds on a previously introduced approach called Hybrid Optimization-based Collision Avoidance (H-OBCA), addressing its primary limitations.

OCEAN planner's enhanced design makes it more robust and faster in real-time, allowing cars to safely navigate the parking lot and find a free spot. It starts by warm-starting a collision-free Hybrid A trajectory, then reformulates the collision avoidance trajectory planning problem as a smooth and convex dual form and solves it by ADMM (Alternating Direction Method of Multiplier) in parallel. The optimization variables are carefully split into several groups, so that ADMM sub-problems are formulated as Quadratic Programming (QP), Sequential Quadratic Programming (SQP), and Second Order Cone Programming (SOCP) problems that can be efficiently and robustly solved.

The OCEAN planner was tested on hundreds of simulated scenarios and conducted real-world experiments in public parking areas. The results were highly promising, with OCEAN outperforming a variety of methods for autonomous parking applications. Our proposed method makes it possible to deploy large-scale parking planner on low computing power platforms.

Don't miss out on this revolutionary technology - try it today and experience the convenience of autonomous parking with OCEAN planner!

Call to Action: Try OCEAN planner today and revolutionize your parking experience. Visit our website to learn more and get started now.",Autonomous Parking,Technology,"Formicoders,News,AI,Technology,Innovation,Programmering,Coding,Wordpress,Python"
https://techxplore.com/news/2024-03-simultaneous-energy-algorithm-6g-vision.html,Simultaneous performance improvement and energy savings with an innovative algorithm for 6G vision services,Optimized VisionScaling for 6G Mobile Vision Services: Cutting-Edge Algorithm Combines Accuracy and Efficiency for Real-Time Resource Utilization,"

Welcome to our blog post on the latest research in the field of 6G mobile vision services. In this article, we will delve into the work of Professor Jeongho Kwak from the Department of Electrical Engineering and Computer Science at DGIST, who has developed a learning model and resource optimization technology that combines accuracy and efficiency for 6G vision services.

6G mobile vision services are associated with cutting-edge technologies such as augmented reality (AR) and autonomous driving, which are receiving significant attention in modern society. These services enable quick capturing of videos and images, and efficient understanding of their content through deep learning-based models. However, this requires high-performance processors (GPUs) and accurate learning models. Previous technologies treated learning models and computing/networking resources as separate entities, failing to optimize performance and mobile device resource utilization.

To address this issue, Professor Kwak's team focused on simultaneously optimizing learning models and computing/networking resources in real-time. As a result, they proposed a new integrated learning model and computing/networking optimization algorithm, VisionScaling, which is capable of reducing energy consumption by at least 30% while maintaining average accuracy compared to current technologies without compromising on average target accuracy or time delay.

The VisionScaling algorithm developed by Professor Kwak's team adapts to constantly changing mobile environments to maintain optimal performance, even without prior knowledge of future conditions, through the use of 'Online Convex Optimization (OCO),' one of the latest learning techniques. Furthermore, Professor Kwak's team implemented and tested the real-world mobile vision service environment using embedded AI devices and connected edge computing platforms. They confirmed that the developed VisionScaling algorithm saves 30% more energy in mobile devices and improves end-to-end latency by 39% compared to previously used algorithms.

Professor Jeongho Kwak from the Department of Electrical Engineering and Computer Science at DGIST stated, ""This research satisfies both the practical contribution of implementing and verifying performance in irregularly changing mobile environments and the mathematical contribution of utilizing dynamic optimization and learning techniques to prove optimal performance. It is significant as it provides a technical foundation for deep learning-based mobile services requiring higher memory/computing resources in the future.""

In conclusion, Professor Kwak's research provides a significant contribution to the field of 6G mobile vision services by combining accuracy and efficiency in resource optimization. The development of the VisionScaling algorithm is a game-changer in the field, providing a technical foundation for future deep learning-based mobile services that require higher memory/computing resources. The research is published in the IEEE Internet of Things Journal.

",https://scx2.b-cdn.net/gfx/news/hires/2024/wireless-tower.jpg,2024-03-30 13:40:01,Optimize 6G mobile vision services with VisionScaling algorithm. Reduce energy consumption by 30% while maintaining accuracy. Discover the latest research by Professor Jeongho Kwak from DGIST.,"The keyphrase for this news article is ""VisionScaling algorithm"".",Technology,"Formicoders,News,AI,Technology,Innovation,Programmering,Coding,Wordpress,Python"
https://www.zdnet.com/article/buy-a-windows-11-pro-license-for-just-25-right-now-last-chance/,Buy a Windows 11 Pro license for just $25 right now: Last chance," ""ZDNET's Product Recommendations: How They're Made, Funded, and Influenced"" ","Introduction:

ZDNET is a reputable source for technology news and product recommendations. In this article, we will explore what it means when ZDNET recommends a product or service. We will delve into how the recommendations are made, how they are funded, and how they are different from traditional advertising.

Body:

When ZDNET recommends a product or service, it means that our editorial team has thoroughly tested, researched, and compared it to other options available in the market. We gather data from a variety of sources, including vendor and retailer listings, other independent review sites, and customer reviews. Our goal is to provide our readers with the most accurate and knowledgeable advice possible when it comes to making buying decisions on tech gear and other products and services.

We follow strict guidelines to ensure that our editorial content is never influenced by advertisers. Our goal is to deliver the most unbiased and informative content possible. In fact, we do not accept any advertising or sponsorships for our product recommendations. Instead, we earn affiliate commissions when our readers click through to a retailer and purchase a product or service that we have recommended. This helps support our work, but it does not affect the price our readers pay.

It is important to note that our product recommendations are based on our own research and testing, not on any external factors such as advertising or sponsorships. We strive to provide our readers with the most accurate and informative recommendations possible, and we take pride in our ability to do so.

Conclusion:

In conclusion, ZDNET's product recommendations are based on extensive testing, research, and comparison shopping. Our goal is to provide our readers with the most accurate and knowledgeable advice possible when it comes to making buying decisions on tech gear and other products and services. We follow strict guidelines to ensure that our editorial content is never influenced by advertisers, and we are committed to providing our readers with the most unbiased and informative content possible.",https://www.zdnet.com/a/img/resize/210bc66f7f72578d128c268bf78cbcf817209402/2023/10/03/e02665e0-f9de-434f-99f7-45a3cde856fa/windowspro-stack-social.jpg?auto=webp&fit=crop&height=675&width=1200,2024-03-31 06:00:00,"Make your next tech purchase with confidence as ZDNET's product recommendations are thoroughly tested, researched, and compared. Our team follows strict guidelines to ensure independence, earning us readers' trust. Explore our product recommendations now!

[Focus Keyphrase: Product Recommendations]", ZDNET's Product Recommendations ,Technology,"Formicoders,News,AI,Technology,Innovation,Programmering,Coding,Wordpress,Python"
https://techcrunch.com/2024/03/30/fisker-loses-customers-money-robinhood-launches-a-credit-card-and-google-generates-travel-itineraries/,"Fisker loses customers' money, Robinhood launches a credit card, and Google generates travel itineraries","Fisker's Financial Mishaps, Google's Itinerary Planner, Robinhood's Gold Card, and AT&T's Data Breach: TechCrunch's Week in Review.","

Hey there, tech enthusiasts! Welcome to the latest edition of TechCrunch's Week in Review (WiR), your go-to source for the most exciting and groundbreaking tech news of the week.

In this edition, we've got a lot to cover, from Fisker's financial fiasco to Facebook's sneaky Snapchat snooping. But before we dive into the juicy details, let's take a moment to remind you to sign up for the WiR newsletter to get the latest tech updates delivered straight to your inbox every Saturday.

Now, let's get started!

Fisker Suspended:
Fisker, the EV startup that recently made headlines for their inefficient customer payment system, has hit another hurdle. The New York Stock Exchange has suspended trading of Fisker's stock, citing ""abnormally low"" stock levels. This is yet another blow for Fisker, which has been struggling to keep up with demand and maintain financial stability.

AI-Powered Itineraries:
Google has recently upgraded its Search Generative Experience to include the ability to plan a travel itinerary. Using AI, Search will gather ideas from various websites and incorporate reviews, photos, and other details to create a personalized itinerary for users. This new feature is aimed at making travel planning easier and more efficient for users.

Robinhood's New Card:
Robinhood, the popular financial management app, has recently launched its new Gold Card, powered by X1's technology. The card offers various features that could make Apple Card users envious, including cashback rewards, no annual fee, and up to 5% cashback on select purchases. This move by Robinhood could further solidify its position as a strong competitor in the financial management industry.

AT&T's Data Breach:
In a concerning development, the personal information of over 73 million AT&T customers was spilled online this week. Despite the hack having occurred over three years ago, AT&T is yet to reveal how the breach occurred. This incident highlights the importance of data security and the potential consequences of a data breach.

Funding:
In other funding news, Copilot, the budgeting app that has benefited from the demise of Mint, has raised $6 million in a Series A round led by Nico Wittenborn's Adjacent. Meanwhile, canned water startup Liquid Death has raised $67 million in a funding round, bringing its total raised to over $267 million. These funding successes highlight the growing demand for innovative financial management and beverage solutions.

Analysis:
In his latest analysis, Ron discusses the parallels between Nvidia's and AWS' growth trajectories. As Nvidia continues to grow in the AI and data center markets, it is poised to become the next dominant player in the cloud computing industry.

Podcasts:
This week on Equity, the team discussed Robinhood's new credit card, Fisker's latest troubles, and Databricks' new AI model. They also highlighted two companies building startups focused on kids and looked at a new $100 million fund aimed at backing innovative climate tech. On Found, Allison Wolff discussed the importance of proper land management in mitigating wildfires. Finally, on Chain Reaction, Jacquelyn interviewed Scott Dykstra about Space and Time, a verifiable compute layer for web3 that focuses on scaling zero-knowledge proofs.

Bonus Round:
In exciting news, Spotify is testing an online learning offering, offering freemium video courses as part of its efforts to keep users engaged on its platform. This move could pave the way for new revenue streams for the music streaming giant.

That's all for this week's WiR! Stay tuned for more exciting tech news and updates in the weeks to come.

","https://techcrunch.com/wp-content/uploads/2024/03/GettyImages-1236611991.jpg?resize=1200,759",2024-03-30 20:15:06,"Sign up for the Week in Review newsletter to stay up-to-date with the latest tech news, including Fisker's financial struggles, Google's AI-powered itineraries, Robinhood's new credit card, and AT&T's data breach. Plus, get insights and analysis from our expert team. Subscribe now!","TechCrunch Week in Review (WiR) - Fisker Suspended, Google AI-Powered Itineraries, Robinhood Launches Credit Card, and AT&T Data Breach",Technology,"Formicoders,News,AI,Technology,Innovation,Programmering,Coding,Wordpress,Python"
https://www.engadget.com/microsoft-copilot-has-reportedly-been-blocked-on-all-congress-owned-devices-034946166.html,Microsoft Copilot has reportedly been blocked on all Congress-owned devices, Microsoft Copilot Blocked on Congress-Owned Devices; US Government Takes AI Security Seriously ,"In recent news, the US Congress has prohibited the use of Microsoft's Copilot AI chatbot on their government-issued devices. The Office of Cybersecurity deemed the chatbot to be a risk due to the threat of leaking House data to non-House approved cloud services. While staffers can still use Copilot on their personal phones and laptops, it will no longer be available on all Windows devices owned by Congress.
This news comes a year after the Congress set strict limits on the use of ChatGPT, which is powered by OpenAI's large language models. Staffers were banned from using the free version of the chatbot on House computers but were allowed to continue using the paid version for research and evaluation due to its tighter privacy controls.
Recently, the White House released rules that federal agencies must follow when it comes to generative AI. These rules aim to ensure that any tool used by agencies does not endanger the rights and safety of Americans. Microsoft has recognized the need for higher security requirements and announced a roadmap of tools and services intended for government use, including an Azure OpenAI service for classified workloads and a new version of Microsoft 365's Copilot assistant. All these tools and services will feature higher levels of security that make them suitable for handling sensitive data.
Szpindor's office will evaluate the government version Copilot when it becomes available before deciding if it can be used on House devices. However, it is clear that government agencies are taking the threat of AI-related security risks seriously and are taking steps to protect sensitive data.",https://s.yimg.com/ny/api/res/1.2/wDCn8FUMHSGZ9JddUvosHA--/YXBwaWQ9aGlnaGxhbmRlcjt3PTEyMDA7aD03ODI-/https://s.yimg.com/os/creatr-uploaded-images/2024-03/f171ef30-ee34-11ee-bf2d-509460709f05,2024-03-30 03:49:46,"Meta Description: Microsoft Copilot banned from Congress-owned devices, but government agencies are taking AI-related security risks seriously. Learn more about the government's new rules for generative AI.","The keyphrase for this article is ""Microsoft Copilot on Congress-owned devices"".",Technology,"Formicoders,News,AI,Technology,Innovation,Programmering,Coding,Wordpress,Python"
