Link,post_title,title,post_content,featured_image,Date-Publish,meta_desc,focuskeywords,post_category,Post_tag
https://www.zdnet.com/article/ai-taking-on-more-work-doesnt-mean-it-replaces-you-here-are-12-reasons-to-worry-less/,AI taking on more work doesn't mean it replaces you. Here are 12 reasons to worry less,"Title: AI & Jobs: Adapting to the Future with New Skills

Introduction

Rapid tech advancements, including AI, reshape jobs & career paths. AI brings opportunities & challenges for employees & employers.

The Impact

AI offers cost-saving opportunities for businesses, potentially replacing jobs. Yet, AI also helps budget-constrained individuals & SMBs enhance work output & compete with larger players.

Evolution of Work Roles

Technological advancements create new opportunities & growth for those driving change, while transition can be difficult for those in careers left behind.

Preparing for AI-Powered Future

Stay informed, acquire relevant skills, embrace lifelong learning, and adapt to the ever-changing job market to thrive in an AI-driven world.","Title: The Impact of AI on Jobs: A Double-Edged Sword

Introduction

Over the years, the rapid advancement of technology has significantly transformed various aspects of our lives, including the job market. The integration of artificial intelligence (AI) into the workforce is the latest disruptive force that is reshaping jobs and career paths. This development brings both opportunities and challenges, affecting employees and employers alike.

The Double-Edged Sword of AI

Artificial intelligence, as a ""good news, bad news"" story, offers cost-saving opportunities for businesses by potentially replacing human writers, programmers, or designers with AI-powered tools like ChatGPT. On the flip side, this trend can be alarming for workers who rely on these jobs for their livelihood.

However, AI also presents a valuable opportunity for budget-constrained individuals and small businesses to enhance their work output, compete with larger players, and reclaim personal time. Generative AI even helps those who struggle with linguistic or artistic skills to produce high-quality work they might not have been able to accomplish otherwise.

The Evolution of Work Roles and Career Paths

Technological advancements, by their very nature, are disruptive. For those driving this change, the cycle of progress and obsolescence paves the way for new opportunities and growth. But for those in careers left behind, the transition can be difficult.

Consider the example of the telephone. In the early 20th century, telephone systems relied on human operators to manage connections. With the advent of electronic switching and dial phones, many of these jobs became obsolete. However, this shift also created new opportunities to serve emerging needs.

Similarly, the rise of automobiles, digital cameras, and electric vehicles has replaced traditional jobs and skills, making way for new ones.

Preparing for the AI-Powered Future

To adapt to the ever-changing job market, workers must stay informed about emerging technologies and acquire the necessary skills to thrive in the new landscape. Here are five steps to pivot your career in response to AI:

1. Stay informed: Keep up-to-date with AI advancements and their implications on various industries.
2. Acquire relevant skills: Develop skills that complement AI, focusing on creativity, critical thinking, and problem-solving.
3. Embrace lifel",https://www.zdnet.com/a/img/resize/72571c1445b33317c01ae9d140c4b951162623d4/2024/04/05/a6d04e2c-581e-4005-b091-a8968e05a6d1/workerssunrisegettyimages-674977783.jpg?auto=webp&fit=crop&height=675&width=1200,2024-04-05 00:00:00,"""Discover the dual impact of AI on jobs: cost savings for businesses, opportunities for all. Stay informed, gain AI-friendly skills. Prepare for the future!""

In this meta description, I've summarized the main theme of the article, emphasized the benefits and challenges of AI, and included a call to action encouraging users to stay informed and acquire relevant skills. It is actionable, written in an active voice, and highlights the focus keyphrase ""AI.""","Longer Articles:

Title: The Impact of AI on Jobs: A Double-Edged Sword

Introduction

Over the years, the rapid advancement of technology has significantly transformed various aspects of our lives, including the job market. The integration of artificial intelligence (AI) into the workforce is the latest disruptive force that is reshaping jobs and career paths. This development brings both opportunities and challenges, affecting employees and employers alike.

The Double-Edged Sword of AI

Artificial intelligence, as a ""good news, bad news"" story, offers cost-saving opportunities for businesses by potentially replacing human writers, programmers, or designers with AI-powered tools like ChatGPT. On the flip side, this trend can be alarming for workers who rely on these jobs for their livelihood.

However, AI also presents a valuable opportunity for budget-constrained individuals and small businesses to enhance their work output, compete with larger players, and reclaim personal time. Generative AI even helps those who struggle with linguistic or artistic skills to produce high-quality work they might not have been able to accomplish otherwise.

AI and the Job Market: Preparing for the Future

As AI continues to advance, workers must be proactive in learning about these technologies and adapting to the new landscape. The following steps outline how to prepare for the AI-powered future:

1. Stay informed: Keep up-to-date with AI advancements and their implications on various industries. This will allow you to identify opportunities and threats arising from AI integration.

2. Acquire relevant skills: Develop skills that complement AI, focusing on creativity, critical thinking, and problem-solving. By strengthening these abilities, you can work alongside AI tools to optimize your performance.

3. Embrace lifelong learning: The rapid advancement of AI requires continuous learning. Regularly update your skillset and knowledge base to ensure you remain relevant in the job market.

4. Collaborate with AI: Learn to work with AI tools, rather than against them. By understanding how these tools function, you can better utilize them to streamline your workflow and increase your productivity.

5. Adaptability: Embrace change and be adaptable to new circumstances. The more flexible you are, the better you'll be able to pivot and thrive in a world driven by AI.",Technology,"Formicoders,News,AI,Technology,Innovation,Programmering,Coding,Wordpress,Python"
