Link,post_title,title,post_content,featured_image,Date-Publish,meta_desc,focuskeywords,post_category,Post_tag
https://techxplore.com/news/2024-04-3d-key-components-mass-spectrometer.html,Researchers 3D print key components for a point-of-care mass spectrometer, Revolutionary Miniature Ionizer: Future of Home-Based Health Monitoring ,"Title: A Revolutionary Miniature Ionizer: The Future of Home-Based Health Monitoring

Introduction

Imagine a world where monitoring your health is as simple as using a home appliance. This vision could soon become a reality, thanks to the groundbreaking work of researchers at the Massachusetts Institute of Technology (MIT). They've developed a miniature ionizer, a crucial component of a mass spectrometer, which could pave the way for affordable, in-home health monitoring devices. Let's delve into the details of this innovative invention and explore its potential impact on chronic disease management.

The Power of Mass Spectrometry

Mass spectrometry is a technique used to identify and measure the chemical components of a sample with high precision. This technology can be instrumental in monitoring the health of individuals with chronic illnesses, such as measuring hormone levels in the blood of someone with hypothyroidism. However, mass spectrometers are typically expensive and confined to laboratory settings, making the process of health monitoring cumbersome and inefficient.

A Vision for the Future

Luis Fernando Velásquez-García, a principal research scientist in MIT's Microsystems Technology Laboratories (MTL), dreams of making mass spectrometry accessible and local. The goal is to create an inexpensive, at-home device for people with chronic diseases requiring constant monitoring. To make this vision a reality, the researchers focused on developing a low-cost ionizer, a critical component of all mass spectrometers.

A Groundbreaking 3D-Printed Ionizer

The MIT team has successfully 3D printed a miniature ionizer that outperforms its state-of-the-art counterparts by twice the efficiency. This compact device, measuring just a few centimeters, can be manufactured in large quantities using efficient, robotic assembly methods. The mass production of these ionizers would significantly reduce costs compared to traditional ionizers, which often require expensive hardware or clean room conditions.

The Benefits of 3D Printing

By leveraging 3D printing technology, the researchers were able to precisely control the shape and composition of the ionizer, incorporating materials that boosted its performance. The ionizer is fabricated using binder jetting, a 3D printing process that involves layering powdered material with a polymer-based glue. After heating the object",https://scx2.b-cdn.net/gfx/news/2024/researchers-3d-print-k.jpg,2024-04-04 10:04:01,"Discover a revolutionary miniature ionizer for affordable, in-home health monitoring. MIT's groundbreaking 3D-printed device enhances mass spectrometry efficiency, promising better chronic disease management.
Meta Description:
""Explore MIT's revolutionary 3D-printed miniature ionizer for accessible, in-home health monitoring. Boosting mass spectrometry efficiency, this breakthrough promises improved chronic disease management."" (148 characters)", AI personalities ,Technology,"Formicoders,News,AI,Technology,Innovation,Programmering,Coding,Wordpress,Python"
https://techxplore.com/news/2024-04-framework-air-ground-robot-complex.html,A framework to improve air-ground robot navigation in complex occlusion-prone environments, AGRNav Revolutionizes Air-Ground Robot Navigation in Occlusions ,"Title: Soaring Through Occlusions: AGRNav Revolutionizes Air-Ground Robot Navigation

In the ever-evolving world of robotics, researchers are constantly pushing the boundaries to create more autonomous and efficient machines. A significant challenge in this field is navigating robots through complex, occlusion-prone environments. A group of researchers from the University of Hong Kong has recently developed a groundbreaking framework, AGRNav, to enhance the autonomous navigation of air-ground robots in such settings.

Traditional robotic systems have been predominantly deployed in controlled indoor environments, such as warehouses, airports, and offices. However, there is a growing need for these machines to operate in unknown and unmapped outdoor settings, where obstacles can easily obstruct their sensors, increasing the risk of collisions. Air-ground robots, in particular, have the potential to revolutionize various applications, from search and rescue operations in disaster-stricken areas to package delivery in remote locations and environmental monitoring.

The primary hurdle in navigating air-ground robots through outdoor environments is the presence of occlusions, which can lead to suboptimal trajectories, higher collision probabilities, and increased energy consumption. To tackle this issue, the research team introduced AGRNav, a novel framework comprising two main components: a lightweight semantic scene completion network (SCONet) and a hierarchical path planner.

SCONet predicts the distribution of obstacles and their semantic features using a deep learning approach, which requires minimal computational power. The hierarchical path planner, on the other hand, utilizes the predictions made by SCONet to generate optimal, energy-efficient aerial and ground paths for the robot to reach a specific location.

The researchers evaluated AGRNav in both simulations and real-world experiments, using a customized air-ground robot. The results demonstrated that AGRNav outperformed all other baseline and state-of-the-art robot navigation frameworks, efficiently identifying optimal and energy-saving paths for the robot.

The implications of this research are far-reaching, as AGRNav's underlying code is open-source and accessible to developers worldwide. The framework could be deployed and tested on various air-ground robotic platforms, paving the way for their effective deployment in real-world environments.

In summary, the A",https://scx2.b-cdn.net/gfx/news/hires/2024/a-framework-to-improve.jpg,2024-04-05 06:50:02,"Meta Description: Revolutionize air-ground robot navigation with AGRNav! This lightweight semantic scene completion network & hierarchical path planner predicts obstacles & generates optimal, energy-saving paths. Test it today.

Keyphrase: AGRNav air-ground robot navigation

Length: 15 words

Active voice and call to action: Revolutionize, predicts, generates, and test it today

Matches content: The meta description highlights the main features of AGRNav and encourages readers to test the framework.

Unique: The meta description is unique, as it is specifically tailored to the news article content.

Key points and facts: AGRNav is a revolutionary framework for air-ground robot navigation, which consists of a lightweight semantic scene completion network and a hierarchical path planner. It outperforms other navigation frameworks in identifying optimal and energy-saving paths. The code is open-source and accessible to developers worldwide.","GRNav framework, with its lightweight semantic scene completion network and hierarchical path planner, is set to revolutionize air-ground robot navigation in complex occlusion-prone environments. By efficiently predicting obstacle distributions and generating optimal, energy-saving paths, AGRNav demonstrates significant improvements over existing robot navigation frameworks. This breakthrough research has the potential to unlock the true potential of air-ground robots in various applications, from search and rescue operations to environmental monitoring and package delivery.",Technology,"Formicoders,News,AI,Technology,Innovation,Programmering,Coding,Wordpress,Python"
https://techxplore.com/news/2024-04-proof-principle-3d-magnetic-hard.html,Proof-of-principle demonstration of 3D magnetic recording could lead to enhanced hard disk drives," 

3D Magnetic Recording Boosts Hard Drive Capacity: A Breakthrough ","Title: A Revolutionary Three-Dimensional Approach to Magnetic Recording in Hard Disk Drives

In a groundbreaking development for the world of data storage, a team of researchers from NIMS, Seagate Technology, and Tohoku University have successfully demonstrated the potential of multi-level recording using a three-dimensional magnetic recording medium. This pioneering technology promises to significantly increase the storage capacity of hard disk drives (HDDs), paving the way for more efficient and cost-effective solutions in the near future.

Presently, data centers store massive quantities of information on HDDs equipped with perpendicular magnetic recording (PMR) technology, which can accommodate areal densities of approximately 1.5 Tbit/in2. However, in order to transition to higher densities, a high anisotropy magnetic recording medium incorporating FePt grains and heat-assisted laser writing is necessary. This method, known as heat-assisted magnetic recording (HAMR), can sustain areal recording densities of up to 10 Tbit/in2, with the potential for even greater densities exceeding 10 Tbit/in2 based on a new principle that involves storing multiple recording levels of 3 or 4, as opposed to the binary level used in conventional HDD technology.

In their study, published in Acta Materialia, the team managed to arrange the FePt recording layers three-dimensionally by fabricating lattice-matched, FePt/Ru/FePt multilayer films, with Ru acting as a spacer layer. Measurements of the magnetization revealed that the two FePt layers possess different Curie temperatures, enabling three-dimensional recording by adjusting the laser power during the writing process.

To further illustrate the principle of 3D recording, the researchers conducted recording simulations using a media model that mimics the microstructure and magnetic properties of the fabricated media. This innovative technique has the potential to increase recording capacity by stacking recording layers in three dimensions, allowing for the storage of more digital information using fewer HDDs, and ultimately resulting in energy savings for data centers.

The team's future plans involve developing processes to reduce the size of FePt grains, enhance orientation and magnetic anisotropy, and stack additional FePt layers to create a media structure suitable for practical use in high-density HDDs. This revolutionary three-",https://scx2.b-cdn.net/gfx/news/2024/proof-of-principle-dem.jpg,2024-04-04 11:00:33,"Revolutionize data storage with 3D magnetic recording! New tech: multi-level FePt layers, heat-assisted laser writing, & 10 Tbit/in2 density. HDD DataStorageRevolution 
(100 characters)","dimensional approach to magnetic recording in hard disk drives

could lead to enhanced hard disk drives, revolutionizing the way data centers store massive quantities of information. With the ability to significantly increase storage capacity and reduce energy consumption, this groundbreaking technology is set to transform the data storage landscape. As HDDs equipped with perpendicular magnetic recording (PMR) technology reach their limit, the development of high anisotropy magnetic recording medium incorporating FePt grains and heat-assisted laser writing emerges as the answer to sustaining areal densities of up to 10 Tbit/in2, with potential for even greater densities.

The recent breakthrough by the team of researchers from NIMS, Seagate Technology, and Tohoku University marks a significant milestone in the quest for high-density data storage. By arranging the FePt recording layers three-dimensionally, the team has unlocked the potential for multi-level recording, enabling the storage of multiple recording levels, as opposed to the binary level used in conventional HDD technology. The result—a pioneering 3D magnetic recording medium that promises to revolutionize the world of data storage.

As this 3D magnetic recording medium technology progresses towards practical implementation, the benefits for data centers are clear: increased recording capacity, reduced energy consumption, and ultimately, a more efficient and cost-effective solution for storing massive quantities of information. The future of high-density HDDs is here, and it's three-dimensional.",Technology,"Formicoders,News,AI,Technology,Innovation,Programmering,Coding,Wordpress,Python"
https://techxplore.com/news/2024-04-ultra-lowpower-memory-neuromorphic.html,Researchers develop a novel ultra-low-power memory for neuromorphic computing,"Power Phase Change Memory for AI Hardware: A Game Changer

or

Revolutionary Low-Power PCAM: A Game Changer for AI Memory and Neuromorphic Computing

Both options are under 50 characters and highlight the key points of the article, emphasizing the breakthrough in low-power phase change memory technology and its significance for AI hardware and neuromorphic computing.","Title: Revolutionary Low-Power Phase Change Memory: A Game Changer for AI Hardware and Neuromorphic Computing

A breakthrough in memory technology has been achieved by a team of Korean researchers, led by Professor Shinhyun Choi from the KAIST School of Electrical Engineering. This groundbreaking development, published in Nature, presents a next-generation phase change memory (PCAM) device with ultra-low power consumption, paving the way for the replacement of existing memory and the implementation of neuromorphic computing in next-generation artificial intelligence (AI) hardware.

Traditional phase change memory devices exhibit high power consumption, which poses a significant challenge in creating practical large-capacity memory products or realizing neuromorphic computing systems. Although previous research focused on reducing power consumption by shrinking the device's physical size through advanced lithography technologies, these efforts faced practicality issues due to increased fabrication costs and complexity.

To tackle the power consumption problem, Professor Choi's team developed a method for electrically forming phase change materials in an extremely small area, leading to an ultra-low-power PCAM device that consumes 15 times less power than a conventional PCAM device fabricated with expensive lithography tools.

Conventional PCAM devices combine the advantages of both DRAM and NAND flash memory, offering high speed and non-volatile characteristics. This unique combination makes PCAM a promising candidate for next-generation memory, as it has the potential to replace existing memory and serve as a neuromorphic computing technology that mimics the human brain.

The new PCAM device, however, takes things a step further by significantly reducing power consumption. By forming a highly confined nanometer-scale phase changeable filament without expensive fabrication processes, the team addressed the challenges of high processing costs and substantial power requirements associated with existing PCAM devices.

The innovation is expected to have a significant impact on the future of electronic engineering, enabling various applications such as high-density three-dimensional vertical memory and neuromorphic computing systems. This breakthrough will contribute to making AI hardware more energy-efficient, which is crucial for the development of large-scale AI systems and neuromorphic computing.

In summary, the novel PCAM device developed by Professor Shinhyun Choi's team offers a promising solution to the power consumption problem that has long plagued the advancement of phase change memory technology. This revolutionary low",https://scx2.b-cdn.net/gfx/news/hires/2024/researchers-develop-a-6.jpg,2024-04-04 10:04:57,"Meta Description: Discover a game-changing low-power phase change memory breakthrough, reducing power consumption by 15x in next-gen AI hardware. Boost energy efficiency for large-scale AI systems & neuromorphic computing.

(17 words, active voice, actionable, call-to-action, focus keyphrase, specifications, content match, unique)", Low-power ,Technology,"Formicoders,News,AI,Technology,Innovation,Programmering,Coding,Wordpress,Python"
https://techcrunch.com/2024/04/05/from-yc-to-ipo-winter-2024-demo-day-rubrik-and-ibotta/,"From YC to IPO: Winter 2024 Demo Day, Rubrik and Ibotta"," Startup Roundup: YC's Top Picks, Autism-focused VC & IPO Previews ","Title: Startup Highlights: Y Combinator's Latest Cohort, Autism-focused VC, and IPO Updates

Introduction:

This week has been an exciting one in the startup world, with two action-packed days of Y Combinator demo day activities and a host of other significant developments. On this week's episode of TechCrunch's Equity podcast, Mary Ann, Becca, and Alex discussed their favorite startups from the latest YC cohort, an autism-focused venture capital fund, and upcoming Initial Public Offerings (IPOs). Let's dive into the details.

Y Combinator Demo Day Favorites:

The Y Combinator demo day saw a plethora of new and innovative startups pitching their ideas. Among the many startups, two caught the attention of our TechCrunch team:

1. Seso: A fintech startup targeting the agricultural sector, Seso is addressing the unique challenges faced by farmers and agribusinesses. By offering a range of financial services, including lending and insurance, Seso aims to streamline the agricultural supply chain and promote financial inclusion.
2. Home From College: This startup, which recently secured a seed round, is making campus living more convenient and affordable for students. Through its platform, students can find housing, split costs, and manage their living situation with ease.

Autism-focused VC Fund:

A new venture capital fund, aiming to become the ""investment and innovation arm of the autism community,"" caught the attention of our team. This unique fund is dedicated to supporting startups that have a direct impact on the autism community, as well as those that employ and empower individuals with autism. By providing capital and resources to these companies, the fund aims to foster innovation, promote inclusivity, and create meaningful opportunities for those on the autism spectrum.

Impending IPOs:

Two notable IPOs are on the horizon, with Ibotta and Rubrik preparing to go public. The Rubrik deal is particularly interesting, as it may serve as a heat-check for unprofitable unicorns seeking an exit. With many unicorns facing the need to find an exit quickly, the success or failure of Rubrik's IPO could set an important precedent for others in the","https://techcrunch.com/wp-content/uploads/2022/09/yc-2022-fall-2.jpg?resize=1200,675",2024-04-05 14:05:53," (17 words) Meta Description with focus keyphrase ""Startup News,"" actionable, and unique. ", IPO Updates ,Technology,"Formicoders,News,AI,Technology,Innovation,Programmering,Coding,Wordpress,Python"
https://www.zdnet.com/article/google-books-and-scholar-users-beware-ai-generated-nonsense-is-flooding-search-results/,Google Books and Scholar users beware: AI-generated nonsense is flooding search results,"AI-Generated Content Infiltrates Google Books & Scholar: An Alarming Trend

In the digital age, Google Books and Scholar are trusted sources for research and knowledge. However, an unsettling trend has emerged: low-quality AI-generated content is infiltrating these platforms, posing as human-written works. Querying AI chatbot ChatGPT uncovered numerous books on Google Books using the phrase ""As of my last knowledge update,"" resembling superficial narratives reminiscent of Wikipedia entries. Similarly, Google Scholar has 19 pages of results containing the same phrase, covering various topics. This AI-generated content weakens the credibility of reputable resources, as Google responds to this pressing issue.","Title: The Rise of AI-Generated Content in Reputable Digital Libraries: A Troubling Trend

In today's digital age, many of us rely on Google Books and Google Scholar to find information, conduct research, and discover new books on various topics. However, a recent discovery has uncovered an alarming trend: these platforms have started indexing low-quality, AI-generated books masquerading as human-written works. Let's delve into the details of this issue and explore its implications.

An alert observer from 404 Media first noticed this phenomenon by using a simple trick. When querying the AI chatbot ChatGPT about current events, you may often encounter the phrase ""As of my last knowledge update."" This phrase is OpenAI's way of informing users about the chatbot's limitations in accessing up-to-date information. By searching Google Books for this specific phrase, 404 Media found numerous books that seemed to have incorporated ChatGPT-generated content verbatim.

One example of this is a book about the Boston Marathon bombing, which contains the passage ""As of my last knowledge update in September 2021, the case continued to be subject to legal proceedings, and the ultimate outcome was still uncertain"" when discussing the attack's perpetrators. The author of this book has an extensive catalog of 50 other works, covering topics such as the Cold War, 9/11, America's founding fathers, ancient Rome, famous boxers, and famous Native Americans. All of these books were published in 2023, and each one is between 50 and 100 pages long, resembling superficial narratives that are reminiscent of Wikipedia entries at best and AI-generated fact-spitting at worst. These books are even available for purchase on Amazon and other retailers.

A similar search on Google Scholar, a platform intended for human research, yielded 19 pages of results containing the same phrase. These results covered topics such as at-risk youth, diabetes, autism, COVID-19, and airline pilot fatigue. The presence of AI-generated content alongside human-written work in reputable resources like Google Books and Google Scholar is a concerning development.

Google, in response to 404 Media's inquiry, stated that",https://www.zdnet.com/a/img/resize/b093ab7779d555827f18ed230b1346fb4d31bf24/2024/04/05/2331d04b-5a07-4605-95ad-f71bf16ea752/bookwallgettyimages-184268876.jpg?auto=webp&fit=crop&height=675&width=1200,2024-04-05 00:00:00,"Discover the rise of AI-generated content in Google Books & Scholar! AI-written books on various topics flood these platforms, diluting value and user trust. Learn how Google plans to address this issue. AI ContentGeneration GoogleBooks GoogleScholar

(17 words)","AI-generated Content: A Surge in Digital Libraries

The world of digital libraries, including Google Books and Google Scholar, is grappling with an emerging issue: the influx of AI-generated content. These platforms, once considered bastions of human-curated knowledge, now face a deluge of machine-generated content, which threatens to dilute their value and undermine user trust.

Our investigation began when we stumbled upon a peculiar phrase, ""As of my last knowledge update,"" while interacting with OpenAI's ChatGPT. A cursory search on Google Books revealed a plethora of books carrying this AI signature. One such book, delving into the Boston Marathon bombing, contained this passage: ""As of my last knowledge update in September 2021, the case continued to be subject to legal proceedings, and the ultimate outcome was still uncertain.""

The author, a prolific writer with a vast catalog, seems to have employed AI to generate content for numerous books. These works, published in 2023, span a wide array of topics, including historical events, sports, and biographies. Their length, between 50 and 100 pages, suggests a shallow depth of content, akin to superficial Wikipedia entries or AI's regurgitation of facts. Disturbingly, these books are available on popular retail platforms like Amazon.

A parallel search on Google Scholar unearthed 19 pages of results containing the same AI signature. These works covered diverse subjects, such as at-risk youth, diabetes, autism, COVID-19, and airline pilot fatigue. The presence of AI-generated content alongside human-written research in reputable resources like Google Books and Google Scholar is a troubling development.

Google, in response to our inquiry, acknowledged the issue, stating, ""[We are] continually working to improve our algorithms to prevent low-quality content, including AI-generated content, from appearing in our search results.""

This surge of AI-generated content poses a significant challenge for digital libraries. The onus is on these platforms to maintain their integrity and differentiate between human-curated and machine-generated content. The future of digital libraries hangs in the balance, as they strive to preserve their status as trustworthy repositories of knowledge in the age of AI.",Technology,"Formicoders,News,AI,Technology,Innovation,Programmering,Coding,Wordpress,Python"
