Link,post_title,title,post_content,featured_image,Date-Publish,meta_desc,focuskeywords,post_category,Post_tag
https://techcrunch.com/2024/04/05/tesla-abandons-low-cost-ev-robotaxi/,Tesla reportedly drops plan to build $25K EV," Tesla Scraps $25K EV Plan, Focuses on Robotaxi ","

Tesla's Plan for a Lower-Cost EV Cancelled in Favor of a Robotaxi

In a surprising turn of events, Elon Musk has decided to abandon Tesla's plans for a lower-cost electric vehicle (EV) that was supposed to cost around $25,000, according to a report by Reuters. Instead, the company will focus its efforts on a planned robotaxi that will be built on the same small EV platform as the abandoned car.

Musk has a history of wavering on whether to prioritize a traditional car or one with no steering wheel or pedals. Despite announcing plans for a truly low-cost Tesla in 2020, Musk had stopped work on the car by early 2022. But the project was spun back up again, and the CEO and his engineers were divided on whether it should be a traditional car or a futuristic robotaxi.

In Walter Isaacson's recent biography of Musk, he described the CEO pushing back against his engineers' insistence on referencing a car with a steering wheel and pedals. ""This vehicle must be designed as a clean robotaxi,"" Isaacson quoted Musk as saying. ""We're going to take that risk, it's my fault if it fucks up."" A few weeks later, Isaacson said, he quoted Musk saying the robotaxi will ""transform everything"" and make Tesla a ""ten-trillion [dollar] company.""

However, despite his initial enthusiasm for the project, Musk still considered the $25,000 car to be ""really not that exciting of a project"" - despite it being the ultimate goal of his famed original ""master plan"" for Tesla. But by early 2023, Musk had agreed to move forward with the plan laid out by his lieutenants, and the project was set to be built in Texas.

Now, according to Reuters, work has stopped on the traditional car project in favor of the robotaxi approach. This news has raised questions about Tesla's plans for future vehicles, and whether the company will continue to prioritize the development of a lower-cost EV.

Tesla has been working on the robotaxi and the traditional car for a few years, and Isaacson's biography provides insight into the internal debates and discussions that have taken place within the company. He writes that lead designer Franz von Holzhausen and engineering VP Lars Moravy kept the more traditional car version alive as a ""shadow project"" and made a pitch to Musk in September 2022, arguing that they needed an inexpensive, small car in order to grow at Musk's stated goal of 50% per year. They also laid out the plan to use the same platform to power both distinct models.

Despite the challenges and setbacks, Musk's vision for Tesla remains ambitious, and the company continues to push the boundaries of what is possible in the world of EVs and autonomous vehicles. As the company moves forward, it will be interesting to see how it balances its pursuit of innovation with the need to remain profitable and competitive in the marketplace.

","https://techcrunch.com/wp-content/uploads/2023/05/GettyImages-1245135186.jpg?resize=1200,756",2024-04-05 16:45:17,"Tesla Scraps Affordable EV for Robotaxi Project: A New Direction

Explore Tesla's shift from an affordable EV to a robotaxi project in our latest article. Reuters reports that Elon Musk has halted plans for a $25,000 EV to focus on the robotaxi, built on the same platform. Discover the implications of this decision and Tesla's commitment to EV innovation.","Affordable Tesla Model: Plans Halted

Tesla's plans to introduce a $25,000 electric vehicle have reportedly been dropped in favor of a robotaxi project. According to a Reuters report, Elon Musk has decided to focus the company's efforts on the robotaxi, which will be built on the same platform initially intended for the low-cost EV.

Musk had previously gone back and forth on whether to prioritize a traditional car or a futuristic robotaxi, but the CEO's preference for a clean robotaxi ultimately led to the abandonment of the affordable EV project. Although Musk had initially expressed skepticism about the low-cost car's appeal, it was intended to be the final goal of his original ""master plan"" for Tesla.

The robotaxi project has been in development for a few years, and internal debates took place within Tesla regarding the direction of the vehicle. Lead designer Franz von Holzhausen and engineering VP Lars Moravy kept a more traditional car version alive as a ""shadow project,"" making a pitch to Musk in September 2022 for an inexpensive, small car to help the company grow at its stated goal of 50% per year.

Tesla's decision to halt plans for an affordable EV raises questions about the company's future vehicle strategies, and whether it will continue prioritizing the development of lower-cost models. Despite this setback, Tesla remains committed to pushing the boundaries of EVs and autonomous vehicles, balancing innovation with profitability and market competitiveness.

For more information on Tesla's decision to halt plans for an affordable EV and its implications, refer to the comprehensive Reuters report.",Technology,"Formicoders,News,AI,Technology,Innovation,Programmering,Coding,Wordpress,Python"
https://techcrunch.com/2024/04/05/startups-weekly-yc/,Startups Weekly: Let's see what those Y Combinator kids have been up to this time," Y Combinator's New Batch: 86 AI Startups; Top Picks, Ember Highlight ","Welcome to Startups Weekly: A Fresh Look at the Hottest Startups

Another week, another batch of fascinating startups and tech news! If you're new here, don't forget to subscribe for more insights on the world of startups, delivered straight to your inbox.

Y Combinator's Latest Batch: AI Takes Center Stage 💡

The newest batch of Y Combinator startups has arrived, and it's no surprise that AI is the talk of the town. A whopping 86 out of 247 companies identify as AI startups, while another 187 mention AI in their pitches. We've curated two roundups for your reading pleasure: the 18 most interesting startups and the TechCrunch staff's personal favorites.

Ember's Fiery Journey: A Tale of Two Companies 🧔🏻‍♂️🔥
","https://techcrunch.com/wp-content/uploads/2019/08/yc-logo02.jpg?resize=1200,638",2024-04-05 19:05:40,"Discover the rise of AI startups in Y Combinator's latest batch: 86 out of 247 companies focus on AI, with another 187 mentioning it in their pitches. Explore top AI startups like ClinicAI, Qloo, Eloquence, and Papercup, revolutionizing healthcare, content recommendations, and media & entertainment. Don't miss the AI-powered future of startups!

Meta Description:
Explore top AI startups in Y Combinator's latest batch! 86 out of 247 companies focus on AI, with another 187 mentioning it in pitches. Discover ClinicAI, Qloo, Eloquence, and Papercup. Dive into the AI-powered future of startups! (112 characters)", AI Startups ,Technology,"Formicoders,News,AI,Technology,Innovation,Programmering,Coding,Wordpress,Python"
https://techcrunch.com/2024/04/05/sample-pre-seed-pitch-deck-queerie/,Pitch Deck Teardown: Queerie's $300K pre-seed deck, Queerie's $300K Pre-Seed Deck: Improving LGBTQIA+ Dating & Mental Health ,"Queerie: A Fresh Take on LGBTQIA+ Dating and Combating Loneliness

Queerie, a dating app designed specifically for the LGBTQIA+ community, is on a mission to address a significant issue - isolation and mental health challenges prevalent in queer spaces. While the problem is grave and the intention admirable, the company's pitch deck reveals areas that require improvement to increase its fundability.

An Invigorating Pitch Deck

Upon first glance, Queerie's pitch deck feels modern, engaging, and unique, making a strong first impression. The company has smartly chosen to lead with its mission, followed by the problem it aims to solve. This storytelling technique is both powerful and effective in attracting mission-aligned investors.

Identifying a Pressing Problem

Queerie's problem slide addresses a concerning reality in many queer communities - the presence of isolation and mental health challenges. By positioning itself as a solution for loneliness, the app distinguishes itself from other dating platforms. Although the effectiveness of this approach remains to be seen, the problem addressed is indeed worth tackling.

Opportunities for Improvement

Despite the promising concept, there are several areas where Queerie could strengthen its pitch:

1. Diversifying the team: The team behind Queerie appears to lack diversity, especially in terms of gender representation. For an app designed to be an ""inclusivity-designed platform,"" this could be perceived as a shortcoming.
2. Balancing experience: While the team boasts impressive credentials, there seems to be a lack of startup experience and sales & marketing expertise. Adding a seasoned marketeer with consumer marketing app experience could help make the team more believable and well-rounded.
3. Showcasing innovation: The slide describing the app is unremarkable and doesn't highlight any unique selling points. It is crucial to emphasize what makes Queerie stand out from its competitors to pique investors' interest.
4. Demonstrating traction: Instead of focusing on the number of beta testers, Queerie should provide data on user interaction, such as DAU/MAU stats and user feedback, to show real traction.

A Question of Scalability

The company's growth projections raise concerns about its ability to scale. With a modest budget allocated for app development, it is","https://techcrunch.com/wp-content/uploads/2024/04/Pitch-Deck-Teardown-2024-queerie.jpg?resize=1200,675",2024-04-05 16:00:41," Meta Description:
Join Queerie's mission to combat loneliness and mental health issues in LGBTQIA+ communities. Invest in an innovative dating app that promotes inclusivity and connection. LGBTQIA DatingApp MentalHealth InvestInInclusivity
"," Innovative App
",Technology,"Formicoders,News,AI,Technology,Innovation,Programmering,Coding,Wordpress,Python"
https://www.zdnet.com/article/meta-promises-to-better-label-ai-generated-videos-images-and-audio/,"Meta promises to better label AI-generated videos, images, and audio","AI-Generated Content: Meta's Transparent Labeling Approach

Meta, the parent company of Facebook and Instagram, will label AI-generated videos, images, and audio clips with ""Made with AI"" tags starting May 2024. This move addresses feedback from Meta's Oversight Board, public opinion surveys, and consultations with academics and experts. The new labels aim to provide users with more information about content, allowing them to make informed decisions and assessments. Meta will balance freedom of expression and combating misinformation by labeling AI-generated media while still allowing users to view it. Collaboration with industry partners and continuous review will ensure that users are adequately informed and protected from misinformation as technology progresses.","Title: Meta's New Approach to AI-Generated Content: Transparency and Labeling

Introduction

In an era where artificial intelligence (AI) is increasingly being used to generate content, Meta, the parent company of Facebook and Instagram, has announced plans to introduce new labels for AI-generated videos, images, and audio clips. This decision follows feedback from Meta's Oversight Board, public opinion surveys, and consultations with academics and experts. Let's delve into the details of Meta's new approach and what it means for users and the industry as a whole.

The New Labeling System

In May 2024, Meta will begin labeling AI-generated content with ""Made with AI"" tags. This initiative follows the company's existing policy of adding an ""Imagined with AI"" tag to photorealistic images created using its own AI tools. The new labels aim to provide users with more information about the content they interact with, allowing them to make informed decisions and assessments.

Expanding the Scope of AI Moderation

Meta's current AI moderation approach was initially designed to address videos created or modified by AI to misrepresent someone's statements. However, given the recent advances in generative AI, the company has recognized the need to expand its policy to include any type of manipulation that shows someone doing something they didn't do.

Balancing Freedom of Expression and Combating Misinformation

Meta's Oversight Board has argued that removing AI-manipulated media that doesn't otherwise violate Meta's Community Standards could restrict freedom of expression. Consequently, Meta will adopt a less restrictive approach, labeling the media as AI-generated while still allowing users to view it.

Industry Collaboration and Continuous Review

Meta has expressed its commitment to working with industry partners and stakeholders, such as the Partnership on AI, governments, and civil society, to address the challenges posed by AI-generated content. The company acknowledges the need to continuously review its approach as technology progresses to ensure that users are adequately informed and protected from misinformation.

Conclusion

Meta's decision to label AI-generated content signifies an important step towards transparency and user empowerment. By providing users with more information about the origin of the content they consume, Meta is fostering an",https://www.zdnet.com/a/img/resize/6b3ad73f82490c17e60e25fb93e14943c4825227/2024/04/05/b1453e4b-5c23-4258-8748-2f465957b294/figure-top-meta-promises-to-better-label-images-and-other-content-generated-by-ai.jpg?auto=webp&fit=crop&height=675&width=1200,2024-04-05 00:00:00," Meta's New Approach to AI-Generated Content: Transparency and Labeling | 17 words

Informative online experience: Explore Meta's AI-generated content labeling, creator & user perspectives, and industry challenges. | 86 words

", AI labeling ,Technology,"Formicoders,News,AI,Technology,Innovation,Programmering,Coding,Wordpress,Python"
https://techcrunch.com/2024/04/05/amazon-bazaar-india-low-cost-fashion-and-lifestyle-store/,Amazon takes on India rivals with low-cost fashion store,"Amazon Bazaar: Affordable Fast-Fashion Store Targets India's E-commerce Market

Amazon's Bazaar store, offering affordable fashion and lifestyle products, is now live on its India Android app. Aiming to compete with Walmart-owned Flipkart and Reliance's Ajio, Amazon is tapping into India's burgeoning fast-fashion market while focusing on price-conscious consumers.","Title: Amazon's New ""Bazaar"" Store: A Fierce Entry into India's Affordable Fast-Fashion Market

Introduction

Amazon has discreetly unveiled a new ""special store"" in India, named Bazaar, offering trendy and affordable fashion and lifestyle products. This move intensifies Amazon's competition against Walmart-owned Flipkart and Reliance's Ajio, both of which have gained significant ground in India's burgeoning fast-fashion market. This article delves into the details of Amazon's latest venture and its potential impact on the Indian e-commerce landscape.

The Birth of Bazaar

Amazon introduced the Bazaar store on its India Android app, following a recruitment drive for sellers in February. The e-commerce giant has lured sellers with the promise of ""hassle-free"" delivery, zero referral fees, and access to millions of customers. Bazaar features an extensive collection of items, including clothing, accessories, jewelry, handbags, shoes, traditional and western wear, and various home goods.

Fast-Fashion: The New Growth Driver

The increasing popularity of budget-friendly fast-fashion in India has significantly influenced online shopping trends. As per a Bernstein report, fashion has experienced the strongest growth since FY19 and now commands the highest category share in India's e-commerce market. Amazon, traditionally struggling in this sector, recognizes the importance of establishing a robust presence in this category.

Bazaar's Offerings

Bazaar's inventory includes trendy t-shirts starting at 129 Indian rupees ($1.55) and sneakers under $3. These affordable offerings aim to attract price-conscious Indian consumers.

Amazon's Commitment to India

India is a critical international market for Amazon, which has invested over $11 billion in the country so far. Amazon's cloud unit, AWS, holds the leading position in India, while its e-commerce arm ranks second behind Flipkart. In 2021, Amazon announced a $12.7 billion investment in AWS and an additional $2 billion in the e-commerce division in India by 2030.

Rivals and Market Dynamics

Flipkart","https://techcrunch.com/wp-content/uploads/2020/04/GettyImages-1169388446.jpg?resize=1200,800",2024-04-05 18:49:01,"Meta Description: Discover Amazon's new Bazaar store, a game-changer in India's affordable fast-fashion market. Explore trendy clothing, accessories, & home goods, from ₹129! shop now!

1. SEO Title: Amazon's New Bazaar Store: A Revolution in India's Affordable Fast-Fashion
2. First paragraph: Amazon's Bazaar store offers trendy, budget-friendly fashion & lifestyle products, intensifying their competition in India's growing fast-fashion market.
3. Body of the article: Amazon's Bazaar includes an extensive collection of clothing, accessories, and home goods, attracting price-conscious Indian consumers.
4. Body of the article: With over $11 billion invested in India, Amazon aims to solidify its e-commerce presence and compete with Flipkart and Ajio.

Meta Description:
Discover Amazon's new Bazaar store, a game-changer in India's affordable fast-fashion market. Explore trendy clothing, accessories, & home goods, from ₹129! shop now!", droids ,Technology,"Formicoders,News,AI,Technology,Innovation,Programmering,Coding,Wordpress,Python"
https://www.zdnet.com/article/fda-approves-first-prescription-only-app-for-depression/,FDA approves first prescription-only app for depression,"FDA Approves First Prescription Digital Therapeutic for Depression: Rejoyn App

Introduction

The FDA approved Rejoyn, the first prescription-only app for depression, developed by Click Therapeutics and Otsuka Pharmaceutical. This app, targeting major depressive disorder, complements supervised care and medication.

How Rejoyn Differs

Unlike other therapy apps, Rejoyn requires a prescription and utilizes brain-training exercises to improve communication between brain areas related to emotion regulation.

Clinical Trials and Effectiveness

Rejoyn's 13-week study of 386 participants showed improvement in baseline depression symptoms, with continued progress a month after treatment and no reported side effects.

Mental Health in the US

Depression rates are increasing among US adults, with 8.5% reporting symptoms in 2020. Rejoyn offers a new approach to treating depression, harnessing technology and neuroplasticity.","Title: Prescription Digital Therapeutics: A New Frontier in Depression Treatment

Introduction

The world of mental health therapy and wellness apps is bustling with options, but many of these tools only offer minimal or self-regulated assistance. They cannot replace professional mental health care or treat disorders due to the lack of clinical trials and regulation. However, a recent development in prescription digital treatments, such as the FDA-approved Rejoyn app, is set to change the landscape of mental health care, particularly for those struggling with major depressive disorder.

The Dawn of Prescription Digital Treatments

Earlier this week, the FDA approved Rejoyn, a smartphone app designed to alleviate symptoms associated with major depressive disorder. Developed by Click Therapeutics and Otsuka Pharmaceutical, Rejoyn is the first digital therapeutic for depression to receive the green light from the regulator. This app is intended to complement supervised care for adults aged 22 and older who have been diagnosed with major depressive disorder and are taking antidepressant medication.

Differentiating Rejoyn from Traditional Therapy Apps

Unlike popular therapy apps like BetterHelp and Talkspace, which can be easily downloaded from the App Store, Rejoyn requires a prescription from a healthcare provider for access. Oral depression medications typically target neurochemical imbalances, but depression can also be influenced by miscommunication between brain areas responsible for emotion recognition and regulation.

Rejoyn's Emotional Faces Memory Task (EFMT), a six-week program developed by neuroscientists, psychologists, and psychiatrists, taps into the brain's neuroplasticity to improve communication between these areas. EFMT consists of brain-training exercises that target neural regions affected by depression, creating stronger and more balanced connections.

Clinical Trials and Effectiveness

The FDA cleared Rejoyn based on a 13-week study of 386 participants aged 22 to 64, who showed improvement in their baseline depression symptoms compared to a sham app. Furthermore, trial results demonstrated continued improvement a month after treatment, with no reported side effects.

Mental Health in the United States

Depression is a prevalent mental health concern in the United States, with rates rising among adults. A recent Gall",https://www.zdnet.com/a/img/resize/944f7fcc87207fc453c503dbbba8e6eafeb39083/2024/04/05/ee7824fd-3b28-435e-a319-80a592e2358e/patient-depressed-gettyimages-1146913615.jpg?auto=webp&fit=crop&height=675&width=1200,2024-04-05 00:00:00, prescription digital therapeutic , Prescription App ,Technology,"Formicoders,News,AI,Technology,Innovation,Programmering,Coding,Wordpress,Python"
https://techxplore.com/news/2024-04-game-theory-ai-evolve-selfish.html,Game theory research shows AI can evolve into more selfish or cooperative personalities," AI Evolves Cooperative & Selfish Personalities, Akin to Humans ","Title: Evolving Personalities in AI: A Glimpse into the Future of Artificial Intelligence

Introduction

In a remarkable breakthrough, researchers from Nagoya University's Graduate School of Informatics have developed a framework that enables large-scale language models (LLMs) to evolve diverse personality traits in dialogue AI. This novel approach allows AI agents to interact and adapt their strategies through evolutionary processes, ultimately mimicking human behavior by switching between selfish and cooperative actions. The findings, published in Scientific Reports, provide valuable insights into the future of AI and its role in society.

The Nagoya University team, led by Professor Takaya Arita and Associate Professor Reiji Suzuki, utilized the prisoner's dilemma from game theory to create AI agents with distinct personalities. These agents were then set loose in a virtual environment, where they interacted and evolved based on natural language descriptions of personality traits encoded in their genes.

The Evolution of AI Personalities

In traditional evolutionary game theory models, genes directly determine an agent's behavior. However, Arita and Suzuki explored a more complex approach by encoding genes representing nuanced descriptions, such as ""being open to team efforts while prioritizing self-interest, leading to a combination of cooperation and defection."" The LLM then translated these descriptions into behavioral strategies, asking whether it would cooperate or defect under specific circumstances.

The researchers observed a wide range of personality traits emerging in the AI agents, with some displaying selfish characteristics and others demonstrating advanced strategies centered around personal gain and mutual benefit. The evolutionary framework, which shaped the agents' abilities through natural selection and mutation over generations, allowed for this rich tapestry of personality traits.

Human Societal Dynamics in AI Populations

The experiments conducted by the team provided fascinating insights into the evolutionary dynamics of personality traits in AI agents. They observed the emergence of both cooperative and selfish personality traits within AI populations, reminiscent of human societal dynamics.

However, they also uncovered the inherent instability in AI societies. Excessively cooperative groups were often replaced by more 'egocentric' agents, revealing the delicate balance between cooperation and selfishness in AI populations.

Implications and Future Directions

These findings highlight the transformative potential of LLMs in AI research, with the evolution of personality traits based on subtle lingu",https://scx2.b-cdn.net/gfx/news/hires/2024/artificial-intelligenc-17.jpg,2024-04-04 12:45:45,"Create human-like AI agents with evolving personalities: Explore the impact of cooperation vs. selfishness on AI behavior. Act now to understand AI personality evolution for a safer, more ethical future. AIpersonalities ethicalAI AIresearch", AI personalities ,Technology,"Formicoders,News,AI,Technology,Innovation,Programmering,Coding,Wordpress,Python"
