Link,Title,Text,Image,Date Publish
https://techcrunch.com/2024/02/28/reliance-disney-india-media-merger-to-control-85-of-streaming-half-of-tv-audience/, Reliance-Disney Merger Dominates Indian Media Market ,"

Disney and Reliance's Media Merger: A Game-Changer in Indian Entertainment

Prepare yourself for a seismic shift in the Indian entertainment landscape as Reliance's Viacom18 and Disney join forces to create a media behemoth. This merger will reshape the industry, leaving competitors scrambling to keep up.

Dominating the Streaming Scene

The combined entity will command an astonishing 85% of India's on-demand streaming service audience. That's a massive chunk of the market, making it a formidable force against global giants like Netflix and Amazon Prime Video.

Exclusive Sporting Rights

The merger brings together exclusive digital and broadcast rights to some of the most coveted sporting events. Cricket, India's beloved pastime, takes center stage, with the next four years of the Indian Premier League (IPL), ICC events, and domestic cricket under their umbrella. They've also secured the rights to the FIFA World Cup, Premier League, and Wimbledon.

Cricket: The Key to Success

Cricket streaming has been the driving force behind user growth for streaming platforms in India. By securing these rights, Disney and Reliance have effectively cut off their rivals' access to the content that attracts the most fans.

A Content Powerhouse

The merged entity will also boast exclusive access to Disney's vast library of movies, productions, and 30,000 titles. It will become the digital home for content from HBO, Warner Bros, Showtime, and NBCUniversal.

Market Dominance

Analysts estimate that the combined operations of Disney's Hotstar and JioCinema will have an 85% market share in the Indian OTT market. In the broadcast market, the merged entity will command an impressive 49%, with a strong presence in the Hindi-speaking audience.

Reaching Millions

Disney and Reliance aim to reach an astounding 750 million users in India through their combined entity. This merger is not just about market share; it's about connecting with a vast and diverse audience across the country.

Conclusion

The merger of Reliance and Disney's Indian media assets is a game-changer for the entertainment industry. It creates a dominant force that will set the stage for fierce competition and reshape the way Indians consume content. As the streaming wars intensify, this merger will undoubtedly have a profound impact on the future of entertainment in India.

","https://techcrunch.com/wp-content/uploads/2024/02/GettyImages-1987464097.jpg?resize=1200,665",2024-02-29 05:13:24
https://venturebeat.com/business/cibc-innovation-banking-provides-growth-capital-to-drips-holdings-llc/, CIBC Innovation Banking Funds Drips Holdings Growth ,"

Unlocking the Power of 1:1 Conversations: Drips Transforms Customer Engagement

In today's digital landscape, businesses face the challenge of connecting with customers in a meaningful way. Traditional outreach methods like cold calls and emails often fall short, leaving companies struggling to engage with their target audience. Enter Drips, a conversational outreach company that's revolutionizing customer interactions.

Drips empowers organizations to orchestrate large-scale, personalized conversations at critical moments in the customer journey. By asking engaging questions and utilizing human-like AI dialogue over SMS and phone calls, Drips initiates real conversations that foster authentic connections.

Compliance-Focused Technology for Sensitive Industries

Drips' managed technology adheres to strict compliance standards, making it ideal for organizations in highly regulated industries. Healthcare providers, insurance companies, financial institutions, and higher education institutions rely on Drips to deliver sensitive data securely and effectively.

Fueling Growth and Expanding Horizons

Drips recently secured growth financing from CIBC Innovation Banking to accelerate product development and expand into diverse industry verticals within the U.S. market. This partnership will enable Drips to continue delivering innovative solutions that enhance customer engagement.

A Game-Changer in Customer Communication

""We're witnessing a paradigm shift in outbound communication,"" said Aaron Christopher (A.C.), CEO and Co-Founder of Drips. ""Companies need a compliant, proactive approach to engage with customers effectively, and that's where Drips excels.""

John Flemming, Managing Director at CIBC Innovation Banking, expressed his enthusiasm for the partnership. ""We believe in the Drips team's vision and their ability to drive enhanced customer communication at scale.""

About Drips

Drips is the pioneer in conversational outreach, helping organizations master large-scale 1:1 conversations during critical customer touchpoints. Their Conversations as a Service, powered by human-like AI dialogue, fosters authentic connections that drive business outcomes. Drips seamlessly integrates with various CRM, marketing automation, and call center platforms, empowering businesses to communicate effectively and efficiently.

Conclusion

Drips is transforming the way businesses engage with customers. By leveraging the power of personalized conversations, compliance-focused technology, and strategic partnerships, Drips empowers organizations to build stronger customer relationships, drive growth, and ultimately achieve business success.

",https://venturebeat.com/wp-content/uploads/2015/10/BusinessWire_FeaturedImage.jpg?w=1200&strip=all,2024-02-28 18:26:07
https://techcrunch.com/2024/02/28/mastodon-users-can-now-share-their-profile-via-qr-code-on-android/, Share Your Mastodon Profile with QR Codes on Android ,"

Mastodon's QR Code Revolution: Seamless Social Sharing

Mastodon, the decentralized social network, has unveiled a game-changing update for its Android app, introducing QR code sharing. This ingenious feature empowers users to effortlessly connect with others, even in bustling environments like event halls or hotel lobbies.

Gone are the days of fumbling with names or handles. With Mastodon's QR code feature, simply navigate to your profile tab, tap the QR icon beside your name, and voila! You'll have a unique code that others can scan to instantly add you to their network. No more awkward introductions or deciphering illegible usernames.

Navigating the Fediverse with Ease

Mastodon is committed to demystifying the Fediverse, the interconnected network of decentralized social platforms. The latest update includes helpful explainers about domain names in Mastodon handles. When you tap on a handle, the app provides clear insights into the distinction between usernames and server names. It even highlights these elements within the handle for easy comprehension.

Enhanced User Experience

Beyond QR code sharing and Fediverse navigation, Mastodon has introduced several user-friendly enhancements. Blocking and muting prompts now provide detailed explanations of their effects on a profile. Additionally, a sleek new link card preview displays the post's author and date, while drop-down menus on profiles offer intuitive navigation.

The Future of Decentralized Social Media

Mastodon faces growing competition in the decentralized social network arena, with Bluesky recently opening its doors to the public and embracing federation. As users venture into the realm of Mastodon, they may encounter the complexities of its ActivityPub network. Mastodon's ongoing efforts to simplify navigation and foster understanding will be crucial in attracting and retaining users.

Conclusion

Mastodon's latest Android update is a testament to its unwavering commitment to innovation and user experience. With QR code sharing, Fediverse explainers, and a host of other enhancements, Mastodon is paving the way for a more accessible and engaging decentralized social experience. As the battle for dominance in the decentralized social network space intensifies, Mastodon's focus on user-friendliness and community building will undoubtedly play a pivotal role in shaping the future of online communication.

","https://techcrunch.com/wp-content/uploads/2024/02/QR-Code-Mastodon.jpeg?resize=1200,734",2024-02-29 05:45:31
https://techcrunch.com/2024/02/28/bluesky-hires-former-twitter-trust-safety-co-lead-aaron-rodericks/, Bluesky Hires Ex-Twitter Trust & Safety Exec ,"

Bluesky: A New Era of Trust and Safety in Social Media

In a significant move, Bluesky, the up-and-coming decentralized social network, has appointed Aaron Rodericks as its new head of Trust and Safety. Rodericks, a former co-leader of Twitter's Trust and Safety team, brings a wealth of experience to this crucial role.

Bluesky's decision to hire Rodericks sends a clear message: trust and safety are paramount. This is especially important given the platform's decentralized nature, which requires a delicate balance between user autonomy and moderation.

A Timely Appointment

Bluesky's commitment to trust and safety comes at a time when social media platforms are facing intense scrutiny. The network has already faced criticism for its handling of racial slurs and death threats. Rodericks' appointment signals a recognition of these challenges and a determination to address them head-on.

Multi-Layered Moderation

Unlike centralized platforms, Bluesky's moderation system is multi-layered. Server operators can set their own rules, while users can subscribe to independent moderation services. This allows for a customizable approach that balances community values with individual preferences.

Rodericks' Vision

Rodericks believes that social media platforms must provide a ""healthy level of built-in moderation"" while also empowering communities to self-organize and enforce their own moderation principles. He is excited about Bluesky's ""fresh approach"" to user choice and believes it can foster healthy online conversations.

24/7 Coverage and Independent Moderation

Bluesky's Trust and Safety team, led by Rodericks, provides 24/7 coverage to enforce the platform's guidelines. Reports are reviewed within 24 hours, ensuring a timely response to potential violations. Additionally, users will soon be able to subscribe to independent moderation services, further enhancing the platform's ability to address safety concerns.

Rodericks' Background

Before joining Twitter, Rodericks played a pivotal role in developing social data analytics capabilities for the Canadian Federal Government. He also researched extremist activity, contributing to the launch of the Global Coalition against Daesh.

Conclusion

Bluesky's appointment of Aaron Rodericks as its head of Trust and Safety is a significant step towards building a social network that prioritizes user safety and community empowerment. Rodericks' experience and vision will guide Bluesky as it navigates the complexities of decentralized moderation and strives to create a platform where users can connect and engage in meaningful conversations without fear of harassment or harm.

","https://techcrunch.com/wp-content/uploads/2023/08/bluesky-007.jpg?resize=1200,675",2024-02-28 19:06:42
https://venturebeat.com/business/litify-announces-record-performance-in-2023/, Litify Achieves Record Performance in 2023 ,"

Litify: Leading the Legal Tech Revolution with Record-Breaking Growth

In the ever-evolving legal landscape, Litify stands as a beacon of innovation, delivering cutting-edge solutions that empower law firms and in-house legal teams to reach new heights of efficiency and profitability.

A Year of Triumph: Record Revenue and Expanding Profitability

2023 marked a year of unparalleled success for Litify. The company shattered revenue records with a remarkable 54% growth year-over-year, solidifying its position as the industry's leading legal platform. This growth was fueled by the increasing demand for Litify's comprehensive suite of tools, which have transformed the way legal professionals operate.

Client Success Stories: Driving Growth through Innovation

Litify's client roster boasts an impressive array of legal luminaries, including Begum Law Group, Guardant Health, and Unified Women's Healthcare. These organizations have leveraged Litify's technology to streamline their operations, enhance efficiency, and drive exceptional business outcomes.

""Litify's unwavering commitment to client satisfaction aligns perfectly with our values,"" said Victoria Switzer, COO at Begum Law Group. ""Their robust platform has empowered us to operate at our peak, delivering unparalleled results for our clients.""

2024: A Roadmap for Continued Innovation

Building on the momentum of 2023, Litify has outlined an ambitious roadmap for the future. The company plans to invest heavily in its platform, introducing groundbreaking innovations that will further empower its clients.

Key areas of focus include:

 AI-Powered Insights: Unlocking valuable data and insights from legal documents to drive informed decision-making.
 Enhanced Collaboration: Streamlining communication and collaboration between in-house and outside counsel through improved rate and vendor management.
 User-Centric Design: Enhancing the user experience with next-generation UX/UI for heightened efficiency and productivity.
 Optimized Financial Management: Introducing robust timekeeping, billing, and accounting capabilities to optimize time entry, bill creation, and review.
 Beta Programs: Providing clients with exclusive access to cutting-edge features and the opportunity to shape the future of legal technology.

Industry Recognition: A Testament to Excellence

Litify's unwavering commitment to innovation has earned widespread industry recognition. The company has been named the Practice Management Solution Provider of the Year by LegalTech Breakthrough for two consecutive years and has been featured in Gartner's Market Guide for Corporate Legal Operations Technology and IDC's Marketscape for Worldwide Enterprise Legal Management Software.

Conclusion: The Future of Legal Technology

Litify's meteoric rise is a testament to the transformative power of legal technology. By providing law firms and in-house legal teams with the tools they need to succeed, Litify is shaping the future of the legal industry, one innovation at a time.

As the company continues to invest in its platform and expand its offerings, Litify is poised to remain at the forefront of legal technology, empowering legal professionals to achieve unprecedented levels of success.

",https://venturebeat.com/wp-content/uploads/2015/10/BusinessWire_FeaturedImage.jpg?w=1200&strip=all,2024-02-28 14:25:59
https://techcrunch.com/2024/02/28/reliance-buys-majority-stake-in-disney-india-business/, Reliance and Disney Join Forces for $8.5B Media Venture in India ,"

The Media Merger That's Shaking Up India's Entertainment Landscape

In a groundbreaking move, Reliance Industries, Viacom18, and Disney have joined forces to create a media behemoth in India. This merger, valued at a staggering $8.5 billion, will reshape the entertainment industry in the world's second-most populous nation.

Reliance, India's most valuable company, will hold the majority stake in the joint venture, with Disney and Viacom18 owning significant shares. This strategic alliance brings together the strengths of three industry giants, creating a formidable force in the Indian media market.

Expansion and Streamlining for Reliance

Reliance sees this merger as an opportunity to expand and streamline its presence in India's rapidly growing media industry. By combining its media assets with Disney India, Reliance aims to reach a wider audience and offer a more comprehensive entertainment experience.

A Bittersweet Deal for Disney

For Disney, the deal is a bittersweet one. While it will gain a significant stake in the merged entity, it will also incur a non-cash impairment charge of up to $2.4 billion. However, Disney remains optimistic about the long-term value of this partnership.

Uniting Streaming Giants

The merger unites two leading Indian streaming services, JioCinema and Disney+Hotstar. This creates a formidable digital entertainment powerhouse that will offer a vast library of content from HBO, Showtime, NBCUniversal, and Disney's extensive catalog.

A Market Dominator

The combined entity will reach over 750 million viewers across India, making it a dominant player in the country's media landscape. The merger brings together exclusive rights to major sporting events, such as the Indian Premier League (IPL) and ICC matches, giving it a significant advantage in the competitive Indian market.

A Landmark Agreement

Reliance chairman Mukesh Ambani hailed the deal as a ""landmark agreement"" that will usher in a new era in Indian entertainment. He expressed excitement about pooling resources and expertise to deliver unparalleled content at affordable prices.

A Fierce Rivalry

The merger comes after a fierce competition between Hotstar and JioCinema, which lured top Disney talent to boost its platform. Viacom18 also outbid Disney for the streaming rights to the IPL, breaking Hotstar's viewing records.

A Reunion of Former Executives

The merger also reunites former Star India CEO Uday Shankar and James Murdoch with the business they helped build. Shankar now returns as vice chair of the merged entity's board.

Subject to Approvals

The merger is subject to regulatory and shareholder approval and is expected to be completed by the end of March 2025. This historic alliance promises to reshape the Indian media landscape and bring a new era of entertainment to the nation.

","https://techcrunch.com/wp-content/uploads/2023/11/GettyImages-1782382390.jpg?resize=1200,703",2024-02-29 03:55:00
https://www.forbes.com/sites/johnarcher/2024/02/28/amazon-prime-video-reveals-new-films-and-tv-shows-for-march-2024/, March 2024 on Amazon Prime Video: New Films and Shows ,"

Prime Video's March Lineup: A Cinematic Feast

While the number of new titles on Prime Video in March may be modest, the quality more than compensates. Let's dive into the highlights:

New Originals

 Road House (March 21): A reboot of the classic action film, starring Jake Gyllenhaal as a bouncer taking on a criminal gang.
 Ricky Stanicky (March 7): A comedy about three friends who invent an imaginary friend to get out of trouble.
 Frida (March 14): A biopic exploring the life and art of Frida Kahlo.
 Invincible Season 2, Part 2 (March 14): The continuation of the animated superhero series.
 The Baxters (March 28): A family drama based on the best-selling novels by Karen Kingsbury.

Back Catalogue Gems

 Road House (1989): The original classic martial arts film.
 Bulletproof Monk (March 1): A unique blend of martial arts and fantasy.
 Battle Royale (March 31): A dystopian thriller that inspired ""The Hunger Games.""
 Wrath of Man (March 23): A revenge thriller directed by Guy Ritchie and starring Jason Statham.
 The Untouchables (March 1): A classic crime drama with Kevin Costner and Sean Connery.
 The Great Escape (March 1): A timeless war film.
 Lawman (March 1): A revisionist Western.
 The Barefoot Contessa (March 1): A glamorous and poignant drama.
 The Last Waltz (March 1): A concert documentary capturing The Band's final performance.
 The Warriors (March 1): A gritty cult classic about a street gang's journey.
 Desperately Seeking Susan (March 1): A stylish 1980s comedy-drama.
 Bring It On (March 1): A beloved cheerleading film.
 Friday Night Lights (March 1): A powerful exploration of football and small-town America.
 Waterworld (March 1): A post-apocalyptic adventure.
 Gone Baby Gone (March 1): A gripping crime thriller.
 I Saw the Devil (March 1): A dark and disturbing revenge tale.
 Pet Sematary (March 1): A chilling horror adaptation.
 Sleepy Hollow (March 1): A Gothic horror-comedy from Tim Burton.
 Super 8 (March 1): A Spielberg-produced monster movie.
 Rob Roy (March 1): A historical drama starring Liam Neeson.
 Road to Perdition (March 1): A stylish crime drama.
 The Imitation Game (March 29): The story of Alan Turing's code-breaking during WWII.
 Seabiscuit (March 1): A heartwarming tale of rivalry and triumph.
 The Purple Rose of Cairo (March 1): A charming comedy-drama.
 The Madness of King George (March 1): An Oscar-winning adaptation of a play about King George III's mental health.

Freevee Highlights

 The Invisible Man (March 19): A tense and effective remake of the classic sci-fi thriller.
 Hell or High Water (March 1): A character-driven modern Western.

Conclusion

March on Prime Video promises a diverse and engaging lineup, with a focus on quality over quantity. From thrilling action to thought-provoking dramas and timeless classics, there's something for every taste. So, grab your popcorn and prepare for a cinematic feast.

",https://imageio.forbes.com/specials-images/imageserve/65dfd8e7e9a7228e097e3e7f/0x0.jpg?format=jpg&height=900&width=1600&fit=bounds,2024-02-28 20:36:09
https://www.forbes.com/sites/jamiecartereurope/2024/02/28/buy-your-eclipse-glasses-now-before-its-too-late-say-experts/, Buy Eclipse Glasses Now: Don't Miss Out! ,"

The Great Eclipse Glasses Shortage: A Looming Concern

As the highly anticipated total solar eclipse of April 8th approaches, a critical concern has emerged: a potential shortage of safe eclipse glasses. This shortage stems from an unprecedented surge in demand, with over 32 million people expected to be within the path of totality.

The Perfect Storm of Supply and Demand

Eclipses, by nature, are events that garner widespread attention only in the weeks or days leading up to them. This creates a perfect storm of supply and demand, where the sudden influx of buyers overwhelms the production capacity of manufacturers.

Major eclipse glass producers, such as Rainbow Symphony and American Paper Optics, have been working around the clock to meet the demand. American Paper Optics alone has increased production by 400% in recent months, employing additional staff and running extra shifts.

Price Hikes and Reselling

The increased production costs, coupled with rising paper prices, have led to higher unit costs for eclipse glasses. As the eclipse date nears, the market has become ripe for resellers, who are selling glasses at inflated prices.

While companies are advised against price gouging, it remains a common practice during the pre-eclipse period. Consumers should be wary of such practices and purchase their glasses from reputable sources.

Last-Minute Surge and Chinese Imports

In the weeks leading up to the 2017 eclipse, American Paper Optics experienced a surge in orders, with people driving for hours to purchase glasses. This year, while demand is not as intense, experts still anticipate a shortage of ISO-certified eclipse glasses made in the United States.

To fill the gap, companies in China have been producing and exporting eclipse glasses that meet the ISO standard. However, concerns have been raised about the quality of solar film used in these glasses.

Trustworthy Sources

To ensure the safety of your eyes, it is crucial to purchase eclipse glasses from reputable sources. The American Astronomical Society maintains a list of vetted suppliers that adhere to the ISO 12312-2 international standard.

Conclusion

While the total solar eclipse of April 8th promises to be a breathtaking spectacle, it is essential to prioritize safety. By purchasing safe eclipse glasses from trusted sources, you can protect your eyes and fully enjoy this celestial event.

Remember, the eclipse is a once-in-a-lifetime experience. Don't let a shortage of eclipse glasses prevent you from witnessing the wonders of the universe. Plan ahead, research reputable suppliers, and secure your glasses well in advance to avoid disappointment.

",https://imageio.forbes.com/specials-images/imageserve/65dc7e54c4c62a36e9844c53/0x0.jpg?format=jpg&height=900&width=1600&fit=bounds,2024-02-28 19:15:00
