Link,post_title,title,post_content,featured_image,Date-Publish,meta_desc,focuskeywords,post_category,Post_tag
https://techxplore.com/news/2024-04-rubber-stretchable-energy-storage-device.html,Rubber-like stretchable energy storage device fabricated with laser precision,"Start of generated content: [Flexible Energy Storage Revolution: Laser-Ablated Micro Supercapacitors]
End of generated content:

In the realm of wearable tech, the demand for energy storage solutions that can stretch, twist, fold, and wrinkle is more important than ever. A team of researchers from POSTECH and KITECH have developed a groundbreaking small-scale energy storage device, published in npj Flexible Electronics. They created micro supercapacitors (MSCs) with eutectic gallium-indium liquid metal (EGaIn) and graphene, patterned via laser ablation. This method allows for precise and controlled patterning, maintaining flexibility, and retaining areal capacitance after 1,000 stretching cycles.","Title: Revolutionizing Flexible Energy Storage: The Dawn of Laser-Ablated Micro Supercapacitors

In the era of wearable technology, the need for energy storage solutions that can stretch, twist, fold, and wrinkle has become increasingly important. A team of researchers from Pohang University of Science and Technology (POSTECH) and Korea Institute of Industrial Technology (KITECH) has recently developed a groundbreaking small-scale energy storage device that addresses this pressing need. This innovative development is published in the journal npj Flexible Electronics.

Micro supercapacitors (MSCs) have emerged as promising candidates for deformable energy storage due to their high-power density, rapid charging, and long cycle life. However, the creation of interdigitated electrode patterns that maintain energy storage performance under repeated stretching and twisting has proven to be a significant challenge. This is primarily due to the use of brittle materials like gold, which are prone to cracking and degradation under mechanical stress.

Enter the world of eutectic gallium-indium liquid metal (EGaIn) and graphene. Both of these materials possess high conductivity and deformability. However, the fine patterning of EGaIn is extremely difficult due to its high surface tension. To overcome this challenge, the research team turned to laser ablation, a technique that allows for precise and controlled patterning of these materials.

The team successfully fabricated fine patterns of both EGaIn and graphene layers on a stretchable polystyrene-block-poly(ethylene-co-butylene)-block-polystyrene copolymer (SEBS) substrate using laser ablation. This process did not damage the underlying SEBS substrate, thereby maintaining the overall flexibility of the MSC device.

But what about the performance of these laser-ablated MSCs? The areal capacitance of the resulting MSC retained its original value even after stretching for up to 1,000 cycles. Furthermore, the fabricated MSCs operated stably under various mechanical deformations, including stretching, folding, twisting, and wrinkling.

Professor Jin Kon Kim, a leading researcher in this study, shared his thoughts on the breakthrough: ""The use of laser-patterned",https://scx2.b-cdn.net/gfx/news/hires/2024/rubber-like-stretchabl.jpg,2024-04-24 16:21:02," Meta Description:
Discover laser-ablated Micro Supercapacitors (MSCs) using EGaIn & graphene. High energy & power densities. Maintains performance under 1,000 stretching cycles. Wearable tech possibilities.

Length: 17 words
Focus Keyphrase: laser-ablated Micro Supercapacitors
Match Content: Yes
Unique: Yes
Active Voice: Yes
Call to Action: Explore the potential
Show Specifications: High energy & power densities, 1,000 stretching cycles

Optimized Meta Description:
""Revolutionize flexible energy storage! Explore laser-ablated Micro Supercapacitors (MSCs) using EGaIn & graphene. High energy, power density. Performs under 1,000 stretching cycles. Unleash wearable tech potential.""

Length: 120 characters
Focus Keyphrase: laser-ablated Micro Supercapacitors
Match Content: Yes
Unique: Yes
Active Voice: Yes
Call to Action: Explore, unleash
Show Specifications: High energy, power density, 1,000 stretching cycles

Please note that the original content is quite extensive, and the provided meta description has been condensed to fit within the character limit.

", Stretchable EGaIn MSCs ,Technology,"Formicoders,News,AI,Technology,Innovation,Programmering,Coding,Wordpress,Python"
https://www.zdnet.com/article/this-robot-vacuum-with-the-strongest-suction-power-should-not-be-as-cheap-as-it-is/,This robot vacuum with the strongest suction power should not be as cheap as it is," Yeedi M12 Pro+ Robot Vacuum: Comprehensive Review of a Powerful 11,000Pa Cleaner ","Title: The Powerful Yeedi M12 Pro+: A Comprehensive Review of a High-End Robot Vacuum and Mop

Introduction

The world of robot vacuums and mops has become increasingly competitive, with companies vying to release the most powerful and efficient machines. Yeedi recently launched its newest offering, the Yeedi M12 Pro+, boasting an impressive 11,000Pa of suction power and a range of features designed to simplify the cleaning process. This review will delve into the features, benefits, and potential drawbacks of the Yeedi M12 Pro+, offering valuable insights for those considering this high-end robot for their homes.

Key Features and Benefits

The Yeedi M12 Pro+ is a two-in-one robot vacuum and mop, combining powerful suction with a self-washing station and extended mop pads. The 11,000Pa suction power ensures thorough cleaning of various floor types, effectively picking up crumbs, hairs, and other debris. The V-shaped roller brush is specifically designed to prevent hair tangles, making maintenance easier for users.

One of the standout features of the Yeedi M12 Pro+ is its self-washing station, which cleans and dries the mop pads after each use. This eliminates the need for manual cleaning and ensures the robot is always ready for the next cleaning session. Additionally, the robot features a spot-cleaning feature, allowing users to target specific areas that require extra attention.

The compact charging dock, where the robot's battery is charged, the dustbin emptied, and the mop pads washed, is another advantage of the Yeedi M12 Pro+. Its smaller size compared to competitors like the Roborock S8 MaxV Ultra makes it an attractive option for those with limited space.

Potential Drawbacks

Despite the numerous benefits of the Yeedi M12 Pro+, several drawbacks should be considered. The robot's mop pads tend to get the medium-pile area rug wet, even when they lift 9mm when passing over carpets. This can lead to dampness and potential damage to the rug over time, which may be a concern for some users.

Another",https://www.zdnet.com/a/img/resize/e8d71d5e17859415298df09ee2790b576cd9cfa5/2024/04/24/8e99b9d0-e260-4f29-afc3-1fa7a9d02163/4.jpg?auto=webp&fit=crop&height=675&width=1200,2024-04-24 00:00:00,"Title: SK Hynix Surges in Profitability: A Success Story Fueled by AI Demand

Introduction:
South Korea's leading memory chipmaker, SK Hynix, has recently reported a significant surge in profitability for the first quarter of 2023. This impressive rebound comes after a period of downturn last year, with the company's operating profit reaching 2.88 trillion won - a staggering 144.3% increase in revenue compared to the same period in 2022. Let's delve into the reasons behind this remarkable turnaround and explore the role of SK Hynix as a key supplier of high-bandwidth memory (HBM) to Nvidia, fueling the AI boom.

The AI Boom and Soaring Memory Chip Demand:
The growing popularity of AI services, such as ChatGPT, has led to a substantial increase in demand for high-performance memory chips. These chips are essential for powering the servers that support AI-driven applications. SK Hynix's primary rival, Samsung, is also experiencing a surge in demand, expecting a staggering 900% increase in profit for the same quarter.

SK Hynix's Role as a Main Supplier to Nvidia:
SK Hynix is a major supplier of HBM chips to Nvidia, which uses the high-speed memory in its AI chip platforms. HBM memory consists of multiple DRAM dies stacked vertically, providing the necessary high-bandwidth capabilities required for AI processing.

Investments in High-End Memory Production:
Capitalizing on the growing demand for high-performance memory chips, SK Hynix is investing in cutting-edge technologies. The company recently began mass production of its HBM3E in March 2023 and plans to secure more customers for this advanced product. Additionally, SK Hynix is focusing on other high-end DRAM products, such as DDR5, aimed at server markets.

Expansion Plans:
To further strengthen its position in the market, SK Hynix announced a 20 trillion won ($14.5 billion) investment to build a new cutting-edge DRAM production facility (M15X) in Cheongju, South Korea. This expansion is expected to boost the company's production capabilities and secure its position as a leading supplier of high-performance memory chips in the AI and server markets.

Call to Action:
Don't miss out on the AI boom! Upgrade your AI applications with SK Hynix's cutting-edge high-performance memory chips and take advantage of the company's expansion plans to secure your spot in the AI and server markets. Invest in SK Hynix today and experience the benefits of AI-driven technology.", Powerful ,Technology,"Formicoders,News,AI,Technology,Innovation,Programmering,Coding,Wordpress,Python"
https://techcrunch.com/2024/04/24/jiocinema-launches-35-cent-premium-tier-stepping-up-rivalry-with-netflix-and-prime-video/,India's JioCinema offers Hollywood streaming for a penny a day to box out Netflix and Prime Video,"Title: JioCinema's $1 Monthly Sub, Hollywood & Free Sports: A Game Changer

In a strategic move, JioCinema, an Indian streaming giant, unveils a $1/month subscription with Hollywood & ad-supported free sports, challenging Netflix & Prime Video. JioCinema StreamingWars HollywoodInIndia","Title: JioCinema's New Subscription Plans: A Game-Changer in the Indian Streaming Market

Introduction

JioCinema, an immensely popular Indian on-demand video-streaming service, recently announced a significant overhaul of its subscription plans. The market-leading service, backed by Asia's richest man, Mukesh Ambani, aims to tighten its grip on the industry and redefine premium entertainment with its revamped pricing strategy. This article delves into the details of JioCinema's new subscription plans and their implications for the competitive landscape.

The New Subscription Plans

JioCinema introduced two affordable monthly tiers, setting the stage for a compelling battle against streaming giants such as Netflix and Prime Video. The two tiers include:

1. Rs 89 ($1) per month: This tier supports four simultaneous screen access, ensuring that multiple users within a household can enjoy uninterrupted streaming. Subscribers can enjoy ad-free viewing, 4K streaming, and offline downloads. The plan also grants access to everything on the platform, including a rich library of content from Peacock, HBO, Paramount, and Warner Bros. Discovery.

2. Rs 29 (35 cents) per month: This entry-level tier offers single-screen access with similar features, albeit at a more affordable price point.

A Discontinued Annual Tier

JioCinema had previously launched an annual premium tier with the international catalog at Rs 999 ($12.50), but it is now being discontinued. Existing subscribers to this plan will be automatically switched over to the new Rs 89 per month tier.

Free Sports Content with Ads

While sports content, including the ongoing Indian Premier League, will remain free to stream with ads, the premium tiers will not remove ads from live sports content. This decision reflects Viacom18's aim to recover much of the investment it has made in the next three years.

A Strategic Partnership: Reliance and Disney

The revamp in the pricing strategy follows the merger of Reliance's media business with the local unit of Disney earlier this year, creating a $8.5 billion joint venture. This formidable collaboration aims to","https://techcrunch.com/wp-content/uploads/2024/04/GettyImages-1252311766.jpg?resize=1200,800",2024-04-24 19:39:34,"Discover Hollywood Movies & Shows at Unbeatable Prices: JioCinema's New Subscription Plans

JioCinema introduces two budget-friendly monthly tiers, offering an extensive Hollywood movie and TV show collection in partnership with Disney and major studios. The plans cater to various user preferences:

1. Rs 89 ($1) per month: Four-screen access, ad-free viewing, 4K streaming, offline downloads, and a vast content library.
2. Rs 29 (35 cents) per month: Single-screen access with a wide range of movies and TV shows.

Existing annual premium tier subscribers will be upgraded to the Rs 89 per month plan. Free sports content with ads remains available, while live sports events in premium tiers will still display ads. This strategic partnership between Reliance and Disney targets the Indian market, providing affordability and choice.", 1-2 word keyphrase ,Technology,"Formicoders,News,AI,Technology,Innovation,Programmering,Coding,Wordpress,Python"
https://techxplore.com/news/2024-04-scientists-ray-microscopy-method-analysis.html,Scientists pioneer new X-ray microscopy method for data analysis 'on the fly',"Title: Revolutionizing X-ray Imaging: Real-Time Data Analysis with Streaming Ptychography

Streaming ptychography, a new X-ray microscopy method, enables real-time data analysis ""on the fly."" This neural network-based approach reduces data processing time, allowing for swift experimentation and accurate results. High-resolution imaging meets quick decision-making at Argonne National Lab's Advanced Photon Source. XrayImaging StreamingPtychography","Title: Revolutionizing X-ray Microscopy: Real-Time Data Analysis Through Streaming Ptychography

Scientists at the Advanced Photon Source (APS) of the U.S. Department of Energy's (DOE) Argonne National Laboratory have developed an innovative method to address the challenges posed by the deluge of data generated by advanced X-ray microscopes. By integrating machine learning, specifically a neural network, into X-ray microscopy techniques, the researchers have achieved a remarkable increase in data processing speed and a reduction in data collection, all while maintaining factual accuracy and the core message of the text.

Traditional data analysis methods struggle to keep pace with the rapid data generation of X-ray microscopes. This predicament results in an unfortunate situation where state-of-the-art hardware produces an overwhelming amount of data, yet scientists lack the means to analyze it efficiently, even with large supercomputers. The new technique, termed streaming ptychography, addresses this issue by enabling real-time data processing and analysis, allowing researchers to make informed decisions and adjustments during experiments.

The new neural network-based approach significantly reduces the time required to analyze data, making it possible to run experiments at the full speed of the instrument in a matter of minutes. This improvement allows scientists and autonomous instruments to make split-second choices about sample analysis, leading to faster experimentation and more accurate results. The potential impact of this technique extends beyond ptychography, with applications in a wide range of experiments requiring real-time adjustments based on data analysis.

Ptychography, an imaging technique widely used in X-ray, optical, and electron microscopy, has long been recognized for its high-resolution imaging capabilities. However, traditional image processing methods can be slow and computationally intensive, hindering real-time imaging. Streaming ptychography overcomes this limitation by employing high-performance computers at the Argonne Leadership Computing Facility (ALCF) to carry out the first round of computationally intensive phase retrieval calculations using diffraction patterns generated by X-ray beams.

The streaming process works similarly to video-streaming apps like Netflix, dynamically adjusting the experiment as scientists or machine learning agents react to the data in near-real time. This capability allows researchers to zero in on interesting phenomena as they appear",https://scx2.b-cdn.net/gfx/news/hires/2024/scientists-pioneer-new.jpg,2024-04-24 12:54:13,"Real-time X-ray microscopy: Streaming Ptychography for instant data analysis
Discover how Argonne scientists use machine learning to process X-ray data in real-time, revolutionizing experiments. XrayMicroscopy RealtimeAnalysis","Keyphrase: Real-Time Data

Scientists pioneer new X-ray microscopy method for data analysis 'on the fly'
Title: Revolutionizing X-ray Microscopy: Real-Time Data Analysis Through Streaming Ptychography

Scientists at the Advanced Photon Source (APS) of the U.S. Department of Energy's (DOE) Argonne National Laboratory have developed an innovative method to address the challenges posed by the deluge of data generated by advanced X-ray microscopes. By integrating machine learning, specifically a neural network, into X-ray microscopy techniques, the researchers have achieved a remarkable increase in data processing speed and a reduction in data collection, all while maintaining factual accuracy and the core message of the text.

Traditional data analysis methods struggle to keep pace with the rapid data generation of X-ray microscopes. This predicament results in an unfortunate situation where state-of-the-art hardware produces an overwhelming amount of data, yet scientists lack the means to analyze it efficiently, even with large supercomputers. The new technique, termed streaming ptychography, addresses this issue by enabling real-time data processing and analysis, allowing researchers to make informed decisions and adjustments during experiments.

The new neural network-based approach significantly reduces the time required to analyze data, making it possible to run experiments at the full speed of the instrument in a matter of minutes. This improvement allows scientists and autonomous instruments to make split-second choices about sample analysis, leading to faster experimentation and more accurate results. The potential impact of this technique extends beyond ptychography, with applications in a wide range of experiments requiring real-time adjustments based on data analysis.

Ptychography, an imaging technique widely used in X-ray, optical, and electron microscopy, has long been recognized for its high-resolution imaging capabilities. However, traditional image processing methods can be slow and computationally intensive, hindering real-time imaging. Streaming ptychography overcomes this limitation by employing high-performance computers at the Argonne Leadership Computing Facility (ALCF) to carry out the first round of computationally intensive phase retrieval calculations using diffraction patterns generated by X-ray beams.

The streaming process works similarly to video-streaming apps like Netflix, dynamically adjusting the",Technology,"Formicoders,News,AI,Technology,Innovation,Programmering,Coding,Wordpress,Python"
https://techcrunch.com/2024/04/25/playruo-lets-you-try-game-demos-from-your-web-browser/,Playruo lets you try game demos from your web browser," Playruo: Cloud-based Game Demos Streaming Platform
","Title: Playruo: The Future of Game Demos in the Cloud

Introduction

The concept of cloud gaming has been around for a while, promising flexibility and accessibility to players. However, the mainstream adoption of cloud gaming is yet to become a reality. A new startup, Playruo, is taking a different approach by offering game demos in the cloud. This innovative idea harks back to the initial promise of Google Stadia, delivering a seamless gaming experience right from your web browser.

The Playruo Experience

Playruo distinguishes itself from traditional cloud gaming services by focusing on game demos, which can be launched and played directly from a web browser without any installation. The streaming technology behind Playruo is Kyber, a bi-directional streaming technology developed by Jean-Baptiste Kempf, the CTO of Playruo and the president of VideoLAN, the organization responsible for the popular open-source video player, VLC.

Leveraging open-source software components, such as FFmpeg for audio and video encoding, libVLC for decoding the stream on your local device, and QUIC for the transport layer network protocol, Playruo ensures a smooth gaming experience. Upon testing, the service proved to be responsive and efficient, providing a local-like gaming experience on a solid fiber connection via Wi-Fi.

The Challenge of Making a Viral Game

With thousands of new games being released yearly on PC and game consoles, standing out in a saturated market is a significant challenge. Game publishers also face fierce competition from older, established games that have been popular for over a decade.

Playruo aims to help game publishers maximize their chances of success by offering a platform for game demos during a launch campaign. By integrating Playruo links into video trailers, game launchers, and social media platforms, publishers can reach a wider audience and generate interest in their games.

A Different Business Model

Unlike traditional cloud gaming services that aim to monetize from players, Playruo's primary clients are game publishers. The startup's revenue comes from the fees paid by publishers to offer game demos. This unique business model incentivizes Playruo to ensure that users have a positive experience, as the success of a viral demo can lead to increased game sales for the publishers.

Bal","https://techcrunch.com/wp-content/uploads/2024/04/Playruo.jpg?resize=1200,675",2024-04-25 08:00:00,Playruo: Innovative game demo platform for enhanced player reach! Try game demos in your browser. Boost game sales with our unique business model.,Playruo's Innovative Demo Platform [,Technology,"Formicoders,News,AI,Technology,Innovation,Programmering,Coding,Wordpress,Python"
