Link,Title,Text,Image,Date Publish
https://techcrunch.com/2024/02/26/inkitt-ai-publishing-37-million/,"Inkitt, the self-publishing platform using AI to develop bestsellers, nabs $37M","

In a world captivated by digital distractions, Inkitt, a pioneering startup, is on a mission to rekindle the love for reading and revolutionize the entertainment industry. With its innovative approach, Inkitt aims to transform compelling stories into blockbusters and establish a modern-day ""Disney"" empire centered around captivating content.

Inkitt's journey began with a simple yet powerful idea: to empower aspiring writers and connect them with a global audience. Through its eponymous app, Inkitt provides a platform for self-publishing, allowing authors to share their creations with the world. But Inkitt's vision extends beyond mere publishing. It harnesses the power of AI and data science to identify the most captivating stories, refine them, and distribute them through a second app called Galatea.

The results have been remarkable. Inkitt has amassed a community of 33 million users and produced numerous bestsellers, proving that there's an insatiable appetite for compelling narratives. The company's recent Series C funding of $37 million will fuel its ambitious plans to expand its content library and create a multimedia empire.

Inkitt's vision is audacious: to become the ""Disney of the 21st century,"" a multimedia powerhouse that transcends traditional boundaries. This vision is not merely a pipe dream; it's a testament to Inkitt's belief in the transformative power of storytelling.

The company's CEO and founder, Ali Albazaz, is a visionary leader who recognizes the changing landscape of entertainment. He sees a future where AI-generated content seamlessly blends with human creativity, creating immersive experiences that captivate audiences.

Inkitt's approach is unique. It doesn't compete with established publishing giants; instead, it seeks to redefine the industry by embracing innovation and leveraging technology. The company's focus on shorter chapters, dynamic text effects, and personalized content caters to the modern reader's preferences and attention span.

Inkitt's data-driven approach to storytelling is a game-changer. By analyzing reader behavior and preferences, the company gains valuable insights into what makes a story successful. This knowledge is then applied to subsequent publications, ensuring a higher chance of success.

The company's unwavering commitment to quality has paid off. Inkitt ranks among the top 11 best-selling publishers globally, surpassing established names like Penguin Random House. Its algorithms have proven to be remarkably effective, boasting a 20x higher success rate in publishing bestsellers compared to traditional publishers.

Inkitt's success is not limited to its publishing endeavors. Its foray into audiobooks and video content has yielded impressive results. The TV series ""Beautiful Mistake,"" based on a Galatea book, generated a revenue of $500,000, demonstrating the company's ability to adapt its content to various mediums.

Inkitt's focus on undiscovered talent sets it apart from traditional publishers. The company believes in nurturing emerging writers and providing them with a platform to showcase their creativity. This approach has led to the discovery of hidden gems that might have otherwise remained unknown.

The company's exploration of AI-generated stories is particularly intriguing. Inkitt recognizes the potential of AI to enhance storytelling, but it also understands the importance of human input. The company's approach involves talented humans crafting catchy treatments, which are then refined and expanded using AI algorithms.

Inkitt's commitment to personalization is a testament to its understanding of the modern reader's desire for tailored experiences. The company is experimenting with different levels of personalization, giving readers the power to influence the story's direction.

Inkitt's journey is far from over. The company continues to push the boundaries of storytelling and entertainment, embracing new technologies and exploring uncharted territories. With its unwavering focus on innovation and its commitment to delivering captivating content, Inkitt is poised to revolutionize the way we consume and experience stories.

","https://techcrunch.com/wp-content/uploads/2024/02/Screenshot-2024-02-27-at-00.56.38.png?resize=1200,457",2024-02-27 01:01:39
https://techcrunch.com/2024/02/27/zacua-ventures-construction-tech/,Zacua Ventures has launched a new $56 million fund dedicated to construction tech,"

In a sector notorious for its cautious approach to technology, a new venture capital firm, Zacua Ventures, is poised to revolutionize the construction industry. Backed by construction giants like Procore, Volvo, and Cemex, Zacua has launched its inaugural $56 million fund to empower early-stage construction technology startups.

The construction industry, dominated by small and medium-sized companies, has faced challenges in adopting technology. Zacua's mission is to bridge this gap by investing in startups that can harness the power of AI, industrialized construction, IoT devices, and robotics to transform the industry.

This shift towards technology has sparked a surge in innovative startups. PermitFlow, a construction permitting platform, recently secured $31 million in funding, while Buildstock, a B2B marketplace for construction materials, raised $1.6 million to tackle the industry's pain point of late payments.

Recognizing the construction industry's significant contribution to global GDP and greenhouse gas emissions, Zacua prioritizes startups focused on sustainability, productivity, and urbanization. Their investments target solutions that enhance efficiency, reduce carbon footprints, and contribute to the development of resilient and intelligent structures for future cities.

With a presence in Spain, Mexico, Singapore, and North America, Zacua has already invested in over a dozen startups across the construction technology ecosystem, including Construex, a software-as-a-service marketplace, and Flexnode, a data infrastructure startup.

Zacua's success in raising a $56 million fund during challenging economic times underscores the immense potential for technology to transform the construction industry. This venture capital firm is poised to drive innovation and shape the future of construction.

","https://techcrunch.com/wp-content/uploads/2024/02/ZACUA-TEAMIMG_1804.jpg?resize=1200,675",2024-02-27 13:00:43
https://techcrunch.com/2024/02/27/glean-wants-to-beat-chatgpt-at-its-own-game-in-the-enterprise/,Glean wants to beat ChatGPT at its own game — in the enterprise,"

Glean: A Revolutionary AI-Powered Search Platform Transforming the Enterprise Landscape

In the realm of enterprise technology, Glean stands out as a trailblazing platform that harnesses the power of Generative AI (GenAI) to revolutionize the way employees access and utilize information. Founded by Arvind Jain, the visionary behind Rubrik, Glean emerged from the realization that employees often struggle to find the information they need to excel in their roles.

Glean's mission is to bridge this information gap by providing a custom ChatGPT-like experience tailored to the unique needs of each enterprise. It seamlessly connects to a company's first- and third-party databases, allowing employees to pose plain-English queries and receive comprehensive answers. This user-friendly approach empowers employees to find the information they need quickly and efficiently, boosting productivity and enhancing the overall employee experience.

Addressing the Growing Need for Seamless Information Access

Glean's genesis lies in the growing challenge faced by desk workers in finding the data they need to perform their jobs effectively. A recent Gartner survey revealed that 47% of desk workers struggle with this issue, while the proliferation of apps in the workplace further exacerbates the problem. Glean addresses this challenge head-on by providing a centralized platform that integrates with various data sources, enabling employees to access the information they need from a single, user-friendly interface.

Evolving from Cognitive Search to a Comprehensive GenAI Platform

Glean's journey began as an AI-powered search app, similar to Microsoft's SharePoint Syntex and Amazon Kendra. However, it has since evolved into a comprehensive platform that leverages GenAI to analyze a company's databases and data stores, providing employees with insightful answers to their queries. Glean's ability to ingest information from diverse sources, including support tickets, chat messages, and customer relationship management platforms, sets it apart from traditional cognitive search tools.

Addressing Security and Privacy Concerns in the GenAI Era

The integration of proprietary data with GenAI platforms raises legitimate concerns about privacy and data security. Glean acknowledges these concerns and assures users of its commitment to security and privacy. The platform respects the permissions set in a company's data sources, ensuring that employees only receive answers based on the data they are authorized to access. Additionally, Glean employs robust security measures, including data encryption and regular security audits, to safeguard sensitive information.

Mitigating GenAI's Hallucinations and Ensuring Accuracy

GenAI's tendency to hallucinate or generate inaccurate information is a well-known challenge. Glean employs several strategies to mitigate this issue and enhance the reliability of its GenAI-powered platform. These strategies include training models on customer data to learn industry-specific jargon, allowing customers to switch among multiple open-source GenAI models, and utilizing Retrieval-Augmented Generation (RAG) to ground GenAI responses in real data sources.

Gaining Traction and Winning Over Investors

Despite the cautious approach many corporations have taken towards GenAI, Glean has experienced remarkable growth and success. Its annual recurring revenue has nearly quadrupled in the past year, and its customer base includes renowned companies like Duolingo, Grammarly, and Sony. This impressive track record has attracted the attention of investors, resulting in a recent $200 million Series D funding round led by Kleiner Perkins and Lightspeed Venture Partners.

Conclusion: Glean's Impact on the Future of Work

Glean is poised to revolutionize the way enterprises access and utilize information. Its GenAI-powered platform empowers employees to find the information they need quickly and efficiently, boosting productivity and enhancing the overall employee experience. As Glean continues to expand its capabilities and customer base, it is clear that the platform is a game-changer in the enterprise technology landscape.

","https://techcrunch.com/wp-content/uploads/2023/09/GettyImages-1129489551.jpg?resize=1200,800",2024-02-27 13:00:04
https://techcrunch.com/2024/02/27/the-displace-wireless-tv-that-sticks-to-walls-plans-new-models-and-new-ai-features/,"The Displace wireless TV, that sticks to walls, plans new models and new AI features","

Displace TV: A Wireless Revolution in Home Entertainment

At CES 2023, Displace, a pioneering hardware company, unveiled the 'Display Flex,' a groundbreaking 55-inch 4K OLED TV that defies traditional mounting methods by seamlessly adhering to walls. This innovative concept sparked a sensation, and now, at Mobile World Congress in Barcelona, founder and CEO Balaji Krishna revealed plans for more screen versions with exciting new features.

Expanding the Displace Lineup: Display Mini and Beyond

Displace is poised to introduce the 'Display Mini,' a smaller 27-inch TV designed for kitchens and bathrooms, expanding its product portfolio. Additionally, Krishna hinted at undisclosed tech enhancements, including an ""AI-powered shopping engine"" that enables viewers to purchase products directly from advertisements and a contactless payment reader for added convenience.

Health-Conscious Features and Thermal Camera Integration

Displace devices will incorporate a built-in thermal camera with potential health applications. This advanced technology can detect body heat maps, enabling the identification of inflammation and other health-related issues.

Pre-Orders, Design Changes, and Funding

Displace temporarily halted pre-orders to prioritize fulfilling existing orders, aiming to commence shipments by mid-year. The company has implemented design changes and simplifications, such as weight reduction, to enhance the user experience. Furthermore, Displace is seeking a modest $5 million Series A funding round.

Business Appeal and Unique Mounting Capabilities

The Displace TV has garnered significant interest from art studios, museums, and even embassies. While traditional TV setups suffice for most consumers, businesses seeking flexible mounting options, including walls and windows, find Displace's solution compelling.

Unveiling the Technology: Vacuum Suction, Swappable Batteries, and Wireless Streaming

Displace TVs employ a vacuum suction system for secure attachment to dry walls, eliminating the need for drilling or brackets. Swappable batteries power the screen, ensuring uninterrupted viewing. Content is streamed wirelessly from a base station, similar to LG's OLED M.

Impressive Longevity and Safety Features

The Display Flex boasts an impressive 10-month battery life, adhering to the wall using its vacuum system. In the unlikely event of a power failure, the screen gradually lowers itself using a zipline-like mechanism, preventing damage to the TV or the wall.

",https://techcrunch.com/wp-content/uploads/2024/02/Displace-MiniTV.jpg?w=1200,2024-02-27 12:44:13
https://techcrunch.com/2024/02/27/superhuman-launches-an-ai-powered-instant-replies-feature/,Superhuman launches AI-powered instant replies,"

In the realm of email management, Superhuman, a cutting-edge startup, is making waves with its latest innovation: AI-powered instant replies. This feature is designed to streamline email communication and help users achieve inbox zero swiftly.

Superhuman's instant replies function similarly to Gmail's smart replies, but with a focus on context and personalization. When composing a reply, users are presented with three potential responses tailored to the specific email they received. These options are short and concise, but upon selecting one, Superhuman expands it into a complete sentence, addressing the sender by name.

The company's beta test results indicate that users equipped with instant replies send emails twice as fast. This efficiency boost aligns with Superhuman's core mission of optimizing email workflows and minimizing time spent managing overflowing inboxes.

Superhuman's foray into AI-powered features doesn't end there. The company has already introduced Superhuman AI, an assistant that aids users in crafting better emails by suggesting adjustments to length and tone. Additionally, an auto-summarize feature provides concise one-line summaries atop emails, helping users quickly grasp the gist of messages.

Superhuman's competitors are also embracing AI in their email offerings. Shortwave, founded by ex-Googlers, offers features like AI-driven email summaries and quick replies. Readdle's Spark email client introduced an AI assistant, while tech giants Microsoft and Google have integrated AI capabilities into Outlook and Gmail.

Superhuman's co-founder and CEO, Rahul Vohra, emphasizes the company's unique approach to AI-powered features, highlighting their stickiness and user engagement. On average, Superhuman users leverage AI 25 times weekly to compose emails.

Vohra envisions a three-phase roadmap for Superhuman's AI-powered products. The first phase involves providing an email assistant, the second phase introduces automatic AI functionality without user invocation, and the third phase aims to replace certain aspects of a user's daily workflow, such as scheduling appointments or composing entire emails on their behalf.

While Superhuman's current pricing model remains at $30 per month, Vohra hints at a potential pricing review later this year. The company's focus extends beyond AI, with plans to enhance its team-oriented offerings. Vohra envisions a collaborative email platform that facilitates seamless internal communication, transforming email from a solitary productivity tool into a collaborative hub.

Superhuman is also exploring the development of specialized email clients, such as Superhuman for Sales, tailored to specific roles like account executives and customer managers, with integrations for popular platforms like Salesforce and Hubspot.

","https://techcrunch.com/wp-content/uploads/2024/02/Superhuman-Instant-reply-feat.jpg?resize=1200,675",2024-02-27 12:00:45
https://techcrunch.com/2024/02/27/microsoft-made-a-16-million-investment-in-mistral-ai/,Microsoft made a $16 million investment in Mistral AI,"

In a significant development, Mistral AI, a pioneering AI startup based in Paris, unveiled its latest offering: Mistral Large, a formidable large language model (LLM) poised to challenge the dominance of industry giants like OpenAI's GPT-4. This groundbreaking model marks a strategic partnership between Mistral AI and tech behemoth Microsoft, further intensifying the race in the AI landscape.

Microsoft's unwavering commitment to Mistral AI is evident in its substantial €15 million investment, signaling confidence in the startup's potential to revolutionize the AI industry. This strategic move positions Microsoft as a significant stakeholder in Mistral AI's future, with the investment poised to convert into equity during the startup's next funding round.

The valuation of Mistral AI remains unaffected by this investment, with Microsoft's stake contingent upon the valuation determined in the upcoming funding round. Notably, Mistral AI achieved a remarkable valuation of approximately $2 billion in its most recent funding round in December 2023, attracting prominent investors such as Andreessen Horowitz (a16z).

Mistral Large, the centerpiece of Mistral AI's arsenal, is a cutting-edge LLM meticulously crafted to rival the capabilities of other top-tier models like GPT-4 and Claude 2. Unlike previous Mistral AI releases, Mistral Large adopts a closed-source approach, ensuring exclusivity and controlled access. Developers seeking to harness the model's prowess can do so via Mistral's dedicated API platform.

In a strategic move to expand its reach and cater to a broader customer base, Mistral AI and Microsoft have forged a distribution partnership, enabling seamless integration with Microsoft's Azure platform. This alliance opens up new avenues for Mistral AI to attract customers, empowering them to seamlessly access the model's capabilities through Azure's comprehensive model catalog.

Azure customers now have the advantage of accessing Mistral's models alongside those offered by OpenAI and Meta, further diversifying their options within the Microsoft ecosystem. This strategic partnership not only enhances customer choice but also positions Mistral AI as a formidable player in the generative AI landscape.

However, this investment has drawn the scrutiny of regulatory bodies, with the European Commission expressing its intent to thoroughly analyze the deal between Microsoft and Mistral AI. This heightened attention underscores the growing importance of generative AI and the need for careful oversight to ensure fair competition and responsible development.

Despite the regulatory scrutiny, Mistral AI's partnership with Microsoft marks a significant milestone in the evolution of AI technology. The startup's closed-source approach and impressive list of American backers, including Microsoft, may draw comparisons to its American competitors. However, Mistral AI remains steadfast in its pursuit of innovation, aiming to push the boundaries of AI and redefine the possibilities of language models.

","https://techcrunch.com/wp-content/uploads/2024/02/GettyImages-1930518491.jpg?resize=1200,800",2024-02-27 11:15:26
https://techcrunch.com/2024/02/27/mwc-2024-motorolas-rollable-concept-phone-laughs-at-your-silly-foldable/,MWC 2024: Motorola's Rollable Concept phone laughs at your silly foldable,"

In the bustling halls of MWC, Lenovo/Motorola unveiled a captivating concept device that defied conventional smartphone designs. Dubbed the Rollable Concept Phone, this innovative creation showcased the company's fearless approach to pushing the boundaries of technology.

Unlike traditional foldable phones, the Rollable Concept Phone boasts a unique design that allows it to expand and contract, transforming from a compact device into a larger screen for an immersive viewing experience. This remarkable flexibility opens up a world of possibilities for multitasking, gaming, and entertainment.

However, the device's status as a concept highlights the challenges and uncertainties that lie ahead. With no guarantee of ever reaching production, Lenovo is understandably cautious with its demos, safeguarding the limited prototypes on hand.

The concept phone's journey serves as a reminder of the intricate process of bringing innovative ideas to life. From rigorous testing to gauging public interest, every step is crucial in determining the viability and practicality of a new technology.

The Rollable Concept Phone's versatile design offers intriguing possibilities. Its ability to transform into a giant makeshift smartwatch, secured by a magnetic band, adds a futuristic touch to wearable technology.

While details remain scarce, the device's fabric backing and multiple batteries hint at the engineering prowess behind its flexible form. The operating system's adaptability to the device's orientation enhances user experience, optimizing the display for various tasks.

Lenovo's reputation for embracing unconventional product designs raises hopes for the Rollable Concept Phone's potential journey from concept to reality. The company's track record suggests a willingness to take risks and explore uncharted territories in the world of mobile technology.

The success of foldable smartphones, though representing a small market share, demonstrates the growing acceptance of innovative form factors. As the industry continues to evolve, the question of Apple's entry into the foldable market looms large, potentially shaping the future of this emerging category.

Despite unanswered questions about durability, practicality, and case design, the Rollable Concept Phone captures our imagination with its novelty and charm. It embodies the spirit of innovation, pushing the boundaries of what's possible in the realm of mobile devices.

","https://techcrunch.com/wp-content/uploads/2024/02/Screenshot-2024-02-27-at-11.17.34 AM.jpg?resize=1200,876",2024-02-27 10:32:44
