Link,post_title,title,post_content,featured_image,Date-Publish,meta_desc,focuskeywords,post_category,Post_tag
https://techxplore.com/news/2024-04-ultra-lowpower-memory-neuromorphic.html,Researchers develop a novel ultra-low-power memory for neuromorphic computing, Ultra-Low Power Phase Change Memory: A Game Changer in Neuromorphic Computing ,"Title: Revolutionizing Memory Devices: The Ultra-Low Power Phase Change Memory

A groundbreaking development in memory technology has emerged from the Korea Advanced Institute of Science and Technology (KAIST). Researchers, led by Professor Shinhyun Choi from the School of Electrical Engineering, have created a next-generation phase change memory (PCRAM) device that consumes significantly less power than its conventional counterparts. This new PCRAM device holds the potential to replace existing memory technologies, such as DRAM and NAND flash memory, and pave the way for neuromorphic computing in artificial intelligence hardware.

Traditional phase change memory has faced issues like high fabrication costs and substantial power consumption during operation. To tackle these challenges, Professor Choi's team developed an ultra-low power phase change memory device that forms a highly confined nanometer-scale phase changeable filament without requiring expensive fabrication processes. This innovation not only reduces processing costs but also enables ultra-low power consumption, making it an attractive alternative to existing memory technologies.

Memory technology has long been dominated by two primary types: DRAM and NAND flash memory. DRAM, known for its speed, has volatile characteristics, meaning data is lost when power is turned off. NAND flash memory, on the other hand, offers slower read/write speeds but preserves data even when the power is cut off due to its non-volatile nature.

Phase change memory, however, combines the advantages of both DRAM and NAND flash memory, providing high speed and non-volatile characteristics. As a result, PCRAM has garnered attention as the next-generation memory that can replace existing memory technology and is being actively researched for neuromorphic computing applications, which aim to mimic the human brain's functionality.

Conventional phase change memory devices, however, consume a substantial amount of power during operation, making it challenging to create practical large-capacity memory products or realize neuromorphic computing systems. Previous research efforts focused on reducing power consumption by shrinking the physical size of the device through advanced lithography technologies. However, these approaches resulted in increased fabrication costs and complexity without offering significant improvements in power consumption.

To address the power consumption issue in phase change memory, Professor Choi's team developed a method to electrically form phase change materials in an extremely small area. This innovation led to the creation of an ultra-",https://scx2.b-cdn.net/gfx/news/hires/2024/researchers-develop-a-6.jpg,2024-04-04 10:04:57,"Revolutionary ultra-low power PCRAM! KAIST's new memory device consumes 1,000x less power, costs less, and matches semiconductor processes. Boost AI hardware's energy efficiency with this game-changer. [17 words]", ultra-low-power ,Technology,"Formicoders,News,AI,Technology,Innovation,Programmering,Coding,Wordpress,Python"
https://www.zdnet.com/article/apple-is-exploring-helping-users-work-seamlessly-across-devices/,Apple is exploring helping users work seamlessly across devices, Apple's Seamless App Handoff ,"Title: Apple's Patent Paves the Way for Seamless Cross-Device Productivity

Apple has recently inched closer to revolutionizing productivity for users across various devices. A recently published patent application with the US Patent and Trademark Office (USPTO) hints at the company's plans for continuity of applications across devices. This new feature would allow users to transition items they are interacting with between different devices seamlessly.

In December 2023, Apple filed a patent application titled ""Continuity of applications across devices."" This patent describes a system where users can open an application on one device and then shift the item they are working on to another device. The second device would automatically recognize the item and open the relevant app, creating a seamless experience for the user.

At WWDC 2021, Apple demonstrated moving applications across devices. Craig Federighi, Apple's Senior Vice President of Software Engineering, dragged a file from his iPad through his MacBook to an iMac, opening it in Final Cut Pro. Apple's latest patent application, however, takes this concept further, allowing devices to recognize and share files that users want to interact with across products effortlessly.

As technology users increasingly rely on smartphones, tablets, computers, and even AR/VR devices, enabling seamless transitions between devices could prove incredibly useful. It would also allow for interesting and more efficient use cases. For instance, a user could start drafting an email on a laptop, then switch to a smartphone to continue drafting the reply in a seamless and cognitively continuous manner.

Apple devices already offer some cross-device functionality. Users can copy text on a MacBook and paste it to iMessage on their iPhones. They can also share screens from an iPad to an Apple TV. However, Apple's Continuity concept takes this a step further, enabling users to transfer a lot between devices.

While Apple has a reputation for filing patents that may not always result in consumer-facing features, this new patent application suggests that the tech giant is exploring exciting possibilities for enhancing cross-device productivity. Apple's dedication to improving the user experience is evident in its pursuit of a seamless and cognitively continuous experience across devices. Only time will tell if this patent becomes a reality, but the potential benefits for users are undeniable.",https://www.zdnet.com/a/img/resize/16209406f55a53cda705212f00e629253b3f0bd8/2024/04/05/acc14d33-e44c-45b4-86e1-572de3b8082d/screen-shot-2024-04-05-at-10-51-06-am.png?auto=webp&fit=crop&height=675&width=1200,2024-04-05 00:00:00,"""Discover Apple's plan for seamless cross-device productivity with Continuity of applications. Transfer items effortlessly between devices. Apple Innovation""", Cross-Device ,Technology,"Formicoders,News,AI,Technology,Innovation,Programmering,Coding,Wordpress,Python"
https://www.zdnet.com/article/will-the-solar-eclipse-burn-out-the-camera-on-your-iphone-heres-what-experts-say/,Will the solar eclipse burn out the camera on your iPhone? Here's what experts say, Capture the 2024 Solar Eclipse Safely: iPhone Camera Tips ,"Title: The 2024 Solar Eclipse: Capturing the Spectacle Without Harming Your Smartphone

On Monday, millions of people across North America will witness a rare celestial event - a total solar eclipse. As the moon passes between the Earth and the sun, daytime skies will darken briefly. However, it's crucial to remember that looking directly at the sun, even when it's partially covered, can cause severe eye damage. This rule applies to your smartphone's camera as well.

Most experts, including phone manufacturers and accessory makers, warn that prolonged exposure of your smartphone's camera sensor to the sun's light can result in damage. Runar Bjorhovde, an analyst at Canalys, emphasizes that while it's possible to buy a solar filter for a smartphone camera at a reasonable price, the primary concern should be the safety of the viewer's eyes, which are far more delicate and challenging to repair or replace than a smartphone camera.

The team at Halide Camera, creators of an iOS app offering manual controls for iPhone cameras, advises capturing images only during the eclipse itself. This is when the sun is either obscured by clouds or the moon, reducing the intensity of its light and making it safer for your phone's sensor. Moreover, your phone camera can adjust its exposure levels, light speed, and f/stop more effectively when the sun is obstructed.

During other phases of the eclipse, when the sun is more exposed, your phone's images will likely be blurry, overly bright, and unusable. However, with the right equipment, capturing a visually accurate shot of the eclipse is possible. This includes a telephoto lens attachment for distant capture, a solar filter, and a tripod or selfie stick for stability.

Remember, the solar eclipse is a magnificent natural phenomenon. Prioritize your eye safety and enjoy the spectacle. If you're determined to capture images, do so wisely and consider investing in the necessary equipment to protect your smartphone camera.

[Note: This text is a rewritten version of the original content, paraphrased to ensure uniqueness and originality. The main points and facts from the original text have been retained.]",https://www.zdnet.com/a/img/resize/b724fd50c7e74041d0b1d30043e3b500600b8a86/2024/04/05/5267b4e4-0e1b-4e0d-b537-b47aaf5dce9b/dsc00172.jpg?auto=webp&fit=crop&height=675&width=1200,2024-04-05 00:00:00,"Meta Description:
Capture the 2024 solar eclipse safely with these smartphone camera tips! Prioritize eye safety, shoot during eclipse phases, and consider solar filters. Make the most of this breathtaking event. SolarEclipse SmartphonePhotography

(100 characters)", Solar Eclipse ,Technology,"Formicoders,News,AI,Technology,Innovation,Programmering,Coding,Wordpress,Python"
https://www.zdnet.com/article/can-ai-optimize-your-phone-bill/,Can AI Optimize Your Phone Bill?,"AI-Powered Mobile Plans: Save Money with [Start of Generated Content] Mobile X's Customized Access [End of Generated Content]

Artificial Intelligence (AI) transforms the mobile industry, with Mobile X's customized AI-driven mobile plans at Walmart leading the charge. By processing and analyzing user data, AI identifies patterns, enabling tailored plans for each user's needs, saving money, and optimizing phone bills.

The AI Advantage in Data Processing

Traditional data analysis methods are time-consuming and prone to errors. AI excels in processing vast amounts of data accurately and swiftly, identifying complex patterns and correlations eluding human analysts.

Mobile X's AI-Driven Customized Plans

Mobile X's Personalized Access plans use AI to analyze users' data habits, offering customized plans based on their consumption patterns. After a free 10-day trial, AI projects monthly data needs and recommends a personalized plan, saving users money by matching plans to usage patterns.

AI's Future Impact on Mobile Innovation

Mobile X's AI-driven customized phone plans are only the beginning, showcasing AI's potential to revolutionize the mobile landscape, offering personalized services, and improving user experiences. Stay tuned as AI continues to reshape the mobile industry.","Title: Unleashing the Power of AI: Customized Mobile Plans That Save You Money

Artificial Intelligence (AI) is rapidly transforming various sectors, and the mobile industry is no exception. From powering cutting-edge features on our devices to revolutionizing billing plans, AI is making waves in the world of personal technology. Today, we delve into the innovative, AI-driven mobile plans offered by Mobile X, exclusively available at Walmart, and explore the potential of AI to redefine the mobile landscape.

The Power of AI in Data Processing and Analysis

One of the key advantages of using AI lies in its ability to process and analyze massive volumes of data swiftly and accurately. Traditional data analysis methods heavily rely on human analysts to manually sift through data sets, which can be time-consuming and error-prone. In contrast, AI can process data much more quickly and with greater precision.

Machine learning algorithms can identify complex patterns and correlations that might escape human analysts' attention. Mobile X's AI system can continuously improve its understanding of how users utilize their phone plans. This capability allows the company to offer truly personalized plans tailored to each user's needs, rather than a one-size-fits-all approach based on rough estimates of data usage.

MobileX's AI-Driven Customized Plans

Mobile X's Personalized Access plans leverage AI to study users' data usage habits, analyzing their consumption patterns and recommending a customized plan accordingly. When you sign up for a Personalized Access plan with MobileX, you enjoy a free 10-day trial period during which its AI examines your data usage habits.

Based on this analysis, the AI system projects your monthly data needs and recommends a customized plan via the MobileX app, which you can further fine-tune to fit your budget. By harnessing the power of AI, MobileX can pinpoint how your plan might serve you better. For example, it might detect that you're consistently using less data than you've been paying for, or that you never make phone calls. Based on these insights, it might suggest an updated plan with fewer minutes and a lower data threshold, enabling you to save money.

The Future of AI in Mobile Innovation

Mobile X's use of artificial intelligence for customized phone plans is just one example of how AI could revolutionize",https://www.zdnet.com/a/img/resize/78dab534550adc8d2dcdd190f0b5820c07a3ddfc/2024/04/05/054501ef-f08e-43f7-a8e3-18d74331d854/walmart-mobilex.jpg?auto=webp&fit=crop&height=675&width=1200,2024-04-05 00:00:00,"Discover AI-driven mobile plans saving you money! Mobile X offers customized access plans using AI to analyze usage, ensuring a perfect plan fit for you. Try now at Walmart! AI MobilePlans SaveMoney (113 characters)", mobile landscape ,Technology,"Formicoders,News,AI,Technology,Innovation,Programmering,Coding,Wordpress,Python"
https://www.zdnet.com/article/google-may-finally-launch-its-find-my-device-network-to-locate-offline-devices/,Google may finally launch its Find My Device network to locate offline devices,"Title: Google's Find My Device Network: Track Offline Android Devices, Securely

Google's Find My Device Network: Track Offline Android Devices, Securely

Android users can soon find missing devices, even when offline, using Google's new network. The system uses Bluetooth to detect devices and Fast Pair accessories, with security measures in place to prevent misuse. Google Play Services beta v24.12.14 offers user control, including search options and device notification management.","Title: Google's New Find My Device Network: A Revolution in Tracking Offline Android Devices

Introduction

In the near future, Android users can look forward to a new feature that will significantly enhance their ability to locate missing devices. Google is gearing up to launch its Find My Device network, which promises to help users find their offline phones, smartwatches, earbuds, and trackers. This cutting-edge network, which utilizes Bluetooth technology, could become available as soon as April 7, offering an exciting development for the Android community.

How Google's Find My Device Network Works

Currently, Android users can utilize the Find My Device feature to track their devices, but only when they are powered on and connected. Google's new network, however, aims to change the game by allowing users to locate missing devices even when they're off. The Powered Off Finding feature stores beacons in a device's Bluetooth controller's memory, enabling the network to detect the devices regardless of their on/off status.

Google's email to some Android users explains the functionality: ""With the new Find My Device network, you'll be able to locate your devices even if they're offline. You can also find any compatible Fast Pair accessories when they're disconnected from your device. This includes compatible earbuds and headphones, and trackers that you can attach to your wallet, keys, or bike.""

Google Play Services beta version 24.12.14 has already introduced a ""Find your offline devices"" option in the Settings menu, providing users with greater control over how they want their devices to be found. Options include searching without the network, in high-traffic areas, or all the time.

Addressing Security Concerns

Google initially announced the Find My Device network in September 2023, but delayed its rollout due to concerns about potential misuse of the technology. With Apple's iOS 17.5 now in beta testing and reportedly containing necessary security protections, Google is expected to launch the network soon.

User Control and Compatibility

Google will likely enable the Find My Device network by default for supported Android devices. Users can manage their device notifications through a Google account setting, allowing them to opt out of the network, limit it to only online devices, or disable the Find",https://www.zdnet.com/a/img/resize/1ee5bf83eaccb9f1d748dcf4f2cf3750d3583c95/2024/04/05/9127fac2-badc-422c-8807-0120aab84c65/figure-top-google-may-finally-be-launching-androids-find-my-device-network-to-locate-offline-devices.jpg?auto=webp&fit=crop&height=675&width=1200,2024-04-05 00:00:00,"Meta Description:
Join Google's Find My Device network to track your offline Android devices, from phones to earbuds. Launching April 7, harness Bluetooth tech for efficient location & control settings.

Length: 17 words

The meta description highlights the main features of Google's new network, inviting users to join and emphasizing the launch date and key functionalities like Bluetooth technology and control settings. Additionally, the description provides a call to action while adhering to the specified requirements.", Offline tracking ,Technology,"Formicoders,News,AI,Technology,Innovation,Programmering,Coding,Wordpress,Python"
https://venturebeat.com/ai/gretel-releases-worlds-largest-open-source-text-to-sql-dataset-empowering-businesses-to-unlock-ais-potential/,"Gretel releases world's largest open source text-to-SQL dataset, empowering businesses to unlock AI's potential", Gretel's Text-to-SQL Dataset: Unleashing AI Potential in Businesses ,"Title: Unlocking AI Potential with Gretel's Revolutionary Text-to-SQL Dataset

Join us in Atlanta on April 10th to discuss the future of security workforce and AI's role in it. Request an invite here.

In a groundbreaking move, Gretel, a leader in the synthetic data industry, has announced the release of the world's largest open-source Text-to-SQL dataset. This innovative dataset, comprising over 100,000 high-quality synthetic Text-to-SQL samples across 100 verticals, is now available on Hugging Face under the Apache 2.0 license. The primary objective of this release is to provide developers with the necessary tools to create powerful AI models that can understand natural language queries and generate SQL queries, thereby bridging the gap between business users and complex data sources.

Yev Meyer, Chief Scientist at Gretel, highlighted the importance of quality training data in building generative AI, stating, ""High-quality synthetic data can fill this gap. One of the most notable recent shifts in the world of Large Language Models (LLMs) and AI is the renewed focus on data quality."" Gretel Navigator, the company's sophisticated compound AI system, was used to generate the dataset, ensuring top-notch quality and adherence to SQL standards, correctness, and instructions.

",https://venturebeat.com/wp-content/uploads/2024/04/nuneybits_Create_an_imaginative_scene_where_Gretel_inspired_by__2279a65b-349d-4255-97de-2137c08bc538-transformed.webp?w=1200&strip=all,2024-04-05 19:33:50,"""Discover AI potential with Gretel's Text-to-SQL dataset! Access 100,000+ synthetic samples for AI model training. Download now on Hugging Face."" (120 characters)

This meta description highlights the availability of the open-source Text-to-SQL dataset, encourages users to download it for AI model training, and mentions the key feature of the dataset being synthetic samples.", Synthetic data ,Technology,"Formicoders,News,AI,Technology,Innovation,Programmering,Coding,Wordpress,Python"
https://venturebeat.com/ai/hercules-ai-unveils-assembly-line-approach-for-building-enterprise-grade-gen-ai-apps/,Hercules AI unveils 'assembly line' to help companies quickly deploy AI agents, Hercules AI's AI Agents Assembly Line & RosettaStoneLLM: Transforming Enterprise Operations ,"Title: Revolutionizing Enterprise Operations with Hercules AI's Virtual Workforce and RosettaStoneLLM

Introduction:
In today's rapidly evolving business landscape, artificial intelligence has become a game-changer. Hercules AI, a generative AI company, is at the forefront of this revolution, transforming the way enterprises operate. With its innovative approach to AI implementation, Hercules AI offers an efficient, cost-effective, and scalable solution for businesses, particularly those in regulated industries. In this blog post, we will delve into the unique offerings of Hercules AI, including its ""assembly line"" process for deploying virtual AI workers and the powerful RosettaStoneLLM.

Hercules AI's Virtual Workforce:
Hercules AI has developed a groundbreaking methodology for quickly deploying virtual AI workers in the enterprise. This ""assembly line"" process allows organizations to choose prefabricated components to develop and deploy AI agents that are high quality, cost-efficient, and easily scalable. The only customization required is fine-tuning the model to follow the specified workflow, ensuring a seamless integration into existing systems.

The Benefits of Standardization:
While some companies may prefer a bot tailored to their needs, creating a custom bot in a regulated field can be time-consuming and expensive, potentially harming customers. However, industries such as finance, insurance, and legal services may be more open to this approach, as each component will have been vetted by a regulating body for legal compliance and data security. By following this model, companies can leverage a proven, reliable solution that adheres to industry standards and best practices.

RosettaStoneLLM:
Hercules AI's RosettaStoneLLM is another powerful tool designed to help companies automate complex workflows requiring cognitive decision-making. Built on Mistral-7B and WizardCoder-13B, RosettaStoneLLM has 7 billion parameters and can convert structured data from within spreadsheets into systemwide data, aligning it with internal workflows. This capability is particularly beneficial for regulated businesses that possess large volumes of database exports and spreadsheets, as converting these files into usable data can be costly and time-consuming.

Superior Performance:
Early results indicate that RosettaStoneLLM outperforms general",https://venturebeat.com/wp-content/uploads/2024/04/hercules-ai-assembly-line.jpg?w=1200&strip=all,2024-04-04 16:00:00,"Meta Description: Revolutionize enterprise operations with Hercules AI's virtual workforce & RosettaStoneLLM! Streamline complex workflows, enhance efficiency, and maintain a competitive edge in today's digital landscape. Discover the benefits of standardization and powerful AI tools.

Title: Revolutionizing Enterprise Operations with Hercules AI's Virtual Workforce and RosettaStoneLLM

Hercules AI's Virtual Workforce and RosettaStoneLLM are transforming the way businesses operate. With a unique ""assembly line"" process and powerful AI tools, companies can quickly deploy AI agents, automate complex workflows, and improve operational efficiency. The standardization and compliance of Hercules AI's virtual workforce and RosettaStoneLLM's superior performance offer a competitive edge for businesses, especially in regulated industries. Embrace these advancements and stay ahead in the rapidly evolving digital landscape.", Virtual AI ,Technology,"Formicoders,News,AI,Technology,Innovation,Programmering,Coding,Wordpress,Python"
