Link,Title,Text,Image,Date Publish
https://www.forbes.com/sites/erikkain/2024/02/25/todays-wordle-hints-and-clues-for-monday-february-26th---wordle-982-answer/,"Today’s ‘Wordle’ Hints And Clues For Monday, February 26th - Wordle #982 Answer","

In the realm of word puzzles, Wordle reigns supreme, captivating players with its daily challenge. As the week begins anew, I find myself yearning for the leisurely pace of the weekend that seems to have vanished in the blink of an eye. My Sunday was far from restful, with a morning visit to the vet followed by a day of work that left me feeling stiff and in need of some invigorating exercise. Today, I'm determined to embark on a brisk walk with my beloved doggies, hoping to shake off the weariness and infuse my body with renewed energy.

Amidst the household's bustling routine, a particular concern weighs heavily on my mind: the health of my youngest pup, Bruno. Despite numerous tests and X-rays, the mystery of his ailment remains unsolved. Once a bundle of boundless energy, he now appears lethargic and subdued, a stark contrast to his usual vibrant self. The search for answers continues, as we strive to unravel the puzzle that has befallen our furry companion.

While the enigma of Bruno's health persists, the Wordle puzzle beckons, offering a welcome distraction from life's complexities. Today's hint, ""frequently,"" guides us towards a solution that begins with a vowel. After some contemplation, the word ""often"" emerges as the answer, revealing itself through a series of well-placed guesses.

My starting word, ""spore,"" was inspired by Pedro Pascal's acceptance speech for Best Actor at the SAG Awards, where he spoke about the spores that transmit the sickness in the TV show and video game, The Last Of Us. The subsequent word, ""foley,"" was a random choice that serendipitously yielded a green box and two yellow boxes. With these clues in hand, ""often"" became the only viable option, later confirmed by Wordle Bot, although it suggested ""offed"" as an alternative, which seemed rather grim even for the Bot's standards.

In the competitive spirit of Wordle, I proudly claim two points for my victory: one for guessing the word in three attempts and another for outsmarting the Wordle Bot. Bwahaahahahahaha!

Delving into the etymology of ""often,"" we discover its roots in Old English, where the word ""oft"" meant ""frequently"" or ""many times."" The suffix ""-en"" was added later, transforming it into the adverbial form ""often,"" signifying ""frequently"" or ""in many instances."" The word's Germanic origins are evident in cognates such as German ""oft"" and Dutch ""vaak.""

Over time, the pronunciation of ""often"" has undergone changes, with the ""t"" sometimes being silent and sometimes pronounced. This variation reflects the influence of Latin on English, particularly during the Middle Ages and the Renaissance when Latin held significant sway over scholarly discourse and linguistic norms. Today, both pronunciations—with and without the ""t"" sound—are considered correct, a testament to the word's rich history and the ever-evolving nature of language.

",https://imageio.forbes.com/specials-images/imageserve/6222c207e957517e5b79a719/0x0.jpg?format=jpg&height=900&width=1600&fit=bounds,2024-02-25 21:00:00
https://www.forbes.com/sites/mikestubbs/2024/02/25/w7m-wins-the-the-rainbow-six-invitational-after-incredible-grand-final/,W7m Wins The The Rainbow Six Invitational After Incredible Grand Final,"

In the grand finale of the 2024 Six Invitational, w7m esports emerged victorious over FaZe Clan, securing the title of Rainbow Six Siege world champions. The Brazilian crowd erupted in cheers as their home team claimed the coveted championship trophy and the $1 million grand prize.

The final match was a nail-biting showdown between two of the tournament's most formidable teams. FaZe Clan started strong, dominating the first map, Oregon, with a commanding 7-1 victory. However, w7m quickly regained their composure, trading close rounds with FaZe on Bank and Skyscraper, winning their map pick 7-5. The tension mounted as w7m secured Border 7-4, forcing a thrilling fifth map.

The final showdown unfolded on Nighthaven Labs. FaZe Clan initially surged ahead, taking the first two rounds. w7m fought back, claiming the third round, but FaZe seemed poised to clinch the championship. Yet, in a remarkable turn of events, w7m rallied, mounting an astonishing comeback from a 6-1 deficit to force overtime.

The crowd held their breath as the teams battled it out in overtime. w7m struck first, putting themselves on championship point. With nerves of steel, they secured the final two rounds, etching their names in Rainbow Six Siege history as the 2024 world champions.

While both teams entered the tournament as favorites, their paths to the final were far from straightforward. Neither team secured a group stage victory, forcing them into the upper bracket's extra round. w7m faced elimination in this round, losing to Wolves Esports and dropping to the lower bracket. However, they showcased their resilience, embarking on an impressive run, dropping only two games in six lower bracket best-of-three matches.

FaZe Clan, on the other hand, navigated the upper bracket more smoothly. They defeated G2 Esports, Soniqs, and Virtus.Pro, securing their spot in the final.

Virtus.Pro and G2 Esports rounded out the top four, claiming third and fourth place, respectively.

The first Six Invitational held in Brazil proved to be an unforgettable spectacle, captivating fans with record-breaking attendance and an electrifying atmosphere. The Brazilian crowd's passion and enthusiasm created a unique and unforgettable experience. Rainbow Six Siege fans eagerly await the next major tournament in Brazil, where they can once again witness the world's best teams compete for glory.

",https://imageio.forbes.com/specials-images/imageserve/65dbbfe7ae8ffdcc5052041c/0x0.jpg?format=jpg&height=900&width=1600&fit=bounds,2024-02-25 19:34:42
https://www.forbes.com/sites/jamiecartereurope/2024/02/25/see-jupiter-and-the-false-dusk-as-dark-skies-return-the-night-sky-this-week/,See Jupiter And The ‘False Dusk’ As Dark Skies Return: The Night Sky This Week,"

Title: Unveiling the Night Sky's Secrets: A Journey Through the Cosmos

In the vast expanse of the universe, our planet Earth is just a tiny speck, yet it offers us a front-row seat to witness the celestial wonders that unfold each night. As the moon wanes from last week's full 'Snow Moon,' the night skies become darker, providing an ideal backdrop for stargazing. This week promises a captivating array of astronomical events, inviting us to explore the mysteries of the cosmos.

As we journey through the week, we'll encounter a celestial dance between the moon and Spica, the brightest star in the constellation Virgo. On the morning of February 28th, look towards the south to witness this enchanting rendezvous, where the moon and Spica will appear just a degree and a half apart.

While the moon continues its celestial waltz, we'll also witness a unique occurrence on February 29th - Leap Day. This special day, which only occurs every four years, serves as a reminder of the Earth's intricate orbit around the sun. It's a day to appreciate the delicate balance of our solar system and the cosmic harmony that governs our lives.

As the week progresses, the Last Quarter Moon will grace the night sky on March 3rd. This celestial event offers an excellent opportunity for lunar observation, as the half-lit moon casts sharp shadows across the lunar surface, revealing its intricate details. Look to the south an hour before sunrise to catch a glimpse of this celestial spectacle.

Our journey through the cosmos wouldn't be complete without exploring the Zodiacal Light, a subtle yet spectacular phenomenon visible in the western sky about an hour after sunset. This triangular glow, often referred to as a ""false dusk,"" is caused by sunlight reflecting off cosmic dust left in the solar system. It's a reminder of the vastness of our solar system and the interconnectedness of celestial bodies.

However, as we immerse ourselves in the wonders of the night sky, we must acknowledge the growing threat of light pollution. This artificial illumination not only disrupts our connection with the cosmos but also has detrimental effects on wildlife and our overall well-being. It's crucial to take steps to reduce light pollution and preserve the pristine beauty of our night skies.

As we continue our celestial exploration, let's embrace the darkness and marvel at the wonders that await us above. With a keen eye and a sense of wonder, we can unlock the secrets of the night sky and deepen our connection with the universe that surrounds us.

Wishing you clear skies and a universe of discoveries!

",https://imageio.forbes.com/specials-images/imageserve/658347f80580431d97069f64/0x0.jpg?format=jpg&height=900&width=1600&fit=bounds,2024-02-25 19:15:00
https://www.forbes.com/sites/ewanspence/2024/02/25/samsung-galaxy-z-fold-6-new-design-smaller-size-cover-display-new-galaxy-z-fold/,New Samsung Leak Reveals Galaxy Z Fold 6 Design Decision,"

Samsung's Galaxy Z Fold 6: A Revolutionary Redesign

In the realm of foldable smartphones, Samsung's Galaxy Z Fold series has been a trailblazer. Now, with the upcoming Galaxy Z Fold 6, Samsung is poised to unveil a groundbreaking redesign that addresses some of the key concerns and limitations of previous foldable devices.

Addressing Durability Concerns

One of the biggest hurdles for foldable smartphones has been the durability of their displays. The Galaxy Z Fold 6 aims to tackle this issue head-on by incorporating a new hinge design and more robust materials. This enhanced durability is further bolstered by the recent MIL-STD-810G certification from the US Department of Defense, assuring users of the device's resilience against various environmental stresses.

A Slimmer Profile for Enhanced Usability

Samsung has taken note of the feedback regarding the bulkiness of previous foldable phones. The Galaxy Z Fold 6 boasts a significantly slimmer profile, reducing its depth by an impressive 25%. This reduction in thickness not only enhances the device's aesthetics but also improves its ergonomics, making it more comfortable to hold and use.

An Expanded Cover Display for Seamless Interaction

The Galaxy Z Fold 6 introduces an expanded cover display, addressing one of the pain points of earlier foldable models. The taller and wider cover display provides a more immersive experience for users, making it easier to interact with apps and notifications without having to unfold the device.

A More Mainstream Appeal

With these design improvements, the Galaxy Z Fold 6 aims to appeal to a broader audience, moving beyond early adopters and tech enthusiasts. The slimmer profile, enhanced durability, and expanded cover display make the device more accessible and user-friendly, catering to a wider range of consumers seeking a cutting-edge foldable smartphone.

Addressing Price Concerns

Samsung is aware that price remains a significant barrier for many potential foldable smartphone buyers. To address this issue, the company is reportedly considering various strategies, including offering more affordable variants of the Galaxy Z Fold 6 and exploring innovative financing options.

Conclusion

The Galaxy Z Fold 6 represents a significant step forward for Samsung's foldable smartphone lineup. With its focus on durability, usability, and mainstream appeal, the device aims to overcome the challenges that have hindered the widespread adoption of foldable phones. If Samsung can deliver on its promises, the Galaxy Z Fold 6 could be the foldable smartphone that finally breaks into the mainstream market.

","https://imageio.forbes.com/specials-images/imageserve/65d8c1d99a6516a610d01545/0x0.jpg?format=jpg&crop=2519,1416,x0,y319,safe&height=900&width=1600&fit=bounds",2024-02-25 18:39:52
https://www.forbes.com/sites/erikkain/2024/02/25/the-walking-dead-the-ones-who-live-episode-1-review---rick-and-michonne-return-in-a-lackluster-series-premiere/,‘The Walking Dead: The Ones Who Live’ Episode 1 Review - Rick And Michonne Return In A Lackluster Series Premiere,"

The Walking Dead: The Ones Who Live: A New Chapter in the Zombie Saga

In the post-apocalyptic world of The Walking Dead, we embark on a new chapter with ""The Ones Who Live,"" a spin-off series that follows the enigmatic Rick Grimes, played by the talented Andrew Lincoln. As we delve into this uncharted territory, questions arise: Will this new chapter live up to the legacy of its predecessor? Will it capture the essence of what made The Walking Dead a global phenomenon?

The premiere episode, while intriguing, leaves us with mixed feelings. It serves primarily as a catch-up session, filling us in on Rick's whereabouts and his experiences since his disappearance from the original series. While this exposition is necessary, it does slow down the narrative, leaving us yearning for more action and character development.

Rick's involvement with the Civic Republic Military (CRM) is a central plot point. We learn about his numerous escape attempts and his encounters with various characters, including the enigmatic Okafor (Craig Tate) and the mysterious Major General Beale (Terry O'Quinn). These interactions provide glimpses into the CRM's inner workings and their questionable strategies.

Despite the slow pacing, the episode delivers some captivating moments. The scenes between Rick and Major General Beale are particularly compelling, showcasing the acting prowess of both Lincoln and O'Quinn. The tension between them is palpable, and their dialogue hints at deeper mysteries yet to be revealed.

The episode concludes with a thrilling cliffhanger, leaving us eagerly anticipating the next installment. Michonne (Danai Gurira), Rick's long-lost love, makes a surprise appearance, shooting down the helicopter carrying Rick and Okafor. The reunion between these two beloved characters is sure to be an emotional rollercoaster in the episodes to come.

Overall, ""The Ones Who Live"" is a promising start to a new chapter in The Walking Dead saga. While the premiere episode focuses on exposition and character introductions, it sets the stage for a thrilling journey ahead. With the return of fan-favorite characters and the introduction of intriguing new ones, the series has the potential to captivate audiences once again.

As we eagerly await the next episode, we can't help but wonder: What lies ahead for Rick and Michonne? How will they navigate the treacherous world of the CRM? And what other surprises await us in this post-apocalyptic landscape? Tune in to find out!

",https://imageio.forbes.com/specials-images/imageserve/65dbbece6c3233381309f054/0x0.jpg?format=jpg&height=900&width=1600&fit=bounds,2024-02-25 18:36:04
https://www.forbes.com/sites/traversmark/2024/02/25/a-psychologist-explains-6-types-of-conspiracy-theories/,A Psychologist Explains 6 Types Of Conspiracy Theories,"

In a world teeming with information and unanswered questions, the human mind often seeks explanations beyond the ordinary. This yearning has given rise to conspiracy theories, captivating narratives that weave suspicion and speculation into the fabric of reality. These theories, ranging from whispers of shadowy organizations to hidden agendas and extraterrestrial encounters, have become a curious phenomenon, captivating the imaginations of many.

At the heart of conspiracy theories lies a distrust of official narratives and a belief in hidden truths. Proponents of these theories often point to inconsistencies, alleged connections, and patterns as evidence of a larger, sinister plot. From the belief that governments orchestrate events to control the populace to the notion that powerful elites manipulate world events for their own gain, conspiracy theories offer a tantalizing glimpse into the darker recesses of human imagination.

While some conspiracy theories may seem harmless, research suggests they can have detrimental effects on individuals and society. Misinformation about disease origins and treatments can undermine preventive measures and adherence to medical advice. Concerns about vaccine safety can contribute to declining vaccination rates, potentially endangering public health. Moreover, conspiracy theories can foster social and political disengagement, leading to apathy and even fueling extremism.

To navigate the realm of conspiracy theories, it's essential to be equipped with critical thinking skills. Questioning claims, seeking reliable sources of information, and being open to alternative perspectives can help us discern fact from fiction. It's also important to recognize that not all conspiracy theories are created equal. Some may be based on genuine concerns or historical events, while others may be fueled by fear, prejudice, or a desire for control.

Approaching conspiracy theories with an open mind, yet a discerning eye, can help us engage in meaningful discussions and promote a more informed and critical society. By fostering critical thinking and encouraging healthy skepticism, we can navigate the murky waters of conspiracy theories and emerge with a clearer understanding of the world around us.

","https://imageio.forbes.com/specials-images/imageserve/65dbc3d36a87d91cedc1f520/0x0.jpg?format=jpg&crop=999,469,x0,y58,safe&height=900&width=1600&fit=bounds",2024-02-25 18:25:25
