Link,post_title,title,post_content,featured_image,Date-Publish,meta_desc,focuskeywords,post_category,Post_tag
https://techcrunch.com/2024/04/08/multiverse-the-apprenticeship-unicorn-acquires-searchlight-to-put-a-focus-on-ai/,"Multiverse, the apprenticeship unicorn, acquires Searchlight to put a focus on AI", Multiverse Acquires Searchlight: AI Boosts Workforce Development ,"Title: Multiverse Acquires Searchlight: AI Takes the Lead in Workforce Development

Multiverse, a renowned British edtech unicorn, has made a significant acquisition to enhance its professional training services. The company has purchased Searchlight, an AI-based recruitment platform that connects talent with opportunities in the technology sector. This strategic move will enable Multiverse to develop new AI products and expand its offerings.

Euan Blair, Multiverse's founder and CEO, expressed his excitement about the acquisition: ""Searchlight's AI, platform, and exceptional talent will allow us to better diagnose the skills needed within companies and deliver impactful solutions. Combining our scale and world-class learning with Searchlight's technology and team will ensure even more companies and individuals benefit.""

Searchlight, co-founded by twin sisters Kerry and Anna Wang, has made a name for itself by using AI to identify the best matches for roles, with a success rate four times greater than traditional interviews. Kerry Wang, Searchlight's CEO, said, ""We're solving for the exact same problem, which is increased equitable access to economic opportunity for everyone. Multiverse had a great business but they're looking to expand into an all-in-one workforce development platform.""

This acquisition highlights AI's growing role in the realms of work and education. While some fear AI might replace jobs, this deal demonstrates its potential in enhancing professional training services and filling recruitment gaps.

Founded by Euan Blair, son of former U.K. Prime Minister Tony Blair and high-profile barrister Cherie Booth Blair, Multiverse boasts around 1,000 customers, including Cisco, government organizations, financial services, and industrial companies. Multiverse initially gained recognition for its apprenticeship programs in technology but has since expanded to offer professional training for employed individuals.

Financial details of the acquisition remain undisclosed. However, it is noteworthy that Searchlight, co-founded by the accomplished Stanford graduates Kerry and Anna Wang, raised nearly $20 million, primarily through a $17 million Series A in 2021. Investors like Accel, Founders Fund, Emerson Collective, and Shasta Ventures supported the startup. Pitchbook estimated its valuation in 2021 at $64 million","https://techcrunch.com/wp-content/uploads/2021/12/Searchlight-Founders.jpg?resize=1200,672",2024-04-08 23:46:46,"""Multiverse acquires Searchlight, boosting AI in workforce development. Discover the future of professional training with AI-driven solutions. AI WorkforceDevelopment MultiverseAcquiresSearchlight""", AI ,Technology,"Formicoders,News,AI,Technology,Innovation,Programmering,Coding,Wordpress,Python"
https://techxplore.com/news/2024-04-nuclear-industry-upbeat-small-reactors.html,"US nuclear industry upbeat on small reactors, despite setback", Small Modular Reactors: Carbon-Free Power & Industry Hurdles ,"Title: The Future of Small Modular Reactors: A Carbon-Free Power Source

Introduction

In the face of escalating energy demand and the need for sustainable solutions, small modular reactors (SMRs) are gaining traction as a viable carbon-free power source. Despite setbacks, such as the cancellation of NuScale's project in Idaho, the nuclear industry remains optimistic about the potential of SMRs. This article explores the current state of SMRs, their advantages, and the challenges they face, as well as highlighting promising developments in the field.

The Current State of SMRs

Numerous nations have opted to phase out nuclear plants, but SMR manufacturers are working diligently to win over skeptical customers. The recent cancellation of a next-generation US nuclear plant has not dampened enthusiasm for carbon-free power. In fact, new SMR projects are expected to come online by the end of the decade. One such project is GE Hitachi's BWRX-300 design, which aims to begin power production in Darlington, Ontario, Canada, in 2029.

In the United States, the Tennessee Valley Authority, a federally-owned power company, has invested in the BWRX-300, signaling a vote of confidence in the technology. Additionally, TerraPower, a nuclear company backed by Bill Gates, plans to begin construction on a novel liquid sodium-cooled fast reactor technology in Wyoming in June 2024. Another project in development is Ultra Safe Nuclear Corporation's Micro-Modular Reactor (MMR) assembly plant, scheduled to go online in 2027 in Gadsden, Alabama.

Advantages and Challenges

SMRs offer several advantages over traditional nuclear power plants. They are smaller, making them more adaptable to various locations and less disruptive to the environment. Moreover, SMRs can be built in factories and shipped to their final destinations, reducing construction time and costs. They also have the potential to provide reliable, carbon-free power to remote areas and industries with high energy demands, such as data centers and mining operations.

Despite these advantages, SMRs face several challenges. One major hurdle is reducing costs, which have been driven up by factors such as higher prices for",https://scx2.b-cdn.net/gfx/news/2024/several-nations-have-m.jpg,2024-04-07 13:36:00,"Meta Description:

Explore the future of small modular reactors (SMRs) as a promising, carbon-free power source. Learn about innovative designs, industry optimism, and challenges in this rapidly evolving sector.

(17 words)", nuclear materials ,Technology,"Formicoders,News,AI,Technology,Innovation,Programmering,Coding,Wordpress,Python"
https://www.engadget.com/one-of-these-concept-lunar-vehicles-could-join-nasas-artemis-v-astronauts-on-the-moon-202448277.html,One of these concept lunar vehicles could join NASA’s Artemis V astronauts on the moon, NASA's Artemis V Lunar Missions: 3 Companies Selected for LTV Feasibility Studies ,"[INTRODUCTION]

In the latest chapter of lunar exploration, NASA has announced that three companies have been selected to develop lunar terrain vehicles (LTV) for feasibility studies. These companies, Intuitive Machines, Lunar Outpost, and Venturi Astrolab, will have the opportunity to demonstrate their LTVs' capabilities to support NASA's Artemis missions. This is an exciting time for space exploration, as these vehicles will play a crucial role in future missions, serving as both crewed and uncrewed transportation and exploration devices.

[COMPANIES SELECTED FOR FEASIBILITY STUDIES]

NASA has chosen Intuitive Machines, Lunar Outpost, and Venturi Astrolab to participate in a year-long feasibility study. During this time, each company will develop its unique LTV design. Intuitive Machines, which has already secured multiple contracts with NASA through the Commercial Lunar Payload Services (CLPS) program, will create the Moon Racer. Meanwhile, Venturi Astrolab will develop the Flex, and Lunar Outpost will work on the Lunar Dawn.

[LTV REQUIREMENTS AND CONTRACT VALUE]

The chosen LTV must be capable of transporting a crew of two astronauts and withstanding the harsh conditions of the lunar south pole. After the feasibility study, only one company will be selected for a demonstration mission, in which the vehicle will be completed and sent to the moon for performance and safety tests. NASA plans to use the LTV for crewed missions, starting with the Artemis V, which is projected to launch in early 2030. The selected company will be contracted for lunar services through 2039, with the potential value of all related task orders amounting to $4.6 billion. Moreover, the chosen company will have the opportunity to use its LTV for commercial activities during its downtime.

[LTV FUNCTIONALITY AND SCIENTIFIC IMPORTANCE]

The LTV will serve as both a crewed and uncrewed vehicle. As a crewed vehicle, it will transport astronauts to various locations on the moon, expanding our exploration capabilities. As an uncrewed vehicle, it will function as a remotely operated explorer, enabling scientists",https://s.yimg.com/os/creatr-uploaded-images/2024-04/77222ce0-f519-11ee-affb-422fb4d69dd6,2024-04-07 20:24:48,"Drive NASA's Lunar Rover: Discover the Moon, Expand Space Missions! Uncover lunar secrets with chosen LTVs from Intuitive Machines, Lunar Outpost, and Venturi Astrolab. Be part of the Artemis V mission. [19 words]", Lunar Rover ,Technology,"Formicoders,News,AI,Technology,Innovation,Programmering,Coding,Wordpress,Python"
https://techxplore.com/news/2024-04-words-youre-engaging-chatgpt.html,"The words you use matter, especially when you're engaging with ChatGPT", Subtle Prompt Changes Impact Large Language Models' Predictions: USC Study ,"Title: The Profound Impact of Prompt Variations on Large Language Models

Introduction

Interacting with large language models (LLMs), such as ChatGPT, has become increasingly common in various applications, including data processing and machine learning tasks. However, the influence of minor changes in prompts on the accuracy of LLM-generated labels remains largely unexplored. In a recent study, researchers from the USC Information Sciences Institute (ISI) investigated the effects of prompt variations on LLM predictions, revealing that subtle changes can significantly impact model outcomes.

The Four Categories of Prompt Variations

The researchers examined four categories of prompt variations:

1. Output formats: Requesting responses in specific formats commonly used in data processing, such as lists or CSV files.
2. Minor perturbations: Making minor alterations to the prompt, like adding extra spaces at the beginning or end, or incorporating polite phrases.
3. Jailbreaks: Using techniques to bypass content filters for sensitive topics like hate speech detection.
4. Incentives: Offering different amounts of tips for ""a perfect response.""

Testing the Prompt Variations

The researchers tested these prompt variations across 11 benchmark text classification tasks, evaluating model performance in tasks such as toxicity classification, grammar evaluation, humor and sarcasm detection, and mathematical proficiency.

Key Findings

The study revealed the following insights:

1. Output formats: Adding a specified output format led to a minimum of 10% of predictions changing.
2. Minor perturbations: Introducing spaces or common greetings in prompts resulted in more than 500 (out of 11,000) prediction changes.
3. Jailbreaks: Using jailbreaks on tasks led to a significant proportion of changes, with the impact varying depending on the specific jailbreak used.
4. Incentives: Tipping had minimal performance changes, while certain jailbreaks could result in significant accuracy loss.

Implications

These findings suggest that researchers and developers should carefully consider prompt design when working with LLMs. While specific formatting or perturbation methods may improve accuracy in certain tasks, there is no one-size-fits-all solution. Thus, it is crucial to test various prompt variations and closely monitor model performance.

Furthermore, while incent",https://scx2.b-cdn.net/gfx/news/hires/2024/chatgpt-1.jpg,2024-04-08 13:20:02,"Meta Description: Discover how prompt variations impact large language models' accuracy in data processing & machine learning tasks. Tested across 11 benchmarks, changes in output formats, perturbations, jailbreaks, and incentives led to significant prediction shifts. AI LanguageModels PromptDesign

Matched Content: This news article discusses a study examining the impact of prompt variations on large language models (LLMs) in data processing and machine learning tasks. Researchers from the USC Information Sciences Institute (ISI) tested output formats, minor perturbations, jailbreaks, and incentives across 11 benchmark text classification tasks. The findings revealed that these variations led to significant changes in predictions, emphasizing the importance of careful prompt design for optimal model performance.", Prompt Variations ,Technology,"Formicoders,News,AI,Technology,Innovation,Programmering,Coding,Wordpress,Python"
https://techcrunch.com/2024/04/08/neurovalens-anxiety-fda/,Neurotech startup Neurovalens gets FDA clearance for noninvasive anxiety treatment,"Title: Neurovalens' FDA-Cleared Neurostimulation for Anxiety & Insomnia Treatment

Neurotech startup Neurovalens receives FDA clearance for noninvasive anxiety treatment

Neurovalens' Achievements and Future Plans
- Two FDA-cleared medical devices for GAD and insomnia
- Obesity-related cardiometabolic risk and PTSD devices in the pipeline
- Plans for FDA ""de novo"" classification of obesity-treating device
- PTSD product in development

Noninvasive Neurostimulation: A Growing Trend
- Addressing chronic pain, depression, anxiety, and stress
- Safer and more effective alternatives to pharmaceutical interventions

Neurovalens' Strategic Focus
- Focus on prescription-based medical devices, not wellness-oriented consumer devices","Title: Neurovalens: A Trailblazer in Noninvasive Neurostimulation for Mental Health and Beyond

Introduction

The U.S. medical devices regulator's 2019 rule change, intended to foster innovations targeting insomnia and anxiety, has proven to be a game-changer. Neurovalens, a Belfast-based startup, has recently received FDA clearance for its second head-mounted treatment device, following the approval of its devices targeting generalized anxiety disorder (GAD) and insomnia. This article delves into Neurovalens' groundbreaking work, its unique approach to noninvasive neurostimulation, and its ambitious plans to transform the healthcare landscape.

Neurovalens' Achievements and Future Plans

Neurovalens has made significant strides in noninvasive neurostimulation technology, with two FDA-cleared medical devices available by prescription in the U.S. The GAD device received approval just recently, and the insomnia device was given the green light last October. The company has more products in the pipeline, including a device targeting obesity-related cardiometabolic risk, which influences the storage of harmful visceral fat. Neurovalens is also working on a product for PTSD.

According to Dr. Jason McKeown, Neurovalens' CEO, the company aims to secure an FDA ""de novo"" classification for a third neurostimulating device, focusing on treating obesity, later this year or early next year. Moreover, Neurovalens is developing another product for PTSD, further expanding its reach and impact on the healthcare sector.

Noninvasive Neurostimulation: A Growing Trend

Chronic pain, depression, anxiety, and stress are increasingly becoming challenges for traditional healthcare services. Consequently, a growing number of startups, including Neurovalens, are exploring noninvasive neurostimulation as a solution for various issues and chronic conditions. Pharmaceutical interventions have limitations, such as side effects risks, whereas noninvasive alternatives with proven efficacy and safety could revolutionize treatment and complement drug interventions.

Neurovalens' Strategic Focus

Unlike some startups that market wellness-oriented consumer devices,","https://techcrunch.com/wp-content/uploads/2024/04/Screenshot-2024-04-08-at-19.17.32.png?resize=1200,1061",2024-04-08 17:28:35,"Neurovalens: Pioneering Noninvasive Neurostimulation for Mental Health & Beyond

Discover Neurovalens' groundbreaking work in noninvasive neurostimulation, with two FDA-cleared medical devices for GAD and insomnia. Learn about their ambitious plans, including obesity-treating and PTSD-focused devices. Join the neurostimulation revolution for safer, more effective healthcare.

Meta Description:

Explore Neurovalens' innovative noninvasive neurostimulation for mental health & beyond. FDA-cleared devices target GAD, insomnia, obesity, and PTSD. Learn more about their impact on the healthcare sector.","Neurovalens: Pioneering [End of generated content] Neurostimulation for Mental Health & Beyond

Introduction

The U.S. medical devices regulator's 2019 rule change, intended to foster innovations targeting insomnia and anxiety, has proven to be a game-changer. Neurovalens, a Belfast-based startup, has recently received FDA clearance for its second head-mounted treatment device, following the approval of its devices targeting generalized anxiety disorder (GAD) and insomnia. This article delves into Neurovalens' groundbreaking work, its unique approach to neurostimulation, and its ambitious plans to transform the healthcare landscape.

Neurovalens' Achievements and Future Plans

Neurovalens has made significant strides in neurostimulation technology, with two FDA-cleared medical devices available by prescription in the U.S. The GAD device received approval just recently, and the insomnia device was given the green light last October. The company has more products in the pipeline, including a device targeting obesity-related cardiometabolic risk, which influences the storage of harmful visceral fat. Neurovalens is also working on a product for PTSD.

According to Dr. Jason McKeown, Neurovalens' CEO, the company aims to secure an FDA ""de novo"" classification for a third neurostimulating device, focusing on treating obesity, later this year or early next year. Moreover, Neurovalens is developing another product for PTSD, further expanding its reach and impact on the healthcare sector.

Noninvasive Neurostimulation: A Growing Trend

Chronic pain, depression, anxiety, and stress are increasingly becoming challenges for traditional healthcare services. Consequently, a growing number of startups, including Neurovalens, are exploring noninvasive neurostimulation as a solution for various issues and chronic conditions. Pharmaceutical interventions have limitations, such as side effects risks, whereas noninvasive alternatives with proven efficacy and safety could revolutionize treatment and complement drug interventions.

Neurovalens' Strategic Focus

Unlike some startups that market wellness-oriented consumer devices, Neurovalens concentrates on medical-grade devices",Technology,"Formicoders,News,AI,Technology,Innovation,Programmering,Coding,Wordpress,Python"
https://techcrunch.com/2024/04/08/now-at-the-top-of-the-app-store-the-eclipse-app-is-a-great-companion-for-mondays-solar-eclipse/,"Now at the top of the App Store, the Eclipse App is a great companion for Monday's solar eclipse", Eclipse App: Your Complete Guide to the Solar Eclipse ,"Title: The Rise of the Eclipse App: Your Ultimate Guide to the Solar Eclipse

At the pinnacle of the App Store, the Eclipse App has become a trusty companion for viewers of the highly anticipated solar eclipse. With over 140,000 lifetime downloads on iOS and Android devices, this app offers an enhanced experience for observing the celestial event. Developed in partnership between The Planetary Society and The Eclipse Company, the app includes features such as cloud cover forecasts, precise timings of totality, and information about local events and viewing sites.

The Eclipse App's journey began with a user-friendly eclipse map, helping people find the perfect spot to witness the annual eclipse on October 14, 2023. The app, available in the U.S. and Canada since February, earns revenue through in-app purchases, granting users access to a live stream for $3. As of Monday, there were approximately 9,800 paying users, with download numbers rapidly increasing.

The app's success can be attributed to organic searches, currently ranking first in its category (Travel) and ninth Overall in the U.S. App Store. It also ranks eighth in its category on Google Play, with positive reviews on the App Store. However, there appears to be more consumer dissatisfaction with the Android version.

The Eclipse App offers several features to enhance your viewing experience:

1. Explore the path of totality across U.S. states and Canadian provinces.
2. Discover community events in search states.
3. Utilize a timer to determine the moment of totality for your exact location.
4. Check local weather forecasts.
5. Receive notifications about local events and points of interest.
6. Access parking information for various events.

In addition to the Eclipse App, Solar Snap, another app from the same company, reached No. 3 on the Top Charts for its photography assistant features, perfect for capturing images of the eclipse.

For those unable to watch the eclipse in person or without special glasses, the official NASA livestream is available below:

[Insert NASA livestream link here]

Experience the awe-inspiring solar eclipse with the Eclipse App, your ultimate guide","https://techcrunch.com/wp-content/uploads/2024/04/GettyImages-2141953318.jpg?resize=1200,800",2024-04-08 19:10:37,"""Discover the 2023 Solar Eclipse with our ultimate guide app! Explore paths, events, weather, timings & more. Download now!"" (115 characters)

This meta description highlights the key aspects of the news article, including the year of the solar eclipse, the app's features, and a call-to-action to download the app. It remains under 18 words as requested, but expands slightly to provide a more comprehensive overview of the content.", Solar Eclipse ,Technology,"Formicoders,News,AI,Technology,Innovation,Programmering,Coding,Wordpress,Python"
https://techcrunch.com/2024/04/08/metas-x-competitor-threads-invites-developers-to-sign-up-for-api-access-publishes-docs/,"Meta's X competitor Threads invites developers to sign up for API access, publishes docs"," Meta's Threads Opens Up API to Developers: Docs, Features, Limitations ","Meta's Threads, the Twitter/X competitor, recently announced the release of developer documentation and a sign-up sheet for its API, set to go public in June. The new documentation provides insights into the API's capabilities, limitations, and endpoints, enabling developers to create Threads-connected apps and integrate with the social network.

The API offers various features for developers, such as tracking post analytics, publishing posts and media, retrieving replies, and troubleshooting tips. With the Insights API, developers can access data like views, likes, replies, reposts, and quotes for Threads posts. However, there are certain limitations to prevent spam and excessive use, such as a 24-hour limit of 250 API-published posts and 1,000 replies per account.

Media specifications for image and video uploads are also outlined, as well as character count limits for text posts, which are set at 500 characters, surpassing Twitter's 280-character limit but falling short of X's 25,000-character offer for paid subscribers. It remains to be seen if Meta will favor particular app categories in the future.

Among the Threads API beta testers are social tool makers like Sprinklr, Sprout Social, Social News Desk, Hootsuite, and tech news board Techmeme. Threads is now part of the fediverse, an interconnected network of social networking services, but users must still visit the app's settings to enable or disable fediverse sharing.

Meta plans to update the documentation based on developer feedback and encourages those interested in building with the API to provide feedback through the sign-up page. This initiative could help Meta monitor apps preparing to launch alongside the API's public debut.

In summary, Meta's release of Threads' developer documentation and a sign-up sheet for interested parties marks an essential step towards the API's public launch in June. The new documentation provides crucial information on the API's functionalities, limitations, and endpoints, enabling developers to create Threads-connected apps and integrate with the social network. With the new API, users and developers can look forward to enhanced features, improved post analytics, and seamless media uploads on Meta's latest social media platform.","https://techcrunch.com/wp-content/uploads/2023/07/Threads-GettyImages-1524134312.jpg?resize=1200,800",2024-04-08 20:43:05,"""Join Meta's Threads API: Sign up, build, and integrate now. Connect with the social network, access post analytics, and more. ThreadsAPI""", Threads API ,Technology,"Formicoders,News,AI,Technology,Innovation,Programmering,Coding,Wordpress,Python"
