Link,post_title,title,post_content,featured_image,Date-Publish,meta_desc,focuskeywords,post_category,Post_tag
https://techxplore.com/news/2024-04-robots-outrun-animals.html,Why can't robots outrun animals?,"SEO Title: Bridging the Gap: Animals' Agility & Robotics' Engineering in Running Robots

For decades, robotics engineers have attempted to match the agility of animals in running robots. A new study in Science Robotics reveals that animals still outperform robots in movement and overall performance. Although engineering subsystems generally outperform their biological counterparts, animals' integration and control of components remain unmatched. Despite the current disparity, researchers remain optimistic about the potential of robotics, highlighting the remarkable progress achieved in the field and its vast applications.","Title: The Incredible Agility and Endurance of Animal Locomotion: A Lesson for Robotics

For decades, robotics engineers have pursued the creation of a machine capable of matching the walking or running agility of animals. However, even with substantial investments in research, today's robots still lag significantly behind their biological counterparts. As Dr. Max Donelan, a Professor in Simon Fraser University's Department of Biomedical Physiology and Kinesiology, explains, ""A wildebeest can migrate for thousands of kilometers over rough terrain, a mountain goat can climb up a literal cliff, and cockroaches can lose a leg and not slow down."" These impressive animal feats remain unmatched in the world of robotics.

To understand the reasons behind this gap, an interdisciplinary team of scientists and engineers examined various aspects of running robots and compared them with animals in a study published in Science Robotics. The researchers focused on five subsystems essential for creating a running robot - Power, Frame, Actuation, Sensing, and Control. According to Tom Libby, Senior Research Engineer at SRI International, ""By the metrics engineers use, biological components performed surprisingly poorly compared to fabricated parts. However, where animals excel is in their integration and control of those components.""

The team, consisting of experts from the University of Washington, SRI International, the University of Colorado Boulder, and the Georgia Institute of Technology, discovered that engineering subsystems generally outperformed their biological counterparts. Nevertheless, when it comes to movement and overall performance, animals continue to outshine robots. Sam Burden, Associate Professor in the Department of Electrical & Computer Engineering at the University of Washington, rightly notes, ""Animals are amazing, and robots have yet to catch up.""

Despite the current disparity, the researchers remain optimistic about the potential of robotics. When considering the short timespan of robotics technology development compared to the millions of years of animal evolution, the progress achieved in the field so far is quite remarkable. As Burden explains, ""We can move much more quickly when we engineer robots than we can through evolution—but evolution has a massive head start.""

The development of effective running robots holds immense potential for various applications, from solving last-mile delivery challenges and navigating difficult terrain to conducting dangerous searches and",https://scx2.b-cdn.net/gfx/news/hires/2024/robot.jpg,2024-04-24 14:00:01," Meta Description:

Unlock the potential of robotics with insights from a groundbreaking study on animal locomotion. Discover how collaboration between robotics researchers and biologists can create more agile, efficient machines. ", keyphrase ,Technology,"Formicoders,News,AI,Technology,Innovation,Programmering,Coding,Wordpress,Python"
https://www.zdnet.com/article/do-employers-want-ai-skills-or-ai-enhanced-skills-that-could-depend-on-you/,Do employers want AI skills or AI-enhanced skills? That could depend on you, A.I. Era: New Tech Roles & Demand for Traditional Skills ,"THE A.I. ERA: NEW JOB ROLES, CONTINUING DEMAND FOR TRADITIONAL TECH SKILLS

In the age of artificial intelligence (A.I.), the technology job market is evolving, but this doesn't mean that traditional tech skills are becoming obsolete. Instead, A.I. might make existing technology activities faster and more productive. Here's a look at the changing landscape of A.I.-related jobs, the continuous demand for foundational tech skills, and the emergence of new data-focused roles.

THE RISE OF A.I.-FOCUSED ROLES
---------------

A.I. is at the heart of many evolving technology roles. Yusuf Tayob, the group chief executive of Accenture Operations, highlights the increasing demand for A.I.-focused roles and the ongoing need for training in A.I. fundamentals, AI-infused processes, and ethical A.I. usage.

Gill Haus, the chief information officer at JPMorgan Chase, emphasizes the significance of gaining skills that will help companies integrate and apply A.I. effectively, leading to more jobs in A.I., machine learning (M.L.), and generative A.I. Additionally, A.I. will enhance existing roles, making them more efficient by eliminating mundane tasks.

NEW TYPES OF JOBS EMERGING
-------------------

The rise of A.I. has led to the creation of new job types, with a focus on data, exploration, and analysis. Brian Lanehart, president, CTO, and co-founder at Momnt, anticipates more data-focused job titles and an emphasis on AI tools and technologies expertise.

As A.I. tools become more sophisticated, professionals will be required to use them effectively. This includes using Copilot to code faster and more efficiently, generating various test cases, and employing AI to evaluate quality assurance.

THE IMPORTANCE OF BUSINESS AND TECH SKILLS
-----------------------------------

Employers are looking beyond traditional tech skills. A combination of business, technology, and interpersonal skills is critical. In-demand skills include coding, mobile, digital, backend, machine learning, data, cloud computing, software engineering, customer experience, digital design, and product management.
",https://www.zdnet.com/a/img/resize/c1be624eed4535f99e23b332af5b8f82f56db238/2024/04/24/1366cf71-c413-4255-adc5-3fc16e77340d/techface3gettyimages-1333959744.jpg?auto=webp&fit=crop&height=675&width=1200,2024-04-24 00:00:00,"Boost your tech skills with A.I.! Discover new A.I.-focused roles, data-centric jobs, and the importance of blending business & tech skills. Stay relevant in the A.I. era. AITechSkills FutureOfWork 
(149 characters)", A.I. skills ,Technology,"Formicoders,News,AI,Technology,Innovation,Programmering,Coding,Wordpress,Python"
https://techxplore.com/news/2024-04-potential-super-grids-hurricanes-overshadow.html,Study shows potential of super grids when hurricanes overshadow solar panels, Placeholder for the SEO title. ,"Title: Harnessing the Power of Super Grids: A Solution to Hurricane-Prone Solar Energy

Introduction

As Caribbean islands increasingly rely on their abundant sun and wind for electricity generation, a pressing challenge arises: hurricanes. These natural disasters can significantly impact solar energy production, leaving island residents without a crucial source of power. However, a potential solution lies in the implementation of super grids, a collection of interconnected grids that can facilitate the flow of electricity across island chains or between continents. This article explores how Oak Ridge National Laboratory researchers are utilizing comprehensive modeling methods to predict energy losses during hurricanes and examining the role super grids can play in maintaining reliable access to electricity.

The Impact of Hurricanes on Solar Energy

Hurricanes pose a significant threat to the Caribbean's 12 island countries, as well as the U.S. territories of Puerto Rico and the U.S. Virgin Islands. The historically underserved island residents cannot easily evacuate from the path of the numerous hurricanes that hit the region each year. The loss of solar energy during these storms is likely to become increasingly important, especially for places like Puerto Rico, which has set a goal of converting to all-renewable energy by 2050.

Modeling Hurricane Impacts on Electricity Generation

To better understand the impact of hurricane clouds on solar energy generation, Oak Ridge National Laboratory researchers developed a modeling method to predict energy losses more accurately. They used the algorithm to explore different grid connection approaches and their effects on electricity availability. The model analyzed how a large hurricane would reduce power from known solar installations while traveling along 10 possible paths over 10 to 14 days.

The researchers found that some solar plants lost as much as 88% of their generating capacity for two days while shaded by hurricane clouds. Simulations were conducted to understand power availability during hurricanes if electric grids were connected via high-voltage cables on the ocean floor. The team modeled four different combinations: a standalone U.S. grid, a standalone Caribbean super grid, a U.S.-Caribbean super grid, and a super grid connecting the U.S., Caribbean islands, and South America.

Super Grids: A Potential Solution

The study found that the U.S.-Caribbean super",https://scx2.b-cdn.net/gfx/news/2024/study-shows-potential.jpg,2024-04-24 16:29:04,"Boost your tech skills with A.I.! Discover new A.I.-focused roles, data-centric jobs, and the importance of blending business & tech skills. Stay relevant in the A.I. era. AITechSkills FutureOfWork 
(149 characters)", Super grids ,Technology,"Formicoders,News,AI,Technology,Innovation,Programmering,Coding,Wordpress,Python"
https://techcrunch.com/2024/04/24/eric-schmidt-backed-augment-a-github-copilot-rival-launches-out-of-stealth-with-252m/,"Eric Schmidt-backed Augment, a GitHub Copilot rival, launches out of stealth with $252M","Title: Augment's AI-Powered Coding Platform: A $252M Rival to GitHub Copilot

Introduction

AI-powered coding platform Augment, led by former Microsoft developer Igor Ostrovsky, secures $252M in funding. Aiming to improve software quality and team productivity, Augment challenges GitHub Copilot.

The Emergence and Funding

Augment, backed by Eric Schmidt and reputable VC firms, raises $252M, reaching a $977M post-money valuation. This funding will help Augment compete in the generative AI coding technologies market.

AI's Impact on Coding

Augment aims to tackle coding challenges like complex code and long backlogs. AI-driven software development can enhance software quality, productivity, and joy in programming.

The Augment Team

Ostrovsky, with experience at Microsoft and Google, founded Augment alongside Guy Gur-Ari. They've added Scott Dietzen and Dion Almaer to the executive team, further strengthening Augment's position.

Generative AI Models and User Experience

With its powerful AI models, Augment provides a unique user experience, targeting the generative AI coding technologies market and competing with GitHub Copilot.","Title: Unleashing the Power of AI in Coding: A New Era for Developers

Introduction

In the ever-evolving world of technology, Artificial Intelligence (AI) is revolutionizing the way we code. An increasing number of developers are embracing AI tools to enhance their development processes. According to a recent StackOverflow poll, 44% of software engineers already use AI tools, and 26% plan to implement them soon. This trend is expected to continue, with Gartner predicting that 75% of developers will use coding assistants in some form by 2028. Igor Ostrovsky, a former Microsoft software developer, is leading this charge with Augment, an AI-powered coding platform.

Augment's Emergence and Funding

Augment recently emerged from stealth with $252 million in funding, valuing the company at a near-unicorn ($977 million) post-money. With investments from notable figures like former Google CEO Eric Schmidt and venture capital firms such as Index Ventures, Sutter Hill Ventures, Lightspeed Venture Partners, Innovation Endeavors, and Meritech Capital, Augment is poised to disrupt the generative AI coding technologies market.

The Power of AI in Coding

Ostrovsky believes that AI can improve software quality, team productivity, and restore the joy of programming. The current software development landscape is fraught with challenges, such as fragile, complex, and expensive-to-maintain code, long backlogs for feature requests, bug fixes, security patches, and integrations. Augment aims to empower programmers and organizations to deliver high-quality software faster and more efficiently.

The Team Behind Augment

Ostrovsky spent nearly seven years at Microsoft and worked on components of Midori, a next-generation operating system. In 2022, he teamed up with Guy Gur-Ari, a former AI research scientist at Google, to create Augment's minimum viable product (MVP). They also brought on Scott Dietzen, ex-CEO of Pure Storage, and Dion Almaer, formerly a Google engineering director and a VP of engineering at Shopify, to fill out Augment's executive ranks.

Augment's Generative AI Models and User Experience

While specific","https://techcrunch.com/wp-content/uploads/2023/07/GettyImages-1247173235.jpg?resize=1200,760",2024-04-24 19:36:01,"Meta Description: Transform your software development with AI! Discover Augment, the AI-powered coding platform, and boost productivity. $252M funding, led by Eric Schmidt, innovating generative AI coding technologies.

Title: Unleashing the Power of AI in Coding: A New Era for Developers

Introduction

In the ever-evolving world of technology, Artificial Intelligence (AI) is revolutionizing the way we code. An increasing number of developers are embracing AI tools to enhance their development processes. According to a recent StackOverflow poll, 44% of software engineers already use AI tools, and 26% plan to implement them soon. This trend is expected to continue, with Gartner predicting that 75% of developers will use coding assistants in some form by 2028. Igor Ostrovsky, a former Microsoft software developer, is leading this charge with Augment, an AI-powered coding platform.

Augment's Emergence and Funding

Augment recently emerged from stealth with $252 million in funding, valuing the company at a near-unicorn ($977 million) post-money. With investments from notable figures like former Google CEO Eric Schmidt and venture capital firms such as Index Ventures, Sutter Hill Ventures, Lightspeed Venture Partners, Innovation Endeavors, and Meritech Capital, Augment is poised to disrupt the generative AI coding technologies market.

The Power of AI in Coding

Ostrovsky believes that AI can improve software quality, team productivity, and restore the joy of programming. The current software development landscape is fraught with challenges, such as fragile, complex, and expensive-to-maintain code, long backlogs for feature requests, bug fixes, security patches, and integrations. Augment aims to empower programmers and organizations to deliver high-quality software faster and more efficiently.

The Team Behind Augment

Ostrovsky spent nearly seven years at Microsoft and worked on components of Midori, a next-generation operating system. In 2022, he teamed up with Guy Gur-Ari, a former AI research scientist at Google, to create Augment's minimum viable product (MVP). They also brought on Scott Dietzen, ex-CEO of Pure Storage,", AI Coding ,Technology,"Formicoders,News,AI,Technology,Innovation,Programmering,Coding,Wordpress,Python"
https://techcrunch.com/2024/04/25/petlibros-new-smart-refrigerated-wet-food-feeder-is-what-your-cat-deserves/,Petlibro’s new smart refrigerated wet food feeder is what your cat deserves," ""Petlibro's Polar Feeder: Fresh Wet Food for Cats, Anytime"" ","

Ding, Ding, Ding! Dinner is Served in Style

Petlibro, a pet tech startup known for its innovative automatic food and water dispensers, has recently launched its first refrigerated smart feeder, the Polar Wet Food Feeder. This new product promises to solve a longstanding problem among cat owners: keeping their wet food fresh while they're away.

As a content editor, my task is to clean and rewrite the given text to make it more concise, engaging, and error-free. Let's get started!

Cleaning Instructions:

1. Translate non-English text to English.
2. Remove any advertisements, unrelated content, or author attributions.
3. Correct grammatical errors, typos, or awkward phrasings.
4. Maintain factual accuracy and the core message of the text.

Rewriting Instructions:

1. Generate a rewritten version that retains the main points and facts from the original text but avoids close paraphrasing.
2. Ensure the length falls within 700 to 1200 words.
3. Use engaging and creative language suitable for a blog audience.
4. Ensure uniqueness and originality to avoid any copyright issues.

Output Format:

1. Organize the content into coherent paragraphs with a clear introduction, body, and conclusion.
2. Ensure readability, engaging tone, and suitable language for a general audience.
3. Use transition words in at least 50% of the sentences to enhance readability.
4. The final output should be polished and ready for direct publication on a blog website.

",https://techcrunch.com/wp-content/uploads/2024/04/Polar_Petlibro_cat.jpg?w=1200,2024-04-25 13:00:42,"""Discover Petlibro's Polar Wet Food Feeder: Keep your cat's meals fresh & tasty with this smart refrigerated feeder. Wi-Fi enabled, mobile app control, motion detection, & 72-hr freshness. Try now!"" (119 characters)","refrigerated feeder innovation

Petlibro's new Polar Wet Food Feeder is a game-changer in the world of pet tech. This smart refrigerated feeder keeps wet food fresh for up to 72 hours, ensuring your cat's meals are always healthy and tasty. The feeder's sleek design and easy-to-use mobile app make it a must-have for cat owners who want to provide the best care for their furry friends.

The Polar Wet Food Feeder uses semiconductor cool technology to maintain the temperature between 30-50°F, keeping wet food fresh and preventing bacterial growth. With three compartments and a 22.2-ounce capacity, it's perfect for cats who eat multiple meals a day.

But what sets the Polar Wet Food Feeder apart is its smart features. The feeder is Wi-Fi enabled and can be controlled via iOS and Android devices. The accompanying mobile app notifies pet owners when their cat starts eating, thanks to motion detection technology. Additionally, the app ensures that the device remains connected to the internet, even when a user's Wi-Fi goes out while they're out of town.

During testing, the Polar Wet Food Feeder proved to be reliable and consistent in its performance. The device emits only a low humming noise, making it perfect for use in any room. One potential downside is the three compartments, which may not be suitable for cat owners who feed their pets more than three times a day. However, similar products on the market have double the number of compartments.

Overall, Petlibro's Polar Wet Food Feeder is an excellent investment for cat owners who want to ensure their pets are getting fresh, healthy meals. Its smart features, sleek design, and reliable performance make it a standout product in the world of pet tech.

If you're looking for a way to keep your cat's food fresh and provide them with healthy meals, the Polar Wet Food Feeder is the perfect solution. With its smart features and reliable performance, it's the best way to ensure your cat is getting the care they deserve.

So, treat your cat to a fresh and healthy meal with Petlibro's Polar Wet Food Feeder. Your feline friend will thank you!",Technology,"Formicoders,News,AI,Technology,Innovation,Programmering,Coding,Wordpress,Python"
https://techxplore.com/news/2024-04-explores-human-machines-eerie.html,Study explores why human-inspired machines can be perceived as eerie," AI's ""Uncanny Valley"": How Human-Like Qualities Spark Eeriness in Machines ","Artificial Intelligence (AI) and robots are rapidly advancing, exhibiting human-like qualities that can be both fascinating and disconcerting. This phenomenon, known as the uncanny valley, occurs when we attribute human feelings, experiences, thoughts, and sensations to these systems, leading to a sense of eeriness. Karl F. MacDorman, an associate professor at Indiana's Luddy School of Informatics, Computing, and Engineering, has dedicated his research to understanding what makes some robots and AI systems feel unsettling.

In his latest study, published in Computers in Human Behavior, MacDorman explores the theory of ""mind perception,"" which proposes that people feel eeriness when exposed to robots closely resembling humans because they ascribe minds to these robots. The uncanny valley is particularly relevant today, as AI systems like ChatGPT and other large language models (LLMs) become increasingly sophisticated in their natural language processing capabilities. These systems can learn to answer user queries in ways that mimic human communication, making them potentially easier to mistake for sentient beings.

MacDorman was initially skeptical of the ""mind perception"" theory, which inspired him to conduct new studies investigating its existence and the extent to which robots with human-like characteristics are considered eerie. In his analysis, he identified shortcomings in past experiments, including disconnecting the manipulation of experimental conditions from the appearance of an AI system.

To test the mind perception theory, MacDorman performed a meta-regression analysis of previous related findings and conducted a new experiment. This experiment involved convincing a group of participants who do not believe machines could be sentient that they can be, or vice versa, by having them read texts and write related essays. By comparing how eerie the same robots are perceived by two groups—one that ascribes more sentience to them and another that ascribes less sentience—MacDorman found that individuals who attribute sentience to robots do not necessarily find them eerier due to their human resemblance.

MacDorman's research challenges past studies supporting the mind perception theory and offers valuable insights into the uncanny valley phenomenon. As AI and robots continue to evolve, understanding the psychological factors that contribute to the eeriness of human-like systems will be crucial in developing technology that is both advanced and socially acceptable.",https://scx2.b-cdn.net/gfx/news/hires/2024/study-explores-why-hum.jpg,2024-04-25 07:40:02,"""Discover insights on the uncanny valley: Study explores why human-like AI & robots can seem eerie. Read the latest research here."" (113 characters)", Human-like AI ,Technology,"Formicoders,News,AI,Technology,Innovation,Programmering,Coding,Wordpress,Python"
https://techcrunch.com/2024/04/24/edonia-2m-microalgae-ground-meat-alternative/,Edonia grabs €2M to turn microalgae into less bitter-tasting ground meat alternative," Edonia's Algae-Meat: A Sustainable Future for Food
","Title: Edonia's Algae-Based Protein Revolution: A Sustainable Future for Food

Introduction

Feeding the world's growing population is an urgent challenge. One innovative French startup, Edonia, is tackling this issue by creating protein ingredients using microalgae. This article will delve into Edonia's unique approach, its potential impact on the global market, and its ambitious plans for the future.

A Promising Startup in the Algae Market

Founded in Paris, Edonia is part of a growing wave of companies exploring the commercial potential of algae. With an estimated global market value of $25.4 billion by 2033, algae offer a promising alternative to traditional protein sources. Edonia has secured €2 million ($2.1 million) to develop its technology, joining other notable players in the algae sector such as Brevel, AlgaeCore Technologies, Algenuity, and NewFish.

Edonia's Unique Approach

Edonia's CEO, Hugo Valentin, has developed a unique microalgae transformation process called ""edonization."" This innovation converts microalgae biomass, derived from spirulina or chlorella, into a highly nutritious textured super-ingredient. This ingredient boasts enhanced taste, odor, texture, nutritional value, and environmental benefits compared to conventional meat sources.

The primary goal of edonization is to address the organoleptic aspects of microalgae, which are often perceived as having a bitter taste and green color. The process transforms the texture into ""meaty-like tender grains"" and changes the color to a rich brown hue. These changes result in an umami-like flavor and texture, making Edo-1 an excellent plant-based replacement for ground meat.

A Sustainable Solution

Edonia's products offer a more sustainable alternative to traditional meat sources. Greenhouse gas emissions from food production account for 34% of total emissions. Edo-1, Edonia's flagship product, emits 40 times less carbon dioxide than its ground meat equivalent and three times less than textured soy.

Scaling Up and Partnerships

Edonia has already successfully produced small quantities of Edo-1 and plans to","https://techcrunch.com/wp-content/uploads/2024/04/Burger-close-up-LIL_2284-photo-credit-Lilie-Bedos-Edonia.png?resize=1200,676",2024-04-25 06:00:42,"Discover Edonia's algae-meat revolution: a sustainable, nutritious, eco-friendly solution for the future of food. Emitting 40x less CO2 than ground meat, Edo-1 is a game-changer. Join Edonia's journey towards a greener food industry. AlgaeProtein SustainableFuture [9/18]", Algae-Meat ,Technology,"Formicoders,News,AI,Technology,Innovation,Programmering,Coding,Wordpress,Python"
