Link,Title,Text,Image,Date Publish
https://www.forbes.com/sites/nishatalagala/2024/02/28/what-should-we-expect-from-ai-in-2024/, AI Trends and Predictions for 2024 ,"

AI Revolution: A Glimpse into 2024 and Beyond

As we delve into the year 2024, the transformative power of Artificial Intelligence (AI) continues to reshape our world at an unprecedented pace. From government strategies to educational advancements, AI is leaving an indelible mark on every facet of our lives.

Global AI Strategies

Governments worldwide are recognizing the immense potential of AI and are developing comprehensive strategies to harness its benefits. The United States, for instance, has implemented an AI Bill of Rights to safeguard citizen rights in the AI era. Singapore has sparked a national debate on investing in AI to secure its future competitiveness.

Multi-Modal AI: A Paradigm Shift

AI technology is evolving rapidly, and one of the most significant developments is the emergence of multi-modal AI. This breakthrough allows AI systems to process and analyze data from multiple sources, such as text, images, and audio. This convergence has opened up new possibilities, enabling AI to handle complex tasks that were once impossible.

AI's Impact on Education

The education sector has experienced a seismic shift due to AI. Teachers are leveraging AI to enhance lesson delivery, while students are benefiting from personalized learning experiences and AI-assisted assessments. As schools and governments adapt to this transformative technology, we can expect to witness a redefinition of educational practices in 2024.

AI for Scientific Advancements

Beyond its impact on everyday tasks, AI is also revolutionizing scientific research. The same technology that powers chatbots has proven its efficacy in drug discovery, climate science, and agriculture. As the year progresses, we anticipate witnessing more groundbreaking applications of AI in scientific domains.

Workforce Transformation

The rise of AI is having a profound impact on the workforce. Companies are exploring the potential of AI to streamline operations and enhance productivity. While this may lead to job displacement in some sectors, it also creates new opportunities in AI-related fields.

Conclusion

2024 promises to be a pivotal year in the AI revolution. As AI becomes increasingly integrated into our lives, it will continue to reshape industries, redefine education, and drive scientific advancements. Governments, businesses, and individuals alike must embrace this transformative technology to prepare for the challenges and opportunities that lie ahead.

",https://imageio.forbes.com/specials-images/imageserve/65e0028da2001bd2d124c603/0x0.jpg?format=jpg&height=900&width=1600&fit=bounds,2024-02-28 23:07:44
https://www.forbes.com/sites/scotttravers/2024/02/28/5-photos-that-reveal-the-secrets-of-earths-oldest-arachnid/, Ancient Arachnid Secrets: Unraveled in 5 Stunning Photos ,"

Scorpions: Ancient Predators with Enduring Resilience

In the vast tapestry of life on Earth, scorpions stand out as enigmatic and enduring creatures. With their ancient lineage stretching back 430 million years, these fascinating arachnids have witnessed the rise and fall of countless species. Their unique adaptations and remarkable resilience have allowed them to thrive in a wide range of environments, from scorching deserts to lush rainforests.

Exceptional Survivalists

Scorpions have evolved to inhabit some of the most extreme conditions on our planet. They can withstand extreme temperatures, both hot and cold, and can even survive underwater for extended periods. Some species, like the Arizona hairy scorpion, have adapted to the harsh desert environment by digging elaborate burrows that provide shelter from the relentless sun.

Potent Venom

Scorpions are known for their venomous sting, which is among the most potent in the arachnid class. While most scorpion stings are not fatal to humans, the venom of certain species, such as the deathstalker, can be deadly. However, scientists are also exploring the therapeutic potential of scorpion venom, which has shown promise in treating cancer and inflammation.

Multifaceted Defenses

In addition to their venomous sting, scorpions possess an array of defensive mechanisms. Their powerful pincers can crush prey and fend off predators, and their tough exoskeletons provide protection from the elements. Scorpions can also survive for extended periods without food, making them remarkably resilient to starvation.

Parental Care

Unlike most arachnids, scorpions give birth to live young. After birth, the mother scorpion carries her babies on her back, protecting them until they can hunt independently. However, this maternal care comes with a caveat: if the mother becomes desperate for food, she may resort to eating her own offspring.

Ecological Diversity

Scorpions have evolved into a wide range of habitat specialists, each adapted to a specific ecological niche. Some species dwell in vegetation, while others climb rocks or burrow in hard soil or sand. Their physical traits, such as the length of their walking legs, reflect these different adaptations.

Conclusion

Scorpions are a testament to the enduring power of adaptation and resilience. Their ability to thrive in diverse habitats, withstand extreme conditions, and employ a variety of defensive strategies has ensured their survival for millions of years. These ancient predators continue to fascinate scientists and nature enthusiasts alike, serving as a reminder of the remarkable diversity and resilience of life on Earth.

","https://imageio.forbes.com/specials-images/imageserve/65de1b5902fa9caf492654f2/0x0.jpg?format=jpg&crop=2822,1322,x0,y188,safe&height=900&width=1600&fit=bounds",2024-02-28 22:57:46
https://techcrunch.com/2024/02/28/tim-cook-says-apple-will-break-new-ground-in-genai-this-year/, Apple to Revolutionize GenAI in 2023 ,"

Apple's AI Revolution: Breaking Ground in Generative AI

Get ready for a transformative year in technology, as Apple CEO Tim Cook unveils plans to ""break new ground"" in Generative AI (GenAI). This cutting-edge technology has the power to revolutionize our interactions with the digital world.

Apple's Cautious Approach

Unlike its tech rivals, Apple has taken a more measured approach to GenAI, prioritizing internal development and a deliberate customer-facing strategy. This careful approach has allowed Apple to refine its GenAI capabilities without rushing into premature releases.

Siri and Spotlight's GenAI Upgrade

Apple's beloved virtual assistant, Siri, and the intuitive search tool, Spotlight, are poised to receive a significant GenAI boost. These enhancements will empower Siri to engage in more complex conversations and provide comprehensive answers to our queries. Spotlight, too, will harness GenAI to deliver more relevant and personalized search results.

AI-Powered Creativity and Productivity

Apple is also exploring GenAI's potential to enhance creativity and productivity. Imagine effortlessly generating presentation slides in Keynote, curating playlists in Apple Music, or receiving AI-powered coding suggestions in Xcode. GenAI will empower users to create and innovate like never before.

Apple's GenAI Research and Development

Behind the scenes, Apple engineers are actively contributing to the advancement of GenAI through academic and technical publications. They have developed innovative systems that can create animated 3D avatars from videos and animate still images.

Open Source Contributions

Apple is also sharing its GenAI knowledge with the world. In recent months, the company has released open source models and tools, including Ferret, a chatbot, and MGIE, a model that can modify images based on natural language commands.

Investment and Hardware Enhancements

Apple is reportedly investing heavily in GenAI, including the development of its proprietary large language model, Ajax, and an internal chatbot, Apple GPT. Rumors suggest that the upcoming iPhone 16 models may feature a significantly upgraded Neural Engine, Apple's custom AI processing chip.

Conclusion

Apple's cautious yet ambitious approach to GenAI positions it as a formidable player in this rapidly evolving field. As the company continues to break new ground, we can expect transformative experiences that will redefine how we interact with technology and unleash our creativity. Stay tuned for Apple's upcoming announcements and witness the revolution that GenAI brings to our digital lives.

","https://techcrunch.com/wp-content/uploads/2022/09/AppleEvent.SEP07Keynote.Tim_Cook.03.jpg?resize=1200,800",2024-02-28 20:45:21
https://techcrunch.com/2024/02/28/anycubic-users-3d-printers-hacked-warning/, Anycubic 3D Printers Hacked: Security Flaw Exposed ,"

3D Printer Hack Exposes Security Flaw

In a startling turn of events, Anycubic 3D printer users have reported a mysterious hack that has left their devices displaying a chilling warning. A text file named ""hacked_machine_readme"" has appeared on these printers, alleging a critical vulnerability in Anycubic's systems.

The text file claims that this vulnerability allows hackers to remotely connect and control internet-connected Anycubic 3D printers. It urges users to disconnect their printers from the internet to prevent potential exploitation.

MQTT Vulnerability in Question

The text file specifically mentions a vulnerability in Anycubic's MQTT service, a messaging protocol commonly used for communication between devices and servers. The hacker claims to have exploited this vulnerability to send the warning message to 2.9 million Anycubic printers.

Company Response

Anycubic has yet to officially comment on the incident. However, users have reported that the company's app is currently unavailable, displaying a ""network unavailable"" error message.

User Advice

The text file advises users to disconnect their printers from the internet until Anycubic addresses the issue. It also emphasizes that the message is harmless and no harm has been done to the printers.

Call for Information

If you have any information about this incident or have experienced similar issues with your Anycubic 3D printer, please reach out to the author.

Conclusion

This hack highlights the importance of cybersecurity in the realm of connected devices. As more and more devices become internet-enabled, it's crucial for manufacturers to prioritize security and vulnerability management. Anycubic users should remain vigilant and follow the company's instructions until the issue is resolved.

","https://techcrunch.com/wp-content/uploads/2024/02/anycubic-hacked-machine.jpg?resize=1200,916",2024-02-28 18:20:20
https://www.forbes.com/sites/joemckendrick/2024/02/28/how-well-be-interacting-with-ai-as-it-takes-on-more-work/, AI's Impact on Human Interaction in the Workplace ,"

AI: The Dawn of a Revolutionary Business Operating System

Imagine a world where your business operates seamlessly, with intelligent systems automating tasks, optimizing processes, and providing real-time insights. This vision is no longer a distant dream; it's becoming a reality with the advent of artificial intelligence (AI).

AI has the potential to revolutionize the way businesses function, serving as the backbone of a comprehensive operating system that empowers organizations to reach new heights of efficiency and productivity.

AI: The Invisible Powerhouse

Unlike traditional operating systems that simply enhance or power applications, AI-driven systems operate on a deeper level, providing intelligence across the entire organization. This means rethinking not only our technology but also our organizational culture.

Industry experts envision an ""under-the-covers knowledge foundation"" where applications seamlessly integrate AI to augment or replace knowledge bases. This evolution is gaining momentum, with businesses embracing a blend of small and large AI models to power their operations.

Invisible Yet Impactful

AI's impact will be profound yet subtle. It will operate behind the scenes, streamlining processes and enhancing efficiency without the need for direct human intervention. For example, AI models can automatically address trouble tickets or extract essential details from invoices without any manual effort.

Conversational and Immersive Interfaces

AI will also transform the way we interact with our devices. Conversational AI assistants will become our primary interface, allowing us to communicate with our systems naturally and efficiently. This will eliminate the need for complex graphical user interfaces, making technology more accessible and user-friendly.

AI Agents: The Future of Interaction

Conversational and generative AI will pave the way for a new era of communication with computers. AI agents will replace traditional UIs, enabling us to interact with systems through natural conversation. This will revolutionize industries like travel, where AI can assist travelers with complex tasks, providing immersive and proactive support throughout their journeys.

Conclusion

The AI-powered business operating system is not just a concept; it's a reality that is rapidly taking shape. As AI continues to evolve, it will become an indispensable tool for businesses, empowering them to operate more efficiently, make better decisions, and create a more seamless and productive work environment. The future of business is bright, and AI is at the heart of it.

",https://imageio.forbes.com/specials-images/imageserve/65e00323625ed7dc9314aa48/0x0.jpg?format=jpg&height=900&width=1600&fit=bounds,2024-02-28 23:22:58
https://techcrunch.com/2024/02/28/hydrogens-real-markets/, Toyota Offers Incentives for Mirai Hydrogen Fuel Cell Vehicle ,"

Hydrogen Fuel Cells: A Miraculous Deal or a Mirage?

Imagine getting a brand-new Toyota Mirai for a mere $3,000! That's the tantalizing offer Toyota is dangling before us, with a $40,000 discount on its 2023 hydrogen-powered car. Throw in free hydrogen worth $15,000 over six years and an interest-free loan, and the company is practically begging you to take this car off its hands.

But hold your horses! Before you jump at this seemingly incredible deal, let's delve into the reality of hydrogen fuel cells.

The Hydrogen Catch-22

The catch lies in the fuel itself. Toyota's aggressive discounts come on the heels of Shell closing its California hydrogen filling stations, reducing the already scarce infrastructure by over 10%. This means that finding hydrogen to power your Mirai could be a logistical nightmare, especially outside of major cities like Los Angeles and San Francisco.

The Honda Conundrum

Honda, undeterred by the hydrogen infrastructure challenges, has recently launched a Frankenstein-like hybrid: the CR-V plug-in fuel-cell vehicle. It combines a battery for limited electric range with a hydrogen fuel cell for extended mileage. However, this complexity comes at a cost, yielding a range of just 270 miles, comparable to a mid-tier electric crossover. But unlike EVs, the CR-V's range is severely limited by the availability of hydrogen filling stations.

Hydrogen's Potential and Pitfalls

Hydrogen has immense potential as a clean fuel source for industries like steel production and long-distance shipping. However, its use in passenger vehicles faces significant hurdles. Hydrogen production and distribution are still too spotty, and fuel cells are expensive. Moreover, to truly reduce carbon emissions, FCEVs must run on green hydrogen, which is currently scarce. Until then, they offer only marginal environmental benefits over advanced hybrids.

Automakers' Hydrogen Obsession

Despite the challenges, Toyota, Honda, and other automakers remain bullish on hydrogen. Why? The cynical view is that they're buying time, hoping to delay the transition to EVs by promoting hydrogen's advantages (like fast fueling) while continuing to sell fossil-fuel-powered vehicles.

A more charitable view suggests that automakers are simply stuck in their ways. Fuel cells align with their existing engineering expertise, and they may fear that consumers won't embrace EVs due to longer charging times.

The Future of Hydrogen

Whether automakers' hydrogen gambit will pay off remains to be seen. If hydrogen startups can scale up production and make green hydrogen widely available, it might make sense to introduce FCEVs to the masses. But for now, this future seems distant.

Conclusion

Toyota's Mirai deal may seem too good to pass up, but it's essential to consider the limited hydrogen infrastructure. Hydrogen fuel cells have potential, but they face significant challenges in the passenger vehicle market. Until these challenges are overcome, EVs remain the more practical and environmentally friendly choice for zero-emission transportation.

","https://techcrunch.com/wp-content/uploads/2022/08/2022_Mirai_Limited_Oxygen_White_020_hero-1500x900-1.jpeg?resize=1200,720",2024-02-28 21:07:20
https://techcrunch.com/2024/02/28/rocket-lab-has-misrepresented-neutron-launch-readiness-congressional-memo-says/, Rocket Lab's Neutron Launch Readiness Misrepresented ,"

Rocket Lab's Neutron Rocket: A Race Against Time

Rocket Lab, a leading player in the space industry, has ambitious plans to launch its Neutron rocket by the end of this year. However, a recent congressional memo raises doubts about the company's ability to meet a crucial deadline set by the Space Force.

The NSSL Phase 3 Lane 1 Deadline

The Space Force has established a deadline of December 15, 2024, for launch providers to be ready to fly under its National Space Security Launch (NSSL) Phase 3 program. This program promises billions of dollars in contracts for launches from 2025 to 2034.

Rocket Lab's Ambitions

Rocket Lab has expressed its desire to qualify for NSSL Phase 3 Lane 1, which is reserved for newer launch providers. To do so, the company must complete the development and testing of its Neutron rocket by the end of this year.

Congressional Scrutiny

A congressional memo, obtained by TechCrunch, casts doubt on Rocket Lab's claims. The memo argues that the company does not have a credible path to launch by the December 15 deadline. It cites uncertainties surrounding the testing of Neutron's new Archimedes engine and the completion of launch infrastructure at NASA's Wallops Flight Facility.

Uncertainties and Challenges

The memo highlights the complexity and scale of the Neutron launch pad, which differs significantly from Rocket Lab's existing pads. It also points to proprietary timelines shared by other launch providers, suggesting that there is still much work to be done.

Space Force's Timeline

The memo includes a timeline from Space Systems Command, which suggests that the agency will begin selecting contractors in the second quarter of the fiscal year and announce Lane 1 awards in the third quarter. This timeline leaves little room for delays.

Rocket Lab's Response

Rocket Lab has declined to comment on the memo. However, CEO Peter Beck has previously stated that the company is pushing hard to meet the December 15 deadline. He has also highlighted Rocket Lab's track record of developing launch pads in short timelines.

Conclusion

The congressional memo raises serious questions about Rocket Lab's ability to meet the Space Force's NSSL Phase 3 Lane 1 deadline. The company faces significant challenges in completing the development and testing of its Neutron rocket and launch infrastructure. Time will tell if Rocket Lab can overcome these hurdles and secure a coveted contract that could shape its future in the space industry.

","https://techcrunch.com/wp-content/uploads/2024/02/rocket-lab-electron-wallops-launch.webp?resize=1200,800",2024-02-28 23:23:36
https://techcrunch.com/2024/02/28/taiwan-startups-new-president/, Taiwan Startups' Wishlist for the Next President ,"

Taiwan's Startup Ecosystem: A Path to Economic Growth and Global Impact

As Taiwan's newly elected President Lai Ching-te takes office, the country's startup ecosystem stands poised to play a pivotal role in its economic future. With a decade of growth under its belt, the industry faces challenges and opportunities that will shape its trajectory in the years to come.

Addressing Funding Gaps and Regulatory Barriers

One of the key challenges for Taiwan's startups is securing funding, particularly in later stages of development. The government has pledged $4.7 billion USD in investments, but experts emphasize the need for a strategic distribution of these funds.

Moreover, regulations that hinder foreign investment need to be streamlined. The Department of Investment Review's lengthy review process and lack of transparency pose obstacles for startups seeking international capital.

Creating a Supportive Environment for Growth

To foster long-term growth, the government must prioritize sectors that require substantial time to commercialize, such as deep-tech. Japan and South Korea serve as models for providing sustained support for these industries.

Additionally, Taiwan needs to invest in programs that bridge the gap between Series A funding and potential exits. Currently, early-stage startups receive the majority of investments, leaving later-stage companies struggling to secure funding.

Going Global: Expanding Taiwan's Footprint

Given Taiwan's limited domestic market, many startups aim for international expansion from the outset. Government policies that support globalization efforts are essential.

The New Southbound Policy, which aims to facilitate business expansion in Southeast Asia, has been a positive step. However, startups still face hurdles, such as varying tax regulations and legal complexities. Tax incentives and clear guidance on legal and tax issues would provide much-needed support.

Creating Jobs and Long-Term Growth

President Lai has pledged to create 20,000 startup jobs. Startups like Gogoro have demonstrated the potential for job creation through innovative supply chains and the development of new industries.

However, it's crucial to focus on quality over quantity. Startups that develop cutting-edge technologies and create sustainable value will drive long-term economic growth.

Finding Taiwan's Niche: Identifying Competitive Advantages

Taiwan's startup ecosystem should leverage its strengths in combining software and hardware to create unique products and services. By focusing on industries where it can maintain a competitive edge, Taiwan can establish itself as a global leader in innovation.

In conclusion, Taiwan's startup ecosystem has the potential to transform the country's economy and make a significant global impact. By addressing funding gaps, streamlining regulations, creating a supportive environment for growth, and fostering international expansion, the government can empower startups to drive innovation, create jobs, and secure Taiwan's future as a hub of technological advancement.

","https://techcrunch.com/wp-content/uploads/2024/02/GettyImages-1929880589.jpg?resize=1200,800",2024-02-29 01:48:59
