Link,Title,Text,Image,Date Publish
https://www.forbes.com/sites/davidphelan/2024/02/27/apple-developing-ring-to-beat-samsung-galaxy-ring-report-claims/,"Apple Developing Ring To Beat Samsung Galaxy Ring, Report Claims","

In the realm of wearable technology, a new contender is poised to enter the ring—the Apple Ring. Following the buzz surrounding Samsung's Galaxy Ring, rumors suggest that Apple is stepping into the arena with its own smart ring.

Apple's foray into finger-worn wearables stems from a surge in the global smart ring market, driven by the participation of tech giants. Patents filed by Apple hint at their interest in developing a smart ring, mirroring the excitement generated by the Galaxy Ring.

The Apple Ring's potential lies in its ability to provide continuous health monitoring, a feature that has revolutionized wearables. Unlike smartwatches, which can be cumbersome and intrusive, a smart ring offers a lightweight and unobtrusive solution for 24/7 monitoring.

While the Galaxy Ring has set the stage, Apple's preoccupation with health measurements suggests that the Apple Ring will likely incorporate sensors to track heart rate, temperature, and other metrics similar to the Oura Ring.

Industry experts predict a significant impact on the smart ring market with the entry of Samsung and Apple, potentially propelling the sector to new heights.

However, Apple's mantra of ""Don't do it first, do it right"" suggests that the Apple Ring may not materialize anytime soon. Mark Gurman, a renowned Apple analyst, confirms that the ring idea is still in its conceptual phase, with no active development underway.

The Apple Ring's potential advantage lies in catering to individuals who prefer traditional wristwatches or dislike wearing a smartwatch. It eliminates the need for notifications while retaining essential health-tracking features.

While the iRing (a potential name mentioned by Gurman) may not materialize immediately, its prospect is intriguing, promising a seamless blend of health monitoring and personal style.

",https://imageio.forbes.com/specials-images/imageserve/65c64c360efc3073bd2c075d/0x0.jpg?format=jpg&height=900&width=1600&fit=bounds,2024-02-27 08:44:17
https://www.forbes.com/sites/stuartanderson/2024/02/27/h-1b-registration-nears-report-shows-h-1b-denial-rate-increased/,"H-1B Registration Nears, Report Shows H-1B Denial Rate Increased","

 Navigating the H-1B Visa Maze: A Comprehensive Guide for Employers and Applicants 

With the annual H-1B registration process just around the corner, it's time to delve into the intricacies of this highly sought-after visa category. This comprehensive guide will equip employers and applicants with the knowledge they need to navigate the H-1B visa landscape successfully.

 H-1B Visa: A Lifeline for Skilled Professionals 

The H-1B visa serves as a beacon of hope for skilled foreign nationals seeking to work in the United States. It allows employers to hire highly qualified individuals in specialized fields, including technology, healthcare, and engineering. However, securing an H-1B visa is no walk in the park.

 Denial Rates: A Cause for Concern 

In recent years, the denial rates for H-1B petitions have been on the rise. This trend is particularly concerning for mid-range filers, who have witnessed a significant increase in their denial rates. Experts attribute this surge to the growing comfort level of U.S. Citizenship and Immigration Services (USCIS) adjudicators in denying cases following a legal settlement in 2020 that put an end to restrictive practices.

 Top Employers: A Glimpse into the H-1B Landscape 

Despite the overall increase in denial rates, the top employers of H-1B visa holders have managed to maintain their low denial rates. Companies like Amazon, Google, and Microsoft continue to dominate the list of H-1B approvals, demonstrating their expertise in navigating the complex H-1B visa process.

 Leading States and Sectors: Where the H-1B Visa Thrives 

California and Texas stand out as the top locations for employers with H-1B petition approvals, followed by New Jersey, New York, and Virginia. Interestingly, professional, scientific, and technical services account for over half of the approved H-1B petitions, highlighting the demand for skilled workers in these fields.

 Correlation between Filings and Denial Rates: A Surprising Insight 

A fascinating trend has emerged: employers that file more H-1B applications tend to have lower denial rates. This suggests that companies with robust internal processes and experienced legal representation are better equipped to handle the intricacies of the H-1B visa process.

 The H-1B Cap: A Limiting Factor for U.S. Competitiveness 

Despite the vast size of the U.S. labor force, the annual H-1B cap remains a paltry 85,000 visas. This limit poses a significant challenge for technology companies and other sectors that rely on skilled foreign workers. Experts argue that this low cap stifles economic growth and innovation, hindering the U.S.'s ability to compete in the global marketplace.

 H-1B Visa: A Vital Lifeline for the U.S. Economy 

The H-1B visa program plays a pivotal role in attracting and retaining skilled foreign workers, who contribute immensely to the U.S. economy. These individuals bring fresh perspectives, innovative ideas, and specialized skills that fuel economic growth and competitiveness.

 Conclusion: Embracing a Forward-Thinking Approach 

The H-1B visa program is a double-edged sword. While it provides a lifeline for skilled foreign workers, it also faces challenges such as rising denial rates and a restrictive annual cap. To fully harness the potential of this program, policymakers must adopt a forward-thinking approach that balances the need for skilled labor with the protection of American workers.

","https://imageio.forbes.com/specials-images/imageserve/65da45813e9aec5bb8fbc4db/0x0.jpg?format=jpg&crop=2142,1205,x0,y0,safe&height=900&width=1600&fit=bounds",2024-02-27 08:40:02
https://www.forbes.com/sites/robertdefrancesco/2024/02/27/snowflake-faces-high-expectations-heading-into-q4-earnings-report/,Snowflake Faces High Expectations Heading Into Q4 Earnings Report,"

In the realm of cloud data management, Snowflake's journey has been marked by ups and downs. But the company's recent financial performance suggests a promising turnaround. In fiscal Q3, product revenue soared by 34%, surpassing expectations and signaling a stabilization in business trends.

Snowflake's customer base continues to expand, with the total number of customers growing by 24% and the number of customers generating over $1 million in trailing 12-month product revenue jumping by 52%. The company's focus on AI and machine learning, particularly through its Snowpark platform, is gaining traction, with over 60% of Global 2000 customers now using Snowpark weekly.

The introduction of Snowpark Container Services, which provides elastic compute powered by GPUs, opens up new possibilities for developers working with large language models and other data-intensive applications. This product aligns with Snowflake's AI enablement strategy and is poised to drive incremental growth.

Despite these positive developments, Wall Street analysts remain divided on Snowflake's prospects. Some believe that the current stock valuation is lofty and that the company needs to deliver significant consumption-based recovery or new product contributions to sustain its growth trajectory. Others are more optimistic, citing the company's strong partner ecosystem and improving consumption environment as reasons for potential upside.

As Snowflake prepares to release its fiscal Q4 results, investors will be closely watching for signs of continued momentum. If the company can maintain its product revenue growth and demonstrate progress in its AI initiatives, it may be able to silence the skeptics and solidify its position as a leader in the cloud data management space.

",https://imageio.forbes.com/specials-images/imageserve/65dddcb34e043a8ab4b1d7e9/0x0.jpg?format=jpg&height=900&width=1600&fit=bounds,2024-02-27 08:39:57
https://www.forbes.com/sites/tobyshapshak/2024/02/27/show-us-our-data-media-in-south-africa-demands-of-google/,"Show Us Our Data, Media In South Africa Demands Of Google","

In the realm of digital advertising, a pressing concern has emerged, threatening the very essence of journalism and freedom of expression. South Africa has joined the chorus of nations demanding transparency from tech giants like Google, seeking answers to how much information and revenue they derive from news publishers.

Caxton, a prominent media organization in South Africa, along with the Centre for Free Expression, has taken a bold step by serving Google with legal demands. Their aim is to obtain clear and transparent answers to a series of well-considered questions that delve into Google's practices and the impact they have on the news industry.

The crux of the matter lies in the nature of programmatic advertising, which, according to Caxton's chairman, Paul Jenkins, fails to distinguish between genuine news and disinformation, real users and click farms. This indiscriminate approach undermines the value of authentic journalism, leading to a situation where ""news as a public good and freedom of expression is at a tipping point.""

Caxton's demands center around the publisher's content and Google's utilization of it. These questions echo the concerns of media organizations worldwide, who face a maze of confidentiality protections that shield secretive entities like Google from accountability.

Jenkins emphasizes their resolve to leverage South Africa's constitution to safeguard their rights to freedom of expression and information. They reject the notion that commercial confidentiality can be used as an excuse for secrecy.

Studies have revealed the significant financial implications for news publishers due to the dominance of tech giants. Last year, academics estimated that US publishers are owed billions of dollars annually by Google and Meta. The tech giants' argument that news is not essential and that publishers benefit from their platforms driving traffic is seen as a deflection from their responsibility to fairly compensate content creators.

Furthermore, a study in Switzerland found that Google generates a substantial portion of its revenue from media content, highlighting the value of news beyond what policymakers and publishers often perceive.

In South Africa, programmatic advertising has had a detrimental impact on the media industry. The cost-per-impression for programmatic ads is extremely low, with publishers receiving a mere fraction of the advertising revenue. This unsustainable business model, coupled with the limited reach of subscription or paywall models, threatens the survival of local media outlets.

Programmatic advertising has become a pervasive force in the marketing world, often accepted without critical evaluation. However, its metrics have been repeatedly called into question, with instances of inflated or misrepresented data. This raises concerns about the effectiveness of programmatic advertising and the validity of the metrics used to measure its success.

The dominance of tech platforms has led to calls for regulations and legislative measures to ensure fair compensation for news publishers. Australia's News Media Bargaining Code and similar legislation in Canada serve as examples of efforts to address this imbalance.

Caxton's actions reflect the broader struggle of media organizations grappling with the digital revolution and the encroachment of tech behemoths. The average American now spends seven hours a day on a screen, highlighting the profound impact of digital media on society.

As Jenkins aptly states, ""Journalism is in danger."" The erosion of genuine news and the challenges faced by media organizations demand urgent attention and collective action to preserve the integrity of journalism and freedom of expression in the digital age.

",https://imageio.forbes.com/specials-images/imageserve/65dde5419b2d2b6a89477e2c/0x0.jpg?format=jpg&height=900&width=1600&fit=bounds,2024-02-27 08:38:38
https://www.zdnet.com/article/samsung-becomes-first-to-introduce-12-stack-hbm3e-amid-high-demand-from-ai/,Samsung becomes first to introduce 12-stack HBM3E amid high demand from AI,"

Samsung Unveils Groundbreaking HBM3E 12H DRAM: A New Era of High-Performance Memory

In a significant technological leap, Samsung has unveiled the industry's first 12-stack HBM3E DRAM, pushing the boundaries of high bandwidth memory to new heights. This cutting-edge memory chip boasts an impressive maximum bandwidth of 1,280GB/s and a substantial capacity of 36GB, representing a remarkable 50% increase in both aspects compared to its predecessor, the 8-stack HBM3.

The HBM3E 12H DRAM is a marvel of engineering, featuring multiple DRAM modules stacked vertically, each referred to as a stack or layer. Each DRAM module packs a capacity of 24 gigabits (Gb), equivalent to 3 gigabytes (GB), and the 12-stack architecture elevates the total capacity to an astounding 36GB.

Samsung, SK Hynix, and Micron, the leading memory manufacturers, are engaged in a fierce competition to stack more DRAM modules while maintaining a compact height profile. This pursuit aims to create chips that are incredibly thin yet offer unparalleled capacity.

The surge in popularity of artificial intelligence (AI) has fueled a soaring demand for high-performance GPUs, particularly those crafted by Nvidia. These GPUs are often paired with HBMs, making them essential components in AI systems. To meet this burgeoning demand, all three memory giants are ramping up their HBM production output this year, signaling an end to the downturn in the memory chip market.

Samsung's HBM3E 12H DRAM incorporates advanced thermal compression non-conductive film (TC NCF) technology, which enables the 12-stack design to maintain the same height as its 8-stack counterparts, adhering to package requirements. This innovative film is remarkably thin, eliminating voids between the stacks and reducing the gap to a mere seven micrometers. As a result, the 12-stack HBM3E achieves a vertical density that surpasses the 8-stack HBM3 by over 20%.

The TC NCF technology also facilitates the use of small and large bumps during chip bonding. Small bumps are strategically placed in areas designated for signaling, while larger bumps are employed in sections that require efficient heat dissipation.

Samsung asserts that the enhanced performance and capacity of the HBM3E 12H DRAM will significantly reduce the total cost of ownership for data centers. Additionally, AI applications can expect a 34% boost in the average speed of AI training, while the number of simultaneous users of inference services can be amplified by an impressive 11.5 times compared to the HBM3 8H.

Samsung has already distributed samples of the HBM3E 12H DRAM to its customers and anticipates commencing mass production within the first half of 2023. This groundbreaking memory chip promises to revolutionize data centers and AI systems, ushering in a new era of high-performance computing.

",https://www.zdnet.com/a/img/resize/6f7adb4d553815944a1149614dfcb6143622d884/2024/02/27/fe7919e2-c351-438f-bacb-65dc120d8ae4/hbm3e-12h.png?auto=webp&fit=crop&height=675&width=1200,2024-02-27 00:00:00
https://venturebeat.com/ai/writer-unveils-palmyra-vision-a-multimodal-ai-to-reimagine-enterprise-workflows/,"Writer unveils Palmyra-Vision, a multimodal AI to reimagine enterprise workflows","

Palmyra-Vision: Revolutionizing Workflows with Multimodal AI

In a world increasingly reliant on data, businesses face the challenge of streamlining complex workflows that involve visual inputs and natural language understanding. Enter Writer, a leading enterprise AI startup, with its groundbreaking multimodal AI model, Palmyra-Vision. This innovative tool promises to transform workflows by seamlessly integrating visual data with text.

A Paradigm Shift in Multimodal AI

Palmyra-Vision stands out as a versatile model optimized for real-world enterprise use cases. Unlike consumer models that often fall short in practical applications, Palmyra-Vision is tailored to meet the specific needs of businesses across various sectors, including retail, marketing, healthcare, finance, and more.

Unleashing the Power of Multimodal Data

Palmyra-Vision's capabilities are remarkable. It can extract insights from images, classify objects, interpret charts and graphs, answer specific questions, and generate text descriptions with remarkable accuracy. Benchmark tests reveal that Palmyra-Vision outperforms other lauded multimodal models, setting a new standard in the field.

Seamless Integration with Writer's AI Platform

Palmyra-Vision seamlessly integrates with Writer's full-stack AI platform, which boasts large language models, a graph-based knowledge retrieval system, and robust data guardrails. This integration empowers businesses to build custom multimodal apps without the need for extensive engineering resources.

Addressing Enterprise Concerns: Accuracy, Control, and Safety

Writer understands the importance of accuracy, control, and safety in enterprise AI applications. Palmyra-Vision incorporates rigorous bias testing and provides granular control over content policies, ensuring that businesses can use AI responsibly and ethically.

Investor Enthusiasm for Enterprise AI

The enterprise AI landscape is witnessing a surge of investor excitement. Businesses are eager to adopt next-generation AI solutions that deliver tangible value. Writer's focus on purpose-built solutions that address specific business challenges has resonated with investors, leading to over $120 million in funding from leading investment firms.

Palmyra-Vision: A Catalyst for Enterprise AI Adoption

With the launch of Palmyra-Vision, Writer aims to spearhead the adoption of enterprise AI. Its versatile multimodal model, ease of integration, and emphasis on accuracy position it as a game-changer for data-driven businesses seeking to reimagine their workflows. Palmyra-Vision's capabilities have the potential to unlock new levels of efficiency, productivity, and innovation across industries.

",https://venturebeat.com/wp-content/uploads/2024/02/nuneybits_Vector_art_of_a_laptop_on_a_desk_modern_day_workspace_64a2ca68-b6d3-4dba-b6a5-c62b0a7dbc3d-transformed.webp?w=1200&strip=all,2024-02-27 14:00:00
https://venturebeat.com/business/dock-health-achieves-hitrust-essentials-1-year-e1-certification-demonstrating-foundational-cybersecurity/,"Dock Health Achieves HITRUST Essentials, 1-year (e1) Certification Demonstrating Foundational Cybersecurity","

Dock Health Earns HITRUST Essentials Certification, Upholding Cybersecurity Standards in Healthcare Collaboration

In a significant move, Dock Health, the leading provider of work management platforms tailored for healthcare, has achieved HITRUST Essentials, 1-year (e1) Certification. This prestigious recognition underscores Dock Health's unwavering commitment to foundational cybersecurity controls and information risk management.

The HITRUST Essentials Certification is a testament to Dock Health's dedication to safeguarding patient privacy and sensitive healthcare data. By meeting the stringent requirements of the HITRUST Framework, Dock Health demonstrates its adherence to best practices in cybersecurity and risk management. This certification serves as a beacon of trust for healthcare providers and patients alike, assuring them of Dock Health's unwavering commitment to data security.

""At Dock Health, patient privacy is paramount,"" emphasizes Michael Docktor, M.D., CEO and co-founder. ""Our HITRUST e1 Certification is a powerful affirmation of our commitment to providing secure experiences that stay ahead of evolving threats. We take pride in offering our customers, patients, and communities peace of mind knowing that their data is safeguarded with the highest standards of cybersecurity.""

Dock Health's comprehensive workforce management solution empowers healthcare teams to optimize workflows, enhance employee engagement and resilience, boost efficiency, and mitigate the impact of staffing shortages. Its platform serves as a cornerstone for operationalizing value-based care, delivering patient-centered experiences that support measurable health outcomes and fee-for-service models.

""Healthcare teams rely on trustworthy, interconnected systems that enable real-time collaboration,"" says Nitin Gujral, CTO and co-founder of Dock Health. ""Our customers entrust us with securely capturing and automating critical operational and administrative tasks that underpin clinical care delivery.""

Dock Health's HITRUST e1 Certification is a testament to its commitment to cybersecurity and data protection. The certification provides a solid foundation for organizations looking to mature their risk management, privacy, and compliance programs. It also establishes a strong basis for progressing to higher levels of assurance.

""The HITRUST e1 Certification is a valuable tool for cyber-aware organizations like Dock Health,"" explains Robert Booker, Chief Strategy Officer at HITRUST. ""It allows them to build assurances and progressively demonstrate due diligence around information security and privacy.""

Dock Health's unwavering commitment to cybersecurity and successful completion of the HITRUST e1 Certification are commendable. The company's dedication to data security sets a new standard in healthcare collaboration and workflow automation.

",https://venturebeat.com/wp-content/uploads/2015/10/BusinessWire_FeaturedImage.jpg?w=1200&strip=all,2024-02-27 13:25:53
https://venturebeat.com/ai/exclusive-enkrypt-raises-seed-round-to-create-a-control-layer-for-generative-ai-safety/,Exclusive: Enkrypt raises seed round to create a ‘control layer’ for generative AI safety,"

Bridging the Gap: Enkrypt AI Unveils a Revolutionary Control Layer for Generative AI Safety

In the realm of artificial intelligence, generative AI has emerged as a transformative force, promising to revolutionize industries and streamline workflows. However, the path to widespread adoption is fraught with challenges, including concerns over privacy, security, and compliance.

Enter Enkrypt AI, a Boston-based startup that is pioneering a groundbreaking solution to these hurdles. With its innovative control layer, Sentry, Enkrypt AI empowers enterprises to harness the full potential of generative AI while ensuring its safe and responsible use.

Sentry: A Comprehensive Solution for Generative AI Safety

Sentry is a comprehensive platform that addresses the critical safety aspects of generative AI deployment. It provides enterprises with a single, unified solution to manage data privacy, protect against security threats, and ensure compliance with internal and external regulations.

Key Features of Sentry:

 Visibility and Oversight: Sentry offers complete visibility into generative AI usage and performance across business functions, enabling organizations to monitor and manage their AI initiatives effectively.

 Data Privacy Protection: Sentry employs robust data sanitization and anonymization techniques to safeguard sensitive information, preventing unauthorized access and protecting user privacy.

 Security Safeguards: Sentry's proprietary guardrails, driven by advanced models, prevent prompt injection attacks and jailbreaking attempts, ensuring the integrity and security of generative AI applications.

 Compliance Management: Sentry automates compliance monitoring and implements strict access controls, helping organizations meet regulatory requirements and mitigate risks.

Benefits of Using Sentry:

 Accelerated AI Adoption: Sentry streamlines the implementation of generative AI models, reducing project timelines from years to weeks, enabling businesses to capitalize on new opportunities promptly.

 Reduced Vulnerabilities: Sentry significantly reduces the vulnerabilities associated with generative AI, minimizing regulatory, financial, and reputational risks for enterprises.

 Enhanced Trust and Confidence: By addressing safety concerns, Sentry instills trust and confidence in generative AI, encouraging broader adoption and unlocking its full potential.

Enkrypt AI's Mission: Trust and Innovation in Generative AI

Enkrypt AI is committed to fostering a paradigm where trust and innovation coexist, enabling the deployment of AI technologies with the assurance of security, reliability, and revolutionary potential.

The company's recent $2.35 million seed funding round, led by Boldcap, underscores the growing recognition of Enkrypt AI's groundbreaking work in generative AI safety.

Conclusion:

Enkrypt AI's Sentry platform is a game-changer for enterprises seeking to harness the power of generative AI while ensuring its safe and responsible use. By addressing critical safety concerns, Enkrypt AI is paving the way for widespread adoption of generative AI, unlocking new possibilities for innovation and efficiency across industries.

",https://venturebeat.com/wp-content/uploads/2023/12/Hero-image-16-Cybersecurity-leaders-predict-how-gen-AI-will-improve-cybersecurity-in-2024--e1709018174529.png?w=1200&strip=all,2024-02-27 10:00:00
