Link,post_title,title,post_content,featured_image,Date-Publish,meta_desc,focuskeywords,post_category,Post_tag
https://techcrunch.com/2024/03/29/palmsy-is-a-device-only-social-network-to-satisfy-your-posting-itch/,"Meet Palmsy, the fake social network where your posts stay on your device forever","""Palmsy: The Fake Social Network for Writers""","

Social Media: The Double-Edged Sword

In the digital age, social networks have become an integral part of our lives. Whether it's Facebook, Instagram, Twitter, or TikTok, we spend hours scrolling through our feeds and engaging with others. But have you ever wondered what it would be like to post anything and get likes without the constant pressure of maintaining a perfect online persona? That's where Palmsy comes in.

Palmsy is a new app that allows you to post anything you want and get likes without the need for anyone else to see your posts. Developed by Pat Nakajima, Palmsy is designed to help users break their social media addiction and rediscover the joy of writing without the fear of judgment.

How does it work? Palmsy reads your contact list and assigns fake likes to your posts. While the app is reading your contact details, all posts remain local, meaning they are not sent to a server. You can publish as many posts as you like, and the app even allows you to add photos to your posts. The catch is that no one will see your posts, not even your friends or followers.

But don't worry, Nakajima assures us that the app is not a substitute for real-life social interaction. It's meant to be a tool to help users focus on their writing and creativity without the distractions of social media. The app even has advanced options that let you limit the number of likes on a particular post and for how long you want those likes to come in: a few seconds, a few minutes, a few hours, or a few days.

Palmsy is not the only app that aims to help users reduce their social media addiction. There have been multiple time-limiting apps that try to help when it comes to reducing social media addiction. Some developers have also released very basic apps to post dumb posts without consequences. However, Palmsy stands out because it provides a unique solution to the problem of online identity and the pressure to maintain a perfect online persona.

In conclusion, Palmsy is an interesting app that provides a unique solution to the problem of social media addiction. While it may not be for everyone, it's worth considering if you're looking for a way to rediscover the joy of writing without the constant pressure of social media. So why not give it a try and see how it can help you break free from the cycle of likes and comments?

","https://techcrunch.com/wp-content/uploads/2024/03/Palmsy.jpg?resize=1200,589",2024-03-29 11:10:26,"Meta Description under 20 word: ""Palmsy is a new social media app that allows you to post anything and get likes without the need for anyone else to see your posts. Break your addiction and rediscover joy of writing without fear of judgment. Try it today!""",Palmsy,Technology,"Formicoders,News,AI,Technology,Innovation,Programmering,Coding,Wordpress,Python"
https://www.engadget.com/how-uber-and-the-gig-economy-changed-the-way-we-live-and-work-164528738.html,How Uber and the gig economy changed the way we live and work, How Uber and gig economy changed work and life,"A blog-friendly version of the text:

The gig economy has become increasingly popular in recent years, with companies like Uber and Lyft taking advantage of the trend. While these companies claim to offer flexibility and independence to their drivers, they have been criticized for their labor practices and the impact they have had on traditional industries such as the taxi industry.

Uber's business model has been controversial from the beginning. The company has been accused of railroading into new markets without getting approval from regulators and has been involved in several scandals over the years. In addition, Uber has been criticized for its treatment of its drivers, who are often classified as contractors rather than employees.

One of the casualties of the ride-sharing boom has been taxi medallions. For decades, cab drivers in many locales saw these licenses as retirement plans, but in recent years, the value of medallions has plummeted. In New York, for example, the value of a medallion dropped from around $1 million in 2014 to $100,000 in 2021.

Some jurisdictions have tried to offset the collapse in medallion value. Quebec pledged $250 million CAD in 2018 to compensate cab drivers, while other regulators have applied a per-ride fee to ride-sharing services to replace taxi licenses and compensate medallion holders. However, these efforts have not been enough to offset the impact on medallion holders, and many rideshare drivers have also suffered financially.

In 2017, Uber settled allegations from the Federal Trade Commission that it used false promises about potential earnings to entice drivers to join its platform. Late last year, the company and Lyft agreed to pay $328 million to New York drivers after the state conducted a wage theft investigation. The settlement also guaranteed a minimum hourly rate for drivers outside of New York City.

Many rideshare drivers have also sought recognition as employees rather than contractors, so they can have a consistent hourly wage, overtime pay, and benefits. The Department of Labor recently issued a final rule that aims to make it more difficult for gig economy companies to classify workers as independent contractors rather than employees. The EU is also weighing a provisional deal to reclassify millions of app workers as employees.

In the early days, Uber's CEO, Travis Kalanick, had grand plans for the company's future. He envisioned a world without drivers, where Uber would operate a fleet of self-driving vehicles and flying taxis. However, these plans have not come to fruition, and the company continues to face challenges in the face of ongoing legal battles and changing public attitudes towards the gig economy.

In conclusion, the gig economy has had a significant impact on traditional industries and the lives of many workers. While companies like Uber and Lyft have offered some flexibility and independence to their drivers, they have also been criticized for their labor practices and the impact they have had on the economy. As the gig economy continues to evolve, it will be important to consider the potential consequences of these changes and work towards creating a fair and equitable labor market for all workers.",https://s.yimg.com/ny/api/res/1.2/1_Kh9h_P4emCAe45VfYL_Q--/YXBwaWQ9aGlnaGxhbmRlcjt3PTEyMDA7aD04MDA-/https://s.yimg.com/os/creatr-uploaded-images/2024-03/70ebe730-e083-11ee-adb4-2a4cdea0f515,2024-03-29 16:45:28,"The gig economy, popularized by companies like Uber, has both benefits and challenges. While it offers flexibility and independence to drivers, it has also led to labor disputes and a decline in the value of taxi medallions. Uber has been accused of false promises about potential earnings and wage theft, and many drivers have sought recognition as employees. The Department of Labor has also issued a final rule to make it harder for gig economy companies to classify workers as independent contractors. As the gig economy continues to evolve, it is important to consider the potential consequences and work towards creating a fair and equitable labor market for all workers."," Gig economy, Uber",Technology,"Formicoders,News,AI,Technology,Innovation,Programmering,Coding,Wordpress,Python"
https://techcrunch.com/2024/03/29/supaglue-stripe-acquire-acquisition/,"How a tiny 4-person startup, Supaglue, caught Stripe’s eye",Stripe Acquires Supaglue for $500M+ Revenue & Finance Automation Unit,"Stripe's Revenue and Finance Automation (RFA) unit is experiencing significant growth and is expected to reach a $500 million annual run rate. As part of its investment in RFA, Stripe recently completed an ""acqui-hire"" of a team from Supaglue, a four-person open source developer platform for integrations. The team from Supaglue, George Xing and Thomas Chen, built a product that helps companies centralize customer data from various sources like Salesforce.

The acqui-hire offer from Stripe caught the attention of Supaglue because of mutual work acquaintances and because Supaglue was also doing integration work. Supaglue's product is similar to a unified data platform that reconciles data from each of Stripe's products and surfaces relevant insights to end-users via dashboards, alerts, customer reporting, and real-time analytics.

Stripe's RFA suite is a significant part of the company's growth strategy, and Supaglue's expertise in unified data platforms makes it an ideal fit for Stripe's ecosystem. The acqui-hire is one of many things going on at Stripe, and Supaglue will likely quickly find fast friends within Stripe's network.","https://techcrunch.com/wp-content/uploads/2024/03/IMG_1110.jpg?resize=1200,675",2024-03-29 13:30:19,"Here's a meta description that aligns with your SEO guidelines:

""Boost your business with Stripe's latest acqui-hire from Supaglue, enhancing data integration for growth. Act now!""

This description is under 18 words, uses an active voice, includes a call to action, and incorporates the keyphrase ""acqui-hire"". It also matches the content of the page and highlights the specifications of Stripe's growth and the benefits of the acqui-hire, making it unique and actionable. ", Acqui-Hire ,Technology,"Formicoders,News,AI,Technology,Innovation,Programmering,Coding,Wordpress,Python"
https://techcrunch.com/2024/03/29/techcrunch-minute-sam-bankman-frieds-sentencing-marks-an-end-to-the-ftx-saga/,Watch: Sam Bankman-Fried’s sentencing marks an end to the FTX saga,"""Crypto Industry Rebounds Despite Sam Bankman-Fried Sentence""","

After a long and contentious trial, Sam Bankman-Fried was convicted of several crimes and sentenced to up to 25 years in prison. Given the severity of the charges, many in the crypto industry are not surprised by the lengthy sentence.

As we move forward, it seems that the cryptocurrency market is back on the rise. Token prices are surging, trading volumes are increasing, and there are hints of the excitement that web3 brought to the market during the last asset bubble. However, before we move on from the Sam Bankman-Fried saga, it's worth taking a closer look at how we got here.

","https://techcrunch.com/wp-content/uploads/2024/03/SBF-TC-Minute-YT.png?resize=1200,675",2024-03-29 16:00:11,"Meta Description:

Learn about the impact of Sam Bankman-Fried's conviction on the crypto market. Explore the rise of token prices, trading volumes, and web3 excitement. Understand the seriousness of the charges and the lessons we can learn from the crypto industry's past to navigate its future.","The keyphrase for this news article is ""crypto saga."" It is relevant to the main topic of the article, which deals with the trial and conviction of Sam Bankman-Fried and the impact it has had on the cryptocurrency market. The keyphrase is only one word long and appears in the SEO title and the first paragraph of the article. The keyphrase is also woven throughout the text, appearing again in the second paragraph.",Technology,"Formicoders,News,AI,Technology,Innovation,Programmering,Coding,Wordpress,Python"
https://techcrunch.com/2024/03/29/what-is-elon-musks-grok-chatbot-and-how-does-it-work/,What is Elon Musk's Grok chatbot and how does it work?," ""Exploring Grok's Capabilities and Limitations"" ","Title: Exploring the Capabilities and Limitations of Elon Musk's Grok Chatbot

Are you ready to delve into the world of Elon Musk's Grok chatbot? This innovative AI-powered chatbot has taken the internet by storm with its ability to access real-time X data and its rebellious streak. In this guide, we'll explore the inner workings of Grok, its capabilities, and limitations.

Introduction

Grok is a cutting-edge chatbot developed by xAI, Elon Musk's AI startup. Understanding how Grok works and what it can do can help you make the most of this tool. In this article, we'll explore the basics of Grok, its capabilities, and limitations.

How Does Grok Work?

Grok is powered by a generative AI model called Grok-1, which was developed over several months on a cluster of ""tens of thousands"" of GPUs (according to an xAI blog post). To train it, xAI sourced data from the web and from feedback from human assistants referred to as ""AI tutors.""

On popular benchmarks, Grok-1 is as capable as Meta's open source Llama 2 chatbot model and surpasses OpenAI's GPT-3.5, xAI claims. Grok's ability to access real-time X data is one of its key selling points, as no other chatbots have this capability, thanks to X's decision to gatekeep that data.

When asked about a topic, Grok will provide an answer based on its knowledge base. If the topic falls beyond its knowledge base, Grok will leverage ""real-time access"" to information on X and the internet, enabling it to provide up-to-date information about the topic.

Human-guided feedback, or reinforcement learning from human feedback (RLHF), is the way most AI-powered chatbots are fine-tuned these days. RLHF involves training a generative model, then gathering additional information to train a ""reward"" model and fine-tuning the generative model with the reward model via reinforcement learning.

RLHF is quite good at ""teaching"" models to follow instructions, but it's not perfect. Like other models, Grok is pr","https://techcrunch.com/wp-content/uploads/2024/03/GettyImages-1771536851.jpg?resize=1200,800",2024-03-29 13:00:44,"Title: How Elon Musk's Grok Chatbot is Revolutionizing the AI Industry

Are you interested in learning more about Elon Musk's Grok chatbot and its potential to revolutionize the AI industry? In this article, we'll delve into the capabilities and limitations of this innovative AI-powered chatbot.

Introduction

Elon Musk's xAI, a startup dedicated to developing cutting-edge AI technology, has created a chatbot that has taken the internet by storm - Grok. Grok is an AI-powered chatbot that has proven itself to be one of the most advanced chatbots on the market. With its ability to access real-time X data and its rebellious streak, Grok has shown its potential to revolutionize the way we interact with technology.

How Does Grok Work?

Grok is powered by a generative AI model called Grok-1, which was developed over several months on a cluster of ""tens of thousands"" of GPUs (according to an xAI blog post). This model is capable of understanding natural language and providing answers to queries based on its knowledge base. Grok's ability to access real-time X data is one of its key selling points, as no other chatbots have this capability, thanks to X's decision to gatekeep that data.

When asked about a topic, Grok will provide an answer based on its knowledge base. If the topic falls beyond its knowledge base, Grok will leverage ""real-time access"" to information on X and the internet, enabling it to provide up-to-date information about the topic. It uses human-guided feedback to fine-tune its generative model, making it more adaptable and accommodating to human users.

Capabilities and Limitations

Grok has several capabilities that set it apart from other chatbots. It is capable of answering questions in different languages, including Chinese, Arabic, and Russian. Grok can also provide personalized recommendations based on a user's previous interactions with it. Additionally, Grok's ability to access real-time X data allows it to provide up-to-date information on topics related to X.

However, Grok's limitations should also be considered. One limitation is that it requires an active internet connection to provide real-time access to X data. Another limitation is that Grok is still","The keyphrase for this news article is ""Elon Musk's Grok chatbot"".",Technology,"Formicoders,News,AI,Technology,Innovation,Programmering,Coding,Wordpress,Python"
https://techcrunch.com/2024/03/29/google-pushes-podcasts-users-in-u-s-to-move-to-youtube-music-by-april-2/,"Google Podcasts is shutting down soon, users urged to move to YouTube Music", Google Podcasts to Retire in the US: What It Means for Podcast Lovers ,"Title: Google Podcasts App Set to Retire in the US: What It Means for Podcast Lovers

Introduction

Get ready, podcast enthusiasts! Google has announced that it's pulling the plug on its Podcasts app in the United States. As of April 2, 2024, users must transfer their subscriptions to YouTube Music to continue following and enjoying their preferred programs. Failure to do so will result in losing access to stream podcasts via the Google Podcasts app post-April 2. In this article, we delve deeper into what led to this decision, how it might impact podcast consumers, and potential alternatives moving forward.

Rationale Behind Discontinuing Google Podcasts

Launched over half a decade ago, the Google Podcasts app quickly became popular among Android device owners due to its straightforward design, facilitating easy discovery, subscription management, and playback of various podcast series. Additionally, users appreciated the option to manually input podcast URLs using RSS feeds. Regrettably, Google declared in late 2023 its intentions to phase out the Podcasts app gradually throughout 2024 as part of a larger initiative to consolidate its audio services under the YouTube umbrella.

A Transition Strategy Similar to Google Play Music

This isn't Google's first rodeo when it comes to shifting users to different platforms. Back in 2020, YouTube Music provided a comparable approach to guide music lovers away from Google Play Music before its eventual sunset later that same year. While the Google Podcasts app remained functional during this period, it was primarily attributed to YouTube Music being ill-prepared to accommodate podcasts fully—that is, until the end of 2023. At this point, YouTube Music began supporting global podcast consumption. Moreover, the platform introduced RSS feed integration just a couple of months ago, further solidifying its position as a comprehensive audio solution encompassing both music and podcasts alike.

Why Consolidating Under YouTube May Benefit Google

Transferring podcast operations to YouTube makes strategic sense for several reasons. Firstly, merging resources can potentially strengthen Google's presence in the burgeoning podcast market. Secondly, there seems to be growing demand for visual podcast experiences—something YouTube excels at offering. Recently, Spotify formed partnerships with Universal Music Group to introduce video podcasts to American audiences, closely mirroring YouTube's existing capabilities. With these factors in mind, integrating Google Podcasts into YouTube may prove advantageous for Google in terms of increased competitiveness and user engagement.

How Will Affected Users Adapt?

As Google Podcasts app usage ceases domestically, affected users face two primary options: either embracing YouTube Music or exploring third-party alternatives compatible with their needs. Fortunately, numerous high-quality podcast applications cater to diverse preferences and requirements, ensuring users won't experience significant difficulties finding worthy replacements.

Conclusion

Although saying goodbye to the familiar Google Podcasts app might feel bittersweet initially, podcast aficionados can take solace in knowing viable alternatives exist. Whether opting for YouTube Music or seeking refuge elsewhere, users can maintain seamless access to their cherished programs without missing much of a beat. Ultimately, such transitions underscore the ever-evolving nature of technology and digital entertainment landscapes; adaptation remains key to staying connected amidst ongoing changes.","https://techcrunch.com/wp-content/uploads/2019/07/GettyImages-1079623010.jpg?resize=1200,800",2024-03-29 19:49:49,"""Discover your favorite podcasts without missing a beat! Google is retiring its Podcasts app in the US. Transfer your subscriptions to YouTube Music to continue streaming podcasts, or explore alternative podcast apps tailored to your needs. Stay updated and engaged with the latest developments in podcasting. Upgrade to YouTube Music today!""",Keyphrase: Google Podcasts Retirement,Technology,"Formicoders,News,AI,Technology,Innovation,Programmering,Coding,Wordpress,Python"
