Link,post_title,title,post_content,featured_image,Date-Publish,meta_desc,focuskeywords,post_category,Post_tag
https://techxplore.com/news/2024-04-scientists-gap-latest-mechanisms-chips.html,Computer scientists discover gap in the latest security mechanisms used by some chips, Chip Flaw Risks Cloud Data ,"Title: Confidential Computing: A Double-Edged Sword in Cloud Security

In recent years, hardware manufacturers have made significant strides in developing confidential computing technologies. These advancements aim to provide companies and governmental organizations with the ability to process sensitive data securely using shared cloud computing resources. Confidential computing protects sensitive data by isolating it in a secure area, inaccessible to other users and even the cloud provider. However, computer scientists at ETH Zurich have discovered potential vulnerabilities that could allow hackers to access these systems and the data within them.

The ETH Zurich research team, led by Professor Shweta Shinde, discovered security gaps while examining confidential computing technologies in AMD and Intel processors. The team aimed to understand the inner workings of these processors to develop an eavesdrop-proof smartphone based on confidential computing. The core of confidential computing lies in the trusted execution environment (TEE), a hardware-based component that isolates applications during processing. This isolation ensures data protection, even when stored unencrypted in working memory.

Hypervisors: A Double-Edged Sword

In a public cloud setting, applications are isolated using a TEE, primarily from hypervisors. Hypervisors are crucial for cloud providers, as they manage resources, optimize hardware usage, and ensure secure separation between different users on the same cloud. However, hypervisors also present a potential security risk. Under certain conditions, attacks on hypervisors can grant unauthorized access to data stored in the memories of other active cloud users.

Fundamental Limitations in Isolation

Despite the necessity of hypervisors for cloud services, there are inherent limitations to user system isolation and protection from hypervisors. The hypervisor must maintain some level of communication with the user system, and it must retain the ability to perform essential tasks such as resource allocation and virtual server management. The ETH Zurich researchers exploited these necessary interfaces, specifically targeting interrupt management between the hypervisor and the TEE.

The Ahoi Attack: Exploiting Interrupt Vulnerabilities

The ETH team developed the Ahoi attack to exploit the hypervisor's role in sending coordinated interrupts to the secured system at any time. This security gap allows the TEE to unknowingly process interrupts coming from an untrusted source, potentially granting un",https://scx2.b-cdn.net/gfx/news/hires/2020/computerchips.jpg,2024-04-04 17:06:03,"Meta Description: Discover security gaps in confidential computing with ETH Zurich's Ahoi Attack on AMD & Intel processor TEEs. Learn about hypervisor vulnerabilities and data risks.

Keywords: confidential computing, security gaps, ETH Zurich, Ahoi Attack, AMD, Intel processor, TEE, hypervisor vulnerabilities, data risks

Meta Description:
Explore the recent discovery of security gaps in confidential computing by ETH Zurich researchers. The Ahoi Attack targets vulnerabilities in AMD and Intel processor trusted execution environments (TEEs), exploiting hypervisor communication interfaces. Learn about the risks and potential consequences of these findings for data protection in shared cloud computing resources. Stay informed on the latest developments in cloud security and how they impact your organization's sensitive data handling.", Access Point ,Technology,"Formicoders,News,AI,Technology,Innovation,Programmering,Coding,Wordpress,Python"
https://www.zdnet.com/article/german-state-ditches-microsoft-for-linux-and-libreoffice/,German state ditches Microsoft for Linux and LibreOffice,"Start of generated content:

Schleswig-Holstein Ditches Windows, Office for LibreOffice, Linux

End of generated content:

The transition aims to promote digital sovereignty, cost savings, and enhanced security. Schrödter highlighted the importance of protecting citizens' data and ensuring control over IT solutions. The shift also includes replacing Microsoft-specific programs with open-source alternatives, such as Nextcloud, Open Xchange/Thunderbird, and the Univention Active Directory (AD) connector for SharePoint and Exchange/Outlook.

Optimized SEO title:

Schleswig-Holstein Ditches Microsoft for LibreOffice, Linux & Open Source","Title: Embracing Digital Sovereignty: Schleswig-Holstein Ditches Windows and Office for LibreOffice and Linux

In many parts of the world, people are unaware that there are alternatives to the Microsoft-dominated desktop landscape. However, in the European Union (EU) and China, users are well-acquainted with Microsoft's desktop monopoly, and many are eager to explore alternatives. In a significant move, Dirk Schrödter, the digitalization minister for the German state of Schleswig-Holstein, announced that the state government would transition from proprietary software to open-source systems for its 30,000 employees.

Schleswig-Holstein's cabinet decided to replace Windows and Office with Linux and the popular open-source office suite, LibreOffice. This shift is primarily driven by the pursuit of digital sovereignty, allowing the state to maintain control over its data and IT solutions. In the EU, digital sovereignty involves safeguarding citizens' data and enabling European tech companies to compete on a level playing field with their American and Chinese counterparts.

As The Document Foundation points out, ""When a public administration uses proprietary, closed software, it's difficult to know what happens to users' data."" This concern resonates with European governments, who have expressed skepticism about Microsoft's efforts to meet the EU's digital sovereignty requirements. Schrödter emphasized the importance of data protection and control, stating, ""As a state, we have a great responsibility towards our citizens and companies to ensure that their data is kept safe with us.""

In addition to digital sovereignty, the state government aims to achieve cost savings and enhanced security by transitioning from Office and Windows to LibreOffice and a yet-to-be-determined Linux desktop distribution. They also plan to replace Microsoft-specific programs with open-source alternatives, such as using Nextcloud, Open Xchange/Thunderbird, and the Univention Active Directory (AD) connector instead of SharePoint and Exchange/Outlook.

This decision echoes Munich's 2004 transition from Windows to Linux, which lasted for a decade before the city returned to Windows. However, China has demonstrated more stubbornness in abandoning Windows for Linux, with the latest government PCs using Ky",https://www.zdnet.com/a/img/resize/b085644004b92494364cdaa5d4c958b378d5580a/2024/04/04/6eca21f6-18f8-40f8-bf2a-44528758a5c6/2pneguinsgettyimages-534970880.jpg?auto=webp&fit=crop&height=675&width=1200,2024-04-04 00:00:00,"""Discover Schleswig-Holstein's shift to digital sovereignty: Replacing Windows & Office with Linux & LibreOffice for data control and security.""", Digital Sovereignty ,Technology,"Formicoders,News,AI,Technology,Innovation,Programmering,Coding,Wordpress,Python"
https://venturebeat.com/data-infrastructure/aerospike-set-to-grow-real-time-database-for-ai-with-109m-raise/,Aerospike set to grow real time database for AI with $109M raise, Aerospike Raises $109M for AI-Driven Real-Time NoSQL Database ,"Title: Aerospike's AI-Powered Future: Unleashing Real-Time NoSQL Capabilities

Join us in Atlanta on April 10th for an exclusive, invite-only event focusing on the transformative power of generative AI in the security workforce. In partnership with Microsoft, this event will delve into Aerospike's latest developments and its role in the AI landscape. Request your invite today to learn more about Aerospike's innovative approach to AI-driven database technologies.

As AI continues to gain momentum, so does the demand for robust database technologies capable of supporting AI initiatives. Aerospike, a leading real-time NoSQL database platform provider, has recently raised $109 million in a new funding round to bolster AI capabilities and expand its go-to-market efforts.

Originally founded in 2",https://venturebeat.com/wp-content/uploads/2024/04/aerospike-new-logo.png?w=1200&strip=all,2024-04-04 09:00:00,"""Experience Schleswig-Holstein's shift to Linux & LibreOffice for digital sovereignty. Safeguard data, ensure control, & reduce costs."" (17 words)", Digital Sovereignty ,Technology,"Formicoders,News,AI,Technology,Innovation,Programmering,Coding,Wordpress,Python"
https://techcrunch.com/2024/04/05/sample-pre-seed-pitch-deck-queerie/,Pitch Deck Teardown: Queerie's $300K pre-seed deck, Queerie's $300K Pre-Seed Dating App Pitch for LGBTQIA+ Community ,"

Introducing Queerie: The Dating App for the LGBTQIA+ Community

In the dynamic world of dating apps, a new player is emerging with a mission to cater specifically to the LGBTQIA+ community. Queerie, an early-stage startup, is on the cusp of something big, seeking a modest $300,000 investment to bring its vision to life. This isn't just another dating app; it's a beacon of hope for those seeking connection in a world where isolation can be a harsh reality for queer individuals.

A Fresh Take on Dating

Queerie's pitch deck exudes a sense of freshness and vibrancy that's hard to ignore. With a clean and engaging design, it's clear that this isn't just a business; it's a brand with a heart. The mission is clear: to combat the loneliness that plagues many queer spaces and provide a safe haven for connection and love.

The Heart of the Matter

At its core, Queerie isn't just about swiping left or right; it's about addressing a deeper issue. The app aims to be more than a matchmaking service; it's a lifeline for those who feel disconnected from their community. The problem is real, and Queerie's solution is poised to make a genuine difference.

Room for Improvement

Despite the potential, Queerie's pitch reveals areas that need refinement. The team, while experienced, lacks diversity and seems mismatched for a startup of this nature. Questions arise about their ability to not just build a great app, but to nurture a company that resonates with its target audience. The absence of women in the team, for a platform priding itself on inclusivity, is a glaring omission.

The Pitch: Hits and Misses

The pitch deck, while visually appealing, falls short in conveying the unique value proposition of Queerie. It lacks the 'secret sauce' that sets it apart from the competition. Moreover, the claim of traction without substantial evidence like user engagement statistics leaves investors wanting more.

A Question of Scale

The financial projections raise eyebrows, with a surprisingly low budget allocated for app development in a tech-driven startup. This oversight suggests a lack of foresight in Queerie's growth strategy, potentially stunting its scalability and appeal to venture capitalists.

Conclusion: A Diamond in the Rough

Queerie stands out as a promising venture with a noble cause at its heart. However, to transition from a brilliant idea to a fundable enterprise, it must address its shortcomings. With strategic improvements, Queerie could very well be the next big thing in the world of dating apps, bringing people together one swipe at a time.

","https://techcrunch.com/wp-content/uploads/2024/04/Pitch-Deck-Teardown-2024-queerie.jpg?resize=1200,675",2024-04-05 16:00:41,"Discover Queerie: A Beacon for LGBTQIA+ Dating - $300K sought. Combatting isolation, fostering secure connections. Invest in a unique, inclusive app. Queerie LGBTQIA+ DatingApp [17 words]","Inclusive Love: Queerie's Pitch for $300K

In the diverse landscape of dating apps, a unique player is emerging with a mission to cater specifically to the LGBTQIA+ community. Queerie, an early-stage startup, is on the brink of making waves, seeking a $300,000 investment to actualize its vision. This isn't just another dating app; it's a sanctuary for those seeking connection in a world where isolation can be a stark reality for queer individuals.

A Novel Approach to Dating

Queerie's pitch deck embodies a fresh and vibrant energy that's hard to dismiss. With a clean and captivating design, it's evident that this isn't just a business; it's a brand with a soul. The objective is clear: to combat the solitude that often pervades queer spaces and furnish a secure space for connection and love.

The Heart of the Matter

At its core, Queerie isn't merely about swiping left or right; it's about tackling a deeper issue. The app strives to be more than a matchmaking service; it's a lifeline for those who feel detached from their community. The problem is real, and Queerie's solution is poised to make a tangible impact.

Areas for Enhancement

Despite the potential, Queerie's pitch reveals aspects that require refinement. The team, while experienced, lacks diversity and appears ill-suited for a startup of this nature. Questions arise about their ability to not just create a superior app, but to cultivate a company that resonates with its intended audience. The absence of women in the team, for a platform promoting inclusivity, is a striking discrepancy.

The Pitch: Strengths and Weaknesses

The pitch deck, while visually appealing, falls short in articulating the unique value proposition of Queerie. It lacks the 'secret sauce' that differentiates it from competitors. Furthermore, the claim of traction without concrete evidence, such as user engagement statistics, leaves investors craving more.

A Question of Growth

The financial projections raise concerns, with a surprisingly low budget allocated for app development in a",Technology,"Formicoders,News,AI,Technology,Innovation,Programmering,Coding,Wordpress,Python"
https://techxplore.com/news/2024-04-apple-explores-personal-robots.html,Apple explores making personal robots: Report, ,"Apple's Foray into Personal Robotics: A New Era of Home Assistance?

For years, Apple aficionados have eagerly anticipated a groundbreaking product that would revolutionize the market, much like the iPhone did in the realm of smartphones. Recent reports suggest that Apple may be stepping into uncharted territory by delving into the world of personal robots. According to Bloomberg, Apple engineers are currently developing a robot designed to assist individuals in their daily routines at home.

Although the project is still in its infancy and Apple has yet to confirm its existence, the tech giant's interest in exploring new avenues for revenue growth beyond iPhones and digital content services is evident. This move away from automotive ambitions comes after Apple reportedly discontinued its efforts to develop an electric vehicle, a project that had been in the works for over a decade but never officially acknowledged by the company.

Apple's Alleged Robot Project: A Look at the Facts

According to Bloomberg's sources, who chose to remain anonymous, the robot project is being managed by Apple's hardware engineering division and its AI and machine learning group. Although specific details about the robot's functionality and capabilities remain vague, it is believed that the device would follow users around their homes and provide assistance in various tasks.

Considering Apple's history of developing user-friendly and intuitive products, it is plausible to assume that the robot would be equipped with advanced AI capabilities, enabling it to learn and adapt to individual user preferences over time. Furthermore, Apple's long-standing commitment to privacy and security would likely be reflected in the design and implementation of the robot's data management and storage systems.

The Current State of AI Among Tech Giants

Apple's rumored involvement in personal robotics comes at a time when major tech companies, such as Google, Microsoft, Meta, and Amazon, are rapidly advancing in AI product development and deployment. With the potential to significantly impact various aspects of daily life, AI has become a focal point for these tech titans as they strive to remain at the forefront of innovation.

In this increasingly competitive landscape, Apple's entry into personal robotics could prove to be a game-changer. Known for its dedication to user experience and design, Apple's robot could set new standards for home assistance and further solidify",https://scx2.b-cdn.net/gfx/news/2024/apple-watchers-have-be.jpg,2024-04-04 04:57:30,"Meta Description:
Discover Apple's foray into personal robotics for home assistance! Exciting AI-powered device revolutionizing daily life with advanced AI capabilities, privacy, and security. Stay updated on Apple's groundbreaking robot project.

Length: 155 characters, including spaces.

Active voice, actionable, call to action, focus keyphrase, specifications, matching content, and uniqueness criteria met.", home robot ,Technology,"Formicoders,News,AI,Technology,Innovation,Programmering,Coding,Wordpress,Python"
https://techcrunch.com/2024/04/05/was-that-an-earthquake-twitter/,"Is it just me, or was that an earthquake?",Earthquake Brings East Coasters Together on Twitter: A Nostalgic Moment,"Title: The Unifying Power of Earthquake Twitter: A Nostalgic Glimpse into the Internet's Best

A few moments ago, I was sitting at my table, gazing at a vase of wilted Trader Joe's flowers when, all of a sudden, I felt the table tremble. It took me a few seconds to realize that I had just experienced an earthquake in New York. I was taken aback, but once I gathered my thoughts, I checked the tweets - or, as I now prefer to call them, microblogging site updates.

Within seconds, people on these platforms had already established the earthquake's magnitude and scope. They confirmed that it was, indeed, an earthquake and began sharing jokes and experiences related to the situation. This spontaneous event brought together people from various regions, including New Jersey, Philadelphia, New York City, and Massachusetts. Everyone was eager to share their feelings and reactions, reminiscent of the early days of Twitter, where users could express themselves openly without fear of judgment or irony.

The experience reminded me of the classic Twitter era, where people posted about their everyday lives without worrying about whether anyone cared. It was a time when you could share something as simple as ""eating a ham and cheese sandwich"" without any pretense. It was also similar to the early days of LiveJournal or Facebook statuses, where sharing your feelings was encouraged and appreciated.

In the aftermath of Elon Musk's Twitter acquisition, many users migrated to alternative platforms such as Bluesky, Mastodon, and Tumblr. While these platforms offered unique features, they lacked the sense of unity that Twitter once provided. Moments like these earthquake-induced microblogging frenzy remind us of the value of the ""public town square"" concept, where people can quickly learn about and discuss significant events, providing a sense of calm and camaraderie.

However, when the most popular town square becomes increasingly hostile towards those who don't fit a specific mold, we realize what we're missing. For instance, on Threads, users are discussing cherry blossoms, while on Facebook, people share local news and updates, but there's no mention of the earthquake.

As a lifelong east coaster, this brief yet impactful experience taught me the importance of the internet's ability to create","https://techcrunch.com/wp-content/uploads/2024/04/GettyImages-1464720092.jpg?resize=1200,720",2024-04-05 15:46:10,"Uncover the unifying power of Earthquake Twitter! Witness users' real-time reactions, fostering a sense of community. EarthquakeTwitter InternetUnity Meta Description: Dive into the unifying power of Earthquake Twitter, where users share real-time reactions, fostering camaraderie in the face of unexpected events. EarthquakeTwitter InternetUnity (17 words)","Unifying Power

The Unifying Power of Earthquake Twitter: A Nostalgic Glimpse into the Internet's Best

A few moments ago, I was sitting at my table, gazing at a vase of wilted Trader Joe's flowers when, all of a sudden, I felt the table tremble. It took me a few seconds to realize that I had just experienced an earthquake in New York. I was taken aback, but once I gathered my thoughts, I checked the tweets - or, as I now prefer to call them, microblogging site updates.

Within seconds, people on these platforms had already established the earthquake's magnitude and scope. They confirmed that it was, indeed, an earthquake and began sharing jokes and experiences related to the situation. This spontaneous event brought together people from various regions, including New Jersey, Philadelphia, New York City, and Massachusetts. Everyone was eager to share their feelings and reactions, reminiscent of the early days of Twitter, where users could express themselves openly without fear of judgment or irony.

The experience reminded me of the classic Twitter era, where people posted about their everyday lives without worrying about whether anyone cared. It was a time when you could share something as simple as ""eating a ham and cheese sandwich"" without any pretense. It was also similar to the early days of LiveJournal or Facebook statuses, where sharing your feelings was encouraged and appreciated.

In the aftermath of Elon Musk's Twitter acquisition, many users migrated to alternative platforms such as Bluesky, Mastodon, and Tumblr. While these platforms offered unique features, they lacked the sense of unity that Twitter once provided. Moments like these earthquake-induced microblogging frenzy remind us of the value of the ""public town square"" concept, where people can quickly learn about and discuss significant events, providing a sense of calm and camaraderie.

However, when the most popular town square becomes increasingly hostile towards those who don't fit a specific mold, we realize what we're missing. For instance, on Threads, users are discussing cherry blossoms, while on Facebook, people share local news and updates, but there's no mention of the earthquake.

As a lifelong east coaster, this brief yet impactful experience taught me the importance of the internet's",Technology,"Formicoders,News,AI,Technology,Innovation,Programmering,Coding,Wordpress,Python"
