Link,post_title,title,post_content,featured_image,Date-Publish,meta_desc,focuskeywords,post_category,Post_tag
https://www.zdnet.com/article/openai-rolls-out-new-features-to-entice-companies-to-build-ai-solutions/,OpenAI rolls out new features to entice companies to build AI solutions, OpenAI Fortifies Enterprise Tools: Security & Cost-Savings Upgrades ,"_[Start of Generated Content]_

OpenAI Bolsters Enterprise Offerings: Security and Cost-Savings Upgrades for Business Users

OpenAI, the artificial intelligence (AI) research organization, has recently unveiled enhancements to its enterprise tools, providing corporate clients with advanced security features and cost-saving measures. These improvements, while not as headline-grabbing as new AI models, are crucial for businesses leveraging OpenAI's technology to build internal and public-facing AI applications.

Enhanced Security Features

OpenAI's API users can now enjoy beefed-up security measures, including single sign-on and multi-factor authentication by default. This upgrade reduces the risk of unauthorized access to AI tools and safeguards sensitive data. Furthermore, the integration of 256-bit AES encryption during data transfer minimizes the potential for data leaks, ensuring tighter control over information flow.

Security improvements are essential for both businesses and their customers, as they help protect user data and prevent unauthorized access, ransomware attacks, and other cyber threats. By incorporating stronger security features, AI tools can offer greater peace of mind for all parties involved.

Cost-Savings Features

OpenAI has also introduced cost-savings measures to help companies better manage their budgets. The new Batch API, for example, reduces spending by up to 50%, enabling organizations to process large datasets more efficiently and cost-effectively.

These cost-savings features are particularly beneficial for businesses aiming to maximize resources while pursuing AI projects. By minimizing financial barriers, OpenAI encourages broader adoption of its AI tools and fosters innovation within the enterprise sector.

Addressing Customer Requests

OpenAI's latest updates also respond to customer feedback, with several enhancements aimed at improving user experience. Companies can now ingest up to 10,000 files into their AI tools, a significant increase from the previous limit of 20. Moreover, new file management features and usage controls enable users to manage resources more efficiently and adapt to changing requirements.

Conclusion

OpenAI's recent enhancements to its enterprise offerings demonstrate the company's commitment to meeting the needs of business users. By bolstering security, reducing costs, and addressing customer feedback,",https://www.zdnet.com/a/img/resize/52c5c4d94a7f6980a8dd82371ec26e00038f8aa5/2024/04/24/c7bed6e9-5a0c-4c8d-831a-a50cc2bd67d2/openai-laptop.jpg?auto=webp&fit=crop&height=675&width=1200,2024-04-24 00:00:00,"Discover OpenAI's enhanced enterprise features: top-notch security and cost savings! Single sign-on, multi-factor authentication, and 256-bit encryption ensure data protection. New Batch API cuts costs by 50% for large dataset processing. Experience the difference with OpenAI's responsive, innovative AI solutions.","OpenAI Attracts Businesses: Security and Savings Upgrades [End of Generated Content]

OpenAI's latest updates, focusing on enhanced security features and cost-saving measures, aim to attract businesses looking to build AI solutions. With single sign-on, multi-factor authentication, and 256-bit AES encryption, OpenAI ensures tighter data control and reduced risks. On the cost front, the new Batch API enables businesses to process large datasets more efficiently, cutting expenses by up to 50%. OpenAI's responsiveness to customer feedback, such as increasing file ingestion limits and introducing new file management features, further strengthens its appeal to the enterprise sector. All in all, OpenAI's upgrades help businesses create secure, cost-effective AI applications, fostering innovation and growth in the industry.",Technology,"Formicoders,News,AI,Technology,Innovation,Programmering,Coding,Wordpress,Python"
https://techxplore.com/news/2024-04-storage-efficiency-durability-capacitors.html,"Researchers increase storage, efficiency and durability of capacitors"," New Design Boosts Capacitor Energy Storage, Efficiency & Durability ","Title: Revolutionizing Capacitors: Unleashing High Energy Storage and Efficiency

In the realm of technology, pacemakers, defibrillators, radar systems, and electric vehicles rely on electrical components known as capacitors. These workhorses store and release energy in mere microseconds. Researchers at the University of Twente have recently unveiled a groundbreaking design strategy to amplify the energy storage capacity, efficiency, and durability of these vital components.

Originally published in the journal Advanced Materials, this research focuses on a novel design approach for capacitors, enhancing their energy storage while reducing energy loss and increasing their reliability. To achieve this, the team worked on a specific type of capacitor consisting of multiple thin layers of distinct materials.

",https://scx2.b-cdn.net/gfx/news/2024/researchers-increase-s.jpg,2024-04-25 09:36:25,"Meta Description:
Boost energy storage & efficiency in capacitors! New design strategy revealed by University of Twente researchers. Discover advancements in pacemakers, defibrillators, radar systems, and electric vehicles.", Energy Storage ,Technology,"Formicoders,News,AI,Technology,Innovation,Programmering,Coding,Wordpress,Python"
https://techxplore.com/news/2024-04-tech-vr-gamers-ludicrous-motion.html,New tech could help traveling VR gamers experience 'ludicrous speed' without motion sickness,"Title: Groundbreaking VR Tech Redefines Speed & Motion Sickness for Travelers

In a revolutionary move, new VR tech allows traveling gamers to experience 'ludicrous speed' without motion sickness, comfortably manipulating their perception of in-car VR motion.","Title: Redefining Virtual Reality Motion for Vehicle Passengers: A Leap from Slow-Mo to Ludicrous Speed

Imagine playing a thrilling car racing game in a virtual reality (VR) headset while traveling in a real vehicle, experiencing the game's speed at 'ludicrous speed' without any motion sickness. A team of researchers has developed a groundbreaking system that allows users to comfortably manipulate their perception of in-car VR motion through vehicular translational gain and attenuation. This innovative technology is set to transform the way vehicle passengers experience VR during travel.

The study, titled 'From Slow-Mo to Ludicrous Speed: Comfortably Manipulating the Perception of Linear In-Car VR Motion Through Vehicular Translational Gain and Attenuation,' will be presented at the Association of Computing Machinery CHI conference on Human Factors in Computing Systems in May 2024. The research focuses on managing motion sickness in VR, enabling users to feel like they're moving much faster or slower than the actual vehicle they're traveling in.

Motion sickness, caused by a discrepancy between physical motion and visual perception, can make some people feel unwell during VR experiences. To combat this issue, some VR systems on the market match real-world vehicle movements with perceived movement in the headset. However, this approach doesn't allow for further manipulation of VR users' impressions of movement to create enjoyable virtual experiences without causing motion sickness.

The new system, built on the principles of translational gain and attenuation, allows for real-world movements to be translated into virtual perceptions in a non-equivalent manner. Translational gain increases virtual movements in response to real-world movements, while attenuation reduces virtual movements in comparison to real-world movements. By manipulating these principles, the researchers created a novel travel-focused VR experience.

Dr. Graham Wilson, one of the lead authors from the University of Glasgow's School of Computing Science, explained, ""Exactly mapping real-world movements to virtual ones does a good job of reducing motion sickness, but it limits the available types of experiences and reduces the range of feelings those experiences can create. Our system aims to expand the scope of VR experiences during travel by exploring translational gain and att",https://scx2.b-cdn.net/gfx/news/2024/new-tech-could-help-tr.jpg,2024-04-24 14:28:05,"Meta Description:
Experience 'ludicrous speed' VR gaming in vehicles with new Motion Matching System. Redefining virtual reality motion for comfortable, adjustable experiences. VR MotionMatching Gaming

(119 characters)", Motion Matching System ,Technology,"Formicoders,News,AI,Technology,Innovation,Programmering,Coding,Wordpress,Python"
https://techcrunch.com/2024/04/25/meta-ads-data-retention-ag-opinion/,Meta could face further squeeze on surveillance ads model in EU, ,"Meta’s Tracking Ads Business May Face Legal Limitations in the EU

The European Union’s (EU) top court could impose restrictions on Meta’s tracking ads business, affecting its ability to profit from users’ attention. This possibility comes after an influential advisor to the EU court, Advocate General Athanasios Rantos, opined that the bloc’s privacy laws limit the use of personal data for targeted advertising.

The Proportionality Principle and Data Retention

In his non-legally binding opinion, Rantos emphasized the importance of limiting the use of personal data for advertising purposes, in line with the principle of proportionality. This principle, a fundamental aspect of EU law, also applies to the General Data Protection Regulation (GDPR). The GDPR requires a legal basis for handling people’s information, and the proportionality principle plays a significant role in determining the lawfulness of processing personal data.

The Court of Justice of the EU (CJEU) is currently considering two legal questions referred by an Austrian court, which are related to a privacy challenge brought against Meta’s adtech business by Max Schrems, a well-known privacy campaigner in Europe. Schrems has already secured multiple privacy victories against Meta, resulting in substantial fines for the tech giant.

Meta’s Business Model and Privacy Concerns

Meta’s core business model relies on tracking and profiling web users to operate its microtargeted advertising business. Any legal limits on the company’s ability to process and retain users’ data could significantly impact its profitability. Meta has disclosed that approximately 10% of its global ad revenue is generated in the EU.

In recent months, EU lawmakers and regulators have increased pressure on Meta to abandon its surveillance advertising model. The European Commission has explicitly mentioned alternative ad models, such as contextual advertising, in its Digital Markets Act investigation. A key GDPR steering body also released guidance on “consent or pay” models, emphasizing the need for larger ad platforms like Meta to provide users with genuine privacy choices.

No Sensitive Data Free-for-All for Ads

Advocate General Rantos has addressed a second point in his opinion, concerning Meta’s use of sensitive data for ad targeting. Schrems had complained about receiving ads on Facebook that targeted his","https://techcrunch.com/wp-content/uploads/2021/11/facebook-meta-surveillance-1.jpg?resize=1200,675",2024-04-25 11:43:07,"""Meta's EU ad business faces tighter rules, post-Rantos' opinion; GDPR & proportionality principle scrutiny""

This meta description highlights the potential tightening of restrictions on Meta's EU ad business, based on Advocate General Rantos' opinion, emphasizing the importance of adhering to GDPR and the proportionality principle. It also touches upon the sensitive data-related concerns and mentions the ad models that comply with privacy laws.", Targeted Ads ,Technology,"Formicoders,News,AI,Technology,Innovation,Programmering,Coding,Wordpress,Python"
https://techxplore.com/news/2024-04-microsoft-small-localized-language-powerful.html,"Microsoft claims that small, localized language models can be powerful as well", Microsoft's Phi-3 Mini: Revolutionary Local AI Language Model ,"Title: Microsoft's Phi-3 Mini: A Revolutionary AI Language Model for Local Applications

Introduction

Microsoft has recently unveiled a groundbreaking development in artificial intelligence (AI) with the creation of a family of compact, locally run AI language models called Phi-3 mini. This blog post will delve into the unique features, capabilities, and benefits of the Phi-3 mini, as well as its potential impact on the AI industry.

Phi-3 Mini: A Powerful and Cost-Effective SLM

Microsoft's Phi-3 mini is an AI language model designed for locally run applications, offering superior capabilities compared to other models of its size and greater cost efficiency than larger models. Impressively, it outperforms many of its classmates and even some larger models, making it a highly attractive option for various AI applications.

A Key Difference: Locally Run Applications

Phi-3 mini models are specifically designed for locally run applications, meaning they can operate on devices that are not connected to the internet. This feature sets them apart from other AI models and enables a wider range of AI functionalities, especially in scenarios where internet connectivity may be limited or unavailable.

Phi-3 Mini Parameters and Training

Phi-3 mini models are 3.8B language models, representing the number of parameters they can utilize. Despite their smaller size, Phi-3 mini models have been trained using 3.3 trillion tokens, ensuring a reasonable degree of artificial intelligence. This training data enables Phi-3 mini models to rival the performance of GPT-3.5 and other large language models (LLMs), offering users a ""shockingly good"" experience compared to other small models.

High-Quality Data and Advanced Features

Microsoft attributes the impressive performance of the Phi-3 mini models to the high-quality data used in their training, including filtered web data and information from textbooks. Additionally, the Phi-3 mini models have been enhanced with new features to ensure a more robust, safe, and pleasant interactive user experience.

Accessibility and Compatibility

The new Phi-3 mini models are accessible and compatible with various systems, as they can be downloaded free of charge from Microsoft's cloud service on Azure and through partnering company sites. They are compatible with both MACs and PCs with just 8GB of RAM, further",https://scx2.b-cdn.net/gfx/news/2024/microsoft-finds-that-s.jpg,2024-04-24 11:30:01,"Meta Description: ""Discover Microsoft's Phi-3 Mini, a revolutionary AI language model for local applications. Experience powerful AI capabilities, cost-effectiveness, and local functionality. Download now on Azure."" (119 characters)

The meta description highlights the unique features of Microsoft's Phi-3 Mini, emphasizing its powerful AI capabilities, cost-effectiveness, and local functionality. Additionally, it includes a call-to-action to download the model from Azure, making it actionable and specific to the content of the page. The meta description is unique, actionable, and matches the content of the article. It also includes the focus keyphrase ""AI language model"" and is under 18 words in length.", Local AI ,Technology,"Formicoders,News,AI,Technology,Innovation,Programmering,Coding,Wordpress,Python"
https://techxplore.com/news/2024-04-emulating-neurodegeneration-aging-artificial-intelligence.html,Emulating neurodegeneration and aging in artificial intelligence systems, AI Neuro-Erosion: Mirroring Human Cognitive Decline in Artificial Systems ,"Title: Artificially Inducing Cognitive Decline in AI: A New Approach to Understanding Complex Systems

In the ever-evolving world of artificial intelligence (AI), systems are typically designed to maintain consistent performance or even improve over time. However, a group of researchers from the University of California, Irvine has taken a novel approach by intentionally introducing cognitive decline in AI agents to better understand complex systems, enhance interpretability, and improve security.

The idea for this groundbreaking study was born during a dinner conversation between Dr. Baldi, Dr. Pishgar, and Yu-Dai Tsai, the study's co-author. Tsai's personal experience with his father's cognitive decline following a brain injury served as additional motivation to explore this subject from a computer science and deep learning perspective.

The researchers utilized IQ tests performed by large language models (LLMs), specifically the LLaMA 2 model, to introduce the concept of ""neural erosion."" By deliberately eroding synapses or neurons or adding Gaussian noise during or after training, they were able to create a controlled decline in the LLMs' performance.

When artificial synapses or neurons were removed from the LLaMA 2 model, its performance on IQ tests declined, following a specific pattern. This finding could provide valuable insights into the functioning of complex AI systems and the capabilities that are most affected when their underlying structure is compromised.

As artificial synapses and neurons were removed from AI systems, the researchers observed a decline in the systems' ability to think abstractly, followed by a loss of mathematical skills, and ultimately, an inability to respond to prompts coherently. This ""neuro-erosion"" pattern mirrors neurodegeneration patterns observed in humans, opening up new possibilities for understanding real-world cognitive decline.

This research could lead to the development of new techniques that leverage AI neuro-erosion patterns to address real-world problems, as well as improve AI security and interpretability. While the primary focus is on exploring new frontiers in AI studies, rather than replicating human brain diseases, the potential for collaboration with neuroscientists remains an exciting opportunity.

The team plans to extend their study to include specific tests of AI systems and explore other neural diseases and neurodiversity. By continuing to investigate the intricate relationship between AI and human cognitive decline, researchers can",https://scx2.b-cdn.net/gfx/news/2024/emulating-neurodegener.jpg,2024-04-24 06:30:01,"Uncover AI's potential by intentionally inducing cognitive decline; read about the UC Irvine study in this article. Explore the neuro-erosion pattern, improve security, and boost AI understanding.

Meta Description:
Discover how UC Irvine researchers induce cognitive decline in AI, revealing a neuro-erosion pattern. Boost AI understanding, improve security, and learn about future collaborations between AI researchers and neuroscientists.", AI decline ,Technology,"Formicoders,News,AI,Technology,Innovation,Programmering,Coding,Wordpress,Python"
https://www.zdnet.com/article/need-a-news-app-here-are-my-top-5-across-android-linux-and-ios/,"Need a news app? Here are my top 5 across Android, Linux, and iOS"," Top 5 News Aggregators: Google News, Apple News, & MoreTitle: Top 5 News Aggregators for Android, Linux, iOS ","Title: The Top 5 News Aggregator Apps to Keep You Informed

Introduction:
Staying informed and up-to-date is crucial in today's fast-paced world. Instead of opening multiple tabs to check news websites, using aggregator apps is a more efficient and effective way to consume news. In this article, we will be discussing the top 5 news aggregator apps that you can use to keep yourself informed.

1. Google News:
Google News is the first app I check every morning. It's user-friendly and can be accessed on a phone, tablet, or web browser. The app has a For You section that's generated based on the news items you open, a Headlines section that lists top news stories from various sources, and a Following section that lists only the news sites you follow. Google News also allows you to follow news showcases, which are stories selected by newsroom editors.

2. Google App:
The Google app is a great option if you're in a hurry and just want to quickly check the latest news headlines. You can swipe right on your phone and see headlines from the Google app. If you're not using a phone with the Pixel Launcher, you can open the Google app from the App Drawer and see stories that are interesting to you. You can also customize the app's settings to add your preferred topics.

3. Apple News:
Apple News is a great option for MacBook Pro users. It has the best user interface and is easy to customize. You can add as many news sources as you like, and clicking on an item allows you to view the story within the app. By opening stories this way, you retain instant access to the sidebar, which makes for a more efficient and effective interaction. Apple News is pre-installed on all iOS phones and tablets.

4. NewsFlash:
NewsFlash is my go-to Linux RSS news aggregator. It has a clean user interface and adding RSS feeds is quick and easy. You can locate RSS feeds on websites by clicking the three horizontal line menu button, selecting Discover Feeds, selecting a top feed (or entering a search string), and adding any news feeds you want to view. While some of the subscriptions I've added present headlines with no content, NewsFlash does a great job of presenting the news I need and want to read.

5. Newsify:
Newsify is another MacOS/iOS app that allows you to access news, blogs, and RSS feeds. It has a user-friendly interface and a large amount of sources to choose from, including topics such as politics, technology, sports, business, finance, design, fashion, photography, entertainment, gaming, music, and cocktails. Like Apple News, when you click on an article, it remains within the Newsify app and doesn't open a browser window.

Conclusion:
These five news aggregator apps are the best options for staying informed and up-to-date. Each app has its unique features and benefits, but they all make it easy to consume news and stay informed. Whether you're a Mac user or a Linux user, there's an aggregator app that's perfect for you. So, try them out and see which one works best for you.",https://www.zdnet.com/a/img/resize/16c3a97d8d8cd738d9a0ea6f172e56ba2e7109e7/2024/04/24/e5af64dc-2cd0-4747-8c00-5c65f295fc8f/newshero.jpg?auto=webp&fit=crop&height=675&width=1200,2024-04-24 00:00:00,"Discover the top 5 news aggregator apps to stay informed! Personalize your news feed with Google News, Google App, Apple News, NewsFlash, and Newsify. Stay up-to-date with customizable, efficient, and user-friendly apps.

Meta Description:
Explore the top 5 news aggregator apps for a personalized and efficient news experience. Stay informed with Google News, Google App, Apple News, NewsFlash, and Newsify.", News Aggregators ,Technology,"Formicoders,News,AI,Technology,Innovation,Programmering,Coding,Wordpress,Python"
